F-Droid;https://f-droid.org/en/packages/org.fdroid.fdroid/;FDroid is an installable catalogue of libre software apps for Android The FDroid client app makes it easy to browse install and keep track of updates on your deviceIt connects to any FDroid compatible repositories The default repo is hosted at fdroidorg which contains only bona fide libre softwareAndroid itself is open in the sense that you are free to install APKs from anywhere you wish but there are many good reasons for using FDroid as your libre software app manager Get notified when updates are available Optionally download and install updates automatically Keep track of older and beta versions Filter out apps incompatible with the device Find apps via categories and searchable descriptions Access associated URLs for donations source code etc Stay safe by checking repo index signatures and APK hashes;https://f-droid.org/repo/org.fdroid.fdroid_1016053.apk;This version requires Android 6.0 or newer.;https://gitlab.com/fdroid/fdroidclient;https://gitlab.com/fdroid/fdroidclient/issues
Xeonjia: Ice Adventures;https://f-droid.org/en/packages/xyz.deepdaikon.xeonjia/;Xeonjia is an adventure game set in a frozen worldThe floor is frozen Think carefully about your moves because you cant change direction until you meet an obstacleUse you mind to solve the ice slide puzzlesThe world has been frozen by the aKing of Evila and itas no longer a safe placeLegend has it that a brave hero will defeat the King of Evil and save the kingdoma For this reason every year a person is appointed as aheroa and sent on a journey to try to save itNow is your time you have been chosen as this yearas hero Will you be able to defeat the King of EvilYou will have to travel the world explore cities dungeons and mystical cavesAre you ready to solve quests and puzzles in this frozen RPG worldOver time you will gain experience points that will allow you to increase your level and you will find money and hidden treasures that you can use to buy stuff and improve yourselfBe careful the world is full of dangerous enemies ready to attack youKeep in mind that most of the floor is frozen so you canat stop yourself until you reach a wall a boulder or any other type of obstacleUse your mind to figure out the best pathNote this game is currently in early beta stage;https://f-droid.org/repo/xyz.deepdaikon.xeonjia_14.apk;This version requires Android 4.1 or newer.;https://gitlab.com/deepdaikon/Xeonjia/tree/HEAD;https://gitlab.com/deepdaikon/Xeonjia/issues
Quinb: 4 players reaction game;https://f-droid.org/en/packages/xyz.deepdaikon.quinb/;Quinb is a reaction  logic game for up to 4 players on the same deviceIt contains many minigames in which you have to answer questions as fast as you can to get a pointIf the answer is correct you score a point otherwise you lose oneThese games are based on 3 different categoriesa Logic games that require intuition logic and fast reflexesa Audio soundbased games you have to listen carefully to find out the correct answera Vibration vibrationbased games that require you to listen carefully to the vibrations of your deviceEach match consists of a succession of different minigamesThe goal is to score 7 points before your opponentsYou can play alone if you want but it is more fun to play with friends of all ages Its great if you are stuck with nothing to do while youre with friendsIf you think youre fast challenge and beat your friendsMain featuresa 28 minigamesa Up to 4 players on the same devicea Completely freea No Adsa Multiple languagesa Minimalist design;https://f-droid.org/repo/xyz.deepdaikon.quinb_8.apk;This version requires Android 4.1 or newer.;https://gitlab.com/deepdaikon/Quinb/tree/HEAD;https://gitlab.com/deepdaikon/Quinb/issues
Jellyfin for Android TV;https://f-droid.org/en/packages/org.jellyfin.androidtv/;Your media on your termsThe Jellyfin project is an open source free software media server No fees no tracking no hidden agenda Get our free server to collect all your audio video photos and more in one placeTo use the app you must have a Jellyfin server set up and running Find out more at jellyfinorgWith a Jellyfin server you can Watch Live TV and recorded shows from your Jellyfin server additional hardwareservices required Stream to a Chromecast device on your network Stream your media to your Android device View your collection in an easy to use interfaceThis is the official Jellyfin companion app for Android TV Thank you for using Jellyfin;https://f-droid.org/repo/org.jellyfin.androidtv_150599.apk;This version requires Android 5.0 or newer.;https://github.com/jellyfin/jellyfin-androidtv;https://github.com/jellyfin/jellyfin-androidtv/issues
Activity Launcher fork;https://f-droid.org/en/packages/de.szalkowski.activitylauncher.rustore_fork/;This opensource Android App launches hidden activities and creates home screen shortcuts for installed apps;https://f-droid.org/repo/de.szalkowski.activitylauncher.rustore_fork_137.apk;This version requires Android 6.0 or newer.;https://github.com/Sash0k/ActivityLauncher;https://github.com/Sash0k/ActivityLauncher/issues
Translate You;https://f-droid.org/en/packages/com.bnyro.translate/;Translate You is a Translator App built with Material Design 3 YouIt supports multiple different translation engiens such as LibreTranslate Lingva Deepl and moreIn total there are more than 200 supported languages across 6 different translation engines;https://f-droid.org/repo/com.bnyro.translate_29.apk;This version requires Android 5.0 or newer.;https://github.com/Bnyro/TranslateYou;https://github.com/Bnyro/TranslateYou/issues
FOSS Warn;https://f-droid.org/en/packages/de.nucleus.foss_warn/;The app is currently in a BETA statusFOSS Warn is an unofficial open source application to get emergency alerts from warnungbundde Germany oder alertswiss Switzerland You can store locations in the app for which you would like to receive notificationsImportant FOSS Warn is unofficial and has nothing to do with the official APP Nina from BBKNotice FOSS Warn is currently only available in German but there is a translation help  here;https://f-droid.org/repo/de.nucleus.foss_warn_27.apk;This version requires Android 6.0 or newer.;https://github.com/nucleus-ffm/foss_warn;https://github.com/nucleus-ffm/foss_warn/issues
InviZible Pro: increase your security, protect you;https://f-droid.org/en/packages/pan.alexander.tordnscrypt.stable/;Protect your device from dangerous sites get rid of annoying ads and tracking get access to blocked resources in your countryInviZible Pro includes the well known modules DNSCrypt Tor and Purple I2P These modules are used to achieve maximum security privacy and ease of use of the InternetInviZible Pro can use root if your device has root privileges or uses a local VPN to deliver Internet traffic to Tor DNSCrypt and I2P networksFeatures No root required Hides location and IP Unblocks the restricted web content Prevents tracking Allows access to hidden networks ARP spoofing detection Builtin firewall Tethering supported Material design themeJust start InviZible Pro and you turn from a simple user to an invisible one who is very difficult to find block or impose unnecessary products and services in the form of ubiquitous advertising onHowever if you want to get full control over the program and your Internet connection  no problem InviZible Pro provides access to a large number of both simple and professional settings You can easily configure InviZible Pro itself as well as its modules  DNSCrypt Tor and Purple I2P to satisfy the most nonstandard requirementsInviZible Pro is an allinone program After installing it you can easily delete all of your VPN applications and ad blockers In most cases InviZible Pro works better is more stable and faster than free VPNs It does not contain ads bloatware and does not spy upon its usersInviZible Pro blocks ipv6 due to some security issues with this protocol and the InviZible appSo what are those three modules and what do they achieveDNSCryptDNS is used by most applications to translate domain names into IP addresses to find a remote server with the site that you want to visit But this communication is not encrypted and can be used by attackers DNSCrypt encrypts and authenticates DNS traffic thus preventing DNS tracking and spoofing Encrypts DNS requests Protects against DNS spoofing Blocks adsA1 Protects against dangerous and phishing sitesA1 Can block adult sitesA1 Hides visited sites from your provider Prevents some types of resource locksA1 Depending on the selected dnscrypt serverTorTor encrypts Internet traffic and hides your actual location It uses thousands of computers around the world to mask your IP address and prevents activity tracking to preserve your privacy and anonymity Tor also provides access to onion services These are sites that are in a completely hidden network without censorship Encrypts Internet traffic Prevents sites locking Can provide privacy and anonymity Provides access to onion sitesPurple I2PThe Invisible Internet Project I2P is a hidden anonymous network It includes thousands of computers distributed around the world Purple I2P encrypts the traffic of your device and sends it through these computers to ensure privacy and anonymity Start I2P to access I2P sites and other Invisible Internet hidden services Encrypts Internet traffic Provides access to the hidden anonymous network Invisible Internet and i2p sites;https://f-droid.org/repo/pan.alexander.tordnscrypt.stable_18103.apk;This version requires Android 4.4 or newer.;https://github.com/Gedsh/InviZible;https://github.com/Gedsh/InviZible/issues
strongSwan VPN Client;https://f-droid.org/en/packages/org.strongswan.android/;Official Android port of the popular strongSwan VPN solution FEATURES AND LIMITATIONS  Uses the VpnService API featured by Android 4 Devices by some manufacturers seem to lack support for this  strongSwan VPN Client wont work on these devices Uses the IKEv2 key exchange protocol IKEv1 is not supported Uses IPsec for data traffic L2TP is not supported Full support for changed connectivity and mobility through MOBIKE or reauthentication Supports usernamepassword EAP authentication namely EAPMSCHAPv2 EAPMD5 and EAPGTC as well as RSAECDSA private keycertificate authentication to authenticate users EAPTLS with client certificates is also supported Combined RSAECDSA and EAP authentication is supported by using two authentication rounds as defined in RFC 4739 VPN server certificates are verified against the CA certificates preinstalled or installed by the user on the system The CA or server certificates used to authenticate the server can also be imported directly into the app IKEv2 fragmentation is supported if the VPN server supports it strongSwan does so since 521 Splittunneling allows sending only certain traffic through the VPN andor excluding specific traffic from it Perapp VPN allows limiting the VPN connection to specific apps or exclude them from using it The IPsec implementation currently supports the AESCBC AESGCM ChaCha20Poly1305 and SHA1SHA2 algorithms Passwords are currently stored as cleartext in the database only if stored with a profile VPN profiles may be imported from filesDetails and a changelog can be found in our documentation httpsdocsstrongswanorgdocs59osandroidVpnClienthtml PERMISSIONS  READEXTERNALSTORAGE Allows importing VPN profiles and CA certificates from external storage on some Android versions QUERYALLPACKAGES Required on Android 11 to select apps to exinclude in VPN profiles and the optional EAPTNC use case EXAMPLE SERVER CONFIGURATION Example server configurations may be found in our documentation httpsdocsstrongswanorgdocs59osandroidVpnClienthtmlserverconfigurationPlease note that the host name or IP address configured with a VPN profile in the app must be contained in the server certificate as subjectAltName extension FEEDBACK Please post bug reports and feature requests via GitHub httpsgithubcomstrongswanstrongswanissuesnewchooseIf you do so please include information about your device manufacturer model OS version etcThe log file written by the key exchange service can be sent directly from within the application;https://f-droid.org/repo/org.strongswan.android_79.apk;This version requires Android 5.0 or newer.;https://github.com/strongswan/strongswan;https://github.com/strongswan/strongswan/issues
NGA客户端开源版;https://f-droid.org/en/packages/gov.anzong.androidnga/;An FOSS client for National Gay Alliance forumThis APP is based on the open source with GNU GPL v2 license published by grpubrgmailcomat httpscodegooglecompngacnphone and as they said they stoped update theirproject at the revision of 580 we start to take over the project we fork theproject to githuband still use GNU GPL v2 as our code license you can see the READMEmd file onour github site that shows this APP in Google Play is completely compile with ourcodes This APP use the open APIs of the forum Nation Geography of Azeroth whichare opened to everyone as the thread said httpbbsngacnccreadphptid6406100users just need to login as they did on the PC site and the APIs use cookie toauthorization users if the user login with our APP they should have the rightsto get all data from the APIs and those APIs also used in many different placessuch as the forums PC and mobile site other developers APPs and so on We statewe have not violated the legitimate rights of the forum Nation Geography of Azerothour APP is free and does not contain advertising our code is based on a open sourceproject and is also opend in github;https://f-droid.org/repo/gov.anzong.androidnga_3085.apk;This version requires Android 7.1 or newer.;https://github.com/Justwen/NGA-CLIENT-VER-OPEN-SOURCE;https://github.com/Justwen/NGA-CLIENT-VER-OPEN-SOURCE/issues
NC Passwords;https://f-droid.org/en/packages/de.jbservices.nc_passwords_app/;Features     View your passwords with quick copy to clipboard functionality     CreateUpdateDelete your passwords     Autofill Support on Android     ViewSetUnset your favorites     Fast search of your passwords     View your passwords in folder view     Optional Local Biometric Authentication     Local cache of your passwords if you have no current internet connection     Nextcloud theming     Displaying the logos of supported websites for saved passwords;https://f-droid.org/repo/de.jbservices.nc_passwords_app_24.apk;This version requires Android 5.1 or newer.;https://gitlab.com/joleaf/nc-passwords-app;https://gitlab.com/joleaf/nc-passwords-app/-/issues
Warpinator for Android (unofficial);https://f-droid.org/en/packages/slowscript.warpinator/;Warpinator for Android is an unofficial port of Linux Mints file sharing tool of the same name It is fully compatible with the original protocol and allows for easy transfer of files between Android and Linux devicesFeatures Automatic discovery of compatible services on local network Works on WiFi or hotspot no internet connection needed Transfer any type of files quickly and easily Receive entire directories Run multiple transfers in parallel Share files from other applications Limit who can connect using a group code Option to start on boot Does not require your location or any other unnecessary permissionsThis application is free software licensed under GNU General Public License v3You can obtain the source code at httpsgithubcomslowscriptwarpinatorandroid;https://f-droid.org/repo/slowscript.warpinator_1060.apk;This version requires Android 5.0 or newer.;https://github.com/slowscript/warpinator-android;https://github.com/slowscript/warpinator-android/issues
RadarWeather;https://f-droid.org/en/packages/org.woheller69.weather/;RadarWeather lets you watch the weather for cities and locations you are interested inWeather data is provided via the free API from OpenWeatherMap As the new One Call API allows only 1000 calls per day every user must enter his own free OpenWeatherMap key httpshomeopenweathermaporguserssignup Data for the rain radar is retrieved via the free RainViewer APIFeatures Current weather Hourly forecasts for 48h  3h forecasts for 5 days 8 day forecast Precipitation in next 60min Rain radar Radius search Widget with optional GPS auto position update No advertisementMinimum permissionsRadarWeather only requires the minimum amount of permission namely only the INTERNET permission This permission is necessary to make HTTP requests to remote servers for retrieving weather dataOptional authorization for GPS;https://f-droid.org/repo/org.woheller69.weather_58.apk;This version requires Android 5.0 or newer.;https://github.com/woheller69/weather;https://github.com/woheller69/weather/issues
IRMA;https://f-droid.org/en/packages/org.irmacard.cardemu/;IRMA keeps your personal data safe and gives you controlThe IRMA app manages your personal IRMA cards you can receive new cards selectively disclose them to others and associate them with digital signatures Examples of tickets are I am over 18 my name is  and I have access to  These are safely stored on your phone and are protected by your PIN codeIRMA is produced and maintained by the Privacy by Design Foundation together with SIDN It is freely available and open source Find out more at irmaapp For the IRMA source code see githubcomprivacybydesign;https://f-droid.org/repo/org.irmacard.cardemu_148.apk;This version requires Android 6.0 or newer.;https://github.com/privacybydesign/irmamobile;https://github.com/privacybydesign/irmamobile/issues
Snapcast - multi-room audio in perfect sync;https://f-droid.org/en/packages/de.badaix.snapcast/;Multiroom clientserver audio player where all clients are time synchronizedwith the server to play perfectly synced audio Its not a standalone playerbut an extension that turns your existing audio player into a Sonoslikemultiroom solution The servers audio input is a named pipe tmpsnapfifo Alldata that is fed into this file will be send to the connected clients One ofthe most generic ways to use Snapcast is in conjunction with the music playerdaemon MPD or Mopidy which can be configured to use a named pipe as audiooutput;https://f-droid.org/repo/de.badaix.snapcast_2700.apk;This version requires Android 4.1 or newer.;https://github.com/badaix/snapcast;https://github.com/badaix/snapcast/issues
KurobaEx;https://f-droid.org/en/packages/com.github.k1rakishou.chan.fdroid/;KurobaEx is a fast Android app for browsing imageboards such as 4chan Its a fork of Kuroba This fork provides lots of new features New technological stack Kotlin RxJavaCoroutines Room etc On demand content loading includes prefetching youtube videos titles and durations fetching inlined files size fetching etc Thirdparty archives support New thread navigation tabs New inapp navigation bottom nav bar New bookmarks they were fully rewritten from scratch now use way less memory dont use wakelocks show separate notifications per thread and notifications can be swiped away Edgetoedge theme support New database 4chan global search support Fully dynamic themes with Android Q DayNight mode support Persite proxies Ability to attach multiple media files to reply attach media files that was shared by external apps event by some keyboards attach remote media files by URL etc New image downloader Allows downloading images while the app is in background retrying failed to download images resolving duplicates etc  New posting Posting code was moved into a foreground service which now allows stuff using like automatic captcha solvers 2captcha API seamlessly or queueing multiple replies in different threads only one reply per thread New Media Viewer It was rewritten from scratch and now lives in a separate activity It now also supports stuff like viewing links to media files shared into the app Thread downloader with ability to export threads as HTML pages with all downloaded media Composite catalogs ability to combine multiple boards of any available sites except archives together into a single catalog Mpv video player Lots of other tiny improvementsAntiFeatures NonFreeNet The app has to connect to image board sites which may be closed source The app may connect to nonfree services such as Google ReCaptcha JSnoJS CloudFlareGitHub for some image resources YoutubeSoundCloudStreamable to parse titles and durationsand other sites This may depend on the site itself as well as the app settingsThe app uses some permissions that may be considered dangerous  RECEIVEBOOTCOMPLETED It is used to listen to reboots and reschedule BookmarkWatcher service FOREGROUNDSERVICE It is used by the service that shows a notification when a file isdownloaded allows you cancel it WAKELOCK It may be used on Android versions prior to API 23 to keep the device awake whileBookmarkWatcher service is doing its jobWhen making a reply on some sites the app may connect to Googles ReCaptcha servicesThe app supports JavaScript and nonJavaScript based captcha systems Whether to use a JS or noJS captcha can be configured in the site settings depends on the siteTo make the final APK smaller some of the static resources are stored on Github servers and areloaded lazily so the app may connect to Github servicesThe app uses its own crash reporting system which is turned on by defaultIt collects crash logs and other logs prior the crash stores them but does not upload themautomatically You have to do it manually You can see what is being sent and even edit itor delete crash logs You can also completely disable collection of crash logs in the settingsThe servers source code can be found here httpsgithubcomK1rakishouKurobaapkserver;https://f-droid.org/repo/com.github.k1rakishou.chan.fdroid_10323.apk;This version requires Android 5.0 or newer.;https://github.com/K1rakishou/Kuroba-Experimental;https://github.com/K1rakishou/Kuroba-Experimental/issues
Bangumi;https://f-droid.org/en/packages/com.czy0729.bangumi/;A thirdparty Bangumi client based on ReactNativeThe layout is designed for mobile covering basically all pages of the websiteBangumi is used for discovering discussing and managing the progress of the anime music Japanese drama game AVG and moreBasic FunctionsManaging progressDetails of the entries and charactorsTimeline user activitySuperexpanding forumTime Machine person center user spaceMore than search rank index daily broadcast yearbook amd labelFeatured FunctionsServe most resources on selfmaintained CDN high speed accessServe images on CDN with postprocessingfaster than the origin site with higher quality and less sizeSeasonal drama with precise single episode web source manga source search looking for drama novel game and musicScreenshot preview for drama and gameLittle chalice Character Trading Air Game with independent UIUX design;https://f-droid.org/repo/com.czy0729.bangumi_70701.apk;This version requires Android 5.0 or newer.;https://github.com/czy0729/Bangumi;https://github.com/czy0729/Bangumi/issues
