Yggdrasil;https://f-droid.org/en/packages/io.github.chronosx88.yggdrasil/;The application for connecting to Yggdrasil network on AndroidOnce connected you can access yggdrasil public servicesas the application has peered automatically to default peers within the application;https://f-droid.org/repo/io.github.chronosx88.yggdrasil_43.apk;This version requires Android 4.0.3 or newer.;https://github.com/yggdrasil-network/crispa-android;https://github.com/yggdrasil-network/crispa-android/issues
Nitter for Android;https://f-droid.org/en/packages/com.plexer0.nitter/;If you didnt know already Nitter is a free opensource frontend for Twitter maintained by Zedeus on GitHub All praise to the Nitter service goes to themThanks to Android WebView you can have a completely separate app for Nitter and isolate your cookies and history from your main browser app which is a privacy bonusFull details about this client can be found in the projects README file on GitLab;https://f-droid.org/repo/com.plexer0.nitter_11.apk;This version requires Android 5.1 or newer.;https://gitlab.com/Plexer0/Nitter-Android;https://gitlab.com/Plexer0/Nitter-Android/issues
News Reader;https://f-droid.org/en/packages/livio.rssreader/;This minimal RSS news reader brings you the latest news It includes several feeds in different categories including news technology science sports and others You can also add your own feedsNews feeds are available in the following languages German English Spanish French Italian Portuguese and RussianFeatureseasy to use and lightweight with wide selection of news feedstext to speech listen to your newschoose your theme add your personal feedsmini widget showing latest news headlinebackup and restore settingsdesigned for speed and low battery consumptionlanguage of news feeds can be changed please select Settings and then click on Feeds language to choose the language of news feedsPermissionsThis application requires the following permissionsINTERNET  to retrieve newsWRITEEXTERNALSTORAGE aka PhotosMediaFiles  to backup settings;https://f-droid.org/repo/livio.rssreader_101.apk;This version requires Android 6.0 or newer.;https://github.com/javalc6/rssreader;None
SauceNAO;https://f-droid.org/en/packages/com.luk.saucenao/;Unofficial application for SauceNAO reverse image search engine;https://f-droid.org/repo/com.luk.saucenao_20.apk;This version requires Android 5.0 or newer.;https://github.com/LuK1337/SauceNAO;https://github.com/luk1337/SauceNAO/issues
Fritter;https://f-droid.org/en/packages/com.jonjomckay.fritter/; Devicelocal subscriptions and groups NewPipestyle including a feed view Devicelocal saving of tweets allowing offline reading Viewing profiles Viewing tweets and replies Viewing pictures videos and GIFs in tweets Searching for tweets and users Supports opening twittercom links directly Supports RTL contentFritter uses Sentry for optin error reporting which is not enabled by default;https://f-droid.org/repo/com.jonjomckay.fritter_202212092.apk;This version requires Android 4.1 or newer.;https://github.com/jonjomckay/fritter;https://github.com/jonjomckay/fritter/issues
F-Droid;https://f-droid.org/en/packages/org.fdroid.fdroid/;FDroid is an installable catalogue of libre software apps for Android The FDroid client app makes it easy to browse install and keep track of updates on your deviceIt connects to any FDroid compatible repositories The default repo is hosted at fdroidorg which contains only bona fide libre softwareAndroid itself is open in the sense that you are free to install APKs from anywhere you wish but there are many good reasons for using FDroid as your libre software app manager Get notified when updates are available Optionally download and install updates automatically Keep track of older and beta versions Filter out apps incompatible with the device Find apps via categories and searchable descriptions Access associated URLs for donations source code etc Stay safe by checking repo index signatures and APK hashes;https://f-droid.org/repo/org.fdroid.fdroid_1016053.apk;This version requires Android 6.0 or newer.;https://gitlab.com/fdroid/fdroidclient;https://gitlab.com/fdroid/fdroidclient/issues
Xeonjia: Ice Adventures;https://f-droid.org/en/packages/xyz.deepdaikon.xeonjia/;Xeonjia is an adventure game set in a frozen worldThe floor is frozen Think carefully about your moves because you cant change direction until you meet an obstacleUse you mind to solve the ice slide puzzlesThe world has been frozen by the aKing of Evila and itas no longer a safe placeLegend has it that a brave hero will defeat the King of Evil and save the kingdoma For this reason every year a person is appointed as aheroa and sent on a journey to try to save itNow is your time you have been chosen as this yearas hero Will you be able to defeat the King of EvilYou will have to travel the world explore cities dungeons and mystical cavesAre you ready to solve quests and puzzles in this frozen RPG worldOver time you will gain experience points that will allow you to increase your level and you will find money and hidden treasures that you can use to buy stuff and improve yourselfBe careful the world is full of dangerous enemies ready to attack youKeep in mind that most of the floor is frozen so you canat stop yourself until you reach a wall a boulder or any other type of obstacleUse your mind to figure out the best pathNote this game is currently in early beta stage;https://f-droid.org/repo/xyz.deepdaikon.xeonjia_14.apk;This version requires Android 4.1 or newer.;https://gitlab.com/deepdaikon/Xeonjia/tree/HEAD;https://gitlab.com/deepdaikon/Xeonjia/issues
Quinb: 4 players reaction game;https://f-droid.org/en/packages/xyz.deepdaikon.quinb/;Quinb is a reaction  logic game for up to 4 players on the same deviceIt contains many minigames in which you have to answer questions as fast as you can to get a pointIf the answer is correct you score a point otherwise you lose oneThese games are based on 3 different categoriesa Logic games that require intuition logic and fast reflexesa Audio soundbased games you have to listen carefully to find out the correct answera Vibration vibrationbased games that require you to listen carefully to the vibrations of your deviceEach match consists of a succession of different minigamesThe goal is to score 7 points before your opponentsYou can play alone if you want but it is more fun to play with friends of all ages Its great if you are stuck with nothing to do while youre with friendsIf you think youre fast challenge and beat your friendsMain featuresa 28 minigamesa Up to 4 players on the same devicea Completely freea No Adsa Multiple languagesa Minimalist design;https://f-droid.org/repo/xyz.deepdaikon.quinb_8.apk;This version requires Android 4.1 or newer.;https://gitlab.com/deepdaikon/Quinb/tree/HEAD;https://gitlab.com/deepdaikon/Quinb/issues
Jellyfin for Android TV;https://f-droid.org/en/packages/org.jellyfin.androidtv/;Your media on your termsThe Jellyfin project is an open source free software media server No fees no tracking no hidden agenda Get our free server to collect all your audio video photos and more in one placeTo use the app you must have a Jellyfin server set up and running Find out more at jellyfinorgWith a Jellyfin server you can Watch Live TV and recorded shows from your Jellyfin server additional hardwareservices required Stream to a Chromecast device on your network Stream your media to your Android device View your collection in an easy to use interfaceThis is the official Jellyfin companion app for Android TV Thank you for using Jellyfin;https://f-droid.org/repo/org.jellyfin.androidtv_150599.apk;This version requires Android 5.0 or newer.;https://github.com/jellyfin/jellyfin-androidtv;https://github.com/jellyfin/jellyfin-androidtv/issues
Activity Launcher fork;https://f-droid.org/en/packages/de.szalkowski.activitylauncher.rustore_fork/;This opensource Android App launches hidden activities and creates home screen shortcuts for installed apps;https://f-droid.org/repo/de.szalkowski.activitylauncher.rustore_fork_137.apk;This version requires Android 6.0 or newer.;https://github.com/Sash0k/ActivityLauncher;https://github.com/Sash0k/ActivityLauncher/issues
Translate You;https://f-droid.org/en/packages/com.bnyro.translate/;Translate You is a Translator App built with Material Design 3 YouIt supports multiple different translation engiens such as LibreTranslate Lingva Deepl and moreIn total there are more than 200 supported languages across 6 different translation engines;https://f-droid.org/repo/com.bnyro.translate_29.apk;This version requires Android 5.0 or newer.;https://github.com/Bnyro/TranslateYou;https://github.com/Bnyro/TranslateYou/issues
SimpleLogin | Anti-spam;https://f-droid.org/en/packages/io.simplelogin.android.fdroid/;Application featuresManage aliases createeditdelete  enabledisable an aliasManage contacts create contacts to send email from your aliasesManage mailboxes createdeletemake default a mailboxShare extension create alias without leaving your browserSecure login with Two Factor Authentication 2FASupport selfhosted you can use this application with your own SimpleLogin instanceAnd many more features in active developmentSimpleLogin is an open source solution to protect your email inbox It allows you to create quickly a random email address aka alias All emails sent to an alias are forwarded to your personal email address You can use the alias when subscribing to a newsletter signing up for a new account giving your email to someone you dont trust Not only an alias can receive emails it can also send emails An alias is a fullfledged email address Later you can simply block or delete an alias if its too spammyWhy SimpleLoginWhen you give away your personal email online there is a good chance that your email address would end up with a spammer or a hacker SimpleLogin acts as a firewall to protect your personal email inboxWhat distinguishes SimpleLoginOpensource and easy to selfhost The selfhosting is based on Docker and could be run on almost any Linux server The hosting instruction is on our repository at httpsgithubcomsimpleloginappPowerful features if you have a domain only available at premium planGenerous free plan theres no cap on bandwidth or number of repliessends The Free Plan is enough for protecting your personal email Premium Plan targets at more advanced users with features like custom domain unlimited alias or catchall aliasOpen Roadmap with exciting upcoming features email directory extension for Safari mobile applications etc Feel free to check it out on httpstrellocomb4d6A69I4openroadmapExport your data allows you to change the service provider if someday you decide to leave SimpleLoginTerms and conditions httpssimpleloginiotermsPrivacy policy httpssimpleloginioprivacy;https://f-droid.org/repo/io.simplelogin.android.fdroid_11920.apk;This version requires Android 5.0 or newer.;https://github.com/simple-login/Simple-Login-Android;https://github.com/simple-login/Simple-Login-Android/issues
OpenVPN for Android;https://f-droid.org/en/packages/de.blinkt.openvpn/;With the VPNService in Android 40 it is possible to create a VPN that doesntneed root access;https://f-droid.org/repo/de.blinkt.openvpn_198.apk;This version requires Android 5.0 or newer.;https://github.com/schwabe/ics-openvpn;https://github.com/schwabe/ics-openvpn/issues
MusicBrainz;https://f-droid.org/en/packages/org.metabrainz.android/;MusicBrainz is an open music encyclopedia that collects music metadata and makes it available to the publicMusicBrainz aims to be The ultimate source of music information by allowing anyone to contribute and releasing the data under open licenses The universal lingua franca for music by providing a reliable and unambiguous form of music identification enabling both people and machines to have meaningful conversations about musicMusicBrainz is maintained by a global community of users and we want everyone including you to participate and contributeVisit httpsmusicbrainzorg to know moreMusicBrainz App is designed to do the following View release information by scanning a barcode Search for information about artists releases release groups labels recordings instruments and events View collections Tag audio files like Picard Send Releases to your Picard Donate to the MetaBrainz FoundationMusicBrainz captures information about artists their recorded works and the relationships between themRecorded works entries capture at a minimum the album title track titles and the length of each trackThese entries are maintained by volunteer editors who follow community written style guidelinesRecorded works can also store information about the release date and country the CD ID cover art acoustic fingerprint freeform annotation text and other metadataThe source code for this app is available on GitHub at httpsgithubcommetabrainzmusicbrainzandroidThis app uses icons designed by Freepik and Flaticon leverages the Spotify Android SDK for playing tracks;https://f-droid.org/repo/org.metabrainz.android_55.apk;This version requires Android 5.0 or newer.;https://github.com/metabrainz/musicbrainz-android/;https://tickets.musicbrainz.org/browse/MOBILE
ntfy - PUT/POST to your phone;https://f-droid.org/en/packages/io.heckel.ntfy/;Send notifications to your phone from any Bash or PowerShell script or from your own app using PUTPOST requests eg via curl on Linux or InvokeWebRequestntfy is an Android client for httpsntfysh a free and open source HTTPbased pubsub service You can subscribe to topics in this app and then publish messages via a simple HTTP APIUses Notify yourself when a longrunning process is done Ping your phone when a backup has failed Alerts when someone logs into your serverExample curl d Your backup is done ntfyshmytopicFind more examples and usage instructions here Website httpsntfysh GitHub server httpsgithubcombinwiederhierntfy GitHub Android app httpsgithubcombinwiederhierntfyandroid;https://f-droid.org/repo/io.heckel.ntfy_32.apk;This version requires Android 5.0 or newer.;https://github.com/binwiederhier/ntfy-android;https://github.com/binwiederhier/ntfy-android/issues
Snikket;https://f-droid.org/en/packages/org.snikket.android/;The Snikket app allows you to join a worldwide communication network Use the app for communicating with friends family and colleagues without surrendering your data to large corporationsa1i  Important Note To get started with the app you need an invite to a Snikket service or run your own The app will not work unless you have an invite to join a Snikket serviceSnikket allows you to use a service provided by someone you trust This could be an organisation simply a techie friend or family memberBoth the app and service are 100 free and opensource softwareLearn more at httpssnikketorgapplearnThis app is based on the awesome XMPP client Conversations;https://f-droid.org/repo/org.snikket.android_42025.apk;This version requires Android 5.0 or newer.;https://github.com/snikket-im/snikket-android;https://github.com/snikket-im/snikket-android/issues
twitter2nitter;https://f-droid.org/en/packages/eu.auct.twitter2nitter/;twitter2nitter  redirect twitter to nitterShare twitter url to this app and you will be redirectedRedirect works for1 Open twitter url with twitter2nitter2 Share twitter url with twitter2nitter3 Share text that includes twitter url with twitter2nitterThe third option is useful for users of materialistic hackernews app or any app that shares text like Android  httpstwittercomandroidCurrently it is the only app that can redirect such texts Also you can share google search result with twitter on mobile;https://f-droid.org/repo/eu.auct.twitter2nitter_6.apk;This version requires Android 5.0 or newer.;https://github.com/AucT/twitter2nitter;https://github.com/AucT/twitter2nitter/issues
dawdle;https://f-droid.org/en/packages/godau.fynn.moodledirect/;dawdle is a performant and native client for the Moodle elearning platform This platform is oftentimes selfhosted by universities schools and other institutions to provide teaching material to learnersConnections to arbitrary Moodle instances are supported You may log in with username and password or if your instance requests this you can also sign in through a web browser for singlesignon Course contents are queried from the server and stored for offline usage Markedup content and embedded images are usually displayed correctly An inapp user help menu documents many of the applications featuresAt this moment only some of the basic modules are supported However opening an unsupported module will through magic automatically sign you in to your browser before opening there a providing a very convenient access to all types of contentNote dawdle can only operate if mobile web services are enabled on your Moodle instance This is oftentimes the case as it is also required for using the official Moodle Pty Ltd appScreenshot material from httpsschoolmoodledemonet by Mary Chris and Estelle Cooch licensed CC BYSA with adaptions;https://f-droid.org/repo/godau.fynn.moodledirect_7.apk;This version requires Android 5.0 or newer.;https://codeberg.org/fynngodau/dawdle;https://codeberg.org/fynngodau/dawdle/issues
Clima;https://f-droid.org/en/packages/co.prestosole.clima/;Beautiful minimal and fast weather app that uses the OpenWeatherMap API Requires Android 60 or later Beautiful minimal UI 8day forecast Imperial units support Dark and light themes No ads or trackers;https://f-droid.org/repo/co.prestosole.clima_12.apk;This version requires Android 6.0 or newer.;https://codeberg.org/Lacerte/clima;https://codeberg.org/Lacerte/clima/issues
UDP Bus;https://f-droid.org/en/packages/org.vi_server.androidudpbus/;androidudpbus is an application to create UDP forwarders hubs and other tools To aid building VPNs video streaming and other tricky network usesFeatures Binding UDP socket on specified port and exchanging traffic between all known peers Exchanging traffic between multiple UDP sockets Remembering specified number of peers that have sent us some datagram with optional expiration policy Directly specifying peers to send datagrams to Combined with remembering it allows using the application as UDP forwarder Joining multicast groups setting TTL TOS read and write buffer sizes and other socket options Periodical sending of hardcoded datagrams to specified peers eg to keep NAT open Displaying of detailed statistics of the traffic Starting multiple isolated hubs each with distinct set of ports Can even act as a simplistic load balancer due to SOREUSEPORTThe application does not send datagrams back to senderLimitations UI is not userfriendly Not all features are exposed in GUI  you may want to add some undocumented fields to the JSON manually Not very optimised for speed or latency It may be slightly slower than socat udp4l udp Not everything is tested yet Documentation is lacking;https://f-droid.org/repo/org.vi_server.androidudpbus_1.apk;This version requires Android 5.0 or newer.;https://github.com/vi/android-udp-bus;https://github.com/vi/android-udp-bus/issues
Energize;https://f-droid.org/en/packages/com.flasskamp.energize/;Track your meals including calories macro and micronutrientsUse several databases Open Food Facts USDA and Swiss Food Composition Database or create custom foodSearch meals by product name or just scan the EAN codeGet meal suggestions based on your last tracked mealsSet targets for macro and micronutrients including calculating them based on your personal detailsSee your daily nutrition detailsCreate an encrypted backup with WebDAV and restore it;https://f-droid.org/repo/com.flasskamp.energize_16.apk;This version requires Android 5.0 or newer.;https://codeberg.org/epinez/Energize/;https://codeberg.org/epinez/Energize/issues
RedReader;https://f-droid.org/en/packages/org.quantumbadger.redreader/;An unofficial opensource client for Reddit Free and opensource Software  no adstracking Lightweight and fast Swipe posts left and right to perform customizable actions such as upvotedownvote or savehide Advanced cache management  automatically stores past versions of posts and comments Support for multiple accounts Twocolumn tablet mode can be used on your phone if itas big enough Image and comment precaching optional always never or WiFi only Builtin image viewer and GIFvideo player Multiple themes including night mode and ultra black for AMOLED displays Support for Android 40;https://f-droid.org/repo/org.quantumbadger.redreader_104.apk;This version requires Android 4.1 or newer.;https://github.com/QuantumBadger/RedReader;https://github.com/QuantumBadger/RedReader/issues
Mastodon;https://f-droid.org/en/packages/org.joinmastodon.android/;Mastodon is the largest decentralized social network on the internet Instead of a single website itas a network of millions of users in independent communities that can all interact with one another seamlessly No matter what youare into you can meet passionate people posting about it on MastodonJoin a community and create your profile Find and follow fascinating folks and read their posts in an adfree chronological timeline Express yourself with custom emoji images GIFs videos and audio in 500character posts Reply to threads and reblog posts from anyone to share great stuff Find new accounts to follow and trending hashtags to expand your networkMastodon is built with a focus on privacy and safety Decide whether your posts are shared with your followers just the people you mention or the whole world Content warnings let you hide posts containing sensitive or triggering material until youre ready to engage with them Each community has its own guidelines and moderators to keep its members safe and robust blocking and reporting tools help prevent abuseMore featuresa Dark Mode Read posts in light dark or true black modea Polls Ask followers for their opinion and tally the votesa Explore Trending hashtags and accounts are a tap awaya Notifications Get notified about new follows replies and reblogsa Sharing Post directly to Mastodon from any share sheet in any appa Cuteness Our mascot is an adorable elephant and youll see them pop up from time to timeMastodon is a registered nonprofit and development is supported directly by your donations Thereas no advertising no monetization and no venture capital and we plan to keep it that way;https://f-droid.org/repo/org.joinmastodon.android_39.apk;This version requires Android 6.0 or newer.;https://github.com/mastodon/mastodon-android;https://github.com/mastodon/mastodon-android/issues
Mullvad VPN: privacy is a universal right;https://f-droid.org/en/packages/net.mullvad.mullvadvpn/;Get started1 Install the app2 Click aCreate accounta to generate an account number3 Add time to your account on our website Just a5monthWhy use Mullvad VPNMaintain your anonymityaaCreating an account requires no personal info a not even an email addressaaWe keep no activity logsaaPay anonymously with cash or cryptocurrencyMitigate ISP blocking and throttlingBypass geographical restrictions with our global network of VPN serversOur Android app uses WireGuard a superior VPN protocol that connects fast and doesnat drain your batteryHow does Mullvad VPN workMullvad VPN allows you to browse the web securely and privatelyWith Mullvad your traffic travels through an encrypted tunnel to one of our VPN servers and then onward to the website you are visiting In this way websites will only see our serveras identity instead of yours In addition any information that your internet service provider ISP saves cannot be tied specifically to youUsing a VPN is a great first step toward protecting your privacy We believe that privacy is a universal rightFor your right to privacyMullvad was founded in 2009 purely with the ambition of upholding the universal right to privacy a for you for us for everyone And not only that we want to make Internet censorship and mass surveillance ineffectiveThats a tall order but if you want to make a change youve gotta start somewhereSince our humble beginning our VPN service has helped to keep users online activity identity and location private Over the years weve been blazing a trail forward to provide the most secure and anonymous VPN out there  for everyone for us for you;https://f-droid.org/repo/net.mullvad.mullvadvpn_22030099.apk;This version requires Android 8.0 or newer.;https://github.com/mullvad/mullvadvpn-app;None
StoneAge;https://f-droid.org/en/packages/com.cweb.messenger/;A simple P2P messenger app with no central backend  requires userprovided S3 bucket to functionAll data is stored on your device and in your S3 bucket Messages are endtoend encrypted and exchanged via a P2P protocol over S3No phone number is requiredSupports text images audio video No voice or video callsFor more details see httpscwebgitlabioStoneAgehtmlForked from ConversationshttpsgithubcomsiacsConversationswith communication protocol switched from XMPP to Cwebhttpscwebgitlabio;https://f-droid.org/repo/com.cweb.messenger_42038.apk;This version requires Android 5.0 or newer.;https://gitlab.com/cweb-repos/cweb-conversations;https://gitlab.com/cweb-repos/cweb-conversations/issues
