Mull;https://f-droid.org/en/packages/us.spotco.fennec_dos/;This is a privacy oriented and deblobbed web browser based on Mozilla technology It enables many features upstreamed by the Tor Uplift project using preferences from the arkenfoxuserjs project It is recommended to install uBlock Origin;https://f-droid.org/repo/us.spotco.fennec_dos_21111020.apk;This version requires Android 5.0 or newer.;https://gitlab.com/divested-mobile/mull-fenix;https://gitlab.com/divested-mobile/mull-fenix/issues
TorrServe;https://f-droid.org/en/packages/ru.yourok.torrserve/;Download torrent filesApplication for downloading torrents as HTTP filesTorrent connection is done localy If your provider blocks torrents be awareCache is stored in RAM that is why internal memory does not corruptingApplication consists of two parts server and client After first load you have to download server Side Menu a Updates a Update server from network;https://f-droid.org/repo/ru.yourok.torrserve_128.apk;This version requires Android 4.2 or newer.;https://github.com/YouROK/TorrServe;https://github.com/YouROK/TorrServe/issues
Radio Romania;https://f-droid.org/en/packages/ro.radioromaniaactualitati.podcasts/;Play the latest podcasts from Radio Romania stations Alternatively it can also play the radiotstations liveWeb version httpsradioromaniapav3lsynologymewebFull archive httpsradioromaniapav3lsynologymeBugs  suggestions in Telegram httpstmeappradioromaniaNonFreeNet We collect no logs but the backend is hosted by one thirdparty and content on thesite redirects to another thirdparty See httpsradioromaniaddnsnetprivacypolicyhtml;https://f-droid.org/repo/ro.radioromaniaactualitati.podcasts_63.apk;This version requires Android 4.4 or newer.;https://gitlab.com/andrei-pavel/radio-romania;https://gitlab.com/andrei-pavel/radio-romania/-/issues
Stingle Photos;https://f-droid.org/en/packages/org.stingle.photos/;Stingle Photos is a secure opensource photo video cloud storage and backup application that is safe adfree and easy to use It provides strong encryption and privacy to keep you safe from data breaches and leaks Easily sync and backup and share your photos and videos on our secure cloud storageWhy use Stingle Photos safe cloud storage appSuccessor of wildly popular SafeCamera application Stingle Photos is an opensource secure endtoend encrypted media backup application with the stateoftheart security technologies that ensure your privacy We put our users first by prioritizing your privacy  All your photos  videos are secured with endtoend encryption Unlike other companies we only store the bare minimum of metadata on our servers your email registration date payment plan number of active devices number and size of encrypted files We donat collect big data or track our users in any way No need to fear for your data privacy  ONLY you can have access to your photos  videosKey features Full on the fly encryption of video support recording and playback Fingerprint and face id support for fast unlocking Ability to take photos  videos without entering a password or providing a fingerprint  Backup and sync functionality All your photos  videos are backed up in the background to the cloud and synced to other devices using the same account Albums for better library organization Secure sharing You can share photos and videos with friends and family with strong endtoend encryption As anonymous as possible Registration just takes an email and password to start using the app Stingle Photos is 100 free and opensource It includes 1GB free cloud storage space You only pay if you need more cloud storage No ads or thirdparty libraries like that can track you We as a provider canat see anything in your account If the servers ever get hacked or law enforcement agencies request access to your data they wonat get anything valuable If you have any questions or suggestions drop us a message at supportstingleorg;https://f-droid.org/repo/org.stingle.photos_52.apk;This version requires Android 6.0 or newer.;https://github.com/stingle/stingle-photos-android;https://github.com/stingle/stingle-photos-android/issues
Smoke;https://f-droid.org/en/packages/org.purple.smoke/;Summary of Smoke Aliases Preserve your contacts Almost zerodependency software Application lock Argon2id and PBKDF2 keyderivation functions Automatic oscillatory publickey exchange protocol via SipHash BSD 3clause license Content is recorded via authenticated encryption Decentralized TCP and UDP multicast and unicast Does not require Internet connectivity Does not require registration Telephone numbers are not required Eventful tasks Limited polling FDroid Fiasco forward secrecy Futureproof software Introduces Cryptographic Discovery Cryptographic Discovery is a  practical protocol which creates coordinated data paths Juggling Juggernaut Protocol Manufactured tool tips McEliece Fujisaka and Pointcheval Message structures do not explicitly expose contents Headerless protocols  Some messages do include type information Mobile servers via SmokeStack Obfuscation of resident secret keys Optional foreground services Optional silence over the wires Original implementation of SipHash Ozone destinations private and public repositories Post offices for messages of the past Private servers Public and private publickey servers Rainbow digital signature scheme Reliable distribution of archived messages Reliable distribution of deliverable text messages SPHINCS digital signature scheme SSLTLS through SmokeStack Semicompatible with SpotOn via Fire Share files with TCP utilities such as Netcat SipHash128 Smoke and mirrors Software congestion control Software manual included Steam reliable file sharing TCP over the Echo Steamrolling or realtime broadcasting of inbound Steams to fellow participants Super McEliece m  13 t  118;https://f-droid.org/repo/org.purple.smoke_20230330.apk;This version requires Android 4.4 or newer.;https://github.com/textbrowser/smoke;https://github.com/textbrowser/smoke/issues
OONI Probe;https://f-droid.org/en/packages/org.openobservatory.ooniprobe/;Are websites and social media apps blocked Is your network unusually slowRun OONI Probe to find outWith this app you will examine the blocking of websites and instantmessaging apps measure your networks speed and performance and checkwhether systems that could be responsible for censorship and surveillanceare in your networkOONI Probe is developed by the Open Observatory of Network InterferenceOONI a free software project under The Tor Project that aims to uncoverinternet censorship around the worldSince 2012 OONIs global community has collected millions of networkmeasurements from more than 200 countries shedding light on multiple casesof network interferenceCollect evidence of internet censorshipYou can check whether and how websites and instant messaging apps areblocked The network measurement data you will collect may serve as evidenceof internet censorshipDetect systems responsible for censorship and surveillanceOONI Probe tests are also designed to uncover the presence of systemsmiddleboxes that could be responsible for censorship and surveillanceMeasure the speed and performance of your networkYou can measure the speed and performance of your network by running OONIsimplementation of the Network Diagnostic Test NDT You can also measurevideo streaming performance with the Dynamic Adaptive Streaming over HTTPDASH testOpen dataOONI publishes network measurement data because open data allows thirdparties to verify OONI findings conduct independent studies and answerother research questions Openly publishing OONI data also helps increasetransparency of internet censorship around the world You can explore anddownload OONI data here httpsooniiodataFree softwareAll OONI Probe tests including our NDT and DASH implementations are basedon free and open source software You can find OONI software projectson Github Curious to learn how OONI Probe testswork Learn more hereTo receive updates from the OONIversefollow us on TwitterDisclaimer Running OONI Probe might be against the terms of service of your ISPor legally questionable in your country By running OONI Probe you will connectto web services which might be banned The OONI project will publish datasubmitted by probes possibly including your IP address or other identifyinginformation In addition your use of OONI Probe will be clear to anyone who hasaccess to your computer and to anyone who can monitor your Internet connectionsuch as your employer ISP or government Learn more about potential riskshere;https://f-droid.org/repo/org.openobservatory.ooniprobe_98.apk;This version requires Android 5.0 or newer.;https://github.com/ooni/probe-android;https://github.com/ooni/probe/issues
openHAB;https://f-droid.org/en/packages/org.openhab.habdroid/;openHAB  empowering the smart home  vendor and technology agnostic open source home automationThe builds on FDroid have FCM removed and therefore wont be able to receive push notifications from openHAB Cloud Instead notifications are polled on a regular basis in these buildsopenHAB is a Javabased opensource home automation platform that integrates and combines a vast range of different smart home systems and technologies into one single solutionOn top of the unified abstraction layer all connected devices are available for the overarching automation rule engines and different user interfacesSupported ProductsOver 200 specific addons provide support for brands devices technologies and communication protocols Examples are ZWave Philips Hue Amazon Echo Chromecast and Sonos Discover all available addons and supported devices andor functions at httpswwwopenhaborgaddonsThe app has an action plugin for Tasker and Locale includedOpen Source CommunityThe openHAB open source initiative strongly supports its vibrant community The forum with over 13000 registered users is a place to find guidance help and inspiration Join the openHAB community forum over at httpscommunityopenhaborgWhen you find an issue please report it in the forum or at httpsgithubcomopenhabopenhabandroidissuesIf you want to translate the app into your language join us at httpscrowdincomprojectopenhabandroidopenHAB FoundationThe openHAB Foundation eV is a nonprofit organization with the mission to educate the public about the possibilities and benefits of free and open smart home solutions Learn about the mission and the services of the foundation under httpswwwopenhabfoundationorgImportant noteYou need an openHAB server for this appPrivacy policy httpswwwopenhabfoundationorgprivacyhtml;https://f-droid.org/repo/org.openhab.habdroid_479.apk;This version requires Android 5.0 or newer.;https://github.com/openhab/openhab-android;https://github.com/openhab/openhab-android/issues
Fennec F-Droid;https://f-droid.org/en/packages/org.mozilla.fennec_fdroid/;Browser that supports current and anticipated web standards Improved tracking protection that blocks over 2000 online trackers Private mode available in a single tap Customizable navigation bar position Dark theme Collections of tabs Synchronization across multiple devices Search widget Pictureinpicture modeFennec FDroid is based on the latest Firefox release codenamed FenixIt has proprietary bits and telemetry removed but still connects tovarious Mozilla and Google services that can track users;https://f-droid.org/repo/org.mozilla.fennec_fdroid_1111020.apk;This version requires Android 5.0 or newer.;https://github.com/mozilla-mobile/firefox-android;https://gitlab.com/relan/fennecbuild/-/issues
floccus bookmark sync;https://f-droid.org/en/packages/org.handmadeideas.floccus/;With floccus you can sync your bookmarks across browsers via a server of your choosing a be it Nextcloud WebDAV or Google Drive A Nextcloud Bookmarks instance Your Google Drive or any WebDAV server;https://f-droid.org/repo/org.handmadeideas.floccus_4019001.apk;This version requires Android 5.1 or newer.;https://github.com/floccusaddon/floccus;https://github.com/floccusaddon/floccus/issues
Forkgram;https://f-droid.org/en/packages/org.forkgram.messenger/;Featuresa Delete for everyone option enabled by defaulta Removed pencil floating icona Original message date for forwarded messagesa Smaller header in the sidebara Option to disable inaapp cameraa Option to keep unmuted unread chats right after pinned dialogsa See the correct full number of subscribers in groupschannelsa Option to go to the first message of a chata Added more mute duration options 3 hours 1 daya Quick share button for every media in private chatsa Option to start recording video messages with the rear cameraa Unlimited unarchived pinned chats turns their sync offa Option to disable big emojisa Forward messages without quoting the original sendera Added a lot of selfadestruct timers options in secret chatsa Added Color Picker button in Photo Editora Tap on cloud GIF with preawritten text will send GIF with this text as captiona Tap on sticker with preawritten text will send botha Added upload date for profile photosa Added ability to see the profile info from the dialogs list via context menua Added ability to see unread count when you want to mark as read multiple dialogsa Option to directly open the archive on pulldowna PiP mode for YouTubes inaapp playera And morea;https://f-droid.org/repo/org.forkgram.messenger_323708.apk;This version requires Android 4.4 or newer.;https://github.com/Forkgram/TelegramAndroid;https://github.com/Forkgram/TelegramAndroid/issues
Tremotesf;https://f-droid.org/en/packages/org.equeim.tremotesf/;Remote GUI for Transmission BitTorrent clientFeatures  View torrent list  Sort torrents  Filter torrents by name status and trackers  Startstopverifyremove torrents with multiselection  Add torrents from torrent files and magnet links  Select which files to download when adding torrent  Manage torrent files  Add and remove torrent trackers  View torrent peers  Set torrent limits  Change remote server settings  View server statistics  Multiple servers  Supports HTTPS connection  Can connect to servers with selfsigned certificates you need to add certificate to server settings  Client certificate authenticationSource code httpsgithubcomequeimtremotesfandroidTranslations httpswwwtransifexcomequeimtremotesfandroid;https://f-droid.org/repo/org.equeim.tremotesf_4054.apk;This version requires Android 5.0 or newer.;https://github.com/equeim/tremotesf-android;https://github.com/equeim/tremotesf-android/issues
Fulguris Web Browser;https://f-droid.org/en/packages/net.slions.fulguris.full.fdroid/;Features includeSessionsAll your tabs belong to a session You can have multiple named sessions to help you stay focused and organized Switching between sessions is lightning fast You can pack hundreds of tabs in every sessions Address barSmart address title and search bar combined You can put it at the top or at the bottom of your screen depending of your screen orientationVertical tab panelReorder your tabs using long tap to drag and drop Swipe right to move a tab to the trash Recover tabs from the trash using panel tool barHorizontal tab barMuch like on your classic PC web browser Most useful when using tablets and desktop modes such as Samsung Dex and Huawei EMUI Desktop You can put it at the top or at the bottom of your screenaTabs managementBy default you should never need to push the new tab button New tabs are spawned as you do searches or input addresses However if you like to have fewer tabs you can adjust those settings to your likingScreen orientationsSpecific look and feel settings for portrait and landscape allowing optimal use of your screen real estate Includes optional pulltorefreshBookmarksImport export group them in folders and organise your bookmarks using drag and drop Backup and restore your bookmarks directly from any Cloud servicesaHistoryReview the pages you visited Clear it any time you wantForce dark modeFor your late night reading sessions you can force any web page to display in dark mode ThemesTool bar and status bar colour theme integrates gracefully with your favourite web sites Supports black dark and light themes Fulguris is not just fast secure and efficient it looks good tooaAd blockerUse ad blocker definitions from local and online files Suppports hosts files and most of Adblock Plus syntax so you can use almost any common filter listPrivacyFulguris protects and respects your privacy Incognito mode Can discard tracking cookies Clear tabs history cookies and caches functionalities Thirdparty apps managementSearchMultiple search engines Google Bing Yahoo StartPage DuckDuckGo etc Find text in page Google search suggestionaAccessibilityReader mode Various rendering mode inverted high contrast grayscalea Keyboard supportKeyboard shortcuts and focus management Persistent recent tab list enabling tab switching using CTRLTAB Visit our web site for a complete list of keyboard shortcutsaHardware acceleratedMakes the most of your hardware processing powerSettingsLots of settings options to fine tune your browser to your liking That includes configuration settings specific to your screen orientationTouch controlLong press to drag and organize your tabsSwipe right on a tab in the list to close itLong press to drag and organize your bookmarksLong press on icon buttons to show tooltipsDevicesThe following devices have had at least minimum testing with some version of FulgurisHuawei P30 Pro  Android 10Samsung Galaxy Tab S6  Android 10Fxtec ProA1  Android 9LG G8X ThinQ  Android 9Samsung Galaxy S7 Edge  Android 8HTC One M8  Android 6LG Leon  Android 6;https://f-droid.org/repo/net.slions.fulguris.full.fdroid_188.apk;This version requires Android 5.0 or newer.;https://github.com/Slion/Fulguris;https://github.com/Slion/Fulguris/issues
FeedWatcher;https://f-droid.org/en/packages/me.murks.feedwatcher/;Create custom queries to scan RSS and Atom feeds You will get a notification when new entries matching your queries are found;https://f-droid.org/repo/me.murks.feedwatcher_26.apk;This version requires Android 7.0 or newer.;https://github.com/zouroboros/feed-watcher;https://github.com/zouroboros/feed-watcher/issues
Nextcloud Notes;https://f-droid.org/en/packages/it.niedermann.owncloud.notes/;Companion app to Nextcloud Notes Funktionen   Mehrere Konten    Erstellen Bearbeiten Teilen Suchen und LAschen von Notizen    Texte und Links als neue Notizen in die App teilen    ToDos direkt in der Leseansicht abhaken a   Notizen als Favoriten markierena   Massenhaftes LAschen i    Notizen durchsuchen    MarkdownRendering a    Kontextbasierte Formatierung    Dark Mode    Single note widget and note list widget    Abersetzt in viele Sprachen  Voraussetzungen   Nextcloud httpsnextcloudcom   Nextcloud Notes App httpsappsnextcloudcomappsnotes   Nextcloud Android Client httpsplaygooglecomstoreappsdetailsidcomnextcloudclient aa Mitwirken   httpsgithubcomnextcloudnotesandroidfamilyjointheteam;https://f-droid.org/repo/it.niedermann.owncloud.notes_40000090.apk;This version requires Android 6.0 or newer.;https://github.com/nextcloud/notes-android;https://github.com/nextcloud/notes-android/issues
Nextcloud Deck;https://f-droid.org/en/packages/it.niedermann.nextcloud.deck/;An Android client for Nextcloud Deck AppA1 Features Multiple accounts  Works offline  Manage cards lists and boards  Manage tags  Supports attachments  activities a  comments  Dark mode  Translated in many languages  Requirements NextcloudA1 instance running Nextcloud AndroidA2 app installed version 322 or later Nextcloud DeckA3 app enabled version 064 or later LicenseAll contributions to this repository are considered to be licensed under the GNU GENERAL PUBLIC LICENSE 3LICENSEA1 httpsgithubcomnextcloudandroidA2 httpsnextcloudcomA3 httpsgithubcomnextclouddeck;https://f-droid.org/repo/it.niedermann.nextcloud.deck_1022001.apk;This version requires Android 7.0 or newer.;https://github.com/stefan-niedermann/nextcloud-deck;https://github.com/stefan-niedermann/nextcloud-deck/issues
NaïveProxy Plugin - SagerNet;https://f-droid.org/en/packages/io.nekohasekai.sagernet.plugin.naive/;DOCUMENTShttpssagernetorgProtocolsThe application is designed to be used whenever possibleProxySOCKSHTTPSShadowsocksShadowsocksRVMessVLESSTrojanVLESS  Trojan  XTLS  xtlsplugin TrojanGo  trojangoplugin NaA veProxy  naiveplugin Ping Tunnel  pingtunnelplugin relaybaton  relaybatonplugin Brook  brookplugin SubscriptionUniversal base64 formatShadowsocks SIP008Just My Socks proprietary formatClashFeaturesFull basic featuresV2Ray WebSocket browser forwardingOption to change the notification update intervalA Chinese apps scanner based on dex classpath scanning so it may be slowerProxy chainAdvanced routing with outbound profile selection support;https://f-droid.org/repo/io.nekohasekai.sagernet.plugin.naive_130.apk;This version requires Android 5.0 or newer.;https://github.com/SagerNet/SagerNet;https://github.com/SagerNet/SagerNet/issues
Mieru Plugin - SagerNet;https://f-droid.org/en/packages/io.nekohasekai.sagernet.plugin.mieru/;DOCUMENTShttpssagernetorgProtocolsThe application is designed to be used whenever possibleProxySOCKSHTTPSShadowsocksShadowsocksRVMessVLESSTrojanVLESS  Trojan  XTLS  xtlsplugin TrojanGo  trojangoplugin NaA veProxy  naiveplugin Ping Tunnel  pingtunnelplugin relaybaton  relaybatonplugin Brook  brookplugin SubscriptionUniversal base64 formatShadowsocks SIP008Just My Socks proprietary formatClashFeaturesFull basic featuresV2Ray WebSocket browser forwardingOption to change the notification update intervalA Chinese apps scanner based on dex classpath scanning so it may be slowerProxy chainAdvanced routing with outbound profile selection support;https://f-droid.org/repo/io.nekohasekai.sagernet.plugin.mieru_60.apk;This version requires Android 5.0 or newer.;https://github.com/SagerNet/SagerNet;https://github.com/SagerNet/SagerNet/issues
HACS;https://f-droid.org/en/packages/io.mainframe.hacs/;An app for our keyholder to view and manage the door states of the hackspace It uses an mqtt service to get the current status and sends door commands per ssh;https://f-droid.org/repo/io.mainframe.hacs_62.apk;This version requires Android 9.0 or newer.;https://github.com/ktt-ol/hacs;https://github.com/ktt-ol/hacs/issues
DanXi;https://f-droid.org/en/packages/io.github.danxi_dev.dan_xi/;Maybe the best allrounded service app for Fudan University students Campus card balance and transactions Dining hall traffic Shortcut for Fudan QR Code with support for Apple Watch View empty classrooms Tree Hole View compulsoryexercise records View timetable and export as ics file Show Notices from Academic Affairs Office View exam schedule and export as ics file View final exam GPA and ranking View school bus scheduleCome to our website to know more about DanXi httpsdanxifduholecom;https://f-droid.org/repo/io.github.danxi_dev.dan_xi_335.apk;This version requires Android 5.0 or newer.;https://github.com/DanXi-Dev/DanXi/tree/foss-build;https://github.com/DanXi-Dev/DanXi/issues
Fedilab;https://f-droid.org/en/packages/fr.gouv.etalab.mastodon/;It supports Mastodon Pleroma Pixelfed and FriendicaThe app has advanced features  Compose threads Multiaccounts support Schedule messages from the device Follow and interact with remote instances Crossaccount actions with a long press Translation feature Art timelines;https://f-droid.org/repo/fr.gouv.etalab.mastodon_489.apk;This version requires Android 5.0 or newer.;https://codeberg.org/tom79/Fedilab;https://codeberg.org/tom79/Fedilab/issues
