Jellyfin for Android TV;https://f-droid.org/en/packages/org.jellyfin.androidtv/;Your media on your termsThe Jellyfin project is an open source free software media server No fees no tracking no hidden agenda Get our free server to collect all your audio video photos and more in one placeTo use the app you must have a Jellyfin server set up and running Find out more at jellyfinorgWith a Jellyfin server you can Watch Live TV and recorded shows from your Jellyfin server additional hardwareservices required Stream to a Chromecast device on your network Stream your media to your Android device View your collection in an easy to use interfaceThis is the official Jellyfin companion app for Android TV Thank you for using Jellyfin;https://f-droid.org/repo/org.jellyfin.androidtv_150599.apk;This version requires Android 5.0 or newer.;https://github.com/jellyfin/jellyfin-androidtv;https://github.com/jellyfin/jellyfin-androidtv/issues
Activity Launcher fork;https://f-droid.org/en/packages/de.szalkowski.activitylauncher.rustore_fork/;This opensource Android App launches hidden activities and creates home screen shortcuts for installed apps;https://f-droid.org/repo/de.szalkowski.activitylauncher.rustore_fork_137.apk;This version requires Android 6.0 or newer.;https://github.com/Sash0k/ActivityLauncher;https://github.com/Sash0k/ActivityLauncher/issues
Translate You;https://f-droid.org/en/packages/com.bnyro.translate/;Translate You is a Translator App built with Material Design 3 YouIt supports multiple different translation engiens such as LibreTranslate Lingva Deepl and moreIn total there are more than 200 supported languages across 6 different translation engines;https://f-droid.org/repo/com.bnyro.translate_29.apk;This version requires Android 5.0 or newer.;https://github.com/Bnyro/TranslateYou;https://github.com/Bnyro/TranslateYou/issues
omWeather;https://f-droid.org/en/packages/org.woheller69.omweather/;omWeather lets you watch the weather for cities and locations you are interested inWeather data is provided via the free API from OpenMeteocom and RainViewercomFeatures Current weather Hourly forecasts for 7 days Rain radar Widget with optional GPS auto position update No advertisementMinimum permissionsomWeather only requires the minimum amount of permission namely only the INTERNET permission This permission is necessary to make HTTP requests to remote servers for retrieving weather dataOptional authorization for GPS;https://f-droid.org/repo/org.woheller69.omweather_14.apk;This version requires Android 5.0 or newer.;https://github.com/woheller69/omweather;https://github.com/woheller69/omweather/issues
Wikipedia;https://f-droid.org/en/packages/org.wikipedia/;The official Wikipedia Android app is designed to help you find discover and explore knowledge on Wikipedia Settle a bet with a friend by doing a quick search through the app or dive into featured articles images recommended articles and more using the explore feed With more than 39 million articles in nearly 300 languages your favorite free online encyclopedia is now at your fingertipsFeaturesExplore feed  The new aexplore feeda offers recommended and constantly updating Wikipedia content right on the home screen including trending articles current events suggested reading and moreVoiceintegrated search  Easily find what youare looking for with a prominent search bar at the top of the app including voiceenabled search on your deviceNearby  Learn more about whatas around you by selecting points on an interactive map to see articles related to your current and nearby locationLanguage support  Seamlessly switch to reading any languagesupported Wikipedia either by changing the language of the current article or changing your preferred search language while searchingLink previews  Tap on an article to preview it without losing your place in what youare currently reading Press and hold a link to open it in a new tab allowing you to keep reading the current article without losing your place and switch to the new tab when youre readyTable of contents  swipe left on any article to bring up the table of contents which lets you jump to article sections easilyReading lists  Organize the articles you browse into reading lists which you can access even when youre offline Create as many lists as you like give them custom names and descriptions and populate them with articles from any language wikiImage gallery  Tap on an image to view the image fullscreen in high resolution with options to swipe for browsing additional imagesDefinitions from Wiktionary  Tapandhold to highlight a word then tap the Define button to see a definition of the word from WiktionaryWikipedia Zero  Access Wikipedia for Android free of data charges for participating mobile operators link to participating operatorsSend us your feedback about the app In the menu press Settings then About the Wikipedia app then Send app feedbackThe code is 100 open source If you have experience with Java and the Android SDK then we look forward to your contributions httpsgithubcomwikimediaappsandroidwikipediaBy using this app you agree to the automatic transmission of crash reports to a thirdparty service provider If you would like to disable this feature please press Settings then toggle off Send crash reports under the Privacy sectionExplanation of permissions needed by the app httpswwwmediawikiorgwikiWikimediaAppsAndroidFAQSecurityandPermissionsPrivacy policy httpsmwikimediafoundationorgwikiPrivacypolicyCrash report thirdparty service provider privacy policy httpswwwmicrosoftcomenusprivacystatementOnlineServicesDefaultaspxTerms of Use httpsmwikimediafoundationorgwikiTermsofUseAbout the Wikimedia FoundationThe Wikimedia Foundation is the nonprofit organization that supports Wikipedia and the other Wikimedia projects The Wikimedia Foundation is a charitable organization funded mainly through donations For more information please visit our website httpswikimediafoundationorgwikiHome;https://f-droid.org/repo/org.wikipedia_50433.apk;This version requires Android 5.0 or newer.;https://github.com/wikimedia/apps-android-wikipedia;https://phabricator.wikimedia.org/project/profile/489/
Telegram FOSS;https://f-droid.org/en/packages/org.telegram.messenger/;Warning Creating new accounts in the FOSS version not possible anymore you have to create an account in the official build and then login to the FOSS Client for the Telegram messaging platform Chat with friends start group chats and share all kinds of content All of your messages and conversations are stored in Telegrams cloudThe messaging platform is aimed at mobile devices but desktop and web clients exist as wellSeveral proprietary parts were removed from the original Telegram client including Google Play Services for the location services HockeySDK for selfupdates and push notifications through Google Cloud Messaging Location sharing functionality is restored using OpenStreetMapAntiFeature NonFree Network since the servers run proprietary softwareThe official source code of the app contains binary blobs so this tracks a fork which builds those from source Hence versions might become available with a certain lag;https://f-droid.org/repo/org.telegram.messenger_32139.apk;This version requires Android 4.4 or newer.;https://github.com/Telegram-FOSS-Team/Telegram-FOSS;https://github.com/Telegram-FOSS-Team/Telegram-FOSS/issues
i2pd;https://f-droid.org/en/packages/org.purplei2p.i2pd/;I2P Invisible Internet Protocol is a universal anonymous network layerAll communications over I2P are anonymous and endtoend encrypted participants dont reveal their real IP addressesI2P client is a software used for building and using anonymous I2P networksSuch networks are commonly used for anonymous peertopeer applications filesharing cryptocurrencies and anonymous clientserver applications websites instant messengers chatserversI2P allows people from all around the world to communicate and share information without restrictionsFor more information about I2P you can read article on Wikipedia;https://f-droid.org/repo/org.purplei2p.i2pd_2470000.apk;This version requires Android 4.1 or newer.;https://github.com/PurpleI2P/i2pd-android;https://github.com/PurpleI2P/i2pd-android/issues
openHAB Beta;https://f-droid.org/en/packages/org.openhab.habdroid.beta/;openHAB  empowering the smart home  vendor and technology agnostic open source home automationThe builds on FDroid have FCM removed and therefore wont be able to receive push notifications from openHAB Cloud Instead notifications are polled on a regular basis in these buildsTry out new features and give early feedbackYou can install the beta version alongside the stable versionopenHAB is a Javabased opensource home automation platform that integrates and combines a vast range of different smart home systems and technologies into one single solutionOn top of the unified abstraction layer all connected devices are available for the overarching automation rule engines and different user interfacesSupported ProductsOver 200 specific addons provide support for brands devices technologies and communication protocols Examples are ZWave Philips Hue Amazon Echo Chromecast and Sonos Discover all available addons and supported devices andor functions at httpswwwopenhaborgaddonsThe app has an action plugin for Tasker and Locale includedOpen Source CommunityThe openHAB open source initiative strongly supports its vibrant community The forum with over 13000 registered users is a place to find guidance help and inspiration Join the openHAB community forum over at httpscommunityopenhaborgWhen you find an issue please report it in the forum or at httpsgithubcomopenhabopenhabandroidissuesIf you want to translate the app into your language join us at httpscrowdincomprojectopenhabandroidopenHAB FoundationThe openHAB Foundation eV is a nonprofit organization with the mission to educate the public about the possibilities and benefits of free and open smart home solutions Learn about the mission and the services of the foundation under httpswwwopenhabfoundationorgImportant noteYou need an openHAB server for this appPrivacy policy httpswwwopenhabfoundationorgprivacyhtml;https://f-droid.org/repo/org.openhab.habdroid.beta_478.apk;This version requires Android 5.0 or newer.;https://github.com/openhab/openhab-android;https://github.com/openhab/openhab-android/issues
Ultrasonic;https://f-droid.org/en/packages/org.moire.ultrasonic/;Ultrasonic is a Subsonic and compatible servers client to Android You can use Ultrasonic to connect with your server and listen musicMain features Thin Fast Dark and light theme Multiple server support Offline Mode Bookmarks Playlists on server Ramdom play Jukebox mode Server chat And much moreThe source code is available with GPL license in GitLab httpsgitlabcomultrasonicultrasonicIf you have any issue please post in httpsgitlabcomultrasonicultrasonicissuesPlay store icon designed by httpwwwflaticoncomauthorssebastiengabriel;https://f-droid.org/repo/org.moire.ultrasonic_112.apk;This version requires Android 5.0 or newer.;https://gitlab.com/ultrasonic/ultrasonic;https://gitlab.com/ultrasonic/ultrasonic/issues
Box, Box!;https://f-droid.org/en/packages/org.brightdv.boxbox/;With Box Box follow the latest stories of your favorite driver and teamBe aware of the battles on and off the trackFeatures Read all articles from the official website with its inbuilt reader and video player Latest Standings Drivers and Teams Schedule with previous results for Free Practices Qualifyings and Races While a Grand Prix is running follow the schedule of the different sessions and read the related FIAs documents Enjoy the app in the colours of your favorite team Open links inappBe in the action even without ads or trackers ;https://f-droid.org/repo/org.brightdv.boxbox_17.apk;This version requires Android 5.0 or newer.;https://github.com/BrightDV/BoxBox;https://github.com/BrightDV/BoxBox/issues
I2P;https://f-droid.org/en/packages/net.i2p.android.router/;I2P is an anonymizing network offering a simple layer that identitysensitiveapplications can use to securely communicate All data is wrapped with severallayers of encryption and the network is both distributed and dynamic with notrusted parties;https://f-droid.org/repo/net.i2p.android.router_4745276.apk;This version requires Android 5.0 or newer.;https://github.com/i2p;https://trac.i2p2.de
Nekogram X;https://f-droid.org/en/packages/nekox.messenger/;NekoX is an thirdparty Telegram client based on TelegramFOSS with features added Most of Nekograms features Unlimited login accounts OpenCC Chinese Convert Builtin VMess Shadowsocks SSR TrojanGFW proxies support Builtin public proxy list  Proxy subscription support Ipv6 MTProxy support Able to parse all proxy subscription format SIP008 ssr v2rayN vmess1 shit ios app formats clash config and more Proxies import and export remarks speed measurement sorting delete unusable nodes etc Scan the QR code any link can add a proxy The  vmess  vmess1  ss  ssr  trojan  proxy link in the message can be clicked Allow autodisabling proxy when VPN is enabled Proxy automatic switcher Add stickers without sticker pack Allow disabling vibration Allow clicking on links in self profile Sticker set list backup  restore  share Full InstantView translation support Translation support for selected text on input and in messages Delete all messages in group Dialog sorting is optional Unread and can be prioritized for reminding etc Allow to skip regret within five seconds Unblock all users support Login via QR code Scan and confirm the login QR code directly Allow clearing app data Option to not send comment first when forwarding Option to use nekox chat input menu replace record button with a menu which contains an switch to control link preview enabled by default Option to disable link preview by default to prevent the server from knowing that the link is shared through Telegram Option to ignore Androidonly content restrictions except for the Play Store version OpenKeychain client sign  verify  decrypt  import Google Cloud Translate  YandexTranslate support Custom cache directory supports external storage Custom app ID and Hash optional NekoX  Android  Android X or Manual input Custom server official test DC Keep the original file name when downloading files View the data center you belong to when you dont have an avatar Proxies groups channels sticker packs are able to shared as QR codes Force English emoji keywords to be loaded Add Name when longpressing user option Enhanced notification service optional version without Google Services Dont alert Proxy unavailable for noncurrent account Option to block others from starting a secret chat with you Allow creation of group without invite Option to upgrade group to supergroup Mark dialogs as read using tab menu Improved session dialog Improved link long click menu Improved hide messages from blocked users feature Text replacer Persian calendar support Option to disable trending Telegram X style menu for unpinning messages Builtin Material Design themes  Telegram X style icons Enabled set auto delete timer option for private chats and private groups Dont process cleanup draft events after opening chat Support saving multiple selected messages to Saved Messages Support unpinning multiple selected messages View stats option for messages And more AntiFeature NonFree Network since the servers run proprietary softwareThe official source code of the app contains binary blobs so this tracks a fork which builds those from source Hence versions might become available with a certain lag;https://f-droid.org/repo/nekox.messenger_710.apk;This version requires Android 4.4 or newer.;https://github.com/NekoX-Dev/NekoX;https://github.com/NekoX-Dev/NekoX/issues
Matsuri;https://f-droid.org/en/packages/moe.matsuri.lite/;A proxy toolchain for Android written in Kotlin This is a fork of SagerNet with different features and improved experience in some situations;https://f-droid.org/repo/moe.matsuri.lite_903.apk;This version requires Android 5.0 or newer.;https://github.com/MatsuriDayo/Matsuri;https://github.com/MatsuriDayo/Matsuri/issues
HalfDot for Umami;https://f-droid.org/en/packages/it.davquar.halfdot/;HalfDot is a minimalistic client for Umami an opensource and privacyfocused web analytics platformHalfDot does not have any tracking ads and it follows the Material Design 3 guidelines;https://f-droid.org/repo/it.davquar.halfdot_23.apk;This version requires Android 4.3 or newer.;https://github.com/davquar/halfdot;https://github.com/davquar/halfdot/issues
Element - Secure Messenger;https://f-droid.org/en/packages/im.vector.app/;Element is both a secure messenger and a productivity team collaboration app that is ideal for group chats while remote working This chat app uses endtoend encryption to provide powerful video conferencing file sharing and voice callsElementas features include Advanced online communication tools Fully encrypted messages to allow safer corporate communication even for remote workers Decentralized chat based on the Matrix open source framework File sharing securely with encrypted data while managing projects Video chats with Voice over IP and screen sharing Easy integration with your favourite online collaboration tools project management tools VoIP services and other team messaging appsElement is completely different from other messaging and collaboration apps It operates on Matrix an open network for secure messaging and decentralized communication It allows selfhosting to give users maximum ownership and control of their data and messagesPrivacy and encrypted messagingElement protects you from unwanted ads data mining and walled gardens It also secures all your data onetoone video and voice communication through endtoend encryption and crosssigned device verificationElement gives you control over your privacy while allowing you to communicate securely with anyone on the Matrix network or other business collaboration tools by integrating with apps such as SlackElement can be selfhostedTo allow more control of your sensitive data and conversations Element can be selfhosted or you can choose any Matrixbased host  the standard for open source decentralized communication Element gives you privacy security compliance and integration flexibilityOwn your dataYou decide where to keep your data and messages Without the risk of data mining or access from third partiesElement puts you in control in different ways1 Get a free account on the matrixorg public server hosted by the Matrix developers or choose from thousands of public servers hosted by volunteers2 Selfhost your account by running a server on your own IT infrastructure3 Sign up for an account on a custom server by simply subscribing to the Element Matrix Services hosting platformOpen messaging and collaborationYou can chat with anyone on the Matrix network whether theyare using Element another Matrix app or even if they are using a different messaging appSuper secureReal endtoend encryption only those in the conversation can decrypt messages and crosssigned device verificationComplete communication and integrationMessaging voice and video calls file sharing screen sharing and a whole bunch of integrations bots and widgets Build rooms communities stay in touch and get things donePick up where you left offStay in touch wherever you are with fully synchronised message history across all your devices and on the web at httpsappelementioOpen sourceElement Android is an open source project hosted by GitHub Please report bugs andor contribute to its development at httpsgithubcomvectorimelementandroid;https://f-droid.org/repo/im.vector.app_40105280.apk;This version requires Android 5.0 or newer.;https://github.com/vector-im/element-android;https://github.com/vector-im/element-android/issues
V2EX;https://f-droid.org/en/packages/im.fdx.v2ex/;A simple android client for exploring V2EX Excellent user experience Main functionshow v2ex topic contentcreate topic and make commentopen from web urlunread message through backgroundnight modefont size customizedsearch topic;https://f-droid.org/repo/im.fdx.v2ex_60.apk;This version requires Android 5.1 or newer.;https://github.com/fan123199/v2ex-simple;https://github.com/fan123199/v2ex-simple/issues
AnonAddy for Android;https://f-droid.org/en/packages/host.stjin.anonaddy/;Easily create and manage your AnonAddy aliases recipients and more from your phone tablet or wearable with the AnonAddy app for AndroidRequirementsAnonAddy instance running v0136 or higherCharacteristicsConnect to the AnonAddy instance or your own hosted instanceA unique gorgeous and sleek design based on the Material You Design guidelinesSupport for Deep Link to easily deactivate aliases from the email bannerLock the app using BiometricsApp exclusive featuresWatching aliases for new emailsGet notified when a new update is availableSend emails from aliases by selecting an email address or clicking a mailto linkGet notified on failed deliveriesUpdate multiple aliases at onceEnable error logging to locally store exceptions for easy troubleshootingExport and import encrypted backups of the app configurationWidgetsSecurityEncrypted preferences your API key and other AnonAddy related settings are securely stored on your device using the AndroidX crypto libraryEncrypted app backups when making a backup of the app configuration through the builtin backup managerNo stats buried points or Device IDs or even crash reporting Except for Google Play Store builds So if you get a crash please share the crash info with me I am forgoing the convenient thirdparty collection SDK and various stats just so you can use it with confidenceManage add edit deleteAliasesRecipientsDomainsUsernamesRulesFailed deliveriesWhat is AnonAddyAnonAddy is an open source email forwarding service designed to protect an Internet users email addresses from spam and other unwanted emails Using the AnonAddy Android app managing your aliased has become easier than ever Learn more about AnonAddy httpsanonaddycom Disclaimer This app is in no way associated with the AnonAddy project and does not offer a license for the AnonAddy service;https://f-droid.org/repo/host.stjin.anonaddy_334600100.apk;This version requires Android 6.0 or newer.;https://gitlab.com/Stjin/anonaddy-android;https://gitlab.com/Stjin/anonaddy-android/-/issues
Tutanota;https://f-droid.org/en/packages/de.tutao.tutanota/;Tutanota enables you to use the benefits of the cloud  availability flexibility automatic backup  without compromising on security With Tutanotas builtin encryption you own your data no one else can access it Tutanota comes with a light  beautiful GUI dark theme included with instant push notifications autosync fulltext search swipe gestures and moreThe open source email app Tutanota enables you to send endtoend encrypted emails to anybody Even emails that are being sent without endtoend encryption and all your contacts are stored securely encrypted on the Tutanota serversOur passion for privacyTutanota is being built by a team passionate about everybodys right to privacy We are supported by an amazing community which enables us to grow our team continuously making Tutanota a success without depending on venture capital interestsTutanota respects you  your data Only you can access your encrypted emails  contacts Tutanota does not track or profile you Open source client  apps Innovative fulltext search feature lets you easily search your mailbox TLS with support of PFS DMARC DKIM DNSSEC and DANE Secure password reset that gives us absolutely no access 100 developed and located in Germany under strict Data Protection Laws GDPROfficial website httpstutanotacomSource code httpsgithubcomtutaotutanotaWith the Tutanota app you can create your own Tutanota email address ending in tutanotacom tutanotade tutamailcom tutaio or keemailme with 1 GB of free storage create your custom domain email address for a1 per month send and receive endtoend encrypted emails to anybody send and receive oldfashioned emails not endtoend encrypted Even these emails are stored encrypted on the Tutanota servers automatically encrypt subject content and attachments get push notifications instantly autocomplete email addresses as you type from your Tutanota or your phone contactsThe Tutanota app asks for very few permissions to keep your level of privacy to a maximum Full network access Used to send and receive emails Receive data from the internet To notify you when you receive a new email View network connections To find out if an internet connection exists Read your contacts This enables you to select recipients from your phones contacts Read from SD card To allow adding of attachments from the SD card to emails Control vibration To notify you when you receive a new email Deactivate sleeping mode To notify you when you receive a new email;https://f-droid.org/repo/de.tutao.tutanota_396201.apk;This version requires Android 6.0 or newer.;https://github.com/tutao/tutanota;https://github.com/tutao/tutanota/issues
MetaGer Search;https://f-droid.org/en/packages/de.metager.metagerapp.fdroid/;MetaGerde is a German meta search engine with a focus on data protection and diversity of resultsWith the MetaGer app you search the web optimally The search saves your data volume and is adapted to unstable mobile phone connectionsYour MetaGer key for adfree searches is anonymised by blind signatures when using the app;https://f-droid.org/repo/de.metager.metagerapp.fdroid_50100.apk;This version requires Android 5.0 or newer.;https://gitlab.metager.de/open-source/app-en;https://gitlab.metager.de/open-source/app-en/-/issues
