Duorem;https://f-droid.org/en/packages/com.vadimfrolov.duorem/index.html;The idea behind this app is to provide people who are not very familiar withcomputer interfaces a simple and easy way to control a remote computer Imagineyour grand parent needs a way to power a media server Quick and efficientlyThe application uses Wake On LAN WOL technique to start a remote computer Youneed to make sure that your computer and network is set up for and support WOLThe app can only power off or restart a Linuxbased computer It performs theseactions using secure shell SSH Your remote computer must be configured toenable SSH connections Username that is used for SSH must have sudo rightsNote that SSH credentials are stored in application preferences unencryptedAnyone with root access can read itDifferences from similar apps Supports power off and power on signals Controls only a single computer Big interface controls for people with thick fingers Remote computer status and commands feedback Host search for easy firsttime setup Open source no adsBug reports and comments are welcomed on app development page;https://f-droid.org/repo/com.vadimfrolov.duorem_6.apk;This version requires Android 4.1 or newer.;https://github.com/fralik/Duorem;https://github.com/fralik/Duorem/issues;1.1.4;view network connections <-> view Wi-Fi connections <-> have full network access <-> 
A Photo Manager;https://f-droid.org/en/packages/de.k3b.android.androFotoFinder/index.html;Features Fast find photos by tagskeywords subfolder date geo  title  Display result in gallery or geographic map from openstreetmap Filemanagement copy move rename delete send Incremental Photo Backup   Support for Virtual Albums Edit exif metadata date title description tagskeywords geo rating  AutoProcessing  onmove automatically rename photofiles andor add metadata Can handle big image collections 20000 images in 1000 folders Small memory footprint 15 MB Works on old lowmemory android 40 devices Uses Androids image contentprovider No initial image scan neccessary Extended photo media scanner for Exif IPTC XMPPrivacy Can hide photos from other galleryappsimagepickers Vault mode If enabled unwanted photos cannot be seen and dangerous operations ie delete are prohibited This way you can safely hand over your device to someone else Photos are kept on local device No upload to third party No adds no usertracking free open source available on fdroidRequired Android Permissions INTERNET to download map data from Open Streetmap Server ACCESSNETWORKSTATE and ACCESSWIFISTATE to find out if wifiinternet is online to start downloaded geodata WRITEEXTERNALSTORAGE to cache downloaded map data in local file system and to do file operations with the photos READLOGS to read and save potential crashlogs to a textfile;https://f-droid.org/repo/de.k3b.android.androFotoFinder_47.apk;This version requires Android 4.0 or newer.;https://github.com/k3b/APhotoManager;https://github.com/k3b/APhotoManager/issues;0.8.3.200315;view network connections <-> view Wi-Fi connections <-> have full network access <-> read the contents of your shared storage <-> android.permission.READ_LOGS <-> modify or delete the contents of your shared storage <-> 
CUPS Printing;https://f-droid.org/en/packages/io.github.benoitduffez.cupsprint/index.html;This app provides a Print Service to Android This means that once itsinstalled you need to enable it in the Print section of the settings appOnce the service is enabled printers are automatically discovered using themDNS protocol You can print anything you want from any app as long as theprint service is enabledOf course printing document is an important matter Because your documents areyour most private information you dont want anybody to have access to thisinformation This is why this app is completely open sourced and free to usemodify and redistribute;https://f-droid.org/repo/io.github.benoitduffez.cupsprint_1050099.apk;This version requires Android 4.4 or newer.;https://github.com/BenoitDuffez/AndroidCupsPrint/;https://github.com/BenoitDuffez/AndroidCupsPrint/issues;1.5.0;have full network access <-> read the contents of your shared storage <-> 
FilmChecker;https://f-droid.org/en/packages/me.murks.filmchecker/index.html;Checks the status of photo orders Currently only Rossmann only in Germany andDM Germany and Austria are supported;https://f-droid.org/repo/me.murks.filmchecker_21.apk;This version requires Android 4.0 or newer.;https://github.com/zouroboros/filmchecker;https://github.com/zouroboros/filmchecker/issues;2.0.5;have full network access <-> 
StageFever;https://f-droid.org/en/packages/com.fr3ts0n.stagefever/index.html;Shows stage notes AMPeffect settings BPM etc for any song in setlistA setlist is a csv file following the schemeSongArtistSettingsBPMStage notesFeatures all important song notes on one glance Amplifiereffect settings visual BPM stage notes single click to move to nextprevious song set list overview and navigation with swipe left import set list data from CSV file;https://f-droid.org/repo/com.fr3ts0n.stagefever_10200.apk;This version requires Android 4.0.3 or newer.;https://github.com/fr3ts0n/StageFever;https://github.com/fr3ts0n/StageFever/issues;V1.2.0;read the contents of your shared storage <-> prevent phone from sleeping <-> modify or delete the contents of your shared storage <-> 
A2DP Volume;https://f-droid.org/en/packages/a2dp.Vol/index.html;Automatically adjusts the media volume on connect and resets it on disconnectThis is done so that stereo streaming audio can work properly Intendedprimarily for car Bluetooth systems It can read out text messages using Text ToSpeech TTS services while you are connected Each paired Bluetooth device orvirtual device home dock car dock power connection or headset plug can beconfigured to your liking There is amanual on the websiteA secondary feature is the ability to capture location information so you canfind where you left your car The location can also be automatically capturedwhen exiting Car Mode on your Android device and read by any app thatunderstands GPS data;https://f-droid.org/repo/a2dp.Vol_169.apk;This version requires Android 6.0 or newer.;https://github.com/jroal/a2dpvolume;https://github.com/jroal/a2dpvolume/issues;2.13.0.4;access approximate location only in the foreground <-> access precise location only in the foreground <-> access Do Not Disturb <-> view Wi-Fi connections <-> pair with Bluetooth devices <-> access Bluetooth settings <-> send sticky broadcast <-> connect and disconnect from Wi-Fi <-> run foreground service <-> close other apps <-> change your audio settings <-> read the contents of your shared storage <-> read phone status and identity <-> run at startup <-> modify or delete the contents of your shared storage <-> install shortcuts <-> com.android.launcher.permission.READ_SETTINGS <-> 
Symphony;https://f-droid.org/en/packages/org.fitchfamily.android.symphony/index.html;A simple music player based on the ability to play random albums within aspecified genre with all the songs in the album played in order This istailored to listening to classical music Broadway musicals or other genreswhere the order of the tracks in an album are significant;https://f-droid.org/repo/org.fitchfamily.android.symphony_22.apk;This version requires Android 5.0 or newer.;https://github.com/n76/Symphony;https://github.com/n76/Symphony/issues;1.1.14;run foreground service <-> read the contents of your shared storage <-> prevent phone from sleeping <-> 
Clementine Remote;https://f-droid.org/en/packages/de.qspool.clementineremote/index.html;You need Clementine 13 quiterecent for this to work and to enable the remote Control in Clementine settingsfirstControl the music player Clementine  access your playlists browse thelibrary download files change the volume via hardware buttons read the lyricswhile listening to your favourite song enjoy the cover art and moreIf you receive a call or want to make one you dont have pause the currenttrack Clementine Remote lowers the volume for you It also has many morefeatures for example exchange of music and playlists with a computer;https://f-droid.org/repo/de.qspool.clementineremote_759.apk;This version requires Android 4.0.3 or newer.;https://github.com/clementine-player/Android-Remote;https://github.com/clementine-player/Android-Remote/issues;v12;view network connections <-> view Wi-Fi connections <-> allow Wi-Fi Multicast reception <-> have full network access <-> read the contents of your shared storage <-> read phone status and identity <-> prevent phone from sleeping <-> modify or delete the contents of your shared storage <-> com.android.vending.BILLING <-> 
Youtube Video Listing App (By The Creative Team);https://f-droid.org/en/packages/tn.creativeteam.newyoutubelistingapp/index.html;;https://f-droid.org/repo/tn.creativeteam.newyoutubelistingapp_6.apk;This version requires Android 4.0.3 or newer.;https://github.com/mohamedbelhassen/YoutubeListingApp;https://github.com/mohamedbelhassen/YoutubeListingApp/issues;1.6;view network connections <-> have full network access <-> 
XOverrideHeadphoneJackDetection;https://f-droid.org/en/packages/de.antonarnold.android.xoverrideheadphonejackdetection/index.html;This XPosed module allows you to manually override the headphone jack detection of an Android deviceMost smartphones provide a headphoneheadset jack that allows using a headset instead the internal speakermicrophone To automatically select between these a mechanical switch is added to detect a plugged in cable If this switch breaks and replacing it is not realistic your phone may become more or less unusable With this module you are able to manually control the headphone detection state and continue using your phone;https://f-droid.org/repo/de.antonarnold.android.xoverrideheadphonejackdetection_5.apk;This version requires Android 4.0.3 or newer.;https://github.com/anton-arnold/xoverrideheadphonejackdetection;https://github.com/anton-arnold/xoverrideheadphonejackdetection/issues;1.5;
DNG Processor;https://f-droid.org/en/packages/amirz.dngprocessor/index.html;DNG Processor waits for new RAW images captured using the OEM cameraapp or any other camera app that can capture RAWs and then processes theminto JPEGs in the background It does this by using the power of yourphones GPU for up to a few seconds The results are placed in the folderDCIMProcessed;https://f-droid.org/repo/amirz.dngprocessor_5.apk;This version requires Android 7.0 or newer.;https://github.com/amirzaidi/DNGProcessor;https://github.com/amirzaidi/DNGProcessor/issues;5;run foreground service <-> read the contents of your shared storage <-> run at startup <-> modify or delete the contents of your shared storage <-> 
Vanilla Lyrics Search;https://f-droid.org/en/packages/com.kanedias.vanilla.lyrics/index.html;This app is a plugin Prior to use it you should havechblinkenlightsandroidvanilla installed Once both player and this pluginare installed request a context menu from library screen select Plugins andLyrics search afterwards Note that this plugin requires internet connectionto be usefulFor file tag related operations it also optionally requirescomkanediasvanillaaudiotag to be presentThis plugin allows reading lyrics from file tag or from lrc file with samename If no lyrics is available from these sources it can also download lyricsfrom Lyrics Wiki if it is present  for this filesartist and titleFeatures Requests lyrics by artist and title from lyricswikiacom Can read lyrics from file tags or lrc files and show them without internet connection Can write lyrics retrieved from wiki to file tags;https://f-droid.org/repo/com.kanedias.vanilla.lyrics_13.apk;This version requires Android 4.0 or newer.;https://github.com/vanilla-music/vanilla-music-lyrics-search;https://github.com/vanilla-music/vanilla-music-lyrics-search/issues;1.3.3;have full network access <-> read the contents of your shared storage <-> modify or delete the contents of your shared storage <-> 
Piwigo;https://f-droid.org/en/packages/org.piwigo.android/index.html;Piwigo is a native Android Application for the free and open source photo hosting platform Piwigo With this app you can browse you selfhosted gallery and upload photos from your smart devicePiwigo is built by an active community of users and developersPiwigo empowers you to create your own photo gallery on the web and includes many powerful features such as albums tags geolocation many levels of customization upload by visitors privacy calendar or statistics;https://f-droid.org/repo/org.piwigo.android_102.apk;This version requires Android 4.1 or newer.;https://github.com/Piwigo/Piwigo-Android;https://github.com/Piwigo/Piwigo-Android/issues;1.0.2;view network connections <-> android.permission.AUTHENTICATE_ACCOUNTS <-> find accounts on the device <-> have full network access <-> android.permission.MANAGE_ACCOUNTS <-> read the contents of your shared storage <-> android.permission.USE_CREDENTIALS <-> 
Pitch Pipe;https://f-droid.org/en/packages/com.mustupid.pitch_pipe/index.html;A simple and usable chromatic pitch pipe to provide a pitch reference formusicians The pitch reference for A4 is tunable between 400Hz and 470Hz;https://f-droid.org/repo/com.mustupid.pitch_pipe_1.apk;This version requires Android 4.0.3 or newer.;https://github.com/yuanyelele/mustupid_pitch_pipe;https://github.com/yuanyelele/mustupid_pitch_pipe/issues;1.0;
Metronome;https://f-droid.org/en/packages/com.mustupid.metronome/index.html;A simple and usable metronome that produces an audible click at a tempobetween 40 BPM and 208 BMP that can be set by the user Comes with a bellthat when enabled rings every 2 3 4 or 6th beat;https://f-droid.org/repo/com.mustupid.metronome_1.apk;This version requires Android 4.0.3 or newer.;https://github.com/yuanyelele/mustuipd_metronome;https://github.com/yuanyelele/mustuipd_metronome/issues;1.0;
SimpleProtocolPlayer NG;https://f-droid.org/en/packages/fr.jakse.raphael.simpleprotocolplayer/index.html;This media player plays uncompressed PCM data from a server over your local network  This is meant to be used for streaming audio from a PC to your Android phone or tablet  The focus has been latency and so all the options are intended for the user to be able to find a compromise between latency and qualityAs a rule of thumb a low sample rate  mono  50 ms or less of buffer time are the settings that are generally usedStreaming from Ubuntu or anything running PulseAudioThe following web page describes how to configure PulseAudio for use with this player  httpkaytatcomblogpageid301Streaming from WindowsDownload the server from the following link and run it locally  httpsgithubcomkaytatSimpleProtocolServerThe server has some options also to help tune the performance;https://f-droid.org/repo/fr.jakse.raphael.simpleprotocolplayer_11.apk;This version requires Android 2.2 or newer.;https://gitlab.com/raphj/SimpleProtocolPlayer-ng/tree/HEAD;https://gitlab.com/raphj/SimpleProtocolPlayer-ng/issues;2019.10.0;have full network access <-> change your audio settings <-> prevent phone from sleeping <-> 
YouTube Stream;https://f-droid.org/en/packages/org.thiolliere.youtubestream/index.html;Share a YouTube video with this application or use the clipboardthe application then get the stream and open it with local applicationVLC is a compatible local application The video is then handle by thelocal application which can allow to put in background VLC does allow it;https://f-droid.org/repo/org.thiolliere.youtubestream_3.apk;This version requires Android 4.0.3 or newer.;https://github.com/thiolliere/YouTubeStream;https://github.com/thiolliere/YouTubeStream/issues;1.2;have full network access <-> 
HaveRadiosion;https://f-droid.org/en/packages/click.dummer.have_radiosion/index.html;NOTE This app is no longer maintained its repo was archivedThis app plays internet radio streams The app is a fork of the WebRadioapp  but with a changed editor a focus on rock music and a comicmusic visualization The design of the app has been renewed and somenew features and corrections have been added night mode powersaving Notification Channel since android 8 By modifying the codea backwards compatibility back to Android 41 was reached;https://f-droid.org/repo/click.dummer.have_radiosion_28.apk;This version requires Android 4.1 or newer.;https://github.com/no-go/HaveRadiosion;https://github.com/no-go/HaveRadiosion/issues;2.8;pair with Bluetooth devices <-> have full network access <-> record audio <-> ask to ignore battery optimizations <-> 
Simple Scrobbler;https://f-droid.org/en/packages/com.adam.aslfms/index.html;Scrobbling means submitting listening information to Lastfm andor Librefmyou can then get music recommendations and view your listening history andstatistics Most media players will work Older android versions preLollipopthe media player that you use must be able to work with the API egorgkreedvanilla or jpcokayoandroidlocalplayer Apps can also hookinto the NowPlaying broadcast for example comjlyr can use it to grablyricsMore info about scrobbling can be found onLastfms FAQ;https://f-droid.org/repo/com.adam.aslfms_61.apk;This version requires Android 4.0 or newer.;https://github.com/simple-last-fm-scrobbler/sls;https://github.com/simple-last-fm-scrobbler/sls/issues;1.7.0;view network connections <-> android.permission.BIND_NOTIFICATION_LISTENER_SERVICE <-> run foreground service <-> have full network access <-> read the contents of your shared storage <-> run at startup <-> ask to ignore battery optimizations <-> modify or delete the contents of your shared storage <-> 
SavaPage Print Service;https://f-droid.org/en/packages/org.savapage.android.print/index.html;Enable this app in the Print services section of the Settings app addSavaPage Open Print Portal printers of your choice with your credentialsand use them to print to SavaPage from any appPreview the result in the SavaPage Print Portals HTML5 Web App and proceedthe print workflow in the confines of your organization from thereSavaPage Open Print Portal uses Open Standards and Commodity Hardware forSecure PullPrinting PayPerPrint Delegated Print Job TicketingAuditing and PDF Creation Please consult the User Manual for acomprehensive introductionSavaPage is licensed under the terms of the GNU Affero General PublicLicense AGPL version 3 or any later version It is based on a CommunityDriven Development Model User organizations join the community bysubscribing to the software;https://f-droid.org/repo/org.savapage.android.print_1.apk;This version requires Android 4.4 or newer.;https://gitlab.com/savapage-android/savapage-android-print;https://issues.savapage.org;0.1.0;have full network access <-> 
Nori;https://f-droid.org/en/packages/io.github.tjg1.nori/index.html;Connect to booru tagbased image archives and browse by tagsNote that the images there are usually of high quality and though the app isfast a lot of data will be downloaded;https://f-droid.org/repo/io.github.tjg1.nori_15.apk;This version requires Android 4.1 or newer.;https://github.com/tjg1/nori;None;2019.08;view network connections <-> have full network access <-> read the contents of your shared storage <-> set wallpaper <-> prevent phone from sleeping <-> modify or delete the contents of your shared storage <-> 
Tonality;https://f-droid.org/en/packages/net.currit.tonality/index.html;Tonality provides a piano view to allow to play on a simple piano keyboardBased on a root note different scales can be highlighted on the keyboardto ease learning of a scaleFeatures Piano view to play with Optional key labelling Dynamic sizing of the keyboard Stack multiple keyboards Scale highlighting;https://f-droid.org/repo/net.currit.tonality_2.apk;This version requires Android 4.1 or newer.;https://github.com/sluedecke/tonality;https://github.com/sluedecke/tonality/issues;1.2;
Share To Computer;https://f-droid.org/en/packages/com.jim.sharetocomputer/index.html;DescriptionEasiest and fastest way to share text images or any files from your phone to your computer or phonesFeature Share to your computer use browser to download the files shared require no installation on computer Share to other phones choose scan QR code Through wifi no internet access required No ads free Open source check the full source code at httpsgithubcomjimmodShareToComputer;https://f-droid.org/repo/com.jim.sharetocomputer_1140.apk;This version requires Android 6.0 or newer.;https://github.com/jimmod/ShareToComputer;https://github.com/jimmod/ShareToComputer/issues;1.1.4;view network connections <-> view Wi-Fi connections <-> take pictures and videos <-> run foreground service <-> have full network access <-> read the contents of your shared storage <-> modify or delete the contents of your shared storage <-> 
OpenManga;https://f-droid.org/en/packages/org.nv95.openmanga/index.html;Note This app is discontinuedPowerful manga reader with online cataloguesFeatures 13 online mangas catalogues with search Downloading manga to local storage Material design UI Customizable reader Favourites bookmarks and history with remembering last viewed chapter and page Selecting sort order Filter by genre Notifications about new chapters Importing from CBZ files;https://f-droid.org/repo/org.nv95.openmanga_51331.apk;This version requires Android 4.0 or newer.;https://github.com/nv95/OpenManga;https://github.com/nv95/OpenManga/issues;4.7.1;view network connections <-> view Wi-Fi connections <-> run foreground service <-> have full network access <-> read the contents of your shared storage <-> run at startup <-> prevent phone from sleeping <-> modify or delete the contents of your shared storage <-> install shortcuts <-> 
AiCamera;https://f-droid.org/en/packages/com.lun.chin.aicamera/index.html;This is a camera app for Android that automatically recognises the pixel location of people cats or dogs in the camera view and blurs the background simulating depth of field It can also gray out the background leaving only the recognised object in colourThe app uses a convolutional neural network to perform the detection A TensorFlow implementation of the neural network can be found here It was trained on a dataset of images consisting of people cats and dogs and the trained model then exported as a protobuf file which contains the graph definition and the trained weights;https://f-droid.org/repo/com.lun.chin.aicamera_1.apk;This version requires Android 5.0 or newer.;https://bitbucket.org/chlun/aicamera;None;1.0;take pictures and videos <-> read the contents of your shared storage <-> read phone status and identity <-> modify or delete the contents of your shared storage <-> 
Pixiv for Muzei;https://f-droid.org/en/packages/com.pixiv.muzei.pixivsource/index.html;Enjoy kawaii artworks of Pixiv through MuzeiDisclaimer Its not a part of official products of PixivMuzei art source extension for PixivThis extension for Roman Nuriks netnurikromanmuzei Live Wallpaper appuses some unofficial APIs from Pixiv to fetch random artworksThis is not a standalone app It requires netnurikromanmuzei app to beinstalled;https://f-droid.org/repo/com.pixiv.muzei.pixivsource_30000.apk;This version requires Android 4.4 or newer.;https://github.com/dahlia/muzei-pixiv;https://github.com/dahlia/muzei-pixiv/issues;3.0.0;view network connections <-> have full network access <-> run at startup <-> prevent phone from sleeping <-> 
Headphone detector for Vanilla Music;https://f-droid.org/en/packages/ch.blinkenlights.android.vanillaplug/index.html;This app runs a service that will launch chblinkenlightsandroidvanillawhenever Android broadcasts a HEADSETPLUG eventPlease note that you need to start the application at least once in order tolaunch the persistent background service Also note that the application isuseless unless chblinkenlightsandroidvanilla is installed on your device;https://f-droid.org/repo/ch.blinkenlights.android.vanillaplug_170.apk;This version requires Android 4.0.3 or newer.;https://github.com/vanilla-music/vanilla-headphone-detector;https://github.com/vanilla-music/vanilla-headphone-detector/issues;1.7;run at startup <-> 
Internet Radio;https://f-droid.org/en/packages/community.peers.internetradio/index.html;This is a small app to search Internet radio stations and listen to them Singletap the notification to playpause the stream Remove the notification to stop the playerThe list of radio stations is maintained by RadioBrowser and the data is retrieved from DOKK;https://f-droid.org/repo/community.peers.internetradio_9.apk;This version requires Android 4.1 or newer.;https://notabug.org/zplus/InternetRadio;https://notabug.org/zplus/InternetRadio/issues;4.1.2;have full network access <-> 
Video Transcoder;https://f-droid.org/en/packages/protect.videoeditor/index.html;NOTE This app is currently looking for a volunteer to take over development If you are interested please reach outDo you want to encode videos on your phone into different formats trim videosor extract audio Are you looking for a free solution which will not take yourinformationVideo Transcoder is an application which uses the open source program FFmpeg totranscode video files from one format to another By selecting the video toprocess details for the video are provided and the desired settings can beconfiguredThe application requires very few permissions and never attempts to access theInternet;https://f-droid.org/repo/protect.videoeditor_15.apk;This version requires Android 4.4 or newer.;https://github.com/brarcher/video-transcoder;https://github.com/brarcher/video-transcoder/issues;0.14;read the contents of your shared storage <-> prevent phone from sleeping <-> modify or delete the contents of your shared storage <-> 
