Les Pas - Photo Album for Nextcloud;https://f-droid.org/en/packages/site.leos.apps.lespas/index.html;Les Pas is a free modern lightweight and fast gallery app Organize your photos GIFs and videos into albums for easy viewing and sharing With builtin twoway sync with your Nextcloud server your files are kept private secure and safeManaging Syncing and Archiving   Organize your media files in albums   Easy media importing by simply sharing files to Les Pas   Manage media files in your phones gallery and auto backup to server each media folder in your phone has its own backup setting   Integrate with Snapseed for photo editing   Support adding caption to photo   Synchronization works with Nextcloud server and among multiple devices edit albums on Nextcloud server and on all your mobile devices simultaneously   Support Remote Album which have all its media file stored in Nextcloud server only free up Phones storage   Search for photos by objects with AI   Search photos by location   Support GPX importing so that you can easily add GPS location data to pictures shoot on your digital camera   Support Nextclouds external storage   Beautiful theme inspired by works of Wes Anderson   Support standard media format plus RAW and HDR photosSharing   Share albums and album slideshow with other Nextcloud users groups and circles   Unique Joint Album feature which you and other Nextcloud users can edit together   Export GPX file from album you can share your adventure with othersPrivacy focus   Media files and thumbnails are all saved in Apps private storage stop being scanned by malicious apps   Option provided to strip photos EXIF before sharing to other social networks   Option to hide album both in Phone and on server   Authenticate on your Nextcloud server with your Nextclouds credential   OpensourceAny apps that can do the above is merely a media file manager with a fancy UI Les Pas does not stop here it strives to provide ways of utilizing your photos The past shouldnt be resting in the harddrive make all those memories shine    Integrate with Muzei Live Wallpaper app deliver Today in History pictures right on your phones desktop    Album slideshow with background music    Unique Slideshow on Map feature which runs album slideshow on Map    Support photo blogging in three ready made templates With selected pictures and caption you added you can share your stories with the worldThis project build using the following open source software OkHttp httpssquaregithubiookhttp PhotoView httpsgithubcomchrisbanesPhotoView osmdroid httpsgithubcomosmdroidosmdroid Android Open Source Project httpssourceandroidcom TensorFlow httpswwwtensorfloworg OpenStreetMap httpswwwopenstreetmaporg;https://f-droid.org/repo/site.leos.apps.lespas_99.apk;This version requires Android 7.1 or newer.;https://github.com/scubajeff/lespas;https://github.com/scubajeff/lespas/issues;2.9.10;read locations from your media collection <-> view network connections <-> run foreground service <-> have full network access <-> android.permission.MANAGE_MEDIA <-> show notifications <-> read the contents of your shared storage <-> read audio files from shared storage <-> read image files from shared storage <-> read video files from shared storage <-> read sync settings <-> read sync statistics <-> run at startup <-> use biometric hardware <-> use fingerprint hardware <-> prevent phone from sleeping <-> modify or delete the contents of your shared storage <-> modify system settings <-> toggle sync on and off <-> site.leos.apps.lespas.DYNAMIC_RECEIVER_NOT_EXPORTED_PERMISSION <-> 
Tuner;https://f-droid.org/en/packages/org.billthefarmer.tuner/index.html;Accordion tuner with scope spectrum and strobe or staffCan show up to eight different notes or reeds concurrentlyIn portrait the app shows a scope with the input signal a spectrumshowing the processed signal the main display with the note valuecents error frequency error etc a strobe or staff display and ameter display showing the cents error In landscape the app shows justthe main display or staff and the meter There is a signal indicatorin the action bar which is useful in landscape mode  32 temperaments including Equal Just Pythagorean Meantone  Filter options including low pass fundamental note and octave filter  Optional strobe or musical staff display  Custom temperaments option  Transposition option  SolfA ge DoRAMi option;https://f-droid.org/repo/org.billthefarmer.tuner_156.apk;This version requires Android 6.0 or newer.;https://github.com/billthefarmer/tuner;https://github.com/billthefarmer/tuner/issues;1.56;read the contents of your shared storage <-> record audio <-> 
Helio;https://f-droid.org/en/packages/fm.helio/index.html;Helio is a libre music sequencer aimed at hobbyist composersgame developers and indie artistsFollow the documentation to get started httpsdocsheliofm;https://f-droid.org/repo/fm.helio_313.apk;This version requires Android 5.0 or newer.;https://github.com/helio-fm/helio-sequencer;https://github.com/helio-fm/helio-sequencer/issues;3.13;access precise location only in the foreground <-> pair with Bluetooth devices <-> access Bluetooth settings <-> change your audio settings <-> read the contents of your shared storage <-> modify or delete the contents of your shared storage <-> 
Cams;https://f-droid.org/en/packages/com.vladpen.cams/index.html;Simple Android mobile app for playing RTSP streams from IP camerasFeatures View RTSP streams from any IP cameras including H265 Multiple video cameras on a single screen Image zoom 2 channel cameras support Watching videos via SFTP protocol Motion detection support Maximum connection speed Extreme ease of navigation and control Ability to switch TCPUDP protocol This option is important while viewing cameras over the Internet where UDP may not be supported or may not work wellIMPORTANT NOTE The app is focused on data security and privacy It does not collect or process any information about the userThe data is not sent to any servers including Googles technical infrastructure or camera manufacturers cloud storage;https://f-droid.org/repo/com.vladpen.cams_1010127.apk;This version requires Android 7.0 or newer.;https://github.com/vladpen/cams;https://github.com/vladpen/cams/issues;2.3;view network connections <-> run foreground service <-> have full network access <-> show notifications <-> run at startup <-> prevent phone from sleeping <-> com.vladpen.cams.DYNAMIC_RECEIVER_NOT_EXPORTED_PERMISSION <-> 
Kodi;https://f-droid.org/en/packages/org.xbmc.kodi/index.html;Kodi is a media player and entertainment hub for digital mediaKodi can be used to play almost all popular audio and video formats around It was designed for network playback so you can stream your multimedia from anywhere in the house or directly from the internet using practically any protocol availablePoint Kodi to your media and watch it scan and automagically create a personalized library complete with box covers descriptions and fanart There are playlist and slideshow functions a weather forecast feature and many audio visualizations;https://f-droid.org/repo/org.xbmc.kodi_2100001.apk;This version requires Android 5.0 or newer.;https://github.com/xbmc/xbmc;https://github.com/xbmc/xbmc/issues;21.0;view network connections <-> pair with Bluetooth devices <-> have full network access <-> android.permission.MANAGE_EXTERNAL_STORAGE <-> change your audio settings <-> read the contents of your shared storage <-> run at startup <-> record audio <-> modify or delete the contents of your shared storage <-> com.android.providers.tv.permission.READ_EPG_DATA <-> com.android.providers.tv.permission.WRITE_EPG_DATA <-> 
Vinyl Music Player;https://f-droid.org/en/packages/com.poupa.vinylmusicplayer/index.html;Music player easy to use and customizable multiple themes including a darkone It supports folder browsing sleep timer and a tag editor It is forkedfrom Phonograph;https://f-droid.org/repo/com.poupa.vinylmusicplayer_201.apk;This version requires Android 4.4 or newer.;https://github.com/VinylMusicPlayer/VinylMusicPlayer;https://github.com/VinylMusicPlayer/VinylMusicPlayer/issues;1.10.4;view network connections <-> send sticky broadcast <-> run foreground service <-> have full network access <-> show notifications <-> read the contents of your shared storage <-> read audio files from shared storage <-> read image files from shared storage <-> run at startup <-> prevent phone from sleeping <-> modify or delete the contents of your shared storage <-> modify system settings <-> com.poupa.vinylmusicplayer.DYNAMIC_RECEIVER_NOT_EXPORTED_PERMISSION <-> 
K-19 Player;https://f-droid.org/en/packages/ch.ulys.k19player/index.html;K19 Player is a nice music player for OpenSubsonic serverIts using Material 3 UI and written in Flutter It should work with any OpenSubsonic server but mostly tested on NavidromeThe features are Intelligent caching of data Background audio Pretty simple Nice UI;https://f-droid.org/repo/ch.ulys.k19player_13.apk;This version requires Android 4.4 or newer.;https://github.com/ulysg/k19-player;https://github.com/ulysg/k19-player/issues;1.0.0;view network connections <-> run foreground service <-> have full network access <-> prevent phone from sleeping <-> 
Vibe You;https://f-droid.org/en/packages/app.suhasdissa.vibeyou/index.html;Vibe You is a music app that lets you play music from your device storage or from Piped MusicIt has a Material You dynamic theme with dark mode support offline cached playback shuffle queue and moreWith the added benefit of playing region blocked music This app also has advanced queue management and offline caching for songs to play them later without data consumption;https://f-droid.org/repo/app.suhasdissa.vibeyou_5.apk;This version requires Android 7.0 or newer.;https://github.com/you-apps/VibeYou;https://github.com/you-apps/VibeYou/issues;4.1;view network connections <-> run foreground service <-> run foreground service with the type "mediaPlayback" <-> have full network access <-> show notifications <-> read the contents of your shared storage <-> read audio files from shared storage <-> prevent phone from sleeping <-> app.suhasdissa.vibeyou.DYNAMIC_RECEIVER_NOT_EXPORTED_PERMISSION <-> 
Audio Share;https://f-droid.org/en/packages/io.github.mkckr0.audio_share_app/index.html;Audio Share can share WindowsLinux computers audio to Android phone over network so your phone becomes the speaker of computer You neednt buy a new speakerUsage and server program from httpsgithubcommkckr0audioshare;https://f-droid.org/repo/io.github.mkckr0.audio_share_app_1000.apk;This version requires Android 6.0 or newer.;https://github.com/mkckr0/audio-share;https://github.com/mkckr0/audio-share/issues;0.1.0;view network connections <-> run foreground service <-> have full network access <-> show notifications <-> run at startup <-> ask to ignore battery optimizations <-> prevent phone from sleeping <-> io.github.mkckr0.audio_share_app.DYNAMIC_RECEIVER_NOT_EXPORTED_PERMISSION <-> 
Next Player;https://f-droid.org/en/packages/dev.anilbeesetti.nextplayer/index.html;Next Player is a native video player written in Kotlin and jetpack compose It provides a simple and easytouse interface for users to play videos on their Android devicesThis project is still in development and is expected to have bugsSupported formats  Audio Vorbis Opus FLAC ALAC PCMWAVE I14law Alaw MP1 MP2 MP3 AMR NB WB AAC LC ELD HE xHE on Android 9 AC3 EAC3 DTS DTSHD TrueHD  Video H263 H264 AVC Baseline Profile Main Profile on Android 6 H265 HEVC MPEG4 SP VP8 VP9 AV1  Streaming DASH HLS RTSP  Subtitles SRT SSA ASS TTML VTTKey Features  Native Android app with simple and easytouse interface  Completely free and open source and without any ads or excessive permissions  Material 3 you support  AudioSubtitle track selection  Vertical swipe to change brightness left  volume right  Horizontal swipe to seek through video  Media picker with folder and file view  Playback speed control  Pinch to zoom in and zoom out  Resize fitstretchcrop100  Volume boost  External subtitle support long press subtitle icon  Controls lock  No ads tracking or excessive permissions;https://f-droid.org/repo/dev.anilbeesetti.nextplayer_16.apk;This version requires Android 5.0 or newer.;https://github.com/anilbeesetti/nextplayer;https://github.com/anilbeesetti/nextplayer/issues;0.11.1;view network connections <-> have full network access <-> read the contents of your shared storage <-> read video files from shared storage <-> modify or delete the contents of your shared storage <-> dev.anilbeesetti.nextplayer.DYNAMIC_RECEIVER_NOT_EXPORTED_PERMISSION <-> 
Podverse;https://f-droid.org/en/packages/com.podverse.fdroid/index.html;Free features Subscribe to podcasts Autodownload episodes Video playback Livestream playback Draganddrop queue Boostagrams Value for Value Streaming Value Value for Value Chapters Podcasting 20 Transcripts Podcasting 20 Crossapp comments Podcasting 20 Screenreader accessibilityPremium features Sync your subscriptions across devices Sync your queue across devices Sync your history across devices New episode notifications Livestream notifications Create clips Create playlists Create a profile All Podverse software is provided under a free and open source license AGPLv3podversefmPodverse on Github;https://f-droid.org/repo/com.podverse.fdroid_105004.apk;This version requires Android 6.0 or newer.;https://github.com/podverse/podverse-fdroid;https://github.com/podverse/podverse-fdroid/issues;4.16.3;view network connections <-> access Do Not Disturb <-> view Wi-Fi connections <-> android.permission.DOWNLOAD_WITHOUT_NOTIFICATION <-> run foreground service <-> run foreground service with the type "mediaPlayback" <-> have full network access <-> show notifications <-> read the contents of your shared storage <-> read audio files from shared storage <-> This app can appear on top of other apps <-> use biometric hardware <-> use fingerprint hardware <-> control vibration <-> prevent phone from sleeping <-> modify or delete the contents of your shared storage <-> com.android.vending.BILLING <-> com.podverse.fdroid.DYNAMIC_RECEIVER_NOT_EXPORTED_PERMISSION <-> 
Valv;https://f-droid.org/en/packages/se.arctosoft.vault/index.html;An encrypted gallery vault for Android devicesFeatures Supports images GIFs and videos Organise using folders The app requires no permissions Encrypted files are stored ondisk allowing for easy backups and transfers between devices Supports multiple vaults by the use of different passwords Daynight modes Add notestext to filesEncryptionFiles are encrypted using ChaCha20 and keys are derived using PBKDF2 with HMACSHA512;https://f-droid.org/repo/se.arctosoft.vault_27.apk;This version requires Android 9.0 or newer.;https://github.com/Arctosoft/Valv-Android;https://github.com/Arctosoft/Valv-Android/issues;1.9.0;se.arctosoft.vault.DYNAMIC_RECEIVER_NOT_EXPORTED_PERMISSION <-> 
Transistor - Simple Radio App;https://f-droid.org/en/packages/org.y20k.transistor/index.html;Transistor is a radio app with a minimalistic approach that may not be to everyones liking It has no radio station discovery feature Transistor only offers a very simple search option and it imports audio streaming links when you tap on them in a web browserFREQUENT QUESTIONSHOW CAN I ADD A RADIO STATIONThere are three ways to add a radio station to Transistor Use Search add playlist file address M3U PLS enter a raw stream addressWHERE DO THE RADIO STATION SEARCH RESULTS COME FROMTransistor searches the radiobrowserinfo online database You can help out the radiobrowserinfo community by adding the missing station httpwwwradiobrowserinfoguiadd to their databaseHOW CAN I CURATE THE RADIO STATION LISTUse the swipe gesture to delete a radio station from the list Further editing options can be enabled in Settings If enabled tap and hold a radio station to edit its name image or streaming link;https://f-droid.org/repo/org.y20k.transistor_99.apk;This version requires Android 7.1 or newer.;https://codeberg.org/y20k/transistor;https://codeberg.org/y20k/transistor/issues;4.1.9;view network connections <-> view Wi-Fi connections <-> run foreground service <-> run foreground service with the type "mediaPlayback" <-> have full network access <-> read the contents of your shared storage <-> run at startup <-> control vibration <-> prevent phone from sleeping <-> org.y20k.transistor.DYNAMIC_RECEIVER_NOT_EXPORTED_PERMISSION <-> 
SpMp;https://f-droid.org/en/packages/com.toasterofbread.spmp/index.html;Features Edit song artist and playlist titles Set separate languages for app UI and metadata like song titles Inapp YouTube Music login Display timesynchronised lyrics from KuGouhttpswwwkugoucom     Timed lyrics are displayed in a toggleable bar above every app page     Furigana readings display above Japanese kanji within lyrics Select multiple songs for batch actions on any screen Pin any song playlist album or artist to the top of the main page Customisable Discord rich presence Easily insert songs at any position in the queue;https://f-droid.org/repo/com.toasterofbread.spmp_13.apk;This version requires Android 6.0 or newer.;https://github.com/toasterofbread/spmp;https://github.com/toasterofbread/spmp/issues;0.3.2;view network connections <-> run foreground service <-> run foreground service with the type "dataSync" <-> run foreground service with the type "mediaPlayback" <-> have full network access <-> show notifications <-> query all packages <-> read the contents of your shared storage <-> read phone status and identity <-> This app can appear on top of other apps <-> control vibration <-> prevent phone from sleeping <-> modify or delete the contents of your shared storage <-> android.permission.WRITE_SECURE_SETTINGS <-> com.toasterofbread.spmp.DYNAMIC_RECEIVER_NOT_EXPORTED_PERMISSION <-> 
PiliPala;https://f-droid.org/en/packages/com.guozhigq.pilipala/index.html;PiliPala is a thirdparty Bilibili client developed in FlutterTop Features List of recommended videos List of hottest videos Popular live streams List of bangumis Block videos from blacklisted users;https://f-droid.org/repo/com.guozhigq.pilipala_10223.apk;This version requires Android 5.0 or newer.;https://github.com/guozhigq/pilipala;https://github.com/guozhigq/pilipala/issues;1.0.22;view network connections <-> view Wi-Fi connections <-> run foreground service <-> have full network access <-> read the contents of your shared storage <-> read audio files from shared storage <-> read image files from shared storage <-> read video files from shared storage <-> ask to ignore battery optimizations <-> prevent phone from sleeping <-> modify or delete the contents of your shared storage <-> com.guozhigq.pilipala.DYNAMIC_RECEIVER_NOT_EXPORTED_PERMISSION <-> oppo.permission.OPPO_COMPONENT_SAFE <-> 
Finamp;https://f-droid.org/en/packages/com.unicornsonlsd.finamp/index.html;Finamp is a Jellyfin music player for Android and iOS Its main feature is the ability to download songs for offline listeningTranslationsFinamp uses Weblate to manage translations httpshostedweblateorgengagefinampFeel free to add new languages if yours isnt there yet If you have any questions such as the context of a string you can ask in the Translation Discussions httpsgithubcomjmshrvfinampdiscussionscategoriestranslationsKnown IssuesThis app is still a work in progress and has some bugsissues that havent been fixed yet Here is a list of currently known issuesDeleting large items such as playlists will cause the app to freeze for a few secondsDownload indicators occasionally dont updatePlanned FeaturesTranscoding support for downloadsMultiple usersserversTranslation supportName source httpswwwredditcomrjellyfincommentshjxshnjellyampcrossplatformdesktopmusicplayerfwqs5i0;https://f-droid.org/repo/com.unicornsonlsd.finamp_46.apk;This version requires Android 5.0 or newer.;https://github.com/UnicornsOnLSD/finamp;https://github.com/UnicornsOnLSD/finamp/issues;0.6.23;view network connections <-> run foreground service <-> have full network access <-> show notifications <-> read the contents of your shared storage <-> run at startup <-> prevent phone from sleeping <-> modify or delete the contents of your shared storage <-> com.unicornsonlsd.finamp.DYNAMIC_RECEIVER_NOT_EXPORTED_PERMISSION <-> 
pretixSCAN;https://f-droid.org/en/packages/eu.pretix.pretixscan.droid/index.html;pretix is an Open Source online ticket shop available at httpspretixeuaboutenIf you organize your conference with pretix you can use this application to scan the tickets at the entranceThis app is free software licensed under the Apache license The source code can be found at httpsgithubcompretixpretixscanandroidTracking due to Sentry which cannot be disabled by the user;https://f-droid.org/repo/eu.pretix.pretixscan.droid_94.apk;This version requires Android 5.0 or newer.;https://github.com/pretix/pretixscan-android;https://github.com/pretix/pretixscan-android/issues;2.8.2;view network connections <-> take pictures and videos <-> run foreground service <-> have full network access <-> show notifications <-> read the contents of your shared storage <-> run at startup <-> prevent phone from sleeping <-> modify or delete the contents of your shared storage <-> 
IR Remote;https://f-droid.org/en/packages/us.spotco.ir_remote/index.html;This is a fork of Universal TV Remote by Twinone from 2015 sourcesIn addition to customizable TV remote it removes ads tracking accounts uploading and network accessAlso it includes other languages such as Spanish;https://f-droid.org/repo/us.spotco.ir_remote_1710.apk;This version requires Android 4.4 or newer.;https://gitlab.com/divested-mobile/irremote;https://gitlab.com/divested-mobile/irremote/issues;1.7.1;read the contents of your shared storage <-> This app can appear on top of other apps <-> transmit infrared <-> us.spotco.ir_remote.DYNAMIC_RECEIVER_NOT_EXPORTED_PERMISSION <-> 
Ojo RTSP IP Camera viewer;https://f-droid.org/en/packages/it.danieleverducci.ojo/index.html;Ojo is a basic IP Camera surveillance wallIP cameras RTSP streams are added via its url and shown in the classic tile configuration The number of tiles is automatically chosen based on the number of configured cameras a single camera goes full screen adding more cameras the app switches to a grid view 2x2 3x3 4x4 and so onThe maximum number of cameras is determined by the devices capabilitiesThe stream decoding and rendering is demanded to VLCs library without their effort this app wouldnt be possibleThis app was specifically developed for FDroid as I couldnt find any open source RTSP viewers in the main repositoryThe app can be opened deeplinking to url ojoviewTo open the app with focus on a specific camera you can use an intent itdanieleverducciojoOPENCAMERA to specify which camera you want to viewThe extra argument itdanieleverducciojoCAMERANAME will open the app with the camera with the name you specified while adding the cameraThe extra argument itdanieleverducciojoCAMERANUMBER starting at 1 could be used as well if you have multiple cameras with the same nameSee below an example how to use the intent The flag f 268468224 could be useful if you want to switch to another camera while the app is running    adb s  shell am start a itdanieleverducciojoOPENCAMERA f 268468224 es itdanieleverducciojoCAMERANAME     adb s  shell am start a itdanieleverducciojoOPENCAMERA f 268468224 es itdanieleverducciojoCAMERANUMBER;https://f-droid.org/repo/it.danieleverducci.ojo_9.apk;This version requires Android 4.0.3 or newer.;https://github.com/penguin86/ojo;https://github.com/penguin86/ojo/issues;0.1.4;have full network access <-> it.danieleverducci.ojo.DYNAMIC_RECEIVER_NOT_EXPORTED_PERMISSION <-> 
Zapp;https://f-droid.org/en/packages/de.christinecoenen.code.zapp/index.html;Zapp is a part of MediathekView and gives you easy access to many German public broadcasting stations Watch ARD ZDF and other channels live or from their media centreFeatures Android client for MediathekView Live streams of over 30 channels Adaptive streaming Quick channel transition Up to date program information Channel shortcuts for new versions of Android Shows from over 20 media centers to stream Easy search for shows inside the media center Subtitles for some shows Share function for live and media center shows Background playbackPlease note If you use Zapp outside Germany some channels a like ZDF a may be geoblocked;https://f-droid.org/repo/de.christinecoenen.code.zapp_72.apk;This version requires Android 8.0 or newer.;https://github.com/mediathekview/zapp;https://github.com/mediathekview/zapp/issues;8.5.2;view network connections <-> run foreground service <-> run foreground service with the type "dataSync" <-> run foreground service with the type "mediaPlayback" <-> have full network access <-> show notifications <-> run at startup <-> prevent phone from sleeping <-> de.christinecoenen.code.zapp.DYNAMIC_RECEIVER_NOT_EXPORTED_PERMISSION <-> 
VolumeLockr;https://f-droid.org/en/packages/com.klee.volumelockr/index.html;VolumeLockr allows you to control and lock the volumes of your device;https://f-droid.org/repo/com.klee.volumelockr_9.apk;This version requires Android 4.1 or newer.;https://github.com/jonathanklee/VolumeLockr;https://github.com/jonathanklee/VolumeLockr/issues;1.5.0;access Do Not Disturb <-> run foreground service <-> run at startup <-> 
Stream Player;https://f-droid.org/en/packages/nl.sonck.streamplayer/index.html;This application allows you to play back HTTP streams;https://f-droid.org/repo/nl.sonck.streamplayer_23.apk;This version requires Android 5.0 or newer.;https://git.touhou.fm/misc/stream-player;https://git.touhou.fm/misc/stream-player/-/issues;1.2.0;view network connections <-> run foreground service <-> run foreground service with the type "mediaPlayback" <-> have full network access <-> prevent phone from sleeping <-> nl.sonck.streamplayer.DYNAMIC_RECEIVER_NOT_EXPORTED_PERMISSION <-> 
