Music Player Lite;https://f-droid.org/en/packages/com.atul.musicplayer/index.html;An elegant and light weight music playerFeatures No Ads forever Listen to music Simple and modern design Blazing fast performance and minimal battery usage Manage the queue and shuffle repeat mode Change the accent of the app Manage folders to excludehide Automatic scanning of media files Browse Sort Search albums and artists Change between Dark and Light Modes Easily search songs by keywords Lock screen controls and play in the notification bar Headset controls Listen to music Sleep timer;https://f-droid.org/repo/com.atul.musicplayer_16.apk;This version requires Android 6.0 or newer.;https://github.com/AP-Atul/music_player_lite;https://github.com/AP-Atul/music_player_lite/issues;0.16;run foreground service <-> change your audio settings <-> show notifications <-> read the contents of your shared storage <-> read audio files from shared storage <-> prevent phone from sleeping <-> 
Teapod;https://f-droid.org/en/packages/org.mosad.teapod/index.html;Teapod is a unofficial App for Crunchyroll Watch all animes from Crunchyroll on your Android device Native Player based on ExoPayer Prefer the OmU version via the app settings Picture in Picture Mode Skip the OPED thanks to the TeapodMetaDB integrationTo use Teapod you have to login with your Crunchyroll accountThis Project is not associated with Crunchyroll in any wayTeapodMetaDB supports only shows where metradata is presentHelp us to expand the database httpsgitlabcomSeil0teapodmetadbPlease report bugs and issues to supportmosadxyz;https://f-droid.org/repo/org.mosad.teapod_100992.apk;This version requires Android 6.0 or newer.;https://git.mosad.xyz/Seil0/teapod;https://git.mosad.xyz/Seil0/teapod/issues;1.1.0-beta3;view network connections <-> have full network access <-> org.mosad.teapod.DYNAMIC_RECEIVER_NOT_EXPORTED_PERMISSION <-> 
Ching Machine;https://f-droid.org/en/packages/io.github.dlbeswick.kreuungching/index.html;Automatic ching for practicing Thai music Sampled ching and glong sounds from real instruments Tempo selection Start playing with chup chup the initial doublestrike of the ching cymbals Create your own drum patternsI hope you enjoy this programPlease note that while this app contains both Thai and English translations and instructions for the most complicatedfunctions the majority of the user interface has been deliberately kept in Thai with the aim of encouraging interestin Thai script and the Thai language as well as Thai music I hope that the app also invites you then to be curiouspush buttons learn and explore and have fun;https://f-droid.org/repo/io.github.dlbeswick.kreuungching_11900.apk;This version requires Android 7.0 or newer.;https://github.com/dlbeswick/kreuung-ching;https://github.com/dlbeswick/kreuung-ching/issues;1.19;io.github.dlbeswick.kreuungching.DYNAMIC_RECEIVER_NOT_EXPORTED_PERMISSION <-> 
Geddit;https://f-droid.org/en/packages/geddit.buzl.uk/index.html;Geddit is an opensource Reddit client that is designed to be fast beautiful and simple Its main objective is to not use the Reddit API directly but instead use the RSSJSON feeds to display content This allows the app to view Reddit without being subject to API limits changes and problems Geddit works without a Reddit account which also means that you can stay anonymous while browsing Reddit if you are concerned about privacySome of the features of Geddit include View posts comments subreddits and users View images gifs videos and self posts Access NSFW content View your subscribed subreddits Save photos to your device Share posts Search for posts subreddits and users Support for app links;https://f-droid.org/repo/geddit.buzl.uk_7.apk;This version requires Android 5.1 or newer.;https://github.com/kaangiray26/geddit-app;https://github.com/kaangiray26/geddit-app/issues;1.7;have full network access <-> show notifications <-> read the contents of your shared storage <-> run at startup <-> Schedule precisely timed actions <-> control vibration <-> prevent phone from sleeping <-> modify or delete the contents of your shared storage <-> geddit.buzl.uk.DYNAMIC_RECEIVER_NOT_EXPORTED_PERMISSION <-> 
Pix-EzViewer;https://f-droid.org/en/packages/com.perol.asdpl.play.pixivez.libre/index.html;this app requires an existing Pixiv account No registration in app A thirdparty Pixivnet Android client Android 50  with Multilingual support zhcn zhtw jajp enus Material 23 UI dark mode custom theme color Custom UI horizontal view topbottom navbar image filter batch download original size image preview zoom inout view history download history oneclick collection mode multiuser support aria multi thread downloader anti dnspollution support custom API endpoint config custom file naming save the information such as tags local image pid detection  batch rename enhanced search GIF play  save translation for content desc view add reply comments Pixivision supportauto private bookmark for restricted content seperate download folderand other enhancements for you to explore;https://f-droid.org/repo/com.perol.asdpl.play.pixivez.libre_118.apk;This version requires Android 5.0 or newer.;https://github.com/ultranity/Pix-EzViewer;https://github.com/ultranity/Pix-EzViewer/issues;118;view network connections <-> view Wi-Fi connections <-> have full network access <-> android.permission.MANAGE_EXTERNAL_STORAGE <-> read the contents of your shared storage <-> modify or delete the contents of your shared storage <-> com.perol.asdpl.play.pixivez.libre.DYNAMIC_RECEIVER_NOT_EXPORTED_PERMISSION <-> 
Little Music Player;https://f-droid.org/en/packages/com.martinmimigames.littlemusicplayer/index.html;This project is a lightweight simple yet compatible audio playerSupports Android 10It allows you to play audio and video files like how you expected to Most importantly it is designed in hope to make it compatible with different Android versionsIts usage is as easy as opening or sharing the file you want to play with the app or selecting it directly from the app Enjoy your musicNote that this project was originally known as simple music playerCurrently partially support m3um3u8 playlist files More information below in section Playlist SupportYou can find most information about Little Music Player just belowDifferent variations Tiny Music Player httpsgithubcommartinmimigamestinymusicplayer  Smallest most minimal with the tradeoff of only having the most basic featuresPlaylist support Folderbased playlist on Android 50 Temporary playlist via multishare function Partial m3um3u8 supportm3um3u8 features supported Audio stream url httphttps Absolute audio path eg storageemulated0MusicExamplemp3 Nested m3um3u8 files Absolute path only Custom audio name via EXTINF duration custom name  does not support durationFeatures Its free  Everyone should have the right to listen to music therefore we aim to make it accessible No advertisement  We simply want a distractionfree experience for you so you can relax and enjoy Compact  Less than half a MB in size one of the tiniest audio player apps on Android No need to worry about bloated apps again Currently less than 30 KB Unbelievably compatible  Strangely addicted to support we believe that nobody should be excluded due to an older device Therefore we have theoretical support starting all the way back from Android 10 and tested support on Android 23 and above Isnt it amazing Clean  Simple  No awkward layout no hidden options and straightforward so you can focus on the content Enjoyment is key right It simply works   Even in the modern world there is always something seeming to fail Luckily for you this app was designed to work just like it is supposed to It supports all audio types that your device supports Minimal permissions required  Have you ever met an app asking for a bunch of unrelated permissions Have you ever had some strange requests reminding you of a malware Not this app We will explain how we use all our permissions so you know its safe to use No hidden thirdparties  It is completely opensource and uses as little thirdparty libraries as possibleIf you worry about size compatibility or privacy this is the best app for youWe use the foreground service permission to provide audio playing while using other appsWe use the notification permission for displaying playback control as we are mainly a notificationbased music playerWe use the internet permission to allow for audio streaming however such function is still beingdeveloped and can be very buggyWe use the read storageaudiovideo permission to open the audio files Required for older devices and m3um3u8 processingBeta functionShare a url containing a media file to Little Music Player to stream itOr use a m3u file with the stream url insideIssuesIssues and pull requests are always welcomeSince we do not have telemetry in the app we rely on you to report issues and give feedbackYou can submit issues the following ways via Github issues at httpsgithubcommartinmimigameslittlemusicplayerissues via email martinmimigamesgmailcomMade by MartinmimigamesOfficial website at httpsmartinmimigamesgithubioLast update of Description 20072023 ddmmyyyyImportant Please read the license;https://f-droid.org/repo/com.martinmimigames.littlemusicplayer_15.apk;This version requires Android 1.0 or newer.;https://github.com/martinmimigames/little-music-player;https://github.com/martinmimigames/little-music-player/issues;2.13;run foreground service <-> run foreground service with the type "mediaPlayback" <-> have full network access <-> show notifications <-> read the contents of your shared storage <-> read audio files from shared storage <-> read video files from shared storage <-> 
OBS Blade;https://f-droid.org/en/packages/com.kounex.obsBlade/index.html;DISCLAIMER This app is not in any way affiliated with OBS Open Broadcaster Software Its an unofficial free and open source app to control OBS httpsgithubcomKounexobsbladeOBS Blade is designed to be your stream companion and help you to manage your live stream While using OBS Open Broadcaster Software you can connect to the running instance and gain control over important parts of the software This should help you to manage what your audience can see  hear without the need to switch to OBS on your machine and make such changes You can keep doing what you do and easily use this app to control OBSCurrently OBS Blade supports Start  stop the stream Changing the active scene Toggle visibility of scene items like desktop capture etc Change the volume of your current audio sources or mute them View any Twitch chat and write messages See live statistics of your stream performance FPS CPU usage kbits etcOBS Blade also saves statistics of your previous streams so you can track the overall performance and some nice to know factsThis app is still in its early stages and will get updated with new features over time  for now the main features which I want to add are More engagement with OBS renaming sorting scripted switching etc Export  merge statistics Soundboard Incoming feature requests Maybe Streamlabs client connectionI hope you have a good time using this app If you encounter any bugs have feature requests or anything similar feel free to get in touch with mecontactkounexcom;https://f-droid.org/repo/com.kounex.obsBlade_2023012003.apk;This version requires Android 4.4W or newer.;https://github.com/Kounex/obs_blade;https://github.com/Kounex/obs_blade/issues;3.2.0;view network connections <-> take pictures and videos <-> have full network access <-> com.kounex.obsBlade.DYNAMIC_RECEIVER_NOT_EXPORTED_PERMISSION <-> 
Tella;https://f-droid.org/en/packages/org.hzontal.tellaFOSS/index.html;In challenging environments with limited or no internet connectivity or in the face of repression Tella makes it easier and safer to document events whether thatas violence human rights violations corruption or electoral fraudENCRYPTION All of the content and data stored in Tella are encrypted This means that unless the app is unlocked all the data within Tella will remain inaccessibleFILE MANAGEMENT Take photos videos or audio recordings directly in Tella or import documents from your phone and easily organize your files in foldersCAMOUFLAGE Change the app icon and name to a seemingly harmless one such as a calculator or a cameraQUICK DELETE In just a few seconds delete all the sensitive data and files stored in TellaDATACOLLECTION Groups and organizations can collect data through forms and surveys and received the data directly on their server;https://f-droid.org/repo/org.hzontal.tellaFOSS_149.apk;This version requires Android 5.0 or newer.;https://github.com/Horizontal-org/Tella-Android-FOSS;https://github.com/Horizontal-org/Tella-Android-FOSS/issues;2.0.15;android.permission.ACCESS_ALL_DOWNLOADS <-> access approximate location only in the foreground <-> android.permission.ACCESS_DOWNLOAD_MANAGER <-> access precise location only in the foreground <-> view network connections <-> view Wi-Fi connections <-> take pictures and videos <-> connect and disconnect from Wi-Fi <-> run foreground service <-> have full network access <-> android.permission.MANAGE_DOCUMENTS <-> android.permission.MANAGE_EXTERNAL_STORAGE <-> read the contents of your shared storage <-> run at startup <-> record audio <-> request delete packages <-> use biometric hardware <-> use fingerprint hardware <-> prevent phone from sleeping <-> modify or delete the contents of your shared storage <-> 
Libre Camera;https://f-droid.org/en/packages/com.iakmds.librecamera/index.html;Libre Camera is a free and open source camera app to take pictures and record videos written in Flutter and DartIf you are in need of an open source camera app with several features this app should be for you From flashlight focus and exposure controls to changing themes languages and the compression amount a this app should have you covered And if not feel free to open an issue on GitHub and request a feature Below you can see a list of the features with more coming in the futureFeatures     Take pictures and record videos with your rear and front camera     Privacy No EXIF Metadata saved by default when taking pictures enable optionally in settings a without ads tracking or unnecessary permissions     Themes Material Design with a Dark Light or system theme     Multiple languages supported a Contribute translating your language     Zoom Zoom with 2 fingers or with an optional slider     TimerDelay Select a photo capture timer to get ready for your photo     Flashlight modes On at capture Off Auto Always on     Focus Auto focus locked focus and manual focus by touching the screen     Exposure Auto exposure locked exposure and manual exposure with an optional slider     Image compression Set the compression amount in the settings     Formats Switch between 3 camera formats JPEG PNG WebP     Resolutions Switch between different camera resolutions     Save location Choose your preferred save location     Small size of about 21MB     Customizable Open the settings to customize the app to your likingContactCheck out the GitHub repository which includes the Roadmap httpsgithubcomiakmdslibrecameraIn case you found a bug or have a feature request feel free to file an issue on GitHub httpsgithubcomiakmdslibrecameraissues;https://f-droid.org/repo/com.iakmds.librecamera_143.apk;This version requires Android 5.0 or newer.;https://github.com/iakmds/librecamera;https://github.com/iakmds/librecamera/issues;1.9.1;take pictures and videos <-> read the contents of your shared storage <-> record audio <-> modify or delete the contents of your shared storage <-> 
OneShot;https://f-droid.org/en/packages/de.ptrlx.oneshot/index.html;OneShot is made to remind you of the special moments Because every day has at least one And thats what counts in life So make it your habit and remember the happy daysOneShot is a simple but private android photo diary app a Android 10 You can capture one entry per day write your diary and store your happiness It stores your photos in a local folder and your diary within the app Import and export to JSON is possibleYour data is yours OneShot will not send data to any server without your consent The app requires currently no internet permission;https://f-droid.org/repo/de.ptrlx.oneshot_111.apk;This version requires Android 10 or newer.;https://github.com/ptrLx/OneShot;https://github.com/ptrLx/OneShot/issues;1.1.1;
Practice Suite;https://f-droid.org/en/packages/com.berkersen.practicesuite/index.html;Practice Suite is the ultimate music practice tool for musicians of all levelsWith its comprehensive features you can stay on beat in tune and track your progress in one convenient appThe Metronome feature allows you to set your desired tempo and time signature ensuring that you stay on beat and in time while practicingThe Tuner feature uses your devices microphone to accurately tune your instrument helping you to play in perfect pitchThe Recorder feature allows you to record your practice sessions and play them back so you can listen to your progress and identify areas for improvementWith the builtin Log feature you can keep track of your practice sessions set goals and monitor your progress over timeThe app also provides detailed statistics so you can see how much time youve spent practicing and how youve improved over timeThe app is designed to be userfriendly and easy to navigate so you can focus on your practice and not on figuring out the appIts available for both iOS and Android devicesWhether youre just starting to learn an instrument or youre a seasoned professional looking to finetune your skillsPractice Suite is the perfect tool to help you achieve your goals Download now and see your progress soar;https://f-droid.org/repo/com.berkersen.practicesuite_121.apk;This version requires Android 7.0 or newer.;https://codeberg.org/Berker/practice_suite;https://codeberg.org/Berker/practice_suite/issues;1.2.1;pair with Bluetooth devices <-> change your audio settings <-> read the contents of your shared storage <-> record audio <-> prevent phone from sleeping <-> modify or delete the contents of your shared storage <-> com.berkersen.practicesuite.DYNAMIC_RECEIVER_NOT_EXPORTED_PERMISSION <-> 
PDF Converter;https://f-droid.org/en/packages/swati4star.createpdf/index.html;PDF CONVERTER is an easy to use application to convert Images to PDF Thisis basically an images to PDF Converter The simplicity of this app makesit an ultimate PDF Converter for your deviceSome major features of PDF Converter app No internet connection required  a Smooth and easy to use interface Takes up only a few seconds Select images from cameragallery Image enhancement features Crop images before creating a PDF View PDF files Delete PDF files Extract images from PDF Split PDF Merge PDF Convert text files to PDF Manage your PDF files Remove pages from PDF Reorder PDF pages Share the created PDFs with your friends Easily manage the PDFs created by our appSupported input types JPG PNGand other image formats;https://f-droid.org/repo/swati4star.createpdf_110.apk;This version requires Android 6.0 or newer.;https://github.com/Swati4star/Images-to-PDF;https://github.com/Swati4star/Images-to-PDF/issues;9.0.1;take pictures and videos <-> android.permission.MANAGE_EXTERNAL_STORAGE <-> read the contents of your shared storage <-> reorder running apps <-> modify or delete the contents of your shared storage <-> swati4star.createpdf.DYNAMIC_RECEIVER_NOT_EXPORTED_PERMISSION <-> 
Audio Notes;https://f-droid.org/en/packages/com.certified.audionote/index.html;AudioNotes is a simple app allowing you to take voice recordings a a dictaphone It supports light and dark theme lets you save and edit your recordings;https://f-droid.org/repo/com.certified.audionote_7.apk;This version requires Android 5.0 or newer.;https://github.com/certified84/AudioNote;https://github.com/certified84/AudioNote/issues;0.1.5.2;view network connections <-> run foreground service <-> show notifications <-> run at startup <-> record audio <-> Schedule precisely timed actions <-> control vibration <-> prevent phone from sleeping <-> com.certified.audionote.DYNAMIC_RECEIVER_NOT_EXPORTED_PERMISSION <-> 
Watermarking;https://f-droid.org/en/packages/io.github.freewatermark.mobileapp/index.html;Your sensitive images should be watermarked before sending to someone to protect against exploitation by unkind or immoral people Security code is fully open source to be audited by the public and free to fork and modify no stats no share crash info no nonsense there are no networking involve so no images being sent or collect from the app to the internet UsesUse it however you want eg watermark your passport or id before sending it to someoneExample watermark webregistersomewebcom20260609 onto your passport before sending it for register at some website which requires your passport infoNote that this will reduce info being leaked and possibly knows where it might leaked from the web channel which you watermarked but cannot fully prevent someone from reupload or leaked it but at least u know it is from web channel and maybe on what actionregistersomewebcom you did from your phone or computer etc;https://f-droid.org/repo/io.github.freewatermark.mobileapp_7004.apk;This version requires Android 4.1 or newer.;https://github.com/free-watermark/mobile-app;https://github.com/free-watermark/mobile-app/issues;1.1.4;read the contents of your shared storage <-> io.github.freewatermark.mobileapp.DYNAMIC_RECEIVER_NOT_EXPORTED_PERMISSION <-> 
AudioAnchor;https://f-droid.org/en/packages/com.prangesoftwaresolutions.audioanchor/index.html;AudioAnchor is an audio player that tracks the listening process ofyour audio books and podcastsFeaturesAudioAnchor offers a clean and intuitive interface for listening to audiofiles while keeping track of the listening process Additional featuresinclude lock screen media controls sleep timer export  import listening progress as sql database;https://f-droid.org/repo/com.prangesoftwaresolutions.audioanchor_29.apk;This version requires Android 4.4 or newer.;https://github.com/flackbash/AudioAnchor;https://github.com/flackbash/AudioAnchor/issues;2.3.3;run foreground service <-> read the contents of your shared storage <-> read phone status and identity <-> control vibration <-> prevent phone from sleeping <-> modify or delete the contents of your shared storage <-> 
Lyrics 2;https://f-droid.org/en/packages/it.zitzusoft.lyrics_2/index.html;Lyrics 2 is a lyrics finder and readerYou can search any songs lyrics by author title or if you simply remember a few words of the songOr you can search the song you are listening to on your deviceOnce you found your lyrics you can save them locallyLyrics 2 uses Genius and ChartLyrics search services;https://f-droid.org/repo/it.zitzusoft.lyrics_2_27.apk;This version requires Android 4.4 or newer.;https://github.com/f-leoni/lyrics2;https://github.com/f-leoni/lyrics2/issues;1.0.3;have full network access <-> record audio <-> 
Trivia You;https://f-droid.org/en/packages/com.bnyro.trivia/index.html;Trivia You is an open source Trivia App It supports different quiz APIs as well as creating and playing local quizzes therefore it can be used online and offline;https://f-droid.org/repo/com.bnyro.trivia_17.apk;This version requires Android 5.0 or newer.;https://github.com/you-apps/TriviaYou;https://github.com/you-apps/TriviaYou/issues;1.0;view network connections <-> have full network access <-> com.bnyro.trivia.DYNAMIC_RECEIVER_NOT_EXPORTED_PERMISSION <-> 
News;https://f-droid.org/en/packages/co.appreactor.news/index.html;NOTE This is NOT an official Nextcloud News client but Nextcloud is fully supportedMain Features Subscribe to your favorite RSS and Atom feeds Sync with your personal Miniflux or Nextcloud server Smooth and snappy user experience even on the older and cheaper devices Builtin podcast fetcher which can be used with external players Enhance your news feed with highresolution preview images Enjoy modern and minimalistic Material Design Both light and dark themes are supported This is an open source app which respects your privacy;https://f-droid.org/repo/co.appreactor.news_24.apk;This version requires Android 10 or newer.;https://github.com/bubelov/news;https://github.com/bubelov/news/issues;0.4.3;view network connections <-> run foreground service <-> have full network access <-> show notifications <-> run at startup <-> prevent phone from sleeping <-> co.appreactor.news.DYNAMIC_RECEIVER_NOT_EXPORTED_PERMISSION <-> 
Burning-Series;https://f-droid.org/en/packages/dev.datlag.burningseries/index.html;Watch any series or videos on Burning Series easily with this appYou can see the latest series and episodes get an overview of all available series save your favorites and start watching directly inside the appThis app is completely unofficial;https://f-droid.org/repo/dev.datlag.burningseries_470.apk;This version requires Android 6.0 or newer.;https://github.com/DATL4G/Burning-Series;https://github.com/DATL4G/Burning-Series/issues;4.7.0;view network connections <-> have full network access <-> dev.datlag.burningseries.DYNAMIC_RECEIVER_NOT_EXPORTED_PERMISSION <-> 
Drum On!;https://f-droid.org/en/packages/se.tube42.drum.android/index.html;Simple and minimalist drum app that can for example be used to accompanyguitar or bass players;https://f-droid.org/repo/se.tube42.drum.android_34.apk;This version requires Android 4.4 or newer.;https://github.com/tube42/drumon;https://github.com/tube42/drumon/issues;0.3.4;prevent phone from sleeping <-> 
