Apollo;https://f-droid.org/en/packages/org.nuclearfog.apollo/index.html;ApolloMusic is a fork from CyanogenMods Apollo music player app for Android 41;https://f-droid.org/repo/org.nuclearfog.apollo_51.apk;This version requires Android 4.1 or newer.;https://github.com/nuclearfog/Apollo-Music;https://github.com/nuclearfog/Apollo-Music/issues;1.5.11;view network connections <-> run foreground service <-> run foreground service with the type "mediaPlayback" <-> have full network access <-> show notifications <-> read the contents of your shared storage <-> read audio files from shared storage <-> read image files from shared storage <-> ask to ignore battery optimizations <-> display notifications as full screen activities on a locked device <-> modify or delete the contents of your shared storage <-> modify system settings <-> install shortcuts <-> 
Kitsune;https://f-droid.org/en/packages/io.github.drumber.kitsune/index.html;Kitsune is an unofficial android app for Kitsuio It allows you to browse anime  manga and track your progressFeatures Explore and search anime and manga even without an account View anime and manga details including episodeschapters and characters Manage your anime  manga library Update your Kitsu profile and account settings Material 3 Design;https://f-droid.org/repo/io.github.drumber.kitsune_32.apk;This version requires Android 8.0 or newer.;https://github.com/Drumber/Kitsune;https://github.com/Drumber/Kitsune/issues;2.0.0;view network connections <-> run foreground service <-> have full network access <-> show notifications <-> read the contents of your shared storage <-> run at startup <-> prevent phone from sleeping <-> modify or delete the contents of your shared storage <-> io.github.drumber.kitsune.DYNAMIC_RECEIVER_NOT_EXPORTED_PERMISSION <-> 
InnerTune;https://f-droid.org/en/packages/com.zionhuang.music/index.html;A Material 3 YouTube Music client for AndroidFeatures Play songs from YTYT Music without ads Background playback Search songs videos albums and playlists from YouTube Music Library management Cache and download songs for offline playback Synchronized lyrics Skip silence Audio normalization Dynamic theme Localization Android Auto support Personalized quick picks Material 3;https://f-droid.org/repo/com.zionhuang.music_20.apk;This version requires Android 7.0 or newer.;https://github.com/z-huang/InnerTune;https://github.com/z-huang/InnerTune/issues;0.5.4;view network connections <-> run foreground service <-> have full network access <-> show notifications <-> run at startup <-> prevent phone from sleeping <-> com.zionhuang.music.DYNAMIC_RECEIVER_NOT_EXPORTED_PERMISSION <-> 
Movie DB;https://f-droid.org/en/packages/com.wirelessalien.android.moviedb/index.html;Movie DB is a fully opensource android application for exploring and organizing your personal collection of films and television series It offers synchronization with your TMDB account Once logged in you can sync your favorites watchlist rated movies and more It also integrates with a local database to keep track of your shows You can assign various statuses to each titleasuch as aplanneda awatcheda or adroppedaarate them and note the dates you commenced and concluded each showIt allows you to filter shows based on genre release dates and more Detailed information on each show including the cast crew and recommendations for similar titles is also available Key Features Synchronization with TMDB Add favorite watchlist rate with TMDB Create List Publicprivate Offline support Local database to keep track of your shows ImportExport database Support for Material You  Get notified of movie and tv show release And many moreThe required data are requested from themoviedborg This app is still is development feel free to request feature or report any issue;https://f-droid.org/repo/com.wirelessalien.android.moviedb_5.apk;This version requires Android 7.0 or newer.;https://github.com/WirelessAlien/MovieDB;https://github.com/WirelessAlien/MovieDB/issues;0.9;view network connections <-> run foreground service <-> have full network access <-> show notifications <-> read the contents of your shared storage <-> run at startup <-> prevent phone from sleeping <-> modify or delete the contents of your shared storage <-> com.wirelessalien.android.moviedb.DYNAMIC_RECEIVER_NOT_EXPORTED_PERMISSION <-> 
Rush;https://f-droid.org/en/packages/com.shub39.rush/index.html;Rush is a simple android app to search view save and share lyrics for your favourite songs like spotify Features   Search View and store lyrics Share lyrics as a customisable card to your friends Autofill current playing song in searchRequires Notification Access permission;https://f-droid.org/repo/com.shub39.rush_11.apk;This version requires Android 10 or newer.;https://github.com/shub39/Rush;https://github.com/shub39/Rush/issues;1.6.0;have full network access <-> com.shub39.rush.DYNAMIC_RECEIVER_NOT_EXPORTED_PERMISSION <-> 
Pagan;https://f-droid.org/en/packages/com.qfs.pagan/index.html;Ntonal tuning    Pagan supports Ntone tuning Change your radix to 24 for microtones or something else just to see what happensA Divisive Interface    Pagan completely ignores measures like any other sequencer but instead of laying out notes based on absolute timing uses beats Each column represents one beat and can be split up easily to show rhythmMidi Support    Import a midi file to resequence it Export a midi to share it Plug your midi instrument in to play your music through it not currently applicable with the Ntonal tuningRepetition without Repetition    Single beats and full selections can be linked together to save copypastingBigger than Midi    Pagan isnt only a midi sequencer Use whatever sf2 soundfont you want and export the audio data;https://f-droid.org/repo/com.qfs.pagan_67.apk;This version requires Android 11 or newer.;https://burnsomni.net/git/pagan;https://burnsomni.net/issues/pagan;1.4.20;show notifications <-> 
FilmFacts;https://f-droid.org/en/packages/com.movietrivia.filmfacts/index.html;FilmFacts lets you bring the excitement of movie trivia wherever you go  Challenge your box office knowledge with up to date questions about all your favorite movies actors and moreFeatures Tailor your trivia experience to match your favorite genres and eras Earn achievements and track your personal progress Sign in with Tmdb to further customize your trivia questions to your favorite movies;https://f-droid.org/repo/com.movietrivia.filmfacts_2.apk;This version requires Android 7.1 or newer.;https://github.com/jlynchsd/FilmFacts;https://github.com/jlynchsd/FilmFacts/issues;2.0;have full network access <-> reorder running apps <-> com.movietrivia.filmfacts.DYNAMIC_RECEIVER_NOT_EXPORTED_PERMISSION <-> 
BILIBILIAS;https://f-droid.org/en/packages/com.imcys.bilibilias/index.html;BILIBILIAS is an auxiliary tool for Bilibili video caching providing oneclick cachingUse it to help you cache videos Currently we support a considerable number of features to assist you in completing your workUP creators can download some clips as material for video editingPlease note that the projects maintenance may be stopped at any timeSupported FeaturesScan code loginCache videosBilibili exclusive anime that can be played in Mainland ChinaPersonal Center  Help cache your own videosBatch downloadBackground downloadSupport ffmpegSupport download list operations;https://f-droid.org/repo/com.imcys.bilibilias_204.apk;This version requires Android 5.0 or newer.;https://github.com/1250422131/bilibilias;https://github.com/1250422131/bilibilias/issues;2.0.43;view network connections <-> view Wi-Fi connections <-> pair with Bluetooth devices <-> android.permission.DOWNLOAD_WITHOUT_NOTIFICATION <-> run foreground service <-> have full network access <-> android.permission.MANAGE_EXTERNAL_STORAGE <-> show notifications <-> query all packages <-> read the contents of your shared storage <-> read phone status and identity <-> run at startup <-> request install packages <-> prevent phone from sleeping <-> modify or delete the contents of your shared storage <-> android.permission.WRITE_MEDIA_AUDIO <-> android.permission.WRITE_MEDIA_IMAGES <-> android.permission.WRITE_MEDIA_VIDEO <-> modify system settings <-> com.imcys.bilibilias.DYNAMIC_RECEIVER_NOT_EXPORTED_PERMISSION <-> 
Screenshot Tile (NoRoot);https://f-droid.org/en/packages/com.github.cvzi.screenshottile/index.html;Adds a buttontile to the quick settings panel to take screenshotsAfter install you need to add the buttontile to your quick settings and then grant the permissions to record screen captures and save images to the internal storageFeaturesa Take screenshots from the quick settingsa No root requireda Notification after a screenshot was taken can be disableda Immediately share edit or delete a screenshot from the notificationa Edit the screenshot with the included image editora Floating buttonOverlay button like a chat bubble Android 9a Use as assist app to take a screenshot longpress the Home buttona Only take screenshot of a specific area of the screen longpress the tilea Delay taking a screenshota Store in any folder on any storage eg sd carda Store in different file formats png jpg or webpa Take automatic screenshots with apps like Tasker or MacroDroida Free opensource no advertisingThis is a fork of Screenshot Tile Root but it does not require rootSource code githubcomcvziScreenshotTileOriginal app githubcomipcjsScreenshotTileOpen Source license is GNU GPLv3Note When you take a screenshot the Google Cast icon will appear in the status bar and it will be visible in the screenshot imageIf you want to hide the icon there is an explanation here githubcomcvziScreenshotTileiconPermissionsa androidpermissionWRITEEXTERNALSTORAGE PhotosMediaFiles and StorageThis is required to save the screenshot files on the internal storage of your devicea androidpermissionFOREGROUNDSERVICESince Android 9Pie this permission is required to take screenshots It basically means that this app can run without showing itself However the app will always show a notification when it is runningAutomatic screenshotsIf you want to automate screenshots from another app eg MacroDroid or Tasker you can find a stepbystep guide heregithubcomcvziScreenshotTileautomaticscreenshotswithbroadcastintentsHiding the app iconIn the app settings you can hide the app icon from your launcher You can still access the app by long pressing the tile in your quick settings Unfortunately Android 10 does not allow hiding an app anymore Support and translationsIf there is a problem or you want to help translate this app into your language please contact me on githubcomcvziScreenshotTileissues cuziandroidopenmailcc or contribute a translation on httpscrowdincomprojectscreenshottileThis app can access the Accessibility Services API which allows this app to record the screen Data is neither collected nor shared by this app using the accessibility capabilities;https://f-droid.org/repo/com.github.cvzi.screenshottile_123.apk;This version requires Android 7.0 or newer.;https://github.com/cvzi/ScreenshotTile;https://github.com/cvzi/ScreenshotTile/issues;2.11.1;run foreground service <-> run foreground service with the type "mediaProjection" <-> show notifications <-> read the contents of your shared storage <-> modify or delete the contents of your shared storage <-> com.github.cvzi.screenshottile.DYNAMIC_RECEIVER_NOT_EXPORTED_PERMISSION <-> 
Lyrion;https://f-droid.org/en/packages/com.craigd.lmsmaterial.app/index.html;Provides a webview wrapper for accessing a Logitech Media Server instance usingMaterialSkin Reqires the MaterialSkin plugin to be installed on your LMSinstance;https://f-droid.org/repo/com.craigd.lmsmaterial.app_602.apk;This version requires Android 6.0 or newer.;https://github.com/CDrummond/lms-material-app;https://github.com/CDrummond/lms-material-app/issues;0.6.2;view network connections <-> view Wi-Fi connections <-> connect and disconnect from Wi-Fi <-> run foreground service <-> run foreground service with the type "mediaPlayback" <-> have full network access <-> show notifications <-> read the contents of your shared storage <-> read phone status and identity <-> prevent phone from sleeping <-> modify or delete the contents of your shared storage <-> com.craigd.lmsmaterial.app.DYNAMIC_RECEIVER_NOT_EXPORTED_PERMISSION <-> com.termux.permission.RUN_COMMAND <-> 
Podcini.R - Podcast instrument;https://f-droid.org/en/packages/ac.mdiq.podcini.R/index.html;PodciniR is a revamped version from Podcini version 5 uses a modern objectbase database Though loaded with newer features it works in similar ways as Podcini This app installs afresh and in parallel with any older version of Podcini Though incompatible with older versions migration path is provided If you need migration from an earlier version see Github site for instructionsPodcini an open source podcast instrument attuned to Puccini adorned with pasticcini and aromatized with porcini invites your harmonious heartbeatsIt allows you to subscribe to any RSS feed with or without media gives you instant access to millions of free and paid podcasts or plain RSS feeds from independent podcasters to large publishing houses such as the BBC NPR and CNN Add import and export their feeds hasslefree using the Apple Podcasts database OPML files or simple RSS URLsDownload stream or queue episodes and enjoy them the way you like with adjustable playback speeds chapter support and a sleep timer  In case the feed contains no media plain RSS feed TexttoSpeech engine if available is used to play the textSave effort battery power and mobile data usage with powerful automation controls for downloading episodes specify times intervals and WiFi networks and deleting episodes based on your favourites and delay settingsTranscripts or episode descriptions can be easily shared as text to other apps for recordkeepingListening progress can be instantly synced across devices in the same wifi networkMade by podcastenthusiasts Podcini is free in all senses of the word open source no costs no adsPodcini emphasizes on efficient battery usage streamlined podcast management and convenient player control while listeningImport organize and play Manage playback from anywhere homescreen widget system notification and earplug and bluetooth controls Add and import feeds via the Apple Podcasts gPoddernet fyyd or Podcast Index directories OPML files and RSS or Atom links Enjoy listening your way with adjustable playback speed chapter support remembered playback position and an advanced sleep timer shake to reset lower volume Access passwordprotected feeds and episodesKeep track share  appreciate Keep track of the best of the best by marking episodes as favourites Find that one episode through the playback history or by searching titles and shownotes Share episodes and feeds through advanced social media and email options the gPoddernet services and via OPML exportControl the system Take control over automated downloading choose feeds exclude mobile networks select specific WiFi networks require the phone to be charging and set times or intervals Manage storage by setting the amount of cached episodes smart deletion and selecting your preferred location Adapt to your environment using the light and dark theme Backup your subscriptions with the gPoddernet integration and OPML exportJoin the Podcini communityPodcini is under active development by volunteers You can contribute too with code or with commenthttpsgithubcomXilinJiaPodciniTransifex is the place to help with translationshttpsapptransifexcomxilinjiapodcinidashboard;https://f-droid.org/repo/ac.mdiq.podcini.R_3020228.apk;This version requires Android 6.0 or newer.;https://github.com/XilinJia/Podcini;https://github.com/XilinJia/Podcini/issues;6.3.4;ac.mdiq.podcini.R.DYNAMIC_RECEIVER_NOT_EXPORTED_PERMISSION <-> view network connections <-> view Wi-Fi connections <-> pair with Bluetooth devices <-> run foreground service <-> run foreground service with the type "mediaPlayback" <-> have full network access <-> show notifications <-> read the contents of your shared storage <-> run at startup <-> control vibration <-> prevent phone from sleeping <-> modify or delete the contents of your shared storage <-> 
PipePipe;https://f-droid.org/en/packages/InfinityLoop1309.NewPipeEnhanced/index.html;NewPipe but better  browse the most popular streaming platforms throughout the worldOriginal Features Local subscription  playlists  history Comments  replies Builtin popup player Download video  audio  captionBeyond NewPipe SponsorBlock  ReturnYouTubeDislike Bullet comments  Live Chats Search filters Filter  sort local playlists Music player mode  Background playing Timestamp support Sleep timer  and many minor improvements;https://f-droid.org/repo/InfinityLoop1309.NewPipeEnhanced_105604.apk;This version requires Android 5.0 or newer.;https://github.com/InfinityLoop1308/PipePipe;https://github.com/InfinityLoop1308/PipePipe/issues;3.7.0;view network connections <-> run foreground service <-> have full network access <-> show notifications <-> read the contents of your shared storage <-> run at startup <-> This app can appear on top of other apps <-> prevent phone from sleeping <-> modify or delete the contents of your shared storage <-> 
Phonograph Plus;https://f-droid.org/en/packages/player.phonograph.plus/index.html;An independent fork of Phonograph in developmentPhonograph is a material designed local music player for AndroidAnd Phonograph Plus is an independent fork of Phonograph and is currently under my maintenance and developmentAdditional Features Unlock pro Automatic  adaptive dark mode Plenty of user interface changes Change language in application manually Brandnew Detail page with more information like tags Show Time Axis in Lyrics Dialog and allow seeking basing lyrics time axis and support lyrics following Userdefined click behavior for songs Support history of playing queue Fix Android 11 Scope Storage Partial Improve menu experience Improve Library pages user experience Support more sort orders Allow collecting app crash report use Path filter to replace support exclude mode blacklist and include mode whitelist Add song menu shortcut to add new items to excludedlist blacklist CoworkwithSupport StatusBar Lyric Xposed Module api Export internal databases and settings for the need of backup Increase history played tracks and top played tracks entries capacity 100150 Allow tabs fixed Brandnew File tab Allow deleting songs file along with its external lyrics file Brandnew Tag Editor Brandnew App Intro Better Notification Image Quality for Android T and above Better Playlist support Playback speed control Resume playing after interruptions Enhance multiselecting Basic support for Android Auto and more small featuresfixes;https://f-droid.org/repo/player.phonograph.plus_1081.apk;This version requires Android 7.0 or newer.;https://github.com/chr56/Phonograph_Plus;https://github.com/chr56/Phonograph_Plus/issues;1.8.1;view network connections <-> send sticky broadcast <-> run foreground service <-> run foreground service with the type "mediaPlayback" <-> have full network access <-> android.permission.MANAGE_EXTERNAL_STORAGE <-> show notifications <-> read the contents of your shared storage <-> read audio files from shared storage <-> read image files from shared storage <-> run at startup <-> prevent phone from sleeping <-> modify or delete the contents of your shared storage <-> modify system settings <-> player.phonograph.plus.DYNAMIC_RECEIVER_NOT_EXPORTED_PERMISSION <-> 
Kotatsu;https://f-droid.org/en/packages/org.koitharu.kotatsu/index.html;Kotatsu is a free and open source manga reader for AndroidMain Features Online manga catalogues Search manga by name and genres Reading history and bookmarks Favourites organized by userdefined categories Downloading manga and reading it offline Thirdparty CBZ archives also supported Tabletoptimized Material You UI Standard and Webtoonoptimized reader Notifications about new chapters with updates feed Integration with manga tracking services Shikimori AniList MyAnimeList Passwordfingerprint protect access to the app History and favourites synchronization across devices;https://f-droid.org/repo/org.koitharu.kotatsu_658.apk;This version requires Android 5.0 or newer.;https://github.com/KotatsuApp/Kotatsu;https://github.com/KotatsuApp/Kotatsu/issues;7.4.1;view network connections <-> android.permission.AUTHENTICATE_ACCOUNTS <-> run foreground service <-> run foreground service with the type "dataSync" <-> find accounts on the device <-> have full network access <-> android.permission.MANAGE_ACCOUNTS <-> android.permission.MANAGE_EXTERNAL_STORAGE <-> show notifications <-> query all packages <-> read the contents of your shared storage <-> read sync settings <-> read sync statistics <-> run at startup <-> request delete packages <-> ask to ignore battery optimizations <-> request install packages <-> use biometric hardware <-> android.permission.USE_CREDENTIALS <-> use fingerprint hardware <-> control vibration <-> prevent phone from sleeping <-> modify or delete the contents of your shared storage <-> toggle sync on and off <-> org.koitharu.kotatsu.DYNAMIC_RECEIVER_NOT_EXPORTED_PERMISSION <-> 
Moshidon;https://f-droid.org/en/packages/org.joinmastodon.android.moshinda/index.html;Moshidon is a modified version of the official Mastodon Android app adding important features that are missing in the official app such as the federated timeline unlisted posting and an image description viewerKey features Many colors Brings material you theme and many colorful options for themes Filtered posts The ability to have filtered posts show with a warning Translate button Brings a translate button Toot language picker Brings in a toot language picker Unlisted posting Post publicly without having your post show up in trends hashtags or public timelines Federated timeline See all public posts from people on all other Fediverse neighborhoods your home instance is connected to Image description viewer Quickly check whether an image or video has an alt text attached to it Pinning posts Pin your most important posts to your profile and see what others have pinned using the aPinneda tab Follow hashtags See new posts from specific hashtags directly in your home timeline by following them Answering follow requests Accept or decline follow requests from your notifications or the dedicated Follow requests list Delete and redraft The muchloved feature that made editing possible without an actual editing function Extras Brings many extra UI features such as interaction icons on the Notifications and removing many annoyances with the original UI;https://f-droid.org/repo/org.joinmastodon.android.moshinda_107.apk;This version requires Android 6.0 or newer.;https://github.com/LucasGGamerM/moshidon;https://github.com/LucasGGamerM/moshidon/issues;2.3.0+fork.107.moshinda;take pictures and videos <-> run foreground service <-> run foreground service with the type "mediaPlayback" <-> have full network access <-> show notifications <-> read the contents of your shared storage <-> control vibration <-> prevent phone from sleeping <-> modify or delete the contents of your shared storage <-> com.google.android.c2dm.permission.RECEIVE <-> org.joinmastodon.android.moshinda.permission.C2D_MESSAGE <-> 
Jellyfin for Android TV;https://f-droid.org/en/packages/org.jellyfin.androidtv/index.html;Your media on your termsThe Jellyfin project is an open source free software media server No fees no tracking no hidden agenda Get our free server to collect all your audio video photos and more in one placeTo use the app you must have a Jellyfin server set up and running Find out more at jellyfinorgWith a Jellyfin server you can Watch Live TV and recorded shows from your Jellyfin server additional hardwareservices required Stream to a Chromecast device on your network Stream your media to your Android device View your collection in an easy to use interfaceThis is the official Jellyfin companion app for Android TV Thank you for using Jellyfin;https://f-droid.org/repo/org.jellyfin.androidtv_170099.apk;This version requires Android 5.0 or newer.;https://github.com/jellyfin/jellyfin-androidtv;https://github.com/jellyfin/jellyfin-androidtv/issues;0.17.0;view network connections <-> view Wi-Fi connections <-> run foreground service <-> have full network access <-> read the contents of your shared storage <-> run at startup <-> record audio <-> prevent phone from sleeping <-> com.android.providers.tv.permission.READ_EPG_DATA <-> com.android.providers.tv.permission.WRITE_EPG_DATA <-> org.jellyfin.androidtv.DYNAMIC_RECEIVER_NOT_EXPORTED_PERMISSION <-> 
