ÐÐ°Ð·ÐµÑÐ° VEGETARIAN;https://f-droid.org/en/packages/ymakei.vegetarian_journal/;N 3412  34234NN 3NN NN  12NNNN14N 2NNNo  3NN VEGETARIAN 12 NNNN341NN2 34NoNNNN 234 212N1214 N 3412    N NN12 N   34  NNNN NNNo341 12 2NNNohttpsvegjournalcomissues;https://f-droid.org/repo/ymakei.vegetarian_journal_1.apk;This version requires Android 4.1 or newer.;https://github.com/ymakei/vegetarian_journal;https://github.com/ymakei/vegetarian_journal/issues
LMd;https://f-droid.org/en/packages/de.thecode.lmd/;;https://f-droid.org/repo/de.thecode.lmd_3100300.apk;This version requires Android 4.1 or newer.;https://github.com/woffs/tazapp-android;https://github.com/woffs/tazapp-android/issues
YARR;https://f-droid.org/en/packages/me.cgarcia.yarr/;YARR short for Yet Another RSS Reader is a minimalistic material designcompliant feed reader for Android designed to work with and sync  between preexisting feed reader servicesNotable features Offline support for reading feeds without an Internet connection Import and backup feeds fromto OPML format View feed enclosures such as audio and video within the entries Swipe left and right to page through entries Receive notifications at specified intervals Dark theme to reduce eyestrain;https://f-droid.org/repo/me.cgarcia.yarr_5.apk;This version requires Android 4.2 or newer.;https://gitlab.com/Feral2k/yarr;https://gitlab.com/Feral2k/yarr/issues
Tinte Webcoms;https://f-droid.org/en/packages/com.halftough.webcomreader/;Webcom Reader allows you to pick webcomics from supported titles andadd them to your library Marks read download them to read offlineList of working webcoms xkcd Lunarbaboon Cyanide  HappinessList of planned webcoms Dilbert Pepper  Carrot;https://f-droid.org/repo/com.halftough.webcomreader_4.apk;This version requires Android 4.4 or newer.;https://gitlab.com/halftough/webcom-reader;https://gitlab.com/halftough/webcom-reader/issues
F-Droid;https://f-droid.org/en/packages/org.fdroid.fdroid/;FDroid is an installable catalogue of libre software apps for Android The FDroid client app makes it easy to browse install and keep track of updates on your deviceIt connects to any FDroid compatible repositories The default repo is hosted at fdroidorg which contains only bona fide libre softwareAndroid itself is open in the sense that you are free to install APKs from anywhere you wish but there are many good reasons for using FDroid as your libre software app manager Get notified when updates are available Optionally download and install updates automatically Keep track of older and beta versions Filter out apps incompatible with the device Find apps via categories and searchable descriptions Access associated URLs for donations source code etc Stay safe by checking repo index signatures and APK hashes;https://f-droid.org/repo/org.fdroid.fdroid_1016053.apk;This version requires Android 6.0 or newer.;https://gitlab.com/fdroid/fdroidclient;https://gitlab.com/fdroid/fdroidclient/issues
Xeonjia: Ice Adventures;https://f-droid.org/en/packages/xyz.deepdaikon.xeonjia/;Xeonjia is an adventure game set in a frozen worldThe floor is frozen Think carefully about your moves because you cant change direction until you meet an obstacleUse you mind to solve the ice slide puzzlesThe world has been frozen by the aKing of Evila and itas no longer a safe placeLegend has it that a brave hero will defeat the King of Evil and save the kingdoma For this reason every year a person is appointed as aheroa and sent on a journey to try to save itNow is your time you have been chosen as this yearas hero Will you be able to defeat the King of EvilYou will have to travel the world explore cities dungeons and mystical cavesAre you ready to solve quests and puzzles in this frozen RPG worldOver time you will gain experience points that will allow you to increase your level and you will find money and hidden treasures that you can use to buy stuff and improve yourselfBe careful the world is full of dangerous enemies ready to attack youKeep in mind that most of the floor is frozen so you canat stop yourself until you reach a wall a boulder or any other type of obstacleUse your mind to figure out the best pathNote this game is currently in early beta stage;https://f-droid.org/repo/xyz.deepdaikon.xeonjia_14.apk;This version requires Android 4.1 or newer.;https://gitlab.com/deepdaikon/Xeonjia/tree/HEAD;https://gitlab.com/deepdaikon/Xeonjia/issues
Quinb: 4 players reaction game;https://f-droid.org/en/packages/xyz.deepdaikon.quinb/;Quinb is a reaction  logic game for up to 4 players on the same deviceIt contains many minigames in which you have to answer questions as fast as you can to get a pointIf the answer is correct you score a point otherwise you lose oneThese games are based on 3 different categoriesa Logic games that require intuition logic and fast reflexesa Audio soundbased games you have to listen carefully to find out the correct answera Vibration vibrationbased games that require you to listen carefully to the vibrations of your deviceEach match consists of a succession of different minigamesThe goal is to score 7 points before your opponentsYou can play alone if you want but it is more fun to play with friends of all ages Its great if you are stuck with nothing to do while youre with friendsIf you think youre fast challenge and beat your friendsMain featuresa 28 minigamesa Up to 4 players on the same devicea Completely freea No Adsa Multiple languagesa Minimalist design;https://f-droid.org/repo/xyz.deepdaikon.quinb_8.apk;This version requires Android 4.1 or newer.;https://gitlab.com/deepdaikon/Quinb/tree/HEAD;https://gitlab.com/deepdaikon/Quinb/issues
Jellyfin for Android TV;https://f-droid.org/en/packages/org.jellyfin.androidtv/;Your media on your termsThe Jellyfin project is an open source free software media server No fees no tracking no hidden agenda Get our free server to collect all your audio video photos and more in one placeTo use the app you must have a Jellyfin server set up and running Find out more at jellyfinorgWith a Jellyfin server you can Watch Live TV and recorded shows from your Jellyfin server additional hardwareservices required Stream to a Chromecast device on your network Stream your media to your Android device View your collection in an easy to use interfaceThis is the official Jellyfin companion app for Android TV Thank you for using Jellyfin;https://f-droid.org/repo/org.jellyfin.androidtv_150599.apk;This version requires Android 5.0 or newer.;https://github.com/jellyfin/jellyfin-androidtv;https://github.com/jellyfin/jellyfin-androidtv/issues
Activity Launcher fork;https://f-droid.org/en/packages/de.szalkowski.activitylauncher.rustore_fork/;This opensource Android App launches hidden activities and creates home screen shortcuts for installed apps;https://f-droid.org/repo/de.szalkowski.activitylauncher.rustore_fork_137.apk;This version requires Android 6.0 or newer.;https://github.com/Sash0k/ActivityLauncher;https://github.com/Sash0k/ActivityLauncher/issues
Translate You;https://f-droid.org/en/packages/com.bnyro.translate/;Translate You is a Translator App built with Material Design 3 YouIt supports multiple different translation engiens such as LibreTranslate Lingva Deepl and moreIn total there are more than 200 supported languages across 6 different translation engines;https://f-droid.org/repo/com.bnyro.translate_29.apk;This version requires Android 5.0 or newer.;https://github.com/Bnyro/TranslateYou;https://github.com/Bnyro/TranslateYou/issues
Monochromatic;https://f-droid.org/en/packages/uk.co.richyhbm.monochromatic/;This app makes use of the builtin black and white device feature to providea bluelight filtered screen without the use of an overlay screen to helprelax your eyes at night and disincentivise phone usage;https://f-droid.org/repo/uk.co.richyhbm.monochromatic_17.apk;This version requires Android 5.0 or newer.;https://github.com/RichyHBM/Monochromatic;https://github.com/RichyHBM/Monochromatic/issues
Bhagavad Gita;https://f-droid.org/en/packages/eu.quelltext.gita/;Bhagavad Gita also known as the Gita The Song of God is a practical guide to ones life that guides one to reorganise their life achieve inner peace and approach the Supreme the Ultimate Reality It is a 700verse text in Sanskrit which comprises chapters 23 through 40 in the BhishmaParva section of the MahabharataThe Bhagavad Gita is a dialogue between Arjuna a supernaturally gifted warrior and his guide and charioteer Lord Krishna on the battlefield of Kurukshetra As both armies stand ready for the battle the mighty warrior Arjuna on observing the warriors on both sides becomes overwhelmed with grief and compassion due to the fear of losing his relatives and friends and the consequent sins attributed to killing his own relatives So he surrenders to Lord Krishna seeking a solution Thus follows the wisdom of the Bhagavad Gita Over 18 chapters the Bhagavad Gita packs an intense analysis of life emotions and ambitions discussion of various types of yoga including Jnana Bhakti Karma and Raja the difference between Self and the material body as well as the revelation of the Ultimate Purpose of LifeFeaturesComplete text in EnglishView chapters and versesPlain interfaceMaximum compatibility with all Android versions;https://f-droid.org/repo/eu.quelltext.gita_6.apk;This version requires Android 1.0 or newer.;https://github.com/niccokunzmann/bhagavad-gita-android/;https://github.com/niccokunzmann/bhagavad-gita-android/issues
arXiv eXplorer - Mobile App for arXiv.org;https://f-droid.org/en/packages/com.gbeatty.arxiv/;Find save and download arXiv articles quickly and easily with arXiv eXplorerFeatures includea Personalized Dashboard Customize which arXiv categories you want to viewa Browse categories Physics Astronomy Computer Science etca Favorite arXiv articlesa Search for arXiv articlesa Download arXiv articles and save the PDFa Share papers easilya Paginationa Latex Supporta Dark Modea Animationsa Material Designa Freea Open SourceThe app is open source and contributions are welcome at httpsgithubcomGarrettBeattyarXiveXplorerIf you have any suggestions just create an issue at httpsgithubcomGarrettBeattyarXiveXplorerissues;https://f-droid.org/repo/com.gbeatty.arxiv_39.apk;This version requires Android 5.0 or newer.;https://github.com/GarrettBeatty/arXiv-eXplorer;https://github.com/GarrettBeatty/arXiv-eXplorer/issues
Librery;https://f-droid.org/en/packages/com.example.harisont.librery/;Library is a Kotlin app that helps you to keep track of the books you haveread or want to read Search books in Google Books without any account Save comments and rating in a local database Recommend books to friends Available in English and Italian;https://f-droid.org/repo/com.example.harisont.librery_4.apk;This version requires Android 4.0.3 or newer.;https://gitlab.com/harisont/Librery;https://gitlab.com/harisont/Librery/issues
News;https://f-droid.org/en/packages/press.condense.www/;News apps like Google News Flipboard BBC show trending articles writtena day or two back If say there are hundred articles written in a day these newsapps pick just a few of them It is a time saving feature But they lack a keyflexibilityConsider you havent read any news for the last 1 monthor 1 yearIf you open any of the news apps or news websites you will still be shown trendingarticles written a day or two back and not last month or last year Hence thisapp presscondensewww picks popular articles of a website in a time rangewe specifyFor example techcrunchcom has 292172 articles But this app sortsall those articles based on popularity This app is a a webview of wwwcondensepressand has PWAProgressive Web App features;https://f-droid.org/repo/press.condense.www_18.apk;This version requires Android 4.0 or newer.;https://github.com/agnelvishal/newsDiet;https://github.com/agnelvishal/newsDiet/issues
Simple Dilbert;https://f-droid.org/en/packages/com.mareksebera.simpledilbert/; Select image quality Make favorite strips Caching so you wont download single strip twice All comics strips since 1641989 Supports both large and small screens Supports all device orientations;https://f-droid.org/repo/com.mareksebera.simpledilbert_40.apk;This version requires Android 4.0 or newer.;https://github.com/smarek/Simple-Dilbert;https://github.com/smarek/Simple-Dilbert/issues
Kiwix;https://f-droid.org/en/packages/org.kiwix.kiwixmobile/;Kiwix lets you read Wikipedia and other websites without an Internet connectionIt uses the highly compressed ZIM format to storewebpages for quick and easy readingThe app is a lightweight piece of software reading bigger files stored on yourdevice or SD card once it is installed you can select which additional contentyou would like to download Wikipedia Wiktionary TED talks etc and be readyfor when your internet connection is bad or need to be in airplane modeNote Kiwix is also available on regular computers Windows Mac Linux;https://f-droid.org/repo/org.kiwix.kiwixmobile_55.apk;This version requires Android 4.0 or newer.;https://github.com/kiwix/kiwix-android;https://github.com/kiwix/kiwix-android/issues
ADSdroid;https://f-droid.org/en/packages/hu.vsza.adsdroid/;Unofficial Android app for alldatasheetcom allowing fast access to thousandsof PDFs for specifications about electronic items;https://f-droid.org/repo/hu.vsza.adsdroid_11.apk;This version requires Android 2.3 or newer.;https://github.com/dnet/adsdroid;https://github.com/dnet/adsdroid/issues
OpenWort;https://f-droid.org/en/packages/de.digisocken.openwort/;NOTE This app is no longer maintained its repo was archivedOpenWort ist ein kleiner einfach bedienbarer Thesaurus der deutschen Sprachemit vielen Redewendungen und Synonymen Als Datenquelle dient eine TextDateivon OpenThesaurus LGPL Lizenz die in die Appfest eingebaut ist Eine Internetverbindung ist daher zur Benutzung nichtnotwendigFunktionen arbeitet offline maximaler Datenschutz kein Dateizugriff maximaler Datenschutz der Quellcode der App ist auch fA14r AnfAnger verstAndlich In Suchergebnissen werden Funde hervorgehoben ein Tippen auf einen Eintrag kopiert ihn komplett in die ZwischenablageDu kannst mit OpenWort die deutsche Sprache lernen oder knifflige Wortenachschlagen die du sonst immer falsch geschrieben hast;https://f-droid.org/repo/de.digisocken.openwort_19.apk;This version requires Android 4.1 or newer.;https://github.com/no-go/Wortschatz;None
BookList;https://f-droid.org/en/packages/com.ames.books/;This is the demowrapping app to demonstrate the capabilities of the Uncoverlibrary This library builds a bridge between infinitely scrolling view thatrequires fast synchronous data model and web resource or database that uses slowasynchronous and strongly prefers more than a single item per request Thelibrary performs many internal optimizations on how the data are fetched Unlikemany alternative approaches mostly centered around the scroll listener itfeatures clean classic MVC designThe mentioned library is the open source project under Apache 20 license Thewrapping app same repository is under GPLv3The demo app is fully usable by the end nonprogramming user It allows to viewthe large Google Books directory displaying titles and book covers If it ispossible to purchase the book from some vendor the book purchase link appearsin the book details view Tapping on it opens the web browser of your device nolonger this app and you may read more details or even to make a purchase thereThe app communicates with Google server with the help ofcomgoogleapisgoogleapiservicesbooks library that if fetched from MavenCentral Maven Central specifies the license of this library as Apache 20;https://f-droid.org/repo/com.ames.books_7.apk;This version requires Android 6.0 or newer.;https://github.com/andviane/google-books-android-viewer;https://github.com/andviane/google-books-android-viewer/issues
Library;https://f-droid.org/en/packages/com.cgogolin.library/;Library allows you to browse BibTeX files on your Android deviceFeatures include Clear presentation of BibTeX entries in a list SearchFilter Open associated local files including file path conversion Open URL and DOI links Minimal permissions Can load library file from cloud storage via storage access provider on Android 44 and newer;https://f-droid.org/repo/com.cgogolin.library_63.apk;This version requires Android 3.0 or newer.;https://github.com/cgogolin/library;https://github.com/cgogolin/library/issues
DictionaryForMIDs;https://f-droid.org/en/packages/de.kugihan.dictionaryformids.hmi_android/;DictionaryForMIDs is a multipurpose offline dictionary  word translation application Many dictionaries are available for automatic or manual installation you can create your own dictionary using tools from the websiteFeaturesa Word translationa Offline dictionariesa Search as you typea Clean user interfacea No ads full version open source  Would you like to see the user interface in your native language Then how about contributing to this open source project by translating a few phrases See here for details httpgoogl8AJ5KPlease report bugs to axwdevgmailcomDictionaries available for selected combinations of the following languagesEnglish German French Chinese Dutch Latin Spanish Portuguese Italian Esperanto Polish Swedish Japanese Russian Hungarian Turkish Vietnamese Czech Tagalog Slovak Lithuanian Arabic Armenian Hindi Tamil Thai KhmerOther dictionaries includeChemical Elements SMS Shorthand Dictionary German Car Signs Indian PIN Codes  Locations Indian STD Codes  Area Indian Vehicle No  RTO District Indian STD Code Vehicle No  AreaSome rare dictionaries require the installation of additional fonts;https://f-droid.org/repo/de.kugihan.dictionaryformids.hmi_android_131.apk;This version requires Android 1.6 or newer.;http://dictionarymid.sourceforge.net/android.html;http://dictionarymid.german-fighters.com/forum/index.php?board=12.0
Quran For My Android;https://f-droid.org/en/packages/com.frrahat.quransimple/;Displays Quran text or word by word translation;https://f-droid.org/repo/com.frrahat.quransimple_160.apk;This version requires Android 4.0 or newer.;https://github.com/frrahat/Quran-For-My-Android;https://github.com/frrahat/Quran-For-My-Android/issues
Mi Manga Nu;https://f-droid.org/en/packages/ar.rulosoft.mimanganu/;Read and organize mangas;https://f-droid.org/repo/ar.rulosoft.mimanganu_76.apk;This version requires Android 4.0 or newer.;https://github.com/raulhaag/MiMangaNu;https://github.com/raulhaag/MiMangaNu/issues
Word Power Made Easy;https://f-droid.org/en/packages/org.developfreedom.wordpowermadeeasy/;Vocabulary building with hundreds of word meanings chosen carefully from variousSAT GRE and GMAT course materialsYou will get random words from a very big offline inapp dictionary You have toguess the meaning of the word in 1 second otherwise the app will show it to youSo you need to be fast You can tap anywhere to get the next word;https://f-droid.org/repo/org.developfreedom.wordpowermadeeasy_1700.apk;This version requires Android 2.2 or newer.;https://github.com/ylogx/wordpowermadeeasy;https://github.com/ylogx/wordpowermadeeasy/issues
arXiv mobile;https://f-droid.org/en/packages/com.commonsware.android.arXiv/;Keep up with the latest science research physics math computers scienceBrowse daily science articles Physics Astronomy Math at arXivorg andsearch the entire arXiv collection You can read PDFs save them for laterreading and share articles A homescreen widget lets you know of any newarticles in your favorite science categories dozens of physics math computerscience categories or custom searches;https://f-droid.org/repo/com.commonsware.android.arXiv_112.apk;This version requires Android 1.6 or newer.;https://github.com/jdeslip/arxiv-mobile;https://github.com/jdeslip/arxiv-mobile/issues
LibreNews;https://f-droid.org/en/packages/app.librenews.io.librenews/;Whenever anything noteworthy happens in the world you can be sure that youllbe notified LibreNews doesnt depend on Google Play Services and iscompletely FLOSSBreaking news notifications are perhaps the most important channel by which wereceive our information about the world and LibreNews aims to democratize thisessential medium Dont let any corporation or government agency control yourbreaking newsKey features Free software server and client licensed under GPLv3 Doesnt use up a ton of battery life Uptodate and current Doesnt rely on Google infrastructure Secure forces HTTPS  decentralized Lots of customization Material design adherent interface Simple easy to understand settings Highquality code Encrypted  secure connection No tracking No ads Syncs automatically regardless of whether the app is openYou can expect LibreNews to send you about three notifications per day if youconnect to the default server API;https://f-droid.org/repo/app.librenews.io.librenews_5.apk;This version requires Android 4.1 or newer.;https://github.com/milesmcc/LibreNews-Android;https://github.com/milesmcc/LibreNews-Android/issues
FBReader;https://f-droid.org/en/packages/org.geometerplus.zlibrary.ui.android/;NBThere are three different apks to cover the different versions ofAndroid Donut covers 1516 Froyo covers 2023 and Honeycomb covers 30x86 and MIPS are supported natively in all apksAn ebook reader Features include the ability to stock up on books from onlineOPDS libraries like Project Gutenberg straight from the app FDroidorg has twoother addon apps that provide texttospeech functionality and one to supportlocal OPDS sharesAntifeatures Addons While there are some addons for this app that are freethe dictionaries that are suggested are not However it does supportaarddictandroid as long as that is installed beforehand and youchoose it via the Dictionary section of the settings;https://f-droid.org/repo/org.geometerplus.zlibrary.ui.android_2050920.apk;This version requires Android 3.0 or newer.;https://github.com/geometer/FBReaderJ;https://github.com/geometer/FBReaderJ/issues
The Italian Said;https://f-droid.org/en/packages/italian.said.fran.theitaliansaid/;The app provides a good number of Italian proverbs translated into English;https://f-droid.org/repo/italian.said.fran.theitaliansaid_2.apk;This version requires Android 4.1 or newer.;https://github.com/francescosoave/TIS_android;https://github.com/francescosoave/TIS_android/issues
Anecdote;https://f-droid.org/en/packages/io.gresse.hugo.anecdote/;Anecdote is a simple yet powerful application to read your favorites quoteswebsites Its very light not intrusive fast and simpleFeatures 9GAG feed image and video quotes feeds from fmylifecom FML Bashorg viedemerdefr VDM danstonchatcom DTC and more infinite scroll and pull to refresh no strange permissions no background tasks no ad add your own website with some HTML knowledgeThe content displayed in the application do not belongs to Anecdote Crash andsome usage informations such as the share of an item are sent to upstreamsown Countly server;https://f-droid.org/repo/io.gresse.hugo.anecdote_23.apk;This version requires Android 4.1 or newer.;https://github.com/HugoGresse/Anecdote;https://github.com/HugoGresse/Anecdote/issues
Save to Nextcloud Bookmarks;https://f-droid.org/en/packages/com.tttdevs.stncbookmarks/;Allows users of the Bookmarks NextCloud app to easily save links into theirpersonal cloudInstructions Open the app set the NextCloud server address and save From another app like from a web browser select Share and select NextCloud Bookmarks The first time you do this you will be prompted to log in Credentials will be saved within the app Fill in the fields you want and click save;https://f-droid.org/repo/com.tttdevs.stncbookmarks_2.apk;This version requires Android 4.0 or newer.;https://github.com/TTTDevs/NextCloudBookmarksAndroid;https://github.com/TTTDevs/NextCloudBookmarksAndroid/issues
Logical Defence;https://f-droid.org/en/packages/za.co.lukestonehm.logicaldefence/;View a list of logical fallacies Steel yourselves and begin to defend yourmind from the language used against you by the sophists of the worldSome features Left drawer that houses categories Share function  Long press a fallacy to share it Nice about screen Language selection function;https://f-droid.org/repo/za.co.lukestonehm.logicaldefence_22.apk;This version requires Android 4.1 or newer.;https://github.com/LukeStonehm/LogicalDefence;https://github.com/LukeStonehm/LogicalDefence/issues
Drinks;https://f-droid.org/en/packages/fr.masciulli.drinks/;Helps you to make cocktails You can search by name or ingredient;https://f-droid.org/repo/fr.masciulli.drinks_32.apk;This version requires Android 4.1 or newer.;https://github.com/amasciul/Drinks;https://github.com/amasciul/Drinks/issues
OCS-NG Agent;https://f-droid.org/en/packages/org.ocsinventoryng.android.agent/;AgentClient for the Open Computers andSoftware InventoryYou will have a complete inventory of all your Android devices hardware andsoftware information will be collected and stored Processors memories drivesand space used bios serial number installed applications and versions SIMand operator information AaA OCS Inventory Agent for Android send inventory toOCS Inventory NG Server 21OCS Inventory NG project is an open source project providing hardware and software inventory multiplatform network discovery IP Discover and SNMP software deployment interfaced with others IT and Asset Management Software througt the OCS WebService;https://f-droid.org/repo/org.ocsinventoryng.android.agent_24.apk;This version requires Android 2.3 or newer.;https://bazaar.launchpad.net/~ocsinventory-dev/ocsinventory-android-agent/stable-2.1/files;https://bugs.launchpad.net/ocsinventory-android-agent
