News Provider;https://f-droid.org/en/packages/m.co.rh.id.a_news_provider/;A simple and easy to use RSS aggregator that deliver news to your smartphone Easily add new feed using shortcut Support RSS XML Support Atom XML Support background sync Simple interface to add and read your news Support dark mode and light mode Accessibility friendly with one hand mode Accessibility friendly on screen reader tested with TalkBack;https://f-droid.org/repo/m.co.rh.id.a_news_provider_66.apk;This version requires Android 4.1 or newer.;https://github.com/rh-id/a-news-provider;https://github.com/rh-id/a-news-provider/issues
Markdownr;https://f-droid.org/en/packages/com.sanzoghenzo.markdownr/;Markdownr converts an URL to markdown and lets you share it to your favorite notes appIve written this app to save articles I found interesting to a note taking app that uses markdown and git to sync notes to my pcFeatures Downloads the web page specified in the URL input field and converts it to Markdown Share the markdown to other apps with standard share intent The URL can be also be shared from another app for example the web browser  markdownr will automatically convert it and show the share intent;https://f-droid.org/repo/com.sanzoghenzo.markdownr_8.apk;This version requires Android 4.1 or newer.;https://github.com/sanzoghenzo/markdownr;https://github.com/sanzoghenzo/markdownr/issues
Seeneva: smart comic reader;https://f-droid.org/en/packages/app.seeneva.reader/;A libre smart powered comic book readerFeaturesa Smart speech balloons zooming a Speech balloons OCR and TTS a Supports CBZ zip limited CBR rar CB7 7z CBT tar and PDF comic book archivesa Supports different image formats on any Android devicea View ComicRack metadataa Supports LefttoRight LTR and RighttoLeft RTL read directionsa Supports Android 41 and all available Android ABIs arm64v8a armeabiv7a x8664 and x86a Smart functionality performs locally on the devicea Libre application under GPLv3 or later licensea No ads no personal data collection Speech balloons zoomingRead digital comic books on mobile devices can be difficult especially if they have small screen Seeneva to the rescue Builtin Machine Learning model trained to detect speech balloons on pages allows you easily zooming and navigate through them with a touch of a finger  OCR and TTSHave you ever wanted to copy text from speech balloons Seeneva make it possible to use Optical Character Recognition on all founded speech balloons to extract text from them And the builtin Android TextToSpeech allows you to use Seeneva like audio comic book reader aNotea No comic book includeda OCR and TTS features are only available for English language right nowPlease read app repository httpsgithubcomSeenevaseenevareaderandroid for more information about the app and known issues;https://f-droid.org/repo/app.seeneva.reader_3.apk;This version requires Android 4.1 or newer.;https://github.com/Seeneva/seeneva-reader-android;https://github.com/Seeneva/seeneva-reader-android/issues
Green Pass PDF Wallet;https://f-droid.org/en/packages/com.michaeltroger.gruenerpass/;Unofficial app that is fully open source This app is a simple to use PDF Wallet That means it takes over the task to store and display your most important PDF certificates It includes a convenient fullscreen QR code rendering if a QR Code is present in the PDFs 1 pageBrief Instruction Open Green Pass Import PDF DoneAlternative Brief Instruction Open File browser Email Browser Adobe Reader or a similar app Share the PDF with Green Pass  DoneDescriptionVery simple app that does nothing more than conveniently storing and displaying PDF certificates Naming Green Pass In some European countries the Green Pass is a PDF document with QR code EU Digital Certificate that can be downloaded from the local authorities Since this app follows a universal approach other PDF certificates work as well thoughThe PDF file has to be imported into the app Following the QR code is displayed in fullscreen only if present in the PDFs 1 page as well as the PDF itself Thats already itMore Features Authentication PDFs can be individually sorted and named PDFs can be shared from other apps Dark Mode support Supports also password protected PDFsWhy does the fullscreen QR code look differently than in the PDFThe algorithm to display is different For reading devices the code is identicalPrivacyThis app values your privacy by being fully open source and working offline No ads no trackingIssuesThis is a free time project of a single developer Therefore please understand that replies can take a little while;https://f-droid.org/repo/com.michaeltroger.gruenerpass_41.apk;This version requires Android 5.0 or newer.;https://github.com/michaeltroger/greenpass-android;https://github.com/michaeltroger/greenpass-android/issues
Bookland;https://f-droid.org/en/packages/com.dhaval.bookland/;With Bookland you can search for the book by its title author or ISBN There are 3 categories within the app the book you want to read reading or finished readingFeatures  Browse across the large library of books thanks to Google Books APIs  Keep track of all the books you read  LightDark theme supportBookland is also completely free and opensource so anyone can contribute to its development;https://f-droid.org/repo/com.dhaval.bookland_1.apk;This version requires Android 10 or newer.;https://github.com/dhvl5/Bookland;https://github.com/dhvl5/Bookland/issues
Fujiten;https://f-droid.org/en/packages/fr.odrevet.fujiten/;Fujiten is a Japanese dictionary application made with the flutter frameworkDefinition and kanji comes from the EDICT dictionary compiled as a database from the edictdatabase projectSetupIn order to fujiten to work the Expression Database and the Kanji Database are neededThe databases can be downloaded and installed from fujiten via the settingsdatabases menu or by downloading the database manually from httpsgithubcomodrevetedictdatabaseTop menuBarsAccess the settings menuThe settings menu allow you to download the dictionaries set brightness and read legal informationInsertRadicals Will match kanji composed with the selected radicalsKanji character aWill match any kanjiKana character aWill match a hiraganakatakana characterJoker Any matchConvertIn case your device is not equipped with a Japanese input keyboard fujiten can convert Latin character romaji to hiragana or katakanaLowercase romaji will be converted to hiragana uppercase romaji will be converted to katakanaKotoba  Kanji searchWhen Kotoba is selected fujiten will search for expressionWhen Kanji is selected fujiten will search for kanjiClearClear the input fieldSearchRun the searchTipsSearch are performed with regular expression quantifiers  and metacharacters like  and others can be useUse search by radical   when searching for an expression which you do not know a kanji but recognize some of its radical example i14ai14When no results add  at the beginning or the end of your search;https://f-droid.org/repo/fr.odrevet.fujiten_4.apk;This version requires Android 4.1 or newer.;https://github.com/odrevet/fujiten/;https://github.com/odrevet/fujiten/issues
NewsBlur;https://f-droid.org/en/packages/com.newsblur/;Newsblur is software that runs on a server and collects RSSAtom feeds foryou to read If you dont have your own server you can sign up for a freemiumaccount at newsblurcom The feeds can be read in a web browser or using thisappFeatures Synchronizes with NewsBlur servers so keep your stories and readunread status consistent Read all of your news subscriptions RSS feeds Read while offline and resync read and saved stories when online again Share and comment on the news with friends Multiple device support Web Android iOS Meet new people who share the same interests Collapsible folders Save stories Dark mode for night time reading Multiple viewing options for stories Training your feeds  Hide the stories you dont like and highlight the stories you do River of news  show stories from several different feeds in a single view;https://f-droid.org/repo/com.newsblur_207.apk;This version requires Android 5.0 or newer.;https://github.com/samuelclay/NewsBlur;https://github.com/samuelclay/NewsBlur/issues
HN;https://f-droid.org/en/packages/com.manuelmaly.hn/;Hacker News client with a focus on reliability and usability View articles in ViewText Google or your system browser you can set each as default Upvote stories longpress on story Collapse and expand comments by tapping on them Choose from 3 text sizes Switch between stories and comments with one tap View more stories than only the HN frontpageA proprietary analytics library was removed before building;https://f-droid.org/repo/com.manuelmaly.hn_26.apk;This version requires Android 4.0 or newer.;https://github.com/manmal/hn-android;https://github.com/manmal/hn-android/issues
Lentil Translate;https://f-droid.org/en/packages/dev.atajan.lingva_android/;An Android client for the Lingala Translator Lingva translator is an opensource translator with over a hundred languages available;https://f-droid.org/repo/dev.atajan.lingva_android_17.apk;This version requires Android 8.0 or newer.;https://github.com/yaxarat/lingvaandroid;https://github.com/yaxarat/lingvaandroid/issues
CollinsDictionary;https://f-droid.org/en/packages/me.konyaco.collinsdictionary/;This is a thirdparty client for Collins Dictionary It gets word definitions by parsing Collins Online Dictionary website There is no license from Collins organization This repository is for learning purposes only Commercial use is prohibitedThe client is also available for Desktop WindowsLinuxMacOS PCs;https://f-droid.org/repo/me.konyaco.collinsdictionary_9.apk;This version requires Android 5.0 or newer.;https://github.com/Konyaco/CollinsDictionary;https://github.com/Konyaco/CollinsDictionary/issues
Glider for Hacker News;https://f-droid.org/en/packages/nl.viter.glider/;Glider is an opinionated Hacker News client Adfree opensource nononsensea Browse stories comments and user profilesa Catch up on and search stories from any perioda Log in using an existing or new Hacker News accounta Vote on and favorite stories and commentsa Write replies and submit new stories experimentala Collapse comment treesa No ads no telemetrya Extensive theminga Sensible defaultsSource code is available at httpsgithubcomMoscGlider Dont hesitate to submit an issue if youd like to see anything improvedUses the official Hacker News API hosted on Firebase and the Hacker News Search API provided by Algolia;https://f-droid.org/repo/nl.viter.glider_40.apk;This version requires Android 4.3 or newer.;https://github.com/Mosc/Glider;https://github.com/Mosc/Glider/issues
KFZ-Kennzeichen;https://f-droid.org/en/packages/luke.kfz/;Simple app to tell by a cars number plate where the car is registered If youre using Androids TalkBack functionality a connection to Google servers will be established;https://f-droid.org/repo/luke.kfz_10004.apk;This version requires Android 4.4 or newer.;https://gitlab.com/LukeSoftware/kfz-kennzeichen;https://gitlab.com/LukeSoftware/kfz-kennzeichen/issues
F-Droid;https://f-droid.org/en/packages/org.fdroid.fdroid/;FDroid is an installable catalogue of libre software apps for Android The FDroid client app makes it easy to browse install and keep track of updates on your deviceIt connects to any FDroid compatible repositories The default repo is hosted at fdroidorg which contains only bona fide libre softwareAndroid itself is open in the sense that you are free to install APKs from anywhere you wish but there are many good reasons for using FDroid as your libre software app manager Get notified when updates are available Optionally download and install updates automatically Keep track of older and beta versions Filter out apps incompatible with the device Find apps via categories and searchable descriptions Access associated URLs for donations source code etc Stay safe by checking repo index signatures and APK hashes;https://f-droid.org/repo/org.fdroid.fdroid_1016053.apk;This version requires Android 6.0 or newer.;https://gitlab.com/fdroid/fdroidclient;https://gitlab.com/fdroid/fdroidclient/issues
Xeonjia: Ice Adventures;https://f-droid.org/en/packages/xyz.deepdaikon.xeonjia/;Xeonjia is an adventure game set in a frozen worldThe floor is frozen Think carefully about your moves because you cant change direction until you meet an obstacleUse you mind to solve the ice slide puzzlesThe world has been frozen by the aKing of Evila and itas no longer a safe placeLegend has it that a brave hero will defeat the King of Evil and save the kingdoma For this reason every year a person is appointed as aheroa and sent on a journey to try to save itNow is your time you have been chosen as this yearas hero Will you be able to defeat the King of EvilYou will have to travel the world explore cities dungeons and mystical cavesAre you ready to solve quests and puzzles in this frozen RPG worldOver time you will gain experience points that will allow you to increase your level and you will find money and hidden treasures that you can use to buy stuff and improve yourselfBe careful the world is full of dangerous enemies ready to attack youKeep in mind that most of the floor is frozen so you canat stop yourself until you reach a wall a boulder or any other type of obstacleUse your mind to figure out the best pathNote this game is currently in early beta stage;https://f-droid.org/repo/xyz.deepdaikon.xeonjia_14.apk;This version requires Android 4.1 or newer.;https://gitlab.com/deepdaikon/Xeonjia/tree/HEAD;https://gitlab.com/deepdaikon/Xeonjia/issues
Quinb: 4 players reaction game;https://f-droid.org/en/packages/xyz.deepdaikon.quinb/;Quinb is a reaction  logic game for up to 4 players on the same deviceIt contains many minigames in which you have to answer questions as fast as you can to get a pointIf the answer is correct you score a point otherwise you lose oneThese games are based on 3 different categoriesa Logic games that require intuition logic and fast reflexesa Audio soundbased games you have to listen carefully to find out the correct answera Vibration vibrationbased games that require you to listen carefully to the vibrations of your deviceEach match consists of a succession of different minigamesThe goal is to score 7 points before your opponentsYou can play alone if you want but it is more fun to play with friends of all ages Its great if you are stuck with nothing to do while youre with friendsIf you think youre fast challenge and beat your friendsMain featuresa 28 minigamesa Up to 4 players on the same devicea Completely freea No Adsa Multiple languagesa Minimalist design;https://f-droid.org/repo/xyz.deepdaikon.quinb_8.apk;This version requires Android 4.1 or newer.;https://gitlab.com/deepdaikon/Quinb/tree/HEAD;https://gitlab.com/deepdaikon/Quinb/issues
Jellyfin for Android TV;https://f-droid.org/en/packages/org.jellyfin.androidtv/;Your media on your termsThe Jellyfin project is an open source free software media server No fees no tracking no hidden agenda Get our free server to collect all your audio video photos and more in one placeTo use the app you must have a Jellyfin server set up and running Find out more at jellyfinorgWith a Jellyfin server you can Watch Live TV and recorded shows from your Jellyfin server additional hardwareservices required Stream to a Chromecast device on your network Stream your media to your Android device View your collection in an easy to use interfaceThis is the official Jellyfin companion app for Android TV Thank you for using Jellyfin;https://f-droid.org/repo/org.jellyfin.androidtv_150599.apk;This version requires Android 5.0 or newer.;https://github.com/jellyfin/jellyfin-androidtv;https://github.com/jellyfin/jellyfin-androidtv/issues
Activity Launcher fork;https://f-droid.org/en/packages/de.szalkowski.activitylauncher.rustore_fork/;This opensource Android App launches hidden activities and creates home screen shortcuts for installed apps;https://f-droid.org/repo/de.szalkowski.activitylauncher.rustore_fork_137.apk;This version requires Android 6.0 or newer.;https://github.com/Sash0k/ActivityLauncher;https://github.com/Sash0k/ActivityLauncher/issues
Translate You;https://f-droid.org/en/packages/com.bnyro.translate/;Translate You is a Translator App built with Material Design 3 YouIt supports multiple different translation engiens such as LibreTranslate Lingva Deepl and moreIn total there are more than 200 supported languages across 6 different translation engines;https://f-droid.org/repo/com.bnyro.translate_29.apk;This version requires Android 5.0 or newer.;https://github.com/Bnyro/TranslateYou;https://github.com/Bnyro/TranslateYou/issues
Democracy Droid;https://f-droid.org/en/packages/com.workingagenda.democracydroid/;Democracy Now is an USbased national daily independent awardwinning newsprogram hosted by journalists Amy Goodman and Juan Gonzalez Pioneering thelargest public media collaboration in the USThis application streams or downloads the independent media broadcast DemocracyNow The War and Peace Report It supports streaming and downloading the audioand video broadcast  this includes watching and listening to individualstories reading transcripts and streaming the live streamIf you like the app you are encouraged to donate to Democracy Now at theirwebsiteThe app is not affiliated with the production of the show merely thedistribution;https://f-droid.org/repo/com.workingagenda.democracydroid_56.apk;This version requires Android 8.0 or newer.;https://github.com/fenimore/DemocracyDroid;https://github.com/fenimore/DemocracyDroid/issues
RSSAid;https://f-droid.org/en/packages/com.gmail.cn.leetao94.rssaid/;RSSAid is a client app for RSSHub RSSHub is an open source project to generate RSS links for websites that dont support rss then you can use the rss link in your own RSS reader to subscribeYou can deloy the RSSHub service on your own server or use the free service provided by the project author What RSSAid does is simple it is just a tool not a RSS reader you input a link like httpswwwredditcomrFedora then RSSAid can generate the RSS link according to RSSHub rules and base url RSSHub service hostname;https://f-droid.org/repo/com.gmail.cn.leetao94.rssaid_4.apk;This version requires Android 5.0 or newer.;https://github.com/LeetaoGoooo/RSSAid;https://github.com/LeetaoGoooo/RSSAid/issues
FreshRSS;https://f-droid.org/en/packages/fr.chenry.android.freshrss/;This application lets you sync with your FreshRSS instance view all your subscriptions view subsciptions with unread articles read your subscriptions articles set an article as readunread share an article to another application for instance you favorite social network application open the original web page of the article add new RSS feeds;https://f-droid.org/repo/fr.chenry.android.freshrss_22.apk;This version requires Android 5.0 or newer.;https://gitlab.com/christophehenry/freshrss-android;https://gitlab.com/christophehenry/freshrss-android/-/issues
lemmur;https://f-droid.org/en/packages/com.krawieck.lemmur/;Lemmur aims to provide a seamless experience when browsing different Lemmy instancesYou can have multiple multiple instances added at the same time without having to awkwardly switch between them;https://f-droid.org/repo/com.krawieck.lemmur_20.apk;This version requires Android 4.1 or newer.;https://github.com/LemmurOrg/lemmur;https://github.com/LemmurOrg/lemmur/issues
jQuarks viewer;https://f-droid.org/en/packages/com.oF2pks.jquarks/; Jelly BrowserJelly browser with ads blocker support for android 60 a few ui changes and some bug fixesAds blocker and favicon in search bar based on this httpsgithubcomCarbonROMandroidpackagesappsQuarks Ads blocker  httpspglyoyoorgasserverlistphphostformatnohtmlshowintro0 Offline reading  mht chromiumPC compatible  AndroiddatacomoF2pksjquarksfilesmht  aFavorites  screen Shortcuts  tabs manager  longclick on 3dots main screen  tile  iconShortcut for allTabs kill  external launches  local xmlmhthtmlsvgeml for both content Xplore  file aospFiles or GhostCommander  local video with screenoff audio  ShareLink  ShareContent  web search More Searchengineschosen one via Settings triggered from any selected text anywhere via longpress  Gibiru  SearX  StartPage  Swisscows AOSP compilation use branch b jQuarksMore orglineageosjellyGrant  etcsysconfigxml hiddenapiwhitelistedapp packageorglineageosjellyprimorigin httpsgithubcomLineageOSandroidpackagesappsJelly;https://f-droid.org/repo/com.oF2pks.jquarks_18.apk;This version requires Android 6.0 or newer.;https://gitlab.com/oF2pks/jelly;https://gitlab.com/oF2pks/jelly/issues
Markdown Widget;https://f-droid.org/en/packages/ch.tiim.markdown_widget/;Add a minimalistic widget with the content of a markdown file to your home screen This app is intended for users of Obsidian but the widget will display any markdown file on your phone The app supports all commonmark features as well as some extensions;https://f-droid.org/repo/ch.tiim.markdown_widget_7.apk;This version requires Android 7.0 or newer.;https://github.com/Tiim/Android-Markdown-Widget;https://github.com/Tiim/Android-Markdown-Widget/issues
monocles translator;https://f-droid.org/en/packages/de.monocles.translator/;Features translate your text into up to 9 languages share translation easily from the app completely open source running on a solar powered monocles server more is comingSupported languages UI English German French PortugueseSupported languages translation Arabic Chinese English French German Italian Portuguese Russian SpanishTranslationThe monocles translator API is used for the translation Based on LibreTranslate is licensed under AGPLv3WikiIn the Wiki you will soon find a short UI explanation to get startedLicensingLicensed under the EUPL12OpenSourceThis app is open source;https://f-droid.org/repo/de.monocles.translator_3.apk;This version requires Android 4.1 or newer.;https://codeberg.org/Arne/monocles_translator;https://codeberg.org/Arne/monocles_translator/issues
gophercle;https://f-droid.org/en/packages/org.biotstoiq.gophercle/;gophercle is a gopher client for androidit lets you download items go back in history for the current session bookmark a url set global search url set text size set lightdark theme share a link;https://f-droid.org/repo/org.biotstoiq.gophercle_14.apk;This version requires Android 5.0 or newer.;https://gitlab.com/biotstoiq/gophercle;None
Book Reader;https://f-droid.org/en/packages/com.github.axet.bookreader/;Book reader with a simple UI Based on orggeometerpluszlibraryuiandroidSupported formats fb2 html txt epub mobi rtf doc pdf djvuAll the best in this world is free;https://f-droid.org/repo/com.github.axet.bookreader_416.apk;This version requires Android 2.3 or newer.;https://gitlab.com/axet/android-book-reader/tree/HEAD;https://gitlab.com/axet/android-book-reader/issues
Nani?;https://f-droid.org/en/packages/eu.lepiller.nani/;Nani is an app that allows you to browse a complete bilingual Japanese dictionary offline Some of its features include Entirely free with no ad nor tracking Look for word by kanji pronounciation or meaning Multiple dictionaries enable different functionalitiesOn first start no dictionary is loaded in the application Its up to you to select which dictionary you want to use;https://f-droid.org/repo/eu.lepiller.nani_16.apk;This version requires Android 4.0.3 or newer.;https://framagit.org/nani-project/nani-app;https://framagit.org/nani-project/nani-app/issues
LibreTranslator;https://f-droid.org/en/packages/de.beowulf.libretranslater/;Features translate your text into up to 16 languages 5 different themes share translation easily from the app completely open source more comingSupported languages UI English German French Polish Portuguese Brazil Russian TurkishSupported languages translationThis depends on the LibreTranslate instanceTranslationThe LibreTranslate API is used for the translation LibreTranslate is licensed under AGPLv3WikiIn the Wiki you can find a short UI explanation to get startedLicensingLicensed under the EUPL12OpenSourceThis app is open source;https://f-droid.org/repo/de.beowulf.libretranslater_5.apk;This version requires Android 4.1 or newer.;https://codeberg.org/BeoCode/LibreTranslator;https://codeberg.org/BeoCode/LibreTranslator/issues
Based Cooking;https://f-droid.org/en/packages/np.com.binabh.basedcooking/;Simple ad free open source recipe appMore than 200 recipes from basedcookingFeaturesfilter recipes by tagsearch recipes;https://f-droid.org/repo/np.com.binabh.basedcooking_3.apk;This version requires Android 4.1 or newer.;https://github.com/Binabh/based-cooking-app;https://github.com/Binabh/based-cooking-app/issues
SDB Viewer;https://f-droid.org/en/packages/org.zephyrsoft.sdbviewer/;This app can display the data produced and managed by Song Databaseif the file is accessible via URL web address It cannot be used for anything else so if youdont use Song Database this app isnt meant for youYou can view the song lyrics any available translation and the guitar chords if availableTranslation and chords can be disabled in the settings The app keeps a local version of the datauntil it can fetch an update after a timeout which is three days by default so you can useit offline as wellIf you are the administrator of your Song Database installation and dont want to upload thefile containing the songs every time you modify it you could set up a synchronisation solutionlike Nextcloud and use the share link functionality  the resultinglink has to be used in the app;https://f-droid.org/repo/org.zephyrsoft.sdbviewer_7.apk;This version requires Android 5.0 or newer.;https://github.com/mathisdt/sdbviewer;https://github.com/mathisdt/sdbviewer/issues
