taz.app klassisch;https://f-droid.org/en/packages/de.thecode.android.tazreader/;tazapp features reading the german daily newspaper taz die tageszeitung on phone or tablet A subscription is needed An Archive since 2011 the german edition of Le Monde diplomatique local editions and weekend editions are includedNotes for this FDroid build no Google push notifications for automatic download switches to pulling instead no automatic bug reporting;https://f-droid.org/repo/de.thecode.android.tazreader_3140000.apk;This version requires Android 4.1 or newer.;https://github.com/ctrlaltcoop/tazapp-android;https://github.com/ctrlaltcoop/tazapp-android/issues
Offline Cook Book;https://f-droid.org/en/packages/com.benarmstead.simplecooking/;Cooking app with simple minimalist recipes which does not require an internet connection;https://f-droid.org/repo/com.benarmstead.simplecooking_6.apk;This version requires Android 7.1 or newer.;https://github.com/benarmstead/OfflineCookBook;https://github.com/benarmstead/OfflineCookBook/issues
InstaLate;https://f-droid.org/en/packages/com.concept1tech.instalate/;Features Distractionfree translation displayed in a semitransparent overlay window Choose from many different translation providers 3 different trigger modes  1 Context menu  2 Share intent  3 Floating button requires the selection to be copiedcut to the system clipboard first       Button freely movable via drag n drop       Android versions  10 only showhide button automaticallyPermissions INTERNET  Allows InstaLate to connect to the internet to lookup translations ACCESSNETWORKSTATE  Allows InstaLate to verify if the device is connected to the internet FOREGROUNDSERVICE  Allows InstaLate to run a service that listens to clipboard changes and to show a floating button RECEIVEBOOTCOMPLETED  Allows InstaLate to optionally start this service during startup of the device SYSTEMALERTWINDOW  Allows InstaLate to display a floating button over other appsPrivacy No search history is stored locally or remotely by this app last search term is cached in memory only but it may or may not be possible that your search is tracked by the selected translation provider No clientside JavaScript is executed HTTPS communication between app and translation providersPlease be extra cautious to not share sensitive data passwords etc with translation providers by accident If youre using the floating button dont trigger a translation if sensitive data is located in the system clipboardTips and Tricks If an app has implemented a custom context menu see if the floating button works for you or if the app is able to share text Integration into Librera FOSS ebook reader   1 Select any word in the document by longpressing it text selection must be supported by the document   2 In the opening dialog tap the  sign at the bottom and select InstaLate   3 Next time you select text youll have access to the InstaLate button at the bottomThanksTo all translation providers and their awesome services this application would be nothing without in alphabetical order Beolingus httpsdicttuchemnitzde DeepL httpswwwdeeplcom Dict cc httpswwwdictcc GNU CIDE httpsgcidegnuorgua Heinzelnisse httpswwwheinzelnisseinfo LibreTranslate httpstranslateargosopentechcom Linguee httpswwwlingueecom WikDict httpswwwwikdictcom Wiktionary httpswiktionaryorg;https://f-droid.org/repo/com.concept1tech.instalate_13.apk;This version requires Android 6.0 or newer.;https://gitlab.com/concept1tech/instalate;https://gitlab.com/concept1tech/instalate/-/issues
QuickDic;https://f-droid.org/en/packages/de.reimardoeffinger.quickdic/;Resurrection of comhughesandroiddictionary to a new maintainer Uses datafrom Wiktionary and Beolingus to generate dictionary files that can be usedoffline These can be downloaded from within the app These can also begenerated automatically though documentation for the process is currentlymissing;https://f-droid.org/repo/de.reimardoeffinger.quickdic_117.apk;This version requires Android 2.3.3 or newer.;https://github.com/rdoeffinger/Dictionary;https://github.com/rdoeffinger/Dictionary/issues
Unofficial Golem.de Reader;https://f-droid.org/en/packages/de.eknoes.inofficialgolem/;The unofficial app for the German news site golemde makes reading the current articles comfortableIt is optimized for all screen sizes has functions like dark mode deeplinks and offline articles for premium user And if a feature is missing it can be implemented or requested easily due to its open source developmentInformation for permissions Network Requirement to communicate with Golemde;https://f-droid.org/repo/de.eknoes.inofficialgolem_141.apk;This version requires Android 4.4 or newer.;https://github.com/eknoes/golem-android-reader;https://github.com/eknoes/golem-android-reader/issues
Nextcloud Cookbook;https://f-droid.org/en/packages/de.micmun.android.nextcloudcookbook/;This app is a viewer for recipes in Nextcloud App You need another app eg the Nextcloud Android client to sync the recipes to your Android deviceFirst stepsAfter installation you must go into the settings view and select the recipe directory with the recipes inside When using the Nextcloud Android client you find it on your storage under Androidmediacomnextcloudclientnextcloudyour accountfolderYou also can choose the theme in the settingsAfter that the start view has a list of recipes and you select a recipe to view the detailsIMPORTANT With direct pick of the nextcloud folder there will no images shown and the uri cant be stored right Perhaps at next app start no recipes can be loadedTherefore it is better to use the above mentioned path on the SD card see First steps;https://f-droid.org/repo/de.micmun.android.nextcloudcookbook_270.apk;This version requires Android 6.0 or newer.;https://codeberg.org/MicMun/nextcloud-cookbook;https://codeberg.org/MicMun/nextcloud-cookbook/issues
LifeHQ;https://f-droid.org/en/packages/com.abhinavmarwaha.lifehq/;FeaturesRoutinesJournalKnowledgeGoalsHabitsComing SoonDecisions;https://f-droid.org/repo/com.abhinavmarwaha.lifehq_9.apk;This version requires Android 4.4 or newer.;https://github.com/abhinavmarwaha/LifeHQ;https://github.com/abhinavmarwaha/LifeHQ/issues
Badreads;https://f-droid.org/en/packages/com.timenotclocks.bookcase/;Badreads is a book tracking Android application for logging booksyoure reading read and want to read Your library shelves reading read and to readare stored locally on your phone Use the search or barcode reader to look upnew book on OpenLibraryhttpsopenlibraryorg and add it to your libraryYou can import and export your library from or to Open Library and GoodreadsBadreads is unstable I recommend backing up with an export before installing updates or changes;https://f-droid.org/repo/com.timenotclocks.bookcase_22.apk;This version requires Android 8.0 or newer.;https://github.com/fenimore/badreads;https://github.com/fenimore/badreads/issues
spaRSS DecSync;https://f-droid.org/en/packages/org.decsync.sparss.floss/;spaRSS DecSync is a fork of spaRSS which adds synchronization using DecSync To start synchronizing all you have to do is synchronize the selected DecSync directory using for example Syncthing;https://f-droid.org/repo/org.decsync.sparss.floss_99.apk;This version requires Android 5.0 or newer.;https://github.com/39aldo39/spaRSS-DecSync;https://github.com/39aldo39/spaRSS-DecSync/issues
Notification Dictionary;https://f-droid.org/en/packages/com.xtreak.notificationdictionary/;An app to access meaning of selected word as a notification It works across all apps that support text selection The apps shows the meaning as a notification for quick reference Clicking on the notification user can see all the meanings for the given word The user can also search for meaning of other words Easy access from all apps that have text selection Enabled for offline usage Supports English French and German Click to copy meaning to clipboard Long press to share meanings with others Wide variety of meanings from Wikitionary Open source and MIT License;https://f-droid.org/repo/com.xtreak.notificationdictionary_16.apk;This version requires Android 7.0 or newer.;https://github.com/tirkarthi/NotificationDictionary;https://github.com/tirkarthi/NotificationDictionary/issues
Word of the day - Learn a new word every day;https://f-droid.org/en/packages/com.saverio.wordoftheday_en/;Every day the app offers a new word to learn so you will have a vast vocabulary You can read the definition of the word  its origin  etymology oi  its pronunciation  phonetics RPIPA You can copy or share it as well 2aa The app is opensource and you can find the source code on GitHuba14i  The app contains advertisements in this way you can support the developer indirectly  Either way you can freely disable those in Settings;https://f-droid.org/repo/com.saverio.wordoftheday_en_15.apk;This version requires Android 4.1 or newer.;https://github.com/Sav22999/word-of-the-day;https://github.com/Sav22999/word-of-the-day/issues
Readrops;https://f-droid.org/en/packages/com.readrops.app/;Readrops is a multiservices RSS feed clientFeatures Local RSS parsing RSS 20 ATOM and JSON formats support Multiple accounts Feeds and folders management create update and delete feedsfolders if your service API supports it Nextcloud News support FreshRSS supportOther features will come in the near future;https://f-droid.org/repo/com.readrops.app_14.apk;This version requires Android 5.0 or newer.;https://github.com/readrops/Readrops;https://github.com/readrops/Readrops/issues
Noor-Ul-Huda ÙÙØ± Ø§ÙÙØ¯Ù;https://f-droid.org/en/packages/com.mirfatif.noorulhuda/;NoorUlHuda is a simple open source Quran reader app with extras completely free foreverFeaturesCustomize your reading experience the way you want Choose from different Arabic fonts adjust font contrast and size Set comfortable background tone and screen brightness Choose from Page Mode or continuous reading Dark theme and multiple theme colors supportedMake Quran reading more profitable Translations in different languages Quickly take notes by creating Tags with Title and Description Conveniently tag Ayahs by long pressing Search in Quranic text or translations Share or copy Ayahs with translation by long pressingEasy navigation Bookmark Ayahs by long pressing Go to desired page Surah Juz or ManzilMore Quranic and Masnoon Supplications Duas general and for special occasions Prayer Time notifications and Adhan and Qibla direction for set location Backup and Restore preferences Tags and Bookmarks;https://f-droid.org/repo/com.mirfatif.noorulhuda_102.apk;This version requires Android 7.0 or newer.;https://github.com/mirfatif/NoorUlHuda;https://github.com/mirfatif/NoorUlHuda/issues
AELF - Bible and day's reading;https://f-droid.org/en/packages/co.epitre.aelf_lectures/;The Word of God nothing but the Word of God Find the entire Mass and liturgy of the hours from the liturgical translation Mass readings lauds third sexte none vespers complies Meditate on speech without distractions Sober and unique full screen display with no risk of going into standby Do not look there is no flourish no distraction just the WordAccessible for everyone Use your phone it is compatible Without sacrificing the look Android 22 to Android 51 Adjust the text size according to your preferences depending on your screen Let us guide you with Talkback The application is compatible Read without suffering The texts are formattedAnytime anywhere Automatically synchronize texts to meditate on them even from a cave or the countryside Navigate through time the date is adjustable at least one month in advanceIn a land of trust This application uses the Internet for only one thing to load the texts of the Word No data other than Android automatic error reports whether personal or statistical is transmitted by the application Application proposed on a voluntary basis without any publicity with the support of the Association Apiscopale liturgique pour les pays francophones httpwwwaelforg Texts and logo reproduced with the kind permission of the AELF;https://f-droid.org/repo/co.epitre.aelf_lectures_72.apk;This version requires Android 4.1 or newer.;https://github.com/HackMyChurch/aelf-dailyreadings;https://github.com/HackMyChurch/aelf-dailyreadings/issues
Literal;https://f-droid.org/en/packages/io.literal/;Literal is a textual information browser for augmenting your reading experience capture sources annotations and knowledgeCAPTURE ANNOTATIONSShare URLs text and images to Literal to annotate and highlightCOLLECT INFORMATIONOver time Literal becomes a personal knowledge base containing information and knowledge along with their sourceVIEW ANNOTATIONS IN CONTEXTQuickly view the annotations source context by tapping itORGANIZE BY TAG AND SOURCEGo beyond folders with a tagbased organization system or view annotations by their shared source OPEN SOURCE OPEN STANDARDSLiteral is open source httpsgithubcomliteralioliteral and implements the W3C Web Annotation standard httpswwww3orgTRannotationmodel to ensure that your data is portable The application currently interfaces with proprietary network services hosted on Amazon Web Services though localonly functionality may be supported in the future httpsgithubcomliteralioliteralissues123View httpsliteralio for more information;https://f-droid.org/repo/io.literal_39.apk;This version requires Android 8.0 or newer.;https://github.com/literal-io/literal;https://github.com/literal-io/literal/issues
Aurora;https://f-droid.org/en/packages/com.funkymuse.aurora/; Search books by title author and other parameters See detailed info about the book pages size etc Switch between light and dark theme Dark modelight mode and many moreCheck out the all of my appshttpsfunkymusedevGitHubhttpsgithubcomFunkyMuse;https://f-droid.org/repo/com.funkymuse.aurora_4.apk;This version requires Android 7.0 or newer.;https://github.com/FunkyMuse/Aurora;https://github.com/FunkyMuse/Aurora/issues
Cool Reader;https://f-droid.org/en/packages/org.coolreader.fdroid/;An ebook reader Supported formats FB2 TXT RTF TCR HTML EPUB CHM Browsefree books online and add your own OPDS sharesThe default dictionary app is nonfree However you can chooseaarddictandroid as a dictionary from the Dictionary section of theSettings;https://f-droid.org/repo/org.coolreader.fdroid_32580.apk;This version requires Android 1.6 or newer.;https://github.com/buggins/coolreader;https://github.com/buggins/coolreader/issues
Stoic Reading;https://f-droid.org/en/packages/app.reading.stoic.stoicreading/;Note This app is renamed please use appreadingstoicstoicreading2 insteadThis app contains texts from Stoics including those of Emperor Marcus Aureliusthe freed slave Epictetus and Seneca It contains other less well known Stoictexts too;https://f-droid.org/repo/app.reading.stoic.stoicreading_70.apk;This version requires Android 4.0.3 or newer.;https://github.com/zikalify/StoicReading;https://github.com/zikalify/StoicReading/issues
NiceFeed;https://f-droid.org/en/packages/com.joshuacerdenia.android.nicefeed/;NiceFeed is an RSS Reader for Android This started out as a personal project while getting the hang of Kotlin RSS is an old technology and there are already many readers out there but I find many of them hard to navigate and jampacked with features I dont need The aim is an attractive and intuitive app leightweight but fully functional with not too many frillsNiceFeed is now in Beta and available on Google Play It is also now available on FDroid for nonPlay Store users Please note that until a stable release some functionality may still be limited Im constantly updating this app and trying to make it better I would truly appreciate any and all feedback especially if you find any issues or bugs or have ideas for new features please open an issue I also welcome contributionsFeaturesRSS parsing provided by RSS ParserSearch engine powered by Feedly Search APIOPML support importing and exporting provided by Rome ToolsAbility to organize feeds by categoryStarunstar and mark entries as readunread;https://f-droid.org/repo/com.joshuacerdenia.android.nicefeed_18.apk;This version requires Android 5.0 or newer.;https://github.com/joshuacerdenia/NiceFeed;https://github.com/joshuacerdenia/NiceFeed/issues
Traductor SoftcatalÃ;https://f-droid.org/en/packages/org.softcatala.traductor/;Client for the SoftcatalA  Catalan online service;https://f-droid.org/repo/org.softcatala.traductor_39.apk;This version requires Android 5.0 or newer.;https://github.com/Softcatala/TraductorSoftcatalaAndroid;https://github.com/Softcatala/TraductorSoftcatalaAndroid/issues
Slide;https://f-droid.org/en/packages/me.ccrama.redditslide/;Slide for Reddit is a featurepacked materialdesigned unofficial browser forReddit with an easy to use UI and tons of customization Slide is adfree opensource and is packed with many unique features Slide is for everyone with abroad array of features for power users and sleek design for minimalistsHighlights Gorgeous and unique design that is both pleasing to the eye extremely easy to use and fully configurable with over 12000 theme combinations Slide is fully offlinecapable Sync your subreddits automatically and enjoy Reddit where you dont have internet complete with images and gifs Make each subreddit unique with its own theme colors and accents Always adfree and open source Image Flair support lets you show off your unique flair in your favorite communities including rcollegebasketball and rsoccer Reply to comments and submissions inline without opening a reply window and upload images straight into to your submissionscomments Support for many content sites including Imgur Tumblr Gfycat and Vidme Most featurerich and easy to use moderation suite on Android Hundreds of customization options to make Slide work exactly how you like it Lightweight and blazing fastOther features that make Slide awesome Many view types including desktop compact for dense information display and beautiful material card layout for enjoying photos Gallery and shadowbox modes pro give you a new way to view your favorite subreddits Extensive datasaving options with quality selection never blow through your data caps again Theme choices include a beautiful true black AMOLED theme sepia theme blue gray theme and white theme Synccit integration Full subreddit wiki support and ability to correctly render tables and code blocks Full multireddit support with the ability to view other users multireddits Switch accounts when writing comments Powerful filter system to block out what you dont want to see View and delete your browsing history Get notified of new posts in subreddits aCasuala subscriptions that wont show up on your frontpage AdBlock in websites Pro Optimized for tablet viewing with configurable columns and popup comment views Pro Many more details and features that you will fall in love with;https://f-droid.org/repo/me.ccrama.redditslide_337.apk;This version requires Android 4.1 or newer.;https://github.com/Haptic-Apps/Slide;https://github.com/Haptic-Apps/Slide/issues
wallabag;https://f-droid.org/en/packages/fr.gaulupeau.apps.InThePoche/;A self hosted readitlater app which is made for you to comfortably read andarchive your articles Unlike to other services the server software isMITlicensed so you can set it up on your own Just follow the instructions atwallabagorgThis android application allows you read and manage your articles andautomatically syncs them to the wallabag server Next time you find an articleyou want to read later save it into wallabag It will be automatically syncedon your phone your tablet your ereader or your computer Therefore your canread it anytime anywhere even offlineYou can save an article into wallabag from nearly everywhere including yourcomputer and your favorite RSS reader appsBonus features Automatic synchronization between the server and the apps Downloading pictures for offline reading Tags to manage your content Speech synthesis to listen to your articles;https://f-droid.org/repo/fr.gaulupeau.apps.InThePoche_229.apk;This version requires Android 5.0 or newer.;https://github.com/wallabag/android-app;https://github.com/wallabag/android-app/issues
CuprumPDF;https://f-droid.org/en/packages/org.ninthfloor.copperpdf/;NOTE This app is no longer actively maintainedView PDF files via pdfjs embedded into aWebViewFork of CopperheadOS PdfViewer made before the license was changed from Apache20 to Creative Commons AttributionNonCommercialShareAlike which is not aFreeLibre Software license;https://f-droid.org/repo/org.ninthfloor.copperpdf_5.apk;This version requires Android 6.0 or newer.;https://github.com/paride/CopperPDF;https://github.com/paride/CopperPDF/issues
Malayalam To Manglish;https://f-droid.org/en/packages/subins2000.manglish/;Translate or convert malayalam text to manglish Useful for people who cant read malayalam but understands it    a aa a 3a  will be converted to Keralam    Features     Fast quick conversion     Ability to select text in other apps browsers and share to this app to convert     No ads bloatware     As lightweight as possible    More about app  httpssubinsbcommanglish;https://f-droid.org/repo/subins2000.manglish_7.apk;This version requires Android 4.0.3 or newer.;https://github.com/subins2000/manglish;https://github.com/subins2000/manglish/issues
LibGen Mobile;https://f-droid.org/en/packages/com.manuelvargastapia.libgen/;This is a nonofficial Library Genesis mobile clientThe project is completely independent and Open Source The developer has no relation with Library GenesisFeel free to collaborateCheck the repoFeatures Search books by title author and other parameters See detailed info about the book pages size etc Download the book directly to Downloads folder Switch between light and dark theme Languages English Spanish Polish Portuguese German Japanese French and Chinese The app provides access to SciTech and Fiction sectionsThe only permission required is Storage Its used only to place the downloaded files in Downloads directoryPowered by Flutter;https://f-droid.org/repo/com.manuelvargastapia.libgen_5.apk;This version requires Android 4.1 or newer.;https://github.com/manuelvargastapia/libgen_mobile_app;https://github.com/manuelvargastapia/libgen_mobile_app/issues
QDict;https://f-droid.org/en/packages/com.annie.dictionary.fork/;QDict support 3 ways to search  Globstyle pattern matching  Fuzzy query and Fulltext searchStardict dictionaries are not included in the application and should be obtained separatelyDictionaries should be placed in sdcardQDictdictsEach dictionary should be placed into a separate subfolder for instance sdcardQDictdictsdictnameIts recommended to only use alphanumeric filenamesThis fork of the original applicationhttpsgithubcomnamndevQDict was created to incorporate patcheswhich were not responded to by the upstream and The fork is not actively developed ie no new features or bugfixes are plannedhowever all PRs are welcome and will be reviewed;https://f-droid.org/repo/com.annie.dictionary.fork_20210415.apk;This version requires Android 4.2 or newer.;https://github.com/marmistrz/QDict;https://github.com/marmistrz/QDict/issues
Pdf Viewer Plus;https://f-droid.org/en/packages/com.gsnathan.pdfviewer/;Pdf Viewer Plus is a smooth PDF viewer written in Java It contains a simple user interface multiple themes and the ability to share a PDF;https://f-droid.org/repo/com.gsnathan.pdfviewer_28.apk;This version requires Android 5.0 or newer.;https://github.com/JavaCafe01/PdfViewer;https://github.com/JavaCafe01/PdfViewer/issues
Orion Viewer - Pdf & Djvu;https://f-droid.org/en/packages/universe.constellation.orion.viewer/;Orion Viewer is pdf djvu xps cbz and tiff file viewer for Android devices based on mupdf and DjVuLibre librariesApplication features Outline navigation Bookmarks support Page navigation by screen taps  Tap Zones  Key binding Text selection Single word selection by double tap with translation in external dictionary Custom zoom Custom manual and auto border crop Portraitlandscape orientation Support different navigation patterns inside page left to right right to left External Dictionaries support Builtin file manager with recently opened file view;https://f-droid.org/repo/universe.constellation.orion.viewer_198.apk;This version requires Android 4.1 or newer.;https://github.com/max-kammerer/orion-viewer;https://github.com/max-kammerer/orion-viewer/issues
Zandy;https://f-droid.org/en/packages/com.gimranov.zandy.app/;Access your Zotero library from your mobile device Edit and view your librarysync and work offline Zandy provides a simple interface to all your researchBrowse and modify the items in your library add new items view attachmentstake and edit item notes search your library add webpages from the Androidbrowser and moreThe barcode functionality requires comgooglezxingclientandroid to beinstalled;https://f-droid.org/repo/com.gimranov.zandy.app_1461.apk;This version requires Android 4.0 or newer.;https://github.com/ajlyon/zandy;https://github.com/ajlyon/zandy/issues
