Kotatsu;https://f-droid.org/en/packages/org.koitharu.kotatsu/;Kotatsu is a free and open source manga reader for AndroidMain Features Online manga catalogues Search manga by name and genre Reading history Favourites organized by userdefined categories Downloading manga and reading it offline Thirdparty CBZ archives also supported Tabletoptimized material design UI Standard and Webtoonoptimized reader Notifications about new chapters with updates feed Shikimori integration manga tracking Passwordfingerprint protect access to the app;https://f-droid.org/repo/org.koitharu.kotatsu_523.apk;This version requires Android 5.0 or newer.;https://github.com/KotatsuApp/Kotatsu;https://github.com/KotatsuApp/Kotatsu/issues
The Life;https://f-droid.org/en/packages/org.hlwd.bible_multi_the_life/;Bible multi languages free offline no advertising in English French Italian Spanish Portuguese GermanThe application uses a modern and clean interfaceEasy to use with quick searches and shares favorites parables articles crossreferences but also includes several fonts for people having visibility impairs and a rich clipboard functionality allowing you to copy several verses and chapters of different books before sharing the resultYou can browse your search history containing opened books parables cross references and let you navigate through in an infinite wayThe Life is a powerful study tool to learn the Word of GodBibles included King James Version in old and modern English Segond Ostervald Diodati Valera Almeida SchlachterFor Android iPhone iPad Big Sur MacPlease share the info with your friendsTime is short Tribulations are at the door All The Glory To God;https://f-droid.org/repo/org.hlwd.bible_multi_the_life_20230320.apk;This version requires Android 4.4 or newer.;https://gitlab.com/hotlittlewhitedog/BibleTheLife;https://gitlab.com/hotlittlewhitedog/BibleTheLife/-/issues
floccus bookmark sync;https://f-droid.org/en/packages/org.handmadeideas.floccus/;With floccus you can sync your bookmarks across browsers via a server of your choosing a be it Nextcloud WebDAV or Google Drive A Nextcloud Bookmarks instance Your Google Drive or any WebDAV server;https://f-droid.org/repo/org.handmadeideas.floccus_4019001.apk;This version requires Android 5.1 or newer.;https://github.com/floccusaddon/floccus;https://github.com/floccusaddon/floccus/issues
AndBible: Bible Study;https://f-droid.org/en/packages/net.bible.android.activity/;Powerful Bible Study toolAndBible Bible Study is a powerful yet easy to use offline Bible study application for Android The app does not aim to be simply a Bible reader but focuses on being an advanced tool to do indepth personal Bible studyThis application is developed by Bible readers for Bible readers It aims at helping you make your Bible study convenient deep and fun The best part about this nonprofit community project is that it is opensource completely free and contains no advertisements Having been built from the ground up for Android it is a small download and therefore very efficient and remarkably fastA few popular Bible versions of the many available are KJV NASB NET and also popular commentaries like Matthew Henry and John GillPowerful Bible Study featuresThe application has many insightful original features that makes a complex and deep Bible study experience smoother than ever The most notable features are as follows  Split text views that enable comparing translations and consulting commentaries  Workspaces allow multiple Bible study setups with their own settings  Strongs integration allows Greek and Hebrew word analysis  Linked crossreferences footnotes and documents jump to crossreferences and footnotes by simply tapping a link perform indepth study of the Scriptures by using hyperlinked commentaries Gill Matthew Henry etc crossreference collections Treasure of Scripture Knowledge TSKe and other resources  Advanced text to speech with speak bookmarks enabling a smooth Bible listening experience  Flexible searching  Advanced bookmarking  highlighting features with personal study notes  Study Pads for adding notes and Bible references while listening to sermons  Reading plans set goals for reading the Bible  Vast library of documents Bible translations theological commentaries dictionaries maps and christian books totaling over 1500 documents in over 700 languages legally distributed by Crosswire and other SWORD repositories  Offline the only time you need internet is for downloading documentsLetas make the best Bible app togetherAndBible is an opensource community project In practice this means that anyone with suitable skills can and is encouraged to contribute to the project by  developing new features  testing notyetreleased features  keeping user interface translations uptodate and  helping to extend the module library by obtaining permissions from copyright holders or by converting documents to SWORD formatIf you are a professional software engineer or tester please consider contributing to the project For more information on how to contribute please see httpsgitioJUnajLinks  Homepage httpsandbiblegithubio  Like AndBible on Facebook httpswwwfacebookcomAndBible  Our Youtube Channel httpswwwyoutubecomcAndBible  Frequently Asked Questions httpsgitioJJm8E  Project page on Github httpsgithubcomAndBibleandbible;https://f-droid.org/repo/net.bible.android.activity_683.apk;This version requires Android 5.0 or newer.;https://github.com/AndBible/and-bible;https://github.com/AndBible/and-bible/issues
TKCompanionApp;https://f-droid.org/en/packages/name.bresciani.marco.tkcompanionapp/;Goal of this app is to be a practical vademecumhandbook for those interested in applying scientific thinking through Toyota KataIt contains the Coaching Kata 5Q card plus possibly more things and informationContent to be improved and updated from time to time;https://f-droid.org/repo/name.bresciani.marco.tkcompanionapp_642.apk;This version requires Android 5.0 or newer.;https://codeberg.org/marco.bresciani/TKCompanionApp;https://codeberg.org/marco.bresciani/TKCompanionApp/issues
FeedWatcher;https://f-droid.org/en/packages/me.murks.feedwatcher/;Create custom queries to scan RSS and Atom feeds You will get a notification when new entries matching your queries are found;https://f-droid.org/repo/me.murks.feedwatcher_26.apk;This version requires Android 7.0 or newer.;https://github.com/zouroboros/feed-watcher;https://github.com/zouroboros/feed-watcher/issues
taz;https://f-droid.org/en/packages/de.taz.android.app.free/;Reader for subscribers of the german daily newspaper taz die tageszeitungPlease note that the language of the app is german;https://f-droid.org/repo/de.taz.android.app.free_10700900.apk;This version requires Android 5.0 or newer.;https://github.com/die-tageszeitung/taz-neo;https://github.com/die-tageszeitung/taz-neo/issues
Web Opac;https://f-droid.org/en/packages/de.geeksfactory.opacclient/;This free and open source Android app enables convenient mobile access tocatalogues and user accounts of more than 1000 public and academic librariesmost of them currently in the Germanspeaking countries DeutschlandAsterreich Schweiz but also some in Australia Canada Italia NederlandPolska United Kingdom United States IIIII and  34NN NFeatures of the app Search in the catalogue of your library Watchlist for books Search for ISBN with barcode scannerAnd in some libraries View of lent media also with multiple accounts Prolonging of lent books and cancellation of reservations Reservation of books Notification when books need to be returned no warranty View of information about the library eg opening hoursThe list of supported libraries is available onour websiteTracking as it comes with Sentry which cannot be disabled by the user;https://f-droid.org/repo/de.geeksfactory.opacclient_238.apk;This version requires Android 4.0.3 or newer.;https://github.com/opacapp/opacclient;https://github.com/opacapp/opacclient/issues
zSMTH;https://f-droid.org/en/packages/com.zfdang.zsmth_android/;zSMTH is an adfree open source Mizuki community Android client iSO platform has the same source project SMTHiOS This client has the following features Post graphics mixed display support GIF animation long press the post to pop up the function menu Support the display of superlong pictures fullscreen view and zoom of picture attachments view picture Exif information and save pictures to local Show Like of posts add new Like Show IP source Reminder of letters replies  Like events Quick search of all forum listings support Chinese and English partial matching Share posts to SNS networks including WeChat friends WeChat circle of friends Sina Weibo etcand more;https://f-droid.org/repo/com.zfdang.zsmth_android_966.apk;This version requires Android 4.2 or newer.;https://github.com/zfdang/zSMTH-Android;https://github.com/zfdang/zSMTH-Android/issues
Aggregator;https://f-droid.org/en/packages/com.tughi.aggregator/;This is a feed reader It follows the feeds that you personally choose It lets you create your personalized feed It does not throw ads at you It is open source;https://f-droid.org/repo/com.tughi.aggregator_299033.apk;This version requires Android 5.0 or newer.;https://github.com/tughi/aggregator-android;https://github.com/tughi/aggregator-android/issues
Sav PDF Viewer Pro - Read PDF files safely;https://f-droid.org/en/packages/com.saverio.pdfviewer/; View all PDF files in a simple way The app is safe in fact it doesnt require any permissions It saves automatically saves the last position for each file You can create bookmarks and manage them The app can open PDFs protected by password The Night light to protect your eyes is availableaa The app is opensource and available on GitHuba You cant select or copy text You cant open links;https://f-droid.org/repo/com.saverio.pdfviewer_41.apk;This version requires Android 7.0 or newer.;https://github.com/Sav22999/sav-pdf-viewer-pro;https://github.com/Sav22999/sav-pdf-viewer-pro/issues
Feeder;https://f-droid.org/en/packages/com.nononsenseapps.feeder/;Are you sick of bloated nonfree readers that steal your personal informationAre you tired of convoluted syncing setups requiring hours of server configurationAre you fed up with having to create accounts everywhereTry Feeder insteadFeeder is a fully freelibre feed reader It supports all common feed formats including JSONFeed It doesnt track you It doesnt require any setup It doesnt even need you to create an account Just setup your feeds or import them from your old reader via OPML then get on with syncing and readingFeaturesParses HTML and displays it in a native TextViewOffline readingBackground synchronizationNotificationsOPML ImportExportHandy access to enclosure linksMaterial design;https://f-droid.org/repo/com.nononsenseapps.feeder_273.apk;This version requires Android 6.0 or newer.;https://gitlab.com/spacecowboy/Feeder;https://gitlab.com/spacecowboy/Feeder/issues
Hacki for Hacker News;https://f-droid.org/en/packages/com.jiaqifeng.hacki/;Features Log in using your Hacker News account Browse stories from various categories Search for stories Submit stories Pin stories Mark stories as favorite Leave comments Collapse comments View parent comments without scrolling up View and participate in polls Browse comments and stories you have posted Vote on comments or stories Get inapp notification when there is new reply to your stories or comments Download stories and comments for offline reading Pick up where you left off Launch from system share sheet And more;https://f-droid.org/repo/com.jiaqifeng.hacki_1033.apk;This version requires Android 8.0 or newer.;https://github.com/Livinglist/Hacki;https://github.com/Livinglist/Hacki/issues
Librera Reader;https://f-droid.org/en/packages/com.foobnix.pro.pdf.reader/;Librera Reader is a highly customizable and featurerich applicationfor reading ebooks in PDF EPUB MOBI DjVu FB2 TXT RTF AZW AZW3 HTML CBZ CBR DOC DOCX etc formatsWith its intuitive yet powerful interface Librera makes ebook reading a veritable pleasure It even features a unique autoscrolling handsfree Musicians mode with contollable speedFor better security the FDroid version is based on the latest MuPDF 1161 and does not require access to the InternetFor the above reason some Internetrelated features of Librera Reader are missing in its FDroid version1 Access to OPDS Calibre Catalogs2 Google Drive Syncing3 Access to Clouds Dropbox Google Drive OneDrive4 Saving sharing pages from web browsers5 Rendering MathML formulas in epub3 books6 Access to the Whats New page Just a few Libreras main features Easy document discovery by configurable criteria AutoScan userspecified folders Browse folders using an inapp file explorer  Recent featuring a readingprogress indicator Support for bookmarks annotations and EPUB3 tables of contents Configurable Day and Night modes Configurable link color hence footnotes and endnotes color Support for many popular offline dictionaries Verticalscroll lock Auto and manual centering of documents Custom adhoc CSS coding Singlepage view of twopage documents Musicians mode with configurable scroll speed Customizable TTS reading and builtin media player Pagewise TTS recording to MP3 or WAV Multiword text search Support for archived zip documents Support for RTL languages Thai Hebrew Arabic etc Import and export of settings autobackup of current session Leading initials in FB2 documents RSVP reading A  la Spritz Movable bookmarks w a floating indicator And a whole bunch of other features for you to check outThe best way to fully appreciate Librera Reader however is to use our restrictionfree Librera PRO version from Google Play;https://f-droid.org/repo/com.foobnix.pro.pdf.reader_5242.apk;This version requires Android 4.0 or newer.;https://github.com/foobnix/LibreraReader;https://github.com/foobnix/LibreraReader/issues
Stealth;https://f-droid.org/en/packages/com.cosmos.unreddit/;Stealth provides features from Reddit without the need for an account In fact the app doesnt even let you log in with a Reddit account;https://f-droid.org/repo/com.cosmos.unreddit_18.apk;This version requires Android 5.0 or newer.;https://gitlab.com/cosmosapps/stealth;https://gitlab.com/cosmosapps/stealth/-/issues
Thud;https://f-droid.org/en/packages/com.aerotoad.thud/;If youare tired of having to check a dozen websites and RSS feeds for your daily dose of news then Thud is the app for you Using a sleek mosaiclike interface Thud organizes all your news and feeds in one place so you can easily stay informed Plus with no filtration algorithms you see the content you want in the most efficient way possibleThud was created because we love reading the news but didnat love all the different websites and apps we had to use to get it So we made Thud  a sleek easytouse app that gathers all your news and feeds in one placeWe want you to have an enjoyable clutterfree reading experience With Thud you can quickly scan through all your favorite news sources without having to jump between different websites and appsDownload Thud now and start enjoying your news again;https://f-droid.org/repo/com.aerotoad.thud_8.apk;This version requires Android 5.1 or newer.;https://github.com/aerotoad/Thud;https://github.com/aerotoad/Thud/issues
Openreads;https://f-droid.org/en/packages/software.mdev.bookstracker/;Openreads is the best app for keeping track of your books that is free open source with no ads and no trackingIt is a reading list app that will help you organize your library with four lists provided books you finished books you are currently reading books you want to read later books you didnt finishYou can also use custom tags and filter through themOpenreads supports adding a book by looking it up in the Open Library database scanning its barcode or entering the books details manuallyYou can also view come cool statistics;https://f-droid.org/repo/software.mdev.bookstracker_43.apk;This version requires Android 5.0 or newer.;https://github.com/mateusz-bak/openreads-android;https://github.com/mateusz-bak/openreads-android/issues
KOReader;https://f-droid.org/en/packages/org.koreader.launcher.fdroid/; portable runs on embedded devices Cervantes Kindle Kobo PocketBook Android and Linux computers Developers can run a KOReader emulator in Linux and MacOS multiformat documents supports fixed page formats PDF DjVu CBT CBZ and reflowable ebook formats EPUB FB2 Mobi DOC CHM TXT Scanned PDFDjVu documents can also be reflowed with the builtin K2pdfopt library fullfeatured reading multilingual user interface with a highly customizable reader view and many typesetting options You can set arbitrary page margins override line spacing and choose external fonts and styles It has multilingual hyphenation dictionaries bundled into the application integrated with calibre search metadata receive ebooks wirelessly browse library via OPDS  Wallabag Wikipedia Google Translate and other content providers optimized for eink devices custom UI without animation with paginated menus adjustable text contrast and easy zoom to fit content or page in paged media extensible via plugins and much more look up words with StarDict dictionaries  Wikipedia add your own online OPDS catalogs and RSS feeds online overtheair software updates an FTP client an SSH server a;https://f-droid.org/repo/org.koreader.launcher.fdroid_96603.apk;This version requires Android 4.0 or newer.;https://github.com/koreader/koreader;https://github.com/koreader/koreader/issues
The Light;https://f-droid.org/en/packages/org.hlwd.bible/;Bible multi languages free offline no advertising completely in English French Italian Spanish PortugueseKing James Version Segond Diodati Valera Almeida OstervaldEasy to use with quick search and share plans of reading audio Bible articles crossreferencesAlso works on Android TV Chromebook;https://f-droid.org/repo/org.hlwd.bible_20230316.apk;This version requires Android 5.0 or newer.;https://gitlab.com/hotlittlewhitedog/BibleMultiTheLight;https://gitlab.com/hotlittlewhitedog/BibleMultiTheLight/issues
Library App VideLibri;https://f-droid.org/en/packages/de.benibela.videlibri/;VideLibri protects one from missing the due date when borrowing books from public libraries by downloading the list of borrowed books from the library webpage WebOPAC renewing all renewable books and notifying you about nonrenewable books so you do not have to pay late fees to the librarians Furthermore the app has all the usual functions of an OPACFeatures Tested with 200 public and academic libraries in Germany Switzerland and Austria Supports 20 different kinds of OPACs from different vendors out of the box Custom XPath expressions can be entered in the app to select any data from any website so any library can be added without compiling the app It shows all borrowed books from all library cards from different libraries in a single list so you can always see which book needs to be returned next The list of borrowed books can be sorted by the due date lending date lending library author title and other criteria The notification about a dooming due date is more reliable than reminder emails sent by the library OPAC since you can never know if an email actually arrives in time VideLibri on the other hand stores all data on your smartphone so the due date is always already there and does not need to arrive Renewing of borrowed books manually or automatically before the due date to extend the lending period History of all borrowed books so you can always look back at the books you had borrowed in the past even after the books were returned to the library and are not shown anymore in the library OPAC Turingcomplete XQuery search in the history that can answer arbitrary complex queries like which borrowed book had the longest title and was borrowed more than once  Search in the OPAC for nonlent books as well as ordering and reserving of nonlent books in some libraries Developed since the year 2006 it is the worlds first universal library app and any other library app is a VideLibri copycat OpensourceSome larger public libraries that were tested successfully are for example in the cities Augsburg GGG Basel Berlin Bielefeld Cologne DA14sseldorf LA14beck or Linz or MunichThe entire list of all tested libraries and OPACs is too long for the app store page but you can find it at httpsvidelibridebibliothekenhtml  The Android part of VideLibri has been translated into English However since most libraries in the list are German they have German books with German titles Additional resources like documentation and changelog written for the original VideLibri Windows app in 2006 remain in German The Windows and Linux app are currently being translated;https://f-droid.org/repo/de.benibela.videlibri_2700.apk;This version requires Android 4.0 or newer.;https://sourceforge.net/p/videlibri/code/ci/default/tree/;https://sourceforge.net/p/videlibri/tickets
Myne: Ebook Downloader;https://f-droid.org/en/packages/com.starry.myne/;Myne is a FOSS Android application to download ebooks from the Project GutenBerg it uses GutenDex API to fetch metadata of ebooks in the backendHighlights Clean  beautiful UI based on Googles material design three guidelines Browse and download over 70k free ebooks available in multiple languages and updated daily Comes with inbuilt ebook reader while also having an option to use thirdparty ebook readers Compatible with Android 70 and above API 24 Supports Material You theming in devices running on Android 12 Comes in both light and dark mode MAD UI and logic written with pure Kotlin Single activity no fragments only composable destinationsPS The name of the app is inspired from the main character of an anime called Ascendance of a Bookworm;https://f-droid.org/repo/com.starry.myne_8.apk;This version requires Android 7.0 or newer.;https://github.com/Pool-Of-Tears/Myne;https://github.com/Pool-Of-Tears/Myne/issues
Qwotable;https://f-droid.org/en/packages/com.lijukay.quotesAltDesign/;Qwotable is an opensource application full of quotable content in a modern UI with features such as copy share and saveQwotable offers the possibility of changing the inapp language available languages English German French which automatically changes the source from where quotes and wisdom are getting parsedQwotables content and the app are getting updates constantly;https://f-droid.org/repo/com.lijukay.quotesAltDesign_10.apk;This version requires Android 7.0 or newer.;https://github.com/Lijukay/Qwotable;https://github.com/Lijukay/Qwotable/issues
Quote Unquote;https://f-droid.org/en/packages/com.github.jameshnsears.quoteunquote/;From Reddit to Shakespeare and beyond Discover high quality QuotationsImprove your selfesteem with this easy to use App WidgetKey featuresa The Quotations Carefully sourced and curateda Works offlinea Navigate through what you want how you wanta Single tap to Wikipedia Source articlea Highly customisablea Notification channels and actionsa Backup and Restore locally or remotea User feedback drives development;https://f-droid.org/repo/com.github.jameshnsears.quoteunquote_1312433.apk;This version requires Android 7.0 or newer.;https://github.com/jameshnsears/QuoteUnquote;https://github.com/jameshnsears/QuoteUnquote/issues
MuPDF viewer;https://f-droid.org/en/packages/com.artifex.mupdf.viewer.app/;MuPDF supports PDF 17 with transparency encryption hyperlinks annotationssearching form editing and more It also reads OpenXPS and CBZ comic bookdocuments;https://f-droid.org/repo/com.artifex.mupdf.viewer.app_120.apk;This version requires Android 5.0 or newer.;https://git.ghostscript.com/?p=mupdf-android-viewer.git;a=summary;https://bugs.ghostscript.com
MuPDF mini;https://f-droid.org/en/packages/com.artifex.mupdf.mini.app/;MuPDF Mini Viewer is a minimalist Android app that uses the MuPDF library toview PDF XPS CBZ unprotected EPUB and FB2 documentsThis is a minimalist version of the MuPDF app which focuses on reading only Itdoes not support editing annotations or filling out formsThe app will start with a file picker showing the contents of the externalstorage directory Only files that it can open will be listedEach document you open will start its own activity so you can view manydocuments at once Use the Overview system button to switch between the filepicker and any open documents and other activities you have runningTapping on the left and right side of the screen will flip to the previous andnext pages Tapping in the middle will bring up or hide the tool bars A longtap will toggle highlighting of links When the links are highlighted they arealso active and tappableYou can pinch to zoom in When zoomed in tapping will scroll to advance thenext screenful of contentIn the toolbar there is a button to show the table of contents if the documenthas one In EPUB and FB2 documents there is also a menu item to pick the fontsize The scrubber at the bottom allows you to quickly jump to a given page inthe document;https://f-droid.org/repo/com.artifex.mupdf.mini.app_110.apk;This version requires Android 5.0 or newer.;https://git.ghostscript.com/?p=mupdf-android-viewer-mini.git;a=summary;https://bugs.ghostscript.com/
Reader for Selfoss;https://f-droid.org/en/packages/bou.amine.apps.readerforselfossv2.android/;A new RSS reader for selfossWhat it does Fetches read unread and favorite feeds Marking as read marking as favorite Manage selfoss sources from the app Add an RSS feed from within the app or by sharing a link from your browser Choose between multiple light and dark themesPS It only works with Selfoss;https://f-droid.org/repo/bou.amine.apps.readerforselfossv2.android_123030681.apk;This version requires Android 5.0 or newer.;https://gitea.amine-louveau.fr/Louvorg/ReaderForSelfoss-multiplatform;https://gitea.amine-louveau.fr/Louvorg/ReaderForSelfoss-multiplatform/issues
