Memory;https://f-droid.org/en/packages/com.sanskritbasics.memory/;This application features simple memory game to help you to get familiar with Devanagari letters used by Sanskrit and HindiThere are three field sizes two variants simple and hard level where Devanagari letter matches its Latin variantSupported languages English and Russian;https://f-droid.org/repo/com.sanskritbasics.memory_33.apk;This version requires Android 4.4 or newer.;https://github.com/sanskritbscs/memory;https://github.com/sanskritbscs/memory/issues
dawdle;https://f-droid.org/en/packages/godau.fynn.moodledirect/;dawdle is a performant and native client for the Moodle elearning platform This platform is oftentimes selfhosted by universities schools and other institutions to provide teaching material to learnersConnections to arbitrary Moodle instances are supported You may log in with username and password or if your instance requests this you can also sign in through a web browser for singlesignon Course contents are queried from the server and stored for offline usage Markedup content and embedded images are usually displayed correctly An inapp user help menu documents many of the applications featuresAt this moment only some of the basic modules are supported However opening an unsupported module will through magic automatically sign you in to your browser before opening there a providing a very convenient access to all types of contentNote dawdle can only operate if mobile web services are enabled on your Moodle instance This is oftentimes the case as it is also required for using the official Moodle Pty Ltd appScreenshot material from httpsschoolmoodledemonet by Mary Chris and Estelle Cooch licensed CC BYSA with adaptions;https://f-droid.org/repo/godau.fynn.moodledirect_7.apk;This version requires Android 5.0 or newer.;https://codeberg.org/fynngodau/dawdle;https://codeberg.org/fynngodau/dawdle/issues
Energize;https://f-droid.org/en/packages/com.flasskamp.energize/;Track your meals including calories macro and micronutrientsUse several databases Open Food Facts USDA and Swiss Food Composition Database or create custom foodSearch meals by product name or just scan the EAN codeGet meal suggestions based on your last tracked mealsSet targets for macro and micronutrients including calculating them based on your personal detailsSee your daily nutrition detailsCreate an encrypted backup with WebDAV and restore it;https://f-droid.org/repo/com.flasskamp.energize_16.apk;This version requires Android 5.0 or newer.;https://codeberg.org/epinez/Energize/;https://codeberg.org/epinez/Energize/issues
DeepL;https://f-droid.org/en/packages/com.example.deeplviewer/;This is an unofficial Android app for DeepL translation It uses a technology called WebView an Android GUI component to make it look like a native app JavaScript is used to hide all but the most necessary elementsFeatures Display only the translation screen by WebView Switching to dark mode Launch DeepL from floating text selection action;https://f-droid.org/repo/com.example.deeplviewer_33.apk;This version requires Android 5.0 or newer.;https://github.com/sakusaku3939/DeepLAndroid;https://github.com/sakusaku3939/DeepLAndroid/issues
Nihonoari: Hiragana & Katakana;https://f-droid.org/en/packages/com.LAPARCELA.nihonoari/;Nihonoari is an Open Source project to provide the community with a simple app to memorize and practice the Hiragana and Katakana alphabets without adverts inapp purchases and useless functions simpler is betterWant to collaborate with the project or report some bughttpsgithubcomaeriNihonoariApp;https://f-droid.org/repo/com.LAPARCELA.nihonoari_11.apk;This version requires Android 4.1 or newer.;https://github.com/aeri/Nihonoari-App;https://github.com/aeri/Nihonoari-App/issues
UnitsTool;https://f-droid.org/en/packages/com.unitstool/;A unit conversion application Distance conversionai  Weight conversioni  Temperature conversion Liquid conversiona Surface conversion Volume conversion Currency conversionQuick and easy to use unit converter;https://f-droid.org/repo/com.unitstool_7.apk;This version requires Android 5.0 or newer.;https://github.com/ThiBsc/UnitsTool;https://github.com/ThiBsc/UnitsTool/issues
Hydra;https://f-droid.org/en/packages/be.ugent.zeus.hydra.open/;With Hydra you are always uptodate on the latest news and activities of your favourite student association Listen to Urgentfm read Schamper articles or decide if todays menu of the student restaurant is to your liking Or go study and check if your favourite library is open todayWherever you are with Hydra you have access to Ghent University;https://f-droid.org/repo/be.ugent.zeus.hydra.open_35000.apk;This version requires Android 5.0 or newer.;https://github.com/ZeusWPI/hydra-android;https://github.com/ZeusWPI/hydra-android/issues
Sensorkraken;https://f-droid.org/en/packages/org.sensorkraken/;Sensorkraken collects raw sensor related data and provides them as structured data for later analysis on another machine All available system sensors and some custom defined sources are used to record and export data for further analysisThe interval and sensors to be used can be individually defined and thus enables a highly customizable data collection application Sensorkraken only aims at collecting data and not analyzingvisualizingFor more information see the webpage at httpssensorkrakenorg;https://f-droid.org/repo/org.sensorkraken_1.apk;This version requires Android 4.1 or newer.;https://gitlab.com/sensorkraken/android-app;https://gitlab.com/sensorkraken/android-app/-/issues
c-beam;https://f-droid.org/en/packages/org.c_base.c_beam/;cbase onboard computer interface  control the cbase from your pocketNOTE This app is only usable from within the cbasecrew wifi If you dontknow what this means dont download cbeamIf youre still with us heres a feature set for your informational pleasure login  logout cmission task assignment mind control world domination information retrieval current events cportal artefacts local maps control cleuse cout and the rest of the space station;https://f-droid.org/repo/org.c_base.c_beam_31.apk;This version requires Android 5.0 or newer.;https://github.com/c-base/c-beam-droid;https://github.com/c-base/c-beam-droid/issues
Fujiten;https://f-droid.org/en/packages/fr.odrevet.fujiten/;Fujiten is a Japanese dictionary application made with the flutter frameworkDefinition and kanji comes from the EDICT dictionary compiled as a database from the edictdatabase projectSetupIn order to fujiten to work the Expression Database and the Kanji Database are neededThe databases can be downloaded and installed from fujiten via the settingsdatabases menu or by downloading the database manually from httpsgithubcomodrevetedictdatabaseTop menuBarsAccess the settings menuThe settings menu allow you to download the dictionaries set brightness and read legal informationInsertRadicals Will match kanji composed with the selected radicalsKanji character aWill match any kanjiKana character aWill match a hiraganakatakana characterJoker Any matchConvertIn case your device is not equipped with a Japanese input keyboard fujiten can convert Latin character romaji to hiragana or katakanaLowercase romaji will be converted to hiragana uppercase romaji will be converted to katakanaKotoba  Kanji searchWhen Kotoba is selected fujiten will search for expressionWhen Kanji is selected fujiten will search for kanjiClearClear the input fieldSearchRun the searchTipsSearch are performed with regular expression quantifiers  and metacharacters like  and others can be useUse search by radical   when searching for an expression which you do not know a kanji but recognize some of its radical example i14ai14When no results add  at the beginning or the end of your search;https://f-droid.org/repo/fr.odrevet.fujiten_4.apk;This version requires Android 4.1 or newer.;https://github.com/odrevet/fujiten/;https://github.com/odrevet/fujiten/issues
NoiseCapture;https://f-droid.org/en/packages/org.noise_planet.noisecapture/;NoiseCapture App is an application dedicated to the evaluation of your noise environment It allows to perform measurements and thus to give information on your noise exposure In addition you can contribute to the realization of collaborative or community noise maps by anonymously sharing your measurementsNew If your smartphone is already calibrated you can now calibrate other smartphones with the application based on the ambient noise Select Automatic Calibration in the Calibration menu in Transmitter mode for the reference smartphone and Receiver mode for the smartphones to be calibrated Approach the smartphones together and start calibration from the reference smartphone The rest is automaticFeaturesa Noise measurement and calculation of acoustic indicators Leq Lamin LAmax LA10 LA50 LA90 on a journeya Measurement description text photo tagsa Viewing measurements on a mapa Measurement historya Smartphone calibration with a reference devicea Detailed help on using the applicationRecommendations for the best measurement see Help for detailsa The smartphone should not be in the pocket but hand helda The smartphone microphone should not be hiddena The noise measurement must be carried out without adding noisea It is possible to use an external and calibrated microphoneContribute to collaborative noise mapsa Allow the transfer of measures into the communitya Realize mmeasurement outside buildingsa Do not measure when rainning or with winda Goto the collaborative noise map  httpnoiseplanetorgmapnoisecaptureindexhtmlContribute to the NoiseCapture projecta conttribute to the code development httpsgithubcomIfsttarNoiseCapture a share your comments questions httpsgithubcomIfsttarNoiseCaptureissues a organize NoiseCapture Party to map your sound environment httpnoiseplanetorgNoiseCapture App respects your private lifea You fully control how the information is sent to the servera Only anonymous data is transferreda There are no audio recording only acoustic indicators are calculated and transferreda NoiseCapture App requires only strictly necessary permissionsWarninga Although NoiseCapture App is developed by specialists keep in mind that a smartphone will never replace a professional sound meter If you need advanced expertise contact a professionala The quality of the measurement depends on the technical performance of your smartphone and its calibration Depending on the nature of your phone and the version of Android used it is possible that you can not measure with sufficient accuracyNoiseCapture App is the result of collaboration between two French research laboratories the  Laboratory of Environmental Acoustics  Ifsttar and DECIDE team of LabSTICC CNRS with a support from the European CommissionMore information httpnoiseplanetorg;https://f-droid.org/repo/org.noise_planet.noisecapture_59.apk;This version requires Android 4.0.3 or newer.;https://github.com/Universite-Gustave-Eiffel/NoiseCapture;https://github.com/Universite-Gustave-Eiffel/NoiseCapture/issues
F-Droid;https://f-droid.org/en/packages/org.fdroid.fdroid/;FDroid is an installable catalogue of libre software apps for Android The FDroid client app makes it easy to browse install and keep track of updates on your deviceIt connects to any FDroid compatible repositories The default repo is hosted at fdroidorg which contains only bona fide libre softwareAndroid itself is open in the sense that you are free to install APKs from anywhere you wish but there are many good reasons for using FDroid as your libre software app manager Get notified when updates are available Optionally download and install updates automatically Keep track of older and beta versions Filter out apps incompatible with the device Find apps via categories and searchable descriptions Access associated URLs for donations source code etc Stay safe by checking repo index signatures and APK hashes;https://f-droid.org/repo/org.fdroid.fdroid_1016053.apk;This version requires Android 6.0 or newer.;https://gitlab.com/fdroid/fdroidclient;https://gitlab.com/fdroid/fdroidclient/issues
Xeonjia: Ice Adventures;https://f-droid.org/en/packages/xyz.deepdaikon.xeonjia/;Xeonjia is an adventure game set in a frozen worldThe floor is frozen Think carefully about your moves because you cant change direction until you meet an obstacleUse you mind to solve the ice slide puzzlesThe world has been frozen by the aKing of Evila and itas no longer a safe placeLegend has it that a brave hero will defeat the King of Evil and save the kingdoma For this reason every year a person is appointed as aheroa and sent on a journey to try to save itNow is your time you have been chosen as this yearas hero Will you be able to defeat the King of EvilYou will have to travel the world explore cities dungeons and mystical cavesAre you ready to solve quests and puzzles in this frozen RPG worldOver time you will gain experience points that will allow you to increase your level and you will find money and hidden treasures that you can use to buy stuff and improve yourselfBe careful the world is full of dangerous enemies ready to attack youKeep in mind that most of the floor is frozen so you canat stop yourself until you reach a wall a boulder or any other type of obstacleUse your mind to figure out the best pathNote this game is currently in early beta stage;https://f-droid.org/repo/xyz.deepdaikon.xeonjia_14.apk;This version requires Android 4.1 or newer.;https://gitlab.com/deepdaikon/Xeonjia/tree/HEAD;https://gitlab.com/deepdaikon/Xeonjia/issues
Quinb: 4 players reaction game;https://f-droid.org/en/packages/xyz.deepdaikon.quinb/;Quinb is a reaction  logic game for up to 4 players on the same deviceIt contains many minigames in which you have to answer questions as fast as you can to get a pointIf the answer is correct you score a point otherwise you lose oneThese games are based on 3 different categoriesa Logic games that require intuition logic and fast reflexesa Audio soundbased games you have to listen carefully to find out the correct answera Vibration vibrationbased games that require you to listen carefully to the vibrations of your deviceEach match consists of a succession of different minigamesThe goal is to score 7 points before your opponentsYou can play alone if you want but it is more fun to play with friends of all ages Its great if you are stuck with nothing to do while youre with friendsIf you think youre fast challenge and beat your friendsMain featuresa 28 minigamesa Up to 4 players on the same devicea Completely freea No Adsa Multiple languagesa Minimalist design;https://f-droid.org/repo/xyz.deepdaikon.quinb_8.apk;This version requires Android 4.1 or newer.;https://gitlab.com/deepdaikon/Quinb/tree/HEAD;https://gitlab.com/deepdaikon/Quinb/issues
Jellyfin for Android TV;https://f-droid.org/en/packages/org.jellyfin.androidtv/;Your media on your termsThe Jellyfin project is an open source free software media server No fees no tracking no hidden agenda Get our free server to collect all your audio video photos and more in one placeTo use the app you must have a Jellyfin server set up and running Find out more at jellyfinorgWith a Jellyfin server you can Watch Live TV and recorded shows from your Jellyfin server additional hardwareservices required Stream to a Chromecast device on your network Stream your media to your Android device View your collection in an easy to use interfaceThis is the official Jellyfin companion app for Android TV Thank you for using Jellyfin;https://f-droid.org/repo/org.jellyfin.androidtv_150599.apk;This version requires Android 5.0 or newer.;https://github.com/jellyfin/jellyfin-androidtv;https://github.com/jellyfin/jellyfin-androidtv/issues
Activity Launcher fork;https://f-droid.org/en/packages/de.szalkowski.activitylauncher.rustore_fork/;This opensource Android App launches hidden activities and creates home screen shortcuts for installed apps;https://f-droid.org/repo/de.szalkowski.activitylauncher.rustore_fork_137.apk;This version requires Android 6.0 or newer.;https://github.com/Sash0k/ActivityLauncher;https://github.com/Sash0k/ActivityLauncher/issues
Translate You;https://f-droid.org/en/packages/com.bnyro.translate/;Translate You is a Translator App built with Material Design 3 YouIt supports multiple different translation engiens such as LibreTranslate Lingva Deepl and moreIn total there are more than 200 supported languages across 6 different translation engines;https://f-droid.org/repo/com.bnyro.translate_29.apk;This version requires Android 5.0 or newer.;https://github.com/Bnyro/TranslateYou;https://github.com/Bnyro/TranslateYou/issues
Donate your voice: CV Project;https://f-droid.org/en/packages/org.commonvoice.saverio/;This is not the official app of Common Voice Its developed by Saverio MorelliApp features The user interface UI is smart clear and modern Log in to your Common Voice account Validate clips Record sentences Report sentencesclips in the relative sections Multilanguages supported Offline mode continue to contribute also when you arent connected to the Internet Common Voice statistics of the selected language Top contributors of the selected language App statistics anonymous Voices online of the selected language Dark theme supported Daily goal Gestures Save your recordings on your device Many other features The app experience is totally customisable in SettingsJoin the Telegram group commonvoiceandroidYou can see complete app statistics here App statisticsYou can also see the app usage statistics here App usage statisticsRead more about this app on GitHub CV Project on GitHubWhat is the Common Voice projectCommon Voice is Mozillas initiative to help teach machines how real people speakVoice is natural voice is human Thatas why weare excited about creating usable voice technology for our machines But to create voice systems developers need an extremely large amount of voice dataMost of the data used by large companies isnat available to the majority of people We think that stifles innovation So weave launched Common Voice a project to help make voice recognition open and accessible to everyoneNow you can donate your voice to help us build an opensource voice database that anyone can use to make innovative apps for devices and the web Read a sentence to help machines learn how real people speak Check the work of other contributors to improve the quality Itas that simpleYou can find more details on the official website httpscommonvoicemozillaorgWhy should you use the app instead of the website on mobileThe app is developed specifically for smartphones so its native It has many features that website dont provide you such as dark theme offline mode customisation gestures etcThe app is lighter than website without annoying animations and animations in the app can also be stopped in SettingsIn addition the website has many bugs especially for mobileversion so you cannot do everything correctly;https://f-droid.org/repo/org.commonvoice.saverio_182.apk;This version requires Android 8.0 or newer.;https://github.com/Sav22999/common-voice-android;https://github.com/Sav22999/common-voice-android/issues
CollinsDictionary;https://f-droid.org/en/packages/me.konyaco.collinsdictionary/;This is a thirdparty client for Collins Dictionary It gets word definitions by parsing Collins Online Dictionary website There is no license from Collins organization This repository is for learning purposes only Commercial use is prohibitedThe client is also available for Desktop WindowsLinuxMacOS PCs;https://f-droid.org/repo/me.konyaco.collinsdictionary_9.apk;This version requires Android 5.0 or newer.;https://github.com/Konyaco/CollinsDictionary;https://github.com/Konyaco/CollinsDictionary/issues
Look4Sat: Satellite tracker;https://f-droid.org/en/packages/com.rtbishop.look4sat/;Track satellite passes with easeThanks to the huge database provided by Celestrak and SatNOGS you have access to more than 5000 active satellites orbiting Earth You can search the entire DB by satellite name or by NORAD catnumSatellite positions and passes are calculated relative to your location To get reliable info make sure to set the observation position using GPS or QTH Locator in the Settings menuThe application is built using Kotlin Coroutines Architecture Components and Jetpack Navigation It is now and always will be completely adfree and opensourceMain featuresPredicting satellite positions and passes for up to a weekShowing the list of currently active and upcoming satellite passesShowing the active pass progress polar trajectory and transceivers infoShowing the satellite positional data footprint and ground track on a mapCustom TLE data import is available via files with TXT or TLE extensionsOffline first calculations are made offline Weekly update of TLE data is recommended;https://f-droid.org/repo/com.rtbishop.look4sat_312.apk;This version requires Android 5.0 or newer.;https://github.com/rt-bishop/Look4Sat;https://github.com/rt-bishop/Look4Sat/issues
Fourth Tools;https://f-droid.org/en/packages/com.leestarb.fourthtools/;100 FOSSCurrently available tools Calculator Timer Stopwatch Temporary file hostingDark mode is fully supported;https://f-droid.org/repo/com.leestarb.fourthtools_341.apk;This version requires Android 5.0 or newer.;https://gitlab.com/leestarb/fourthtools;https://gitlab.com/leestarb/fourthtools/issues
KFZ-Kennzeichen;https://f-droid.org/en/packages/luke.kfz/;Simple app to tell by a cars number plate where the car is registered If youre using Androids TalkBack functionality a connection to Google servers will be established;https://f-droid.org/repo/luke.kfz_10004.apk;This version requires Android 4.4 or newer.;https://gitlab.com/LukeSoftware/kfz-kennzeichen;https://gitlab.com/LukeSoftware/kfz-kennzeichen/issues
DetermApp;https://f-droid.org/en/packages/de.determapp.android/;DetermApp allows you to use identification keys streamed from the web or from local files Additionally the DetermApp tools currently only available in german allow creating identification keys at a PC Windows or Linux It is possible to send identification keys to this Apps from the DetermApp tools using your home networkYou can use the content from any server This server must serve content as described at httpsgitlabcomdetermappdetermappandroidblobmasterpackage20sourcesmd However the only known server for this is determappde This server only provides some and only german contentA identification key is something which based on questions and the answers you provide tell you which animal you described;https://f-droid.org/repo/de.determapp.android_8.apk;This version requires Android 5.0 or newer.;https://gitlab.com/determapp/determapp-android/tree/HEAD;https://gitlab.com/determapp/determapp-android/issues
Democracy Droid;https://f-droid.org/en/packages/com.workingagenda.democracydroid/;Democracy Now is an USbased national daily independent awardwinning newsprogram hosted by journalists Amy Goodman and Juan Gonzalez Pioneering thelargest public media collaboration in the USThis application streams or downloads the independent media broadcast DemocracyNow The War and Peace Report It supports streaming and downloading the audioand video broadcast  this includes watching and listening to individualstories reading transcripts and streaming the live streamIf you like the app you are encouraged to donate to Democracy Now at theirwebsiteThe app is not affiliated with the production of the show merely thedistribution;https://f-droid.org/repo/com.workingagenda.democracydroid_56.apk;This version requires Android 8.0 or newer.;https://github.com/fenimore/DemocracyDroid;https://github.com/fenimore/DemocracyDroid/issues
DékaDico;https://f-droid.org/en/packages/com.example.spokennumbers/;Its a memory training app which is intended for those interested in improving their memorizing and recalling skills of spoken numbers Spoken Numbers is a discipline in all memory competitions The aim is to memorize and recall as many Spoken Numbers as possible which are read out at a pace of 1 digit per second Getting better at such a skill would not just improve your memory skills but also enhance your focus and concentration Memorization is fun try it outFeatures New includes Flash Anzan trainer Minimal no clutter display Customizable time delay between spoken numbers No overall time restrictions Easy to use recall system IncrementDecrement time delays on the fly to adjust to your current memorizing speed User can now choose between malefemale voice Choose between binary and decimal numbers to practice Save choices and preferences automatically improved UI transition animation between windows Evaluation mode Store and display Highscore;https://f-droid.org/repo/com.example.spokennumbers_10.apk;This version requires Android 4.1 or newer.;https://github.com/vivekthazhathattil/dekadico;https://github.com/vivekthazhathattil/dekadico/issues
GuitarFretboardTrainer;https://f-droid.org/en/packages/com.simonslater.guitarfretboardtrainer/;A very simple way to learn all the notes on the guitar fretboard by being quizzedIts easy to add to your daily guitar practicePick the string you want to learn which frets you want to learn the notes for and go for itYou can practice finding a note on a stringeg Find G on the E string The answer is Fret 4You can practice answering what note is at a certain freteg What note is on the E string at Fret 5;https://f-droid.org/repo/com.simonslater.guitarfretboardtrainer_2.apk;This version requires Android 5.0 or newer.;https://gitlab.com/pandagoespoop/guitarfretboardtrainer;https://gitlab.com/pandagoespoop/guitarfretboardtrainer/issues
