Blitzortung Lightning Monitor;https://f-droid.org/en/packages/org.blitzortung.android.app/;Simple to use map based application visualizing real time full area lightning data provided by the blitzortungorg lightning location network project The current thunderstorm situation at your fingertipsFeatures realtime display of lightning data display of historical lightning data of the last 24 hours for regions Europe North  South America Asia Africa and AustraliaNew Zealand lightning strike time color coded reduced data volume and fast response current lightning strike time and lightning count optional user location marker alert function shows distancedirection of storms background service for alerts support for notifications sound and vibration alarm single stroke display for blitzortungorg participantsPlease visit httpswwwblitzortungorg for more information regarding the community based lightning location projectThe raster display ensures a fast performance of the application even if there is a very high thunderstorm activity Blitzortungorg participants can visualize all stroke locations individuallyIf you would like to contribute to a translation of the software in your language please do not hesitate to contact the author of the software;https://f-droid.org/repo/org.blitzortung.android.app_286.apk;This version requires Android 4.0.3 or newer.;https://github.com/wuan/bo-android;https://github.com/wuan/bo-android/issues
GCompris;https://f-droid.org/en/packages/net.gcompris.full/;GCompris is a high quality educational software suite including a large numberof activities for children aged 2 to 10 Some of the activities are gameorientated but nonetheless still educational;https://f-droid.org/repo/net.gcompris.full_30200.apk;This version requires Android 4.1 or newer.;https://invent.kde.org/education/gcompris.git;https://bugs.kde.org/enter_bug.cgi?product=gcompris
TKCompanionApp;https://f-droid.org/en/packages/name.bresciani.marco.tkcompanionapp/;Goal of this app is to be a practical vademecumhandbook for those interested in applying scientific thinking through Toyota KataIt contains the Coaching Kata 5Q card plus possibly more things and informationContent to be improved and updated from time to time;https://f-droid.org/repo/name.bresciani.marco.tkcompanionapp_642.apk;This version requires Android 5.0 or newer.;https://codeberg.org/marco.bresciani/TKCompanionApp;https://codeberg.org/marco.bresciani/TKCompanionApp/issues
Fun With Kanji;https://f-droid.org/en/packages/krillefear.funwithkanji/;Simple Flutter app to learn Japanese writing systems Hiragana Katakana and KanjiWith Fun With Kanji you are able to learn all common used Japanese characters All starts with Hiragana Katakana and their special cases and combinations After this you learn the Kanji Radicals and then you are ready to start with the 2136 JAyAKanji You no longer need 4 different apps to learn themThe app also contains a dictionary and a fulltext search over all charactersFun With Kanji is open source under Mozilla Public License 20 Contributions and new translations are always welcome 3;https://f-droid.org/repo/krillefear.funwithkanji_27.apk;This version requires Android 5.0 or newer.;https://gitlab.com/KrilleFear/funny-kanji;https://gitlab.com/KrilleFear/funny-kanji/-/issues
wX;https://f-droid.org/en/packages/joshuatee.wx/;NWS  National Weather Service  data is optimized for mobile format and provided for divisions not normally covered together in the mobile space SPC WPC NHC OPC etc Level 3 and Level 2 Nexrad radar  single dual quad pane  are provided and displayed using the mobile variant of OpenGL This weather app is not affiliated with NOAA or the National Weather ServiceIf you only need current conditions and your local 7 day forecast then this app is probably more then you need although it will easily provide those 2 things as well If you are looking for wasted screen real estate or fancy graphics this app is not for you Given the depth of information covered there is a steep learning curve if you seek to use the program in its entirety help information is available and touched on below Common weather acronyms are used throughout so you should be familiar with those as well Currently United States locations are supported Canada is also supported but is be considered in Beta for nowHELP is available from the main menu and by tapping on any text in the settings activitiesFeatures Current forecast 7 day conditions sounding data for an unlimited number of locations from NWS Customizable home screen Android only Tiles can be rearranged by long press and then drag and drop on Tabs SPC MISC and IMAGES OpenGL based Nexrad radar interface with numerous options Level 2 in the lowest tilt for base reflectivityvelocity is also available 2 pane and 4 pane version also available in MISC tab Optimized text product viewer for easy access to AFDHWO and others from any NWS WFO VisIRWVRadar mosaic viewer  with animations  Widgets  nexrad radar radar mosaic vis afdhwo  SPC products  such as WatchesMCDsConvective OutlooksMesoanalysis  WPC products Weather models NHC productsNotifications Local alerts MCDs impacting your location MPDs impacting your location Convective outlooks for your location US MCDWatches US tornadoes US MCD US MPD NHC Atlantic and EPAC advisoriesNOTE about Canada Canadian locations can be added under Settings  Location  plus symbol but you need to access the options under the submenu You can also use the main search bar at the top but for now you must use a suggested location and cant add an arbitrary locationSee here for a list of often asked questions;https://f-droid.org/repo/joshuatee.wx_55787.apk;This version requires Android 6.0 or newer.;https://gitlab.com/joshua.tee/wx;https://gitlab.com/joshua.tee/wx/issues
DanXi;https://f-droid.org/en/packages/io.github.danxi_dev.dan_xi/;Maybe the best allrounded service app for Fudan University students Campus card balance and transactions Dining hall traffic Shortcut for Fudan QR Code with support for Apple Watch View empty classrooms Tree Hole View compulsoryexercise records View timetable and export as ics file Show Notices from Academic Affairs Office View exam schedule and export as ics file View final exam GPA and ranking View school bus scheduleCome to our website to know more about DanXi httpsdanxifduholecom;https://f-droid.org/repo/io.github.danxi_dev.dan_xi_335.apk;This version requires Android 5.0 or newer.;https://github.com/DanXi-Dev/DanXi/tree/foss-build;https://github.com/DanXi-Dev/DanXi/issues
taz;https://f-droid.org/en/packages/de.taz.android.app.free/;Reader for subscribers of the german daily newspaper taz die tageszeitungPlease note that the language of the app is german;https://f-droid.org/repo/de.taz.android.app.free_10700900.apk;This version requires Android 5.0 or newer.;https://github.com/die-tageszeitung/taz-neo;https://github.com/die-tageszeitung/taz-neo/issues
Show Articles in Map;https://f-droid.org/en/packages/de.k3b.android.geo2articlesmap/;Note You must also install Location Map Viewer to display the resultsThis app adds the option Show Articles in Map to any app that can shownsendshare a geo location or geouri This app hooks into the android system to intercept view geouri When getting a geouri it asksencyclopedia wikipedia  or travelguide wikivoyage or knowledgebase wikidata or photogallery wikimediaand shows the results inLocation Map Vieweror in any other installed app that understands the format kmzLocation Map Viewer shows a map with bubbles or articleicons if enabledavailable for every wikipedia article foundIf you click on a bubble you get a popup with a short article description and a button that links to the full articleHere are some fdroid apps that are compatible with Show Articles in Mapnavigation OsmAndpublic transportation Transportr or oeffitranslate postal address to geo Acastus Photon Share your current position LocationShare or My PositionRequired Android PermissionsINTERNET to download article data from wikipedia or wikivoyage Server;https://f-droid.org/repo/de.k3b.android.geo2articlesmap_6.apk;This version requires Android 4.4 or newer.;https://github.com/k3b/AndroidGeo2ArticlesMap;https://github.com/k3b/AndroidGeo2ArticlesMap/issues
CTU Menza;https://f-droid.org/en/packages/cz.lastaapps.menza/;This Android app shows dish menus for CTU cafeterias from agatasuzcvutcz web in much more pleasant and usable way for phonesIt shows today and week menu opening hours contacts announcements and address for all the canteensIt supports dark mode and Material You including Android 12 dynamic theming;https://f-droid.org/repo/cz.lastaapps.menza_1020500.apk;This version requires Android 5.0 or newer.;https://github.com/Lastaapps/menza;https://github.com/Lastaapps/menza/issues
TransektCount;https://f-droid.org/en/packages/com.wmstein.transektcount/;TransektCount serves transect counters on their inspection walks It supports speciesspecific counting of butterflies per transect section according to the European Butterfly Monitoring Scheme methodFeatures Data recording is organized according to a single transect inspection with a database instance per inspection Databases can be individually created and adapted within the app regarding meta data transect sections and expected butterfly species You may use an individual species list per transect section It contains a prepared basic database with most of the expected species as a starting point Editor for the transect sections to setup or adapt its species Add new species to the list by scrolldownselection from a comprehensive internal species list  Editor for meta data to prepare an inspection Editor for species remark or bulk count entry Counting page with scroll menu to select species Count input per internalexternal counting area and here each with separate counters for a or a a a pupa larva or egg Results are prepared for easy readout to transfer them to science4you entry masks Results are shown with meta data remarks totals and species results per transect section Results may also be exported in SQLite or CSVformat and transferred to a PC for your own processing eg by importing a csvfile into a spreadsheet like MS Excel Help contains a detailed userguidePrerequisitesThe app demands for  storage access permit which is needed for imexporting the counting data  the permit to write settings for setting the screen brightness  the permit to prevent the phone from sleeping to control the counting screen when used under Android 501 or newerThe smartphone screen should have a minimum resolution of 1920 x 1024 pixels The app is usable with Android version 44 KitKat or newerDocumentation is provided under  httpsgithubcomwisteinTransektCounttreemasterdocsTransektCount is one of two apps for European butterfly monitoring The 2nd app TourCount supports speciesspecific and individually GPSlocalized counting of butterflies on any tour in nature Both apps use the coding scheme of KarsholtRazowski for European butterflies and thus contain only European butterfly pictures;https://f-droid.org/repo/com.wmstein.transektcount_336.apk;This version requires Android 4.4 or newer.;https://github.com/wistein/TransektCount;https://github.com/wistein/TransektCount/issues
TourCount;https://f-droid.org/en/packages/com.wmstein.tourcount/;TourCount supports speciesspecific and individually GPSlocalized registering of butterflies Features Data recording is organized for a regional tour with its expected butterfly species The app comes with a prepared basic database with the most common species in Europe as a starting point Databases can be individually created and adapted within the app regarding meta data and expected butterfly species You may use an individual species list per region The app contains an editor to setup or adapt the current species list Add new species to the list by scrolldownselection from a comprehensive internal species list  There is an editor to prepare the meta data for a tour and an editor for individual species data of a count eg state remark or bulk count entry Species can be selected per scrolldownmenu with butterfly names and pictures on the counting page The counting page has 6 separate counters for a or a a a pupa larva or egg The app automatically inserts date time coordinates and height as well as location data by reverse OSMgeocoding provided that GPS and internet are accessible Results are prepared for easy readout to transfer them to the science4you entry mask for butterfly registration Results are shown with meta data totals remarks species results and individual data Results may be exported in SQLite or CSVformat for transfer to a PC for your own processing eg in a spreadsheet Help contains a detailed userguide TourCount uses the European coding scheme for butterflies from KarsholtRazowskiPrerequisitesThe app demands for  storage access permit which is needed for imexporting the counting data  GPS Location permit for coordinates and location info per count  internet access for OpenStreetMap reverse geocoding requests  the permit to write settings for setting the screen brightness the permit to keep the device awake and to switch off the counting screen when the phone is pocketedThe smartphone screen should have a minimum resolution of 1920 x 1024 pixels The app is usable with Android version 44 KitKat or newerDocumentation is provided under  httpsgithubcomwisteinTourCounttreemasterdocsTourCount is one of two apps for European butterfly monitoring The 2nd app TransektCount serves transect counters on their inspection walks It supports speciesspecific counting of butterflies per transect section according to the European Butterfly Monitoring Scheme methodBoth apps use the coding scheme of KarsholtRazowski for European butterflies and thus contain only European butterfly pictures;https://f-droid.org/repo/com.wmstein.tourcount_333.apk;This version requires Android 4.4 or newer.;https://github.com/wistein/TourCount;https://github.com/wistein/TourCount/issues
Drinkable;https://f-droid.org/en/packages/com.moimob.drinkable/;Drinkable is an app which help you find cocktails that you could make today with ingredients from home You can also explore new great cocktails to make The app will always let you know what ingredents is missing Features  Includes 100 cocktails Also includes mocktails and cocktail ingredients Ability to add your own cocktails and ingredients within the app Lets you know what cocktails you can make with the ingredients you have at home 1 missing ingredient list So you can easily pick up that last item and make a new cocktail Save favorite cocktails Rate cocktails with stars from zero to five  Supports both Imperial and Metric measurement system Offline support this app will work even if you dont have internet connection Simple User Interface 8 languages English Spanish French German and more Open source code is avaliable on Github Please reach out to antonmoimobcom if you have any questions or wish for a specific cocktail or feature to be addedHope you enjoy these delicious cocktails;https://f-droid.org/repo/com.moimob.drinkable_12201.apk;This version requires Android 5.1 or newer.;https://github.com/MOIMOB/drinkable;https://github.com/MOIMOB/drinkable/issues
Nanji clock widget;https://f-droid.org/en/packages/com.kazufukurou.nanji/;Home screen clock widget for language learners Chinese Japanese Korean Russian English and default datetime format 1224 hours time format Japanese era date format Customizable time zone Highly customizable appearance Switch between showing digitswords on tap Open system alarm app on tap;https://f-droid.org/repo/com.kazufukurou.nanji_40.apk;This version requires Android 5.0 or newer.;https://github.com/artyommironov/nanji;https://github.com/artyommironov/nanji/issues
RUTMath;https://f-droid.org/en/packages/com.hexbit.rutmath/;RUTMath is an interactive educational app that helps schoolaged children learn math The application offers many different levels of difficulty to adjust to the users skill level and provides exercises and games that help with learning basic math operations such as addition subtraction multiplication and division Additionally the application allows to learn how to convert units such as converting meters to centimeters kilograms to grams etc There is also the possibility of learning multiplication tables and divisibility of numbers which are very important for further mathematical education Thus the application is an excellent tool for teachers and parents who want to help children learn math in a fun and effective way;https://f-droid.org/repo/com.hexbit.rutmath_2.apk;This version requires Android 5.1 or newer.;https://github.com/przemarbor/RUTMath;https://github.com/przemarbor/RUTMath/issues
Evil Insult Generator;https://f-droid.org/en/packages/com.evilinsult/;Why should you download the Evil Insult Generator as opposed to another insult appSimplicityThe interface is userfriendly and the insults are all of high quality The app was developed to provide you with a pleasurable experienceOn the apps main screen youll have the ability to generate and browse various evil insults Using the app couldnt be easier and it only takes a second to generate new insults You can browse through them with a simple tap of your screenFree  Open SourceThis app is completely free to use and will stay that way forever The source code is available on GitHub You do not have to worry about special memberships annual subscriptions or hidden costs to generate results and share them with othersSharingWe endeavored to simplify the process of using this app You will be able to share insults produced by the Evil Insult Generator at no charge Your insults can be shared with friends on various apps Updated RegularlyThe development team that created this app are always adding new insults to it Each insult is easy to share and others can use them if desired But we need your support Please send us your insults and we will review it If we like it the insult will be the newest addition to the app A Huge Collection of InsultsThis app does not have any shortage of insults that you can use Many of them have a uniqueness that canat be found anywhere elseDont delay a download the evil insults app and come up with creative lines that you can use on just about anybodyWe endeavor to optimize user experiences for everyone Feedback is something we welcome If you have a recommendation or suggestion we would like to hear them Dont hesitate to get in touch with us at marvinevilinsultcom In doing so we will be able to optimize your experience and keep the app updated with cuttingedge insultsa1i  Note a1i  The source can be found here httpsgithubcomEvilInsultGeneratorandroidapp Your assistance with app translation is very much appreciated httpscrowdincomprojectevilinsultgeneratorandroid Feel very welcome to send me your favorite insults so that I can add thema i  Warning a i Many insults that are generated by the app will offend some people and as such you should be careful with whom you use these insults on This app is for mature users only;https://f-droid.org/repo/com.evilinsult_39.apk;This version requires Android 5.0 or newer.;https://github.com/EvilInsultGenerator/android-app;https://github.com/EvilInsultGenerator/android-app/issues
Translate You;https://f-droid.org/en/packages/com.bnyro.translate/;Translate You is a Translator App built with Material Design 3 YouIt supports multiple different translation engiens such as LibreTranslate Lingva Deepl and moreIn total there are more than 200 supported languages across 6 different translation engines;https://f-droid.org/repo/com.bnyro.translate_29.apk;This version requires Android 5.0 or newer.;https://github.com/Bnyro/TranslateYou;https://github.com/Bnyro/TranslateYou/issues
ArityCalc;https://f-droid.org/en/packages/org.woheller69.arity/;Scientific calculator with complex numbers and 2D3D graphing of userdefinedfunctions Trigonometric functions Combinatorial functions Complex numbers Binary octal hexadecimal numbers Animated 3D graphing Graphing multiple 2D function on a single graph Graphing of derivatives for 2D functions Screenshots of the graphs;https://f-droid.org/repo/org.woheller69.arity_38.apk;This version requires Android 5.0 or newer.;https://github.com/woheller69/Arity;https://github.com/woheller69/Arity/issues
Unitto — calculator and unit converter;https://f-droid.org/en/packages/com.sadellie.unitto/;Calculator unit converter and moreFeaturesa Instant expression evaluationa Expressions historya Copy paste and cut expressiona Material You Theme even for old devicesa More than 500 units and currenciesa Smart units searcha Adaptive units sorting algorithma Small app sizea Bulk convert unitsa Favorite unitsa Ability to disable unit groupsa Customizable number formattera SI Standard;https://f-droid.org/repo/com.sadellie.unitto_18.apk;This version requires Android 5.0 or newer.;https://github.com/sadellie/unitto;https://github.com/sadellie/unitto/issues
Dib2Calc;https://f-droid.org/en/packages/com.gitlab.dibdib.dib2calc/;Dib2Calc aka Dibdib CalculatorThe crazy calculator Once you get used to it you will love it A short introduction is provided when you start it for the first timeYour data is protected encrypted if you use your own access code and password In case you have a lot of data make sure to save it to the devices Download area via the SAVTO functionSee httpsgitlabcomdibdibdib2calc for more information andhttpsgitlabcomdibdibdib2calcblobmasterknownissuesmd forknown issues;https://f-droid.org/repo/com.gitlab.dibdib.dib2calc_2324.apk;This version requires Android 5.0 or newer.;https://gitlab.com/dibdib/dib2calc/tree/HEAD;https://gitlab.com/dibdib/dib2calc/issues
Wulkanowy;https://f-droid.org/en/packages/io.github.wulkanowy/; calculation of the weighted average percentage attendance preview lucky number preview of completed lessons dark theme no ads offline mode notifications;https://f-droid.org/repo/io.github.wulkanowy_121.apk;This version requires Android 5.0 or newer.;https://github.com/wulkanowy/wulkanowy;https://github.com/wulkanowy/wulkanowy/issues
RPNcalc;https://f-droid.org/en/packages/dev.pesic.rpncalc/;A simple modern RPN calculator that uses RPNReverse Polish Notation is a system where the operators are entered after the operandsFor example rather than 2  2 you would enter    2    2    The main benefit is a faster more accurate interface;https://f-droid.org/repo/dev.pesic.rpncalc_8.apk;This version requires Android 5.1 or newer.;https://github.com/apesic/rpncalc;https://github.com/apesic/rpncalc/issues
Notely;https://f-droid.org/en/packages/ch.thilojaeggi.notely/;Notely is a crossplatform app for the commonly used swiss school platform Schulnetz which allows you to see your grades timetable and absences Its currently only compatible with schools within the canton of Solothurn KSSO GIBS KBS etcFeatures Lightweight Fast Crossplatform Allows you to view your upcoming Exams timetable grades and absences Stay signed in;https://f-droid.org/repo/ch.thilojaeggi.notely_8.apk;This version requires Android 4.4 or newer.;https://github.com/thilojaeggi/notely;https://github.com/thilojaeggi/notely/issues
Kanji Dojo;https://f-droid.org/en/packages/ua.syt0r.kanji.fdroid/;Learn  practice writing Japanese charactersFeatures Study kana both Hiragana and Katakana and kanji Practice by following JLPT levels or school grades Create your own list to study more than 6000 characters in total are available Works offline;https://f-droid.org/repo/ua.syt0r.kanji.fdroid_12.apk;This version requires Android 8.0 or newer.;https://github.com/syt0r/Kanji-Dojo;https://github.com/syt0r/Kanji-Dojo/issues
Tux Math;https://f-droid.org/en/packages/org.afrikalan.tuxmath/;;https://f-droid.org/repo/org.afrikalan.tuxmath_4.apk;This version requires Android 6.0 or newer.;https://gitlab.com/Afrikalan/tuxmath-android;https://gitlab.com/Afrikalan/tuxmath-android/issues
PReVo;https://f-droid.org/en/packages/uk.co.busydoingnothing.prevo/;PReVo is a portable version of Reta Vortaro the free and libre Esperantodictionary for Android Its usable without Internet access and is quicklysearched with the keyboard;https://f-droid.org/repo/uk.co.busydoingnothing.prevo_24.apk;This version requires Android 4.1 or newer.;https://github.com/bpeel/prevo;https://github.com/bpeel/prevo/issues
Morse;https://f-droid.org/en/packages/rocks.poopjournal.morse/;Translate text to Morse code or decipher Morse code by translating them totext Its a simple user friendly but useful app that can help you in alot of ways You can decipher or decode Morse codes you can create secretnumber or learn to be a cipher or learn cryptography and many more If youthink of yourself as a codebreaker download and try our Morse code cyphertool Dont let the special characters or dots and dashes befuddle youFeatures Clean modern app design and interface Super easy to use Realtime translation type in the word or code and we will translate it to you immediately Decode from Morse to text or text to Morse Press the speaker button to hear the code in sound Copy the text by pressing copy button Type in dot and dash using our builtin Morse keyboardHow Morse is useful for youTell others when you are in a dangerous situation SOSHide your secret number or password via dots and dashesCipher Decipher hidden clues in gamesLearn cryptography or cryptogram through learning Morse codesBecome a codebreaker by breaking secret codes in real time translationAnd many moreSo what are you waiting for Use our Morse code cipher tool to decipherMorse code to text or text to Morse code now As a codebreaker  cryptogramenthusiast our cipher tool is a must have It is useful for all of youJust try it out;https://f-droid.org/repo/rocks.poopjournal.morse_11.apk;This version requires Android 4.4 or newer.;https://github.com/Crazy-Marvin/Morse;https://github.com/Crazy-Marvin/Morse/issues
