Verbiste Android;https://f-droid.org/en/packages/com.allansimon.verbisteandroid/;Verb conjugation for French powered byVerbiste database;https://f-droid.org/repo/com.allansimon.verbisteandroid_2.apk;This version requires Android 2.1 or newer.;https://github.com/allan-simon/verbiste-android;https://github.com/allan-simon/verbiste-android/issues
TopoSuite;https://f-droid.org/en/packages/ch.hgdev.toposuite/;TopoSuite for Android is an application that targets land surveyors by helpingthem determining new geographical points based on measurements and offering someutilities It is able to do the following calculationsPolar calculations station orientation free station polar survey polar implantation axis implantationOrthogonal calculations orthogonal survey orthogonal tracking orthogonal implantationIntersections calculations lines intersections circles intersections line  circle intersectionsSurface calculations surface included with arc of a circle parallel limit displacement regarding compulsory surfaceMiscellaneous field  distance point projection on a line circle computation using three points arc of a circle segmentationMathematics triangle solver circular elements resolutionData such as points can be imported into the application from CSV LTOP or PTPfile formats and exported to CSV The history of all the calculations thepoints and application settings can be exported to file tpst which can beimported into other instances of the application or simply later on;https://f-droid.org/repo/ch.hgdev.toposuite_70.apk;This version requires Android 4.0.3 or newer.;https://github.com/hgdev-ch/toposuite-android;https://github.com/hgdev-ch/toposuite-android/issues
Identify Dog Breeds;https://f-droid.org/en/packages/com.jstappdev.dbclf/;Identify over one hundred different dog breeds with your smartphoneThis application will not run on devices with less than 1 GB of RAMIf you like this app consider buying the premium version which supports the identification of more than two hundred different dog breeds with much higher accuracyClick the camera button or load an image from the gallery to identify a dog in a single picture Activate continuous predictions and keep the dog in the circle to get predictions directly from the video stream The app works best for high quality images loaded from the galleryThe application reports up to three predictions with highest confidence Please treat the output only as a suggestionBased on an extended version of the Stanford Dogs Dataset Icons made by Pause08 Smashicons Freepik from wwwflaticoncom;https://f-droid.org/repo/com.jstappdev.dbclf_103.apk;This version requires Android 5.0 or newer.;https://github.com/j05t/dbclf;https://github.com/j05t/dbclf/issues
Poleidoscope;https://f-droid.org/en/packages/com.example.poleidoscope/;Did you ever wonder what the world looks like through a holomorphic function No Wondering what a holomorphic function is in the first place Dont worry You dont need to know any of this to use the app Just touch the screen and see the math at work The Poleidoscope shows a rectangular domain of the plane of complex numbers The user sets up roots and poles of a rational function on the screen and this function is then used to deflect the live camera picture Holomorphic functions are examples of socalled conformal mappings which are prominently featured in the works of contemporary artists such as MC Escher The Poleidoscope provides a live experience of similar pictures For those more involved in mathematics the app is a way to visualize complex polynomials and rational functions and give a feeling for several topics in complex analysis such as differentials of holomorphic functions Rouches theorem ramifications local normal forms etc;https://f-droid.org/repo/com.example.poleidoscope_1.apk;This version requires Android 5.0 or newer.;https://gitlab.com/bowl1/poleidoscope;https://gitlab.com/bowl1/poleidoscope/issues
LibreHealth Cost Of Care Explorer;https://f-droid.org/en/packages/io.librehealth.toolkit.cost_of_care/; Welcome to LibreHealth Cost Of Care ExplorerThe Goal of this LibreHealth Cost Of Care Explorer project is to provide patientfriendly costs of care to help patients get better cost estimates for medical procedures of US HospitalsFeatures User can view the chargemaster Search for a particular procedure in multiple hospitals chargemasters Sort data by Category or sort by price in ascending or descending order Users can also compare hospitals based on ratings  patients experience to get idea about hospital services This App can work offline and updates data once a monthDownload the Android application now and check it out;https://f-droid.org/repo/io.librehealth.toolkit.cost_of_care_3.apk;This version requires Android 4.1 or newer.;https://gitlab.com/librehealth/toolkit/cost-of-care/lh-toolkit-cost-of-care-app;https://gitlab.com/librehealth/toolkit/cost-of-care/lh-toolkit-cost-of-care-app/-/issues
Learn reading (in french);https://f-droid.org/en/packages/org.malinux.lectureFrancais.actLecture/;These activities allow children to practice reading through variousexercises similar to those done at school during first or second gradeThe image bank used has been adapted to the best of our abilityto the cultural context of West AfricaYou will find activities such as Associate a word with its image Find the missing syllable of a word Put in order the syllables or letters forming a word Write the word dictationThe word sets are classified into 7 difficulty levels which follow theusual progression of the teaching of reading starting by simple syllablesin P T M L R then we go gradually towards more complex syllablesThese activities were created voluntarily as part of the Afrikalan Projectwhich aims to make free educational software accessible in West Africa They are distributed free of charge and in a noncommercial mannerunder the terms of the GNUGPL license;https://f-droid.org/repo/org.malinux.lectureFrancais.actLecture_2.apk;This version requires Android 2.3 or newer.;https://gitlab.com/Afrikalan/lecture_francais_android/tree/HEAD;https://gitlab.com/Afrikalan/lecture_francais_android/issues
Malayalam To Manglish;https://f-droid.org/en/packages/subins2000.manglish/;Translate or convert malayalam text to manglish Useful for people who cant read malayalam but understands it    a aa a 3a  will be converted to Keralam    Features     Fast quick conversion     Ability to select text in other apps browsers and share to this app to convert     No ads bloatware     As lightweight as possible    More about app  httpssubinsbcommanglish;https://f-droid.org/repo/subins2000.manglish_7.apk;This version requires Android 4.0.3 or newer.;https://github.com/subins2000/manglish;https://github.com/subins2000/manglish/issues
LibGen Mobile;https://f-droid.org/en/packages/com.manuelvargastapia.libgen/;This is a nonofficial Library Genesis mobile clientThe project is completely independent and Open Source The developer has no relation with Library GenesisFeel free to collaborateCheck the repoFeatures Search books by title author and other parameters See detailed info about the book pages size etc Download the book directly to Downloads folder Switch between light and dark theme Languages English Spanish Polish Portuguese German Japanese French and Chinese The app provides access to SciTech and Fiction sectionsThe only permission required is Storage Its used only to place the downloaded files in Downloads directoryPowered by Flutter;https://f-droid.org/repo/com.manuelvargastapia.libgen_5.apk;This version requires Android 4.1 or newer.;https://github.com/manuelvargastapia/libgen_mobile_app;https://github.com/manuelvargastapia/libgen_mobile_app/issues
CALCVAC-VACLINE;https://f-droid.org/en/packages/de.drhoffmannsoftware.calcvac/;The programs calcvacvacline can calculate logitudinal onedimensionalpressure profiles in vacuum pipes The pipes can consist of differentsections of different shape and material Outgasing of several differentgas species can be simulated Also it is possible to install vacuum pumps ofdifferent types Also cryo effects cold pipes and cryo pumps aresimulated Finally the pipes can be linked together to form a network;https://f-droid.org/repo/de.drhoffmannsoftware.calcvac_3.apk;This version requires Android 3.0 or newer.;https://codeberg.org/kollo/Calcvac-Android;https://codeberg.org/kollo/Calcvac-Android/issues
The Kana Quiz;https://f-droid.org/en/packages/com.noprestige.kanaquiz/;Are you trying to learn Japanese but cant seem to remember the pronunciation of the basic Hiragana or Katakana character setThis application is here to help It will test your knowledge and drill the basics into your head You can select which of the twenty different groups you wish to test yourself on Allowing you to customize based on your skill level Because we cant learn all this stuff at once Also includes a reference screen that can display all kana youre currently working on just to remind you;https://f-droid.org/repo/com.noprestige.kanaquiz_18.apk;This version requires Android 4.2 or newer.;https://github.com/theblackwidower/KanaQuiz;https://github.com/theblackwidower/KanaQuiz/issues
WaniDoku;https://f-droid.org/en/packages/com.nononsenseapps.wanidoku/;You need to be a WaniKani subscriber to use this appEver worry that you are forgetting all your burned kanji and vocabulary Do you find yourself not reading as much Japanese as youad likeThis app will display a notification containing a context sentence from one of your burned or passed vocabulary You read it then you press translate to see if you were right Right or wrong the app will display another notification with a random sentence at a configurable intervalTo ensure notifications are actually displayed remember to disable battery optimization for the appa Note that timing of notifications are not exact due to battery saving reasons in AndroidPlease direct any questions and feedback to the thread at the WaniKani forumhttpscommunitywanikanicomtandroidwanidokuandroidapptogetyoutoreadsomecontextsentencesSource is provided under GNU GPLv3 license httpsgitlabcomspacecowboywanidoku;https://f-droid.org/repo/com.nononsenseapps.wanidoku_7.apk;This version requires Android 7.0 or newer.;https://gitlab.com/spacecowboy/wanidoku;https://gitlab.com/spacecowboy/wanidoku/issues
QDict;https://f-droid.org/en/packages/com.annie.dictionary.fork/;QDict support 3 ways to search  Globstyle pattern matching  Fuzzy query and Fulltext searchStardict dictionaries are not included in the application and should be obtained separatelyDictionaries should be placed in sdcardQDictdictsEach dictionary should be placed into a separate subfolder for instance sdcardQDictdictsdictnameIts recommended to only use alphanumeric filenamesThis fork of the original applicationhttpsgithubcomnamndevQDict was created to incorporate patcheswhich were not responded to by the upstream and The fork is not actively developed ie no new features or bugfixes are plannedhowever all PRs are welcome and will be reviewed;https://f-droid.org/repo/com.annie.dictionary.fork_20210415.apk;This version requires Android 4.2 or newer.;https://github.com/marmistrz/QDict;https://github.com/marmistrz/QDict/issues
Xournal++;https://f-droid.org/en/packages/online.xournal.mobile/;A port of the main features of Xournal to various Flutter platforms like Android iOS and the Web Try it outMission completed We can now render strokes images and text We thereby support the full xopp file format tadaPlease note stroke support is incredibly bad There are lots of errors thrownhttpsxournalonlineAlternatively you can download prebuild binaries for Linux and Android from the GitLab pipeline Visible parts already working x Read the document title x Read and display the number of pages x Create thumbnails of the pages for the navigation bar x Smooth fade in after thumbnail rendering x Render images on the canvas x Render text on the canvas;https://f-droid.org/repo/online.xournal.mobile_27.apk;This version requires Android 4.4 or newer.;https://gitlab.com/TheOneWithTheBraid/xournalpp_mobile;https://gitlab.com/TheOneWithTheBraid/xournalpp_mobile/-/issues
CEToolbox;https://f-droid.org/en/packages/com.github.cetoolbox/;The CEToolbox project aims to provide a convenient tool for computing CapillaryElectrophoresis parameters;https://f-droid.org/repo/com.github.cetoolbox_13.apk;This version requires Android 4.4 or newer.;https://github.com/cetoolbox/cetoolbox;https://github.com/cetoolbox/cetoolbox/issues
TOTALOG;https://f-droid.org/en/packages/de.dm1ri.totalog/;Simple FLOSS Ham Radio logging app for small contests and portable operation 11  12     Features include 13      logging QSOs 14      edit logged QSOs afterwards 15      archive and manage different QSO lists 16      export and share QSO lists as cabrillo 17      dark mode;https://f-droid.org/repo/de.dm1ri.totalog_102.apk;This version requires Android 5.1 or newer.;https://github.com/hallogallo/totalog;https://github.com/hallogallo/totalog/issues
Buddha Quotes;https://f-droid.org/en/packages/org.bandev.buddhaquotes/;Buddha Quotes is a collaborate project and maintains that it is Free Libre and Open Source It has a focus on privacy with no ads no trackers and no nonfree dependencies like Google services;https://f-droid.org/repo/org.bandev.buddhaquotes_1013.apk;This version requires Android 5.0 or newer.;https://github.com/BanDev/Buddha-Quotes;https://github.com/BanDev/Buddha-Quotes/issues
Schule;https://f-droid.org/en/packages/de.com.quaap.primary/;Schule is a simple educational practice game for kids and adults This app is a German version of quaapPrimarySchule ist eine App mit der GrundschA14ler A14ben kAnnen Erwachsene dA14rfen sie auch probieren Es gibt Plus Minus Mal und GeteiltAufgaben Uhrzeit lesen sowie WArter richtig schreiben Vielleicht kommt spAter noch mehr dazu  allerdings macht der Entwickler des Originals gerade eine lAnger Pause ;https://f-droid.org/repo/de.com.quaap.primary_331.apk;This version requires Android 4.4 or newer.;https://github.com/ailin-nemui/Primary;https://github.com/ailin-nemui/Primary/issues
TestApp;https://f-droid.org/en/packages/ga.testapp.testapp/;TestApp is an educational opensource project for writing class tests digitally on smartphones or computers We offer easytouse class management individual class tests and random practice tests Students can register individually or a hole schoolclass can use TestApp;https://f-droid.org/repo/ga.testapp.testapp_66.apk;This version requires Android 4.1 or newer.;https://gitlab.com/testapp-system/testapp-flutter;https://gitlab.com/groups/testapp-system/-/issues
F-Droid;https://f-droid.org/en/packages/org.fdroid.fdroid/;FDroid is an installable catalogue of libre software apps for Android The FDroid client app makes it easy to browse install and keep track of updates on your deviceIt connects to any FDroid compatible repositories The default repo is hosted at fdroidorg which contains only bona fide libre softwareAndroid itself is open in the sense that you are free to install APKs from anywhere you wish but there are many good reasons for using FDroid as your libre software app manager Get notified when updates are available Optionally download and install updates automatically Keep track of older and beta versions Filter out apps incompatible with the device Find apps via categories and searchable descriptions Access associated URLs for donations source code etc Stay safe by checking repo index signatures and APK hashes;https://f-droid.org/repo/org.fdroid.fdroid_1016053.apk;This version requires Android 6.0 or newer.;https://gitlab.com/fdroid/fdroidclient;https://gitlab.com/fdroid/fdroidclient/issues
Xeonjia: Ice Adventures;https://f-droid.org/en/packages/xyz.deepdaikon.xeonjia/;Xeonjia is an adventure game set in a frozen worldThe floor is frozen Think carefully about your moves because you cant change direction until you meet an obstacleUse you mind to solve the ice slide puzzlesThe world has been frozen by the aKing of Evila and itas no longer a safe placeLegend has it that a brave hero will defeat the King of Evil and save the kingdoma For this reason every year a person is appointed as aheroa and sent on a journey to try to save itNow is your time you have been chosen as this yearas hero Will you be able to defeat the King of EvilYou will have to travel the world explore cities dungeons and mystical cavesAre you ready to solve quests and puzzles in this frozen RPG worldOver time you will gain experience points that will allow you to increase your level and you will find money and hidden treasures that you can use to buy stuff and improve yourselfBe careful the world is full of dangerous enemies ready to attack youKeep in mind that most of the floor is frozen so you canat stop yourself until you reach a wall a boulder or any other type of obstacleUse your mind to figure out the best pathNote this game is currently in early beta stage;https://f-droid.org/repo/xyz.deepdaikon.xeonjia_14.apk;This version requires Android 4.1 or newer.;https://gitlab.com/deepdaikon/Xeonjia/tree/HEAD;https://gitlab.com/deepdaikon/Xeonjia/issues
Quinb: 4 players reaction game;https://f-droid.org/en/packages/xyz.deepdaikon.quinb/;Quinb is a reaction  logic game for up to 4 players on the same deviceIt contains many minigames in which you have to answer questions as fast as you can to get a pointIf the answer is correct you score a point otherwise you lose oneThese games are based on 3 different categoriesa Logic games that require intuition logic and fast reflexesa Audio soundbased games you have to listen carefully to find out the correct answera Vibration vibrationbased games that require you to listen carefully to the vibrations of your deviceEach match consists of a succession of different minigamesThe goal is to score 7 points before your opponentsYou can play alone if you want but it is more fun to play with friends of all ages Its great if you are stuck with nothing to do while youre with friendsIf you think youre fast challenge and beat your friendsMain featuresa 28 minigamesa Up to 4 players on the same devicea Completely freea No Adsa Multiple languagesa Minimalist design;https://f-droid.org/repo/xyz.deepdaikon.quinb_8.apk;This version requires Android 4.1 or newer.;https://gitlab.com/deepdaikon/Quinb/tree/HEAD;https://gitlab.com/deepdaikon/Quinb/issues
Jellyfin for Android TV;https://f-droid.org/en/packages/org.jellyfin.androidtv/;Your media on your termsThe Jellyfin project is an open source free software media server No fees no tracking no hidden agenda Get our free server to collect all your audio video photos and more in one placeTo use the app you must have a Jellyfin server set up and running Find out more at jellyfinorgWith a Jellyfin server you can Watch Live TV and recorded shows from your Jellyfin server additional hardwareservices required Stream to a Chromecast device on your network Stream your media to your Android device View your collection in an easy to use interfaceThis is the official Jellyfin companion app for Android TV Thank you for using Jellyfin;https://f-droid.org/repo/org.jellyfin.androidtv_150599.apk;This version requires Android 5.0 or newer.;https://github.com/jellyfin/jellyfin-androidtv;https://github.com/jellyfin/jellyfin-androidtv/issues
Activity Launcher fork;https://f-droid.org/en/packages/de.szalkowski.activitylauncher.rustore_fork/;This opensource Android App launches hidden activities and creates home screen shortcuts for installed apps;https://f-droid.org/repo/de.szalkowski.activitylauncher.rustore_fork_137.apk;This version requires Android 6.0 or newer.;https://github.com/Sash0k/ActivityLauncher;https://github.com/Sash0k/ActivityLauncher/issues
Translate You;https://f-droid.org/en/packages/com.bnyro.translate/;Translate You is a Translator App built with Material Design 3 YouIt supports multiple different translation engiens such as LibreTranslate Lingva Deepl and moreIn total there are more than 200 supported languages across 6 different translation engines;https://f-droid.org/repo/com.bnyro.translate_29.apk;This version requires Android 5.0 or newer.;https://github.com/Bnyro/TranslateYou;https://github.com/Bnyro/TranslateYou/issues
TU Darmstadt Moodle Wrapper;https://f-droid.org/en/packages/de.jonasbernard.tudarmstadtmoodlewrapper/;Open Moodle links of the TU Darmstadt in the official Moodle appDisclaimerNeither is this an officail project by the TU Darmstadt nor by Moodle This is just started by me a student at the TU Darmstadt that has to much spare timeThe Moodle at the TU Darmstadt regularly sends me mails with Moodle links to courses forum posts and other content on Moodle I always read thosemails on my android phone but clicking on those links from the mails results in opening the browser I installed the official Moodle App and wanted the links to open in the Moodle AppAs this is not nativly supported by the Moodle App I sat down and coded this little app that redirects links to the Moodle AppAfter the app was finished I wondered if someone else could find this useful The app is minimal and easy to use Just install it and allsupported links can be opened in MoodlePrerequisitesYou will need to have and android phone with at least Android 60 Marshmallow and the official Moodle App with at least version 2 installedWhich moodle links are supportedThis app supports the folloing Moodle URLs https only moodletudarmstadtde standard Moodle moodleinformatiktudarmstadtde computer science Moodle vorkursmathematiktudarmstadtdemoodlevorkurs Moodle for the mathematicans preliminary course wwwdidmathematiktudarmstadtdemoodle some other probably outdated Moodle installation I foundIf the TU Darmstadt has any other Moodle URLs I should include open an issue and let me knowHow to uninstall the appThe app wont show up on your home screen This is intended as there is no need for a home screen iconTo uninstall the app open your System Settings  Apps  search for TU Darmstadt Moodle Wrapper;https://f-droid.org/repo/de.jonasbernard.tudarmstadtmoodlewrapper_2.apk;This version requires Android 6.0 or newer.;https://github.com/JonasBernard/TU-Darmstadt-Moodle-Wrapper;https://github.com/JonasBernard/TU-Darmstadt-Moodle-Wrapper/issues
NLWeer;https://f-droid.org/en/packages/foss.cnugteren.nlweer/;NLWeer is a simple opensource and privacyfriendly Dutch weather app for Android 50 or newer It is free both as in free lunch and as in freedom Weather information is provided by KNMI or optionally by Buienradar see the about screen in the app for more informationCompared to other weather apps for the Netherlands eg Buienradar here are some reasons to use NLWeer instead It is opensource and can be customizedimproved by anyone if needed It does not nor never will display commercial advertisements It does not require any permissions except for GPS if explicitly requested It is very lightweight and battery friendly It does not require the Google Play ServicesFeatures of NLWeer Includes weather maps as well as a written weather report Includes weather information from multiple sources Three options for localisation manual lonlat coordinates mobile service provider or GPS Includes a precipitation prediction graph on your current location;https://f-droid.org/repo/foss.cnugteren.nlweer_11.apk;This version requires Android 5.0 or newer.;https://github.com/CNugteren/NLWeer;https://github.com/CNugteren/NLWeer/issues
Fiddle Assistant;https://f-droid.org/en/packages/com.github.gschwind.fiddle_assistant/;Music tuner with a logging feature that help to check if the user play in tune;https://f-droid.org/repo/com.github.gschwind.fiddle_assistant_110.apk;This version requires Android 6.0 or newer.;https://github.com/gschwind/fiddle-assistant;https://github.com/gschwind/fiddle-assistant/issues
Covid19 Stats;https://f-droid.org/en/packages/com.gabriel.covid19stats/;Its a simple app to visualize charts and statistics about the current Covid19 emergency All the data visualized in the app is taken from the website worldometersinfocoronavirus ;https://f-droid.org/repo/com.gabriel.covid19stats_14.apk;This version requires Android 4.1 or newer.;https://github.com/GabrielTavernini/Covid19Stats;https://github.com/GabrielTavernini/Covid19Stats/issues
Mebis (Unofficial);https://f-droid.org/en/packages/com.asdoi.mebis/;This unofficial app displays mobile Mebis websitesYou must set link username and password to use the appFEATURESa All features of mobile Mebis websitesa Automatic logina Own bookmark managementa App protection by pina Small app size 3mba Gesture navigationa No adsa No unnecessary permissionsa Open Source httpsgitlabcomasdoiMebisAppThis is a fork of FOSS Moodle by Gaukler Faun;https://f-droid.org/repo/com.asdoi.mebis_150.apk;This version requires Android 5.0 or newer.;https://gitlab.com/asdoi/MebisApp;https://gitlab.com/asdoi/MebisApp/issues
