Anki Image Occlusion;https://f-droid.org/en/packages/io.krmanik.ankiimageocclusion/;Create image occlusion for AnkiDroidAnki Image Occlusion app used to create normal group and combine cloze anki cards for reviewing and studying cards in Anki software spaced repetition flashcard app httpsappsankiwebnet The cards generated by this app will be added to AnkiDroid app Android version of Anki Software This app is like addon for AnkiDroid So before using this app please make sure you have installed AnkiDroid on your devicehttpsgithubcomkrmanikimageocclusioninbrowserusage;https://f-droid.org/repo/io.krmanik.ankiimageocclusion_14800.apk;This version requires Android 5.1 or newer.;https://github.com/krmanik/Anki-Occlusion;https://github.com/krmanik/Anki-Occlusion/issues
Calculator Notification;https://f-droid.org/en/packages/com.tananaev.calculator/;How many times did you want to use calculator without suspending the app that you are currently using Now its possible with Calculator application in the notification areaThe app is very minimalistic but it includes all the essential functionality including copying and pasting data Design was inspired by the official Android calendar application On Android Nougat and later you can add settings tile for the Calculator so you do not need to leave any app to launch the Calculator;https://f-droid.org/repo/com.tananaev.calculator_11.apk;This version requires Android 4.1 or newer.;https://github.com/tananaev/calculator-notification;https://github.com/tananaev/calculator-notification/issues
Docspell Share;https://f-droid.org/en/packages/org.docspell.docspellshare/;Docspell Share adds Docspell to the Android share menu to easily push files to your Docspell serverIt requires a running Docspell server instance which you can host yourself for free Use specialized scan apps like OpenNoteScanner on FDroid OpenScan or Office Lens to create documents and push them directly to your server Docspell allows for different upload URLs where each may define additional metadata to add eg tags This app lets you manage these upload URLs you can Maintain a list of Docspell URLs to upload to Select an URL each time or set a default onePermissions CAMERA optional it is used to scan QR codes for conveniently copying URLs from a screen INTERNET to upload a file to a remote Docspell serverDocspell consumes your files extracts and analyses the text and adds metadata automatically It lets you manage your documents with minial effort Check out the documentation;https://f-droid.org/repo/org.docspell.docspellshare_40.apk;This version requires Android 5.0 or newer.;https://github.com/docspell/android-client;https://github.com/docspell/android-client/issues
aksharam;https://f-droid.org/en/packages/in.digistorm.aksharam/;Aksharam is an easy to use reference app to learn Indian language scripts by comparing the alphabets Know the script for an Indian language See what those letters look like in a different Indian languageFeaturesTap a letter to see what it corresponds to in a different languageLong tap a letter to see more detailed information about a particular letterIncludes easy to visualise comparison of vowels consonants and joint lettersSee how letters combine with each other consonants  vowels consonants  consonantsTransliteration of text into a script you can understandPractice your ability to recognize the script for a language by typing in corresponding letters in a language you are familiar withNote This app is designed for those who already know the script for an Indian language Currently Kannada Hindi and Malayalam languages are supported UI language is in English;https://f-droid.org/repo/in.digistorm.aksharam_6.apk;This version requires Android 5.0 or newer.;https://github.com/NyxTrail/aksharam;https://github.com/NyxTrail/aksharam/issues
Baby Books;https://f-droid.org/en/packages/com.serwylo.babybook/;Make your own booksCreate your book search for wiki pages watch images and text flow onto your pagesLearn with your kidsInterested in biology Want to build a book for you and your kids to learn more about it Try creating a new book add some pages by searching for Organism Animal Plant and then Fungi then watch your book come to lifeShare your creationsGenerate a PDF and email it to a friend or print it for your own physical bookLimitationsThis is still in the early stages of development Some things which are on the roadmapProper attribution for Wikipedia sources in resulting PDFsMore intuitive swipe controls eg for changing pages when reading or for reordering pages in a bookSelect your favourite images from a wiki page instead of being forced to use the one the app selectedSharing of books between Android devices to support remixing and improving others books rather than just PDF export as we have nowDonate via Liberapay or GitHub Sponsors to support further development;https://f-droid.org/repo/com.serwylo.babybook_10.apk;This version requires Android 5.0 or newer.;https://github.com/babydots/babybook;https://github.com/babydots/babybook/issues
Kaku;https://f-droid.org/en/packages/ca.fuwafuwa.kaku/;Kaku is a fast powerful Japanese dictionary that stays on top of all your apps It uses optical character recognition OCR technology to recognize kanji on the device screen for you rather than the slowww tedious process of looking up individual characters manually making it perfect for Japanese learners who want to study by reading raw manga play untranslated games and so on without the hassle of switching apps;https://f-droid.org/repo/ca.fuwafuwa.kaku_78.apk;This version requires Android 5.0 or newer.;https://github.com/0xbad1d3a5/Kaku;https://github.com/0xbad1d3a5/Kaku/issues
VocableTrainer;https://f-droid.org/en/packages/vocabletrainer.heinecke.aron.vocabletrainer/;Vocabulary and word trainer to memorize foreign languages and remember definitions Flashcard like system training progress based on correct and incorrect answers multiple meanings per entry dark mode support android 81 training mode for entering one meaning training mode for entering all meanings training mode for writing down on real paper import and export to spreadsheet CSV files with full utf8 supportPrivacyInternet access is used only for one OPTIN survey and OPTIN crash reporting;https://f-droid.org/repo/vocabletrainer.heinecke.aron.vocabletrainer_25.apk;This version requires Android 5.1 or newer.;https://github.com/0xpr03/VocableTrainer-Android;https://github.com/0xpr03/VocableTrainer-Android/issues
SimplyTranslate Mobile;https://f-droid.org/en/packages/com.simplytranslate_mobile/;This app is an alternative frontend to Google Translate but doesnt directly connect to itIt works as follows1 Text is submitted from you the user and sent to a random SimplyTranslate instance server2 This instance will request that data from Google Translate3 Google Translate will send the translation back to that instance4 That instance will send the translation back to youThis way Google Translate wont know your identity Auto selecting a random instance default mode each request will obfuscate and spread your data more between instances so nothing will be linked easily as its not in a centralized databaseFeatures Supports 108 languages TextToSpeech TTS Can receive shared text from other apps A translate button in the text selection toolbar Auto random instance selection each request An updatable official list of SimplyTranslate instances Custom instance option Dark theme Camera Text Recognition;https://f-droid.org/repo/com.simplytranslate_mobile_8.apk;This version requires Android 5.0 or newer.;https://github.com/ManeraKai/simplytranslate_mobile;https://github.com/ManeraKai/simplytranslate_mobile/issues
LfDI BW;https://f-droid.org/en/packages/de.bwl.lfdi.app/;All news and communication channels of the LfDI BW in one placeThe app offers the possibility to retrieve information of the Data Protection and Freedom of Information Authority for the German state of BadenWA14rttemberg on an Android smartphone;https://f-droid.org/repo/de.bwl.lfdi.app_2.apk;This version requires Android 5.0 or newer.;https://gitlab.lfdi-bw.de/LfDI/lfdi-app-android-public;None
Planisphere;https://f-droid.org/en/packages/org.tengel.planisphere/;The app shows the sky for an user defined point of time and an arbitrary location on the earth sun and moon over 9000 stars constellation lines constellation names in English Latin or as abbreviation constellation boundaries all eight planets of the solar system azimuthal grid equatorial grid horizon ecliptic celestial equatorThe location can be entered manually or is provided by the device There are several options to enable or disable elements of the chart select the maximum apparent magnitude or choose the color theme No Internet connection required;https://f-droid.org/repo/org.tengel.planisphere_13.apk;This version requires Android 4.0.3 or newer.;https://github.com/tengel/AndroidPlanisphere;https://github.com/tengel/AndroidPlanisphere/issues
Aard 2;https://f-droid.org/en/packages/itkach.aard2/;Aard 2 for Android is a successor to aarddictandroid It comes withredesigned user interface bookmarks history and a better dictionary storageformat;https://f-droid.org/repo/itkach.aard2_53.apk;This version requires Android 4.4 or newer.;https://github.com/itkach/aard2-android;https://github.com/itkach/aard2-android/issues
Plant Sense;https://f-droid.org/en/packages/com.macpoule.plantsense/;Plant Sense is the companion app for the Arduino project ofthe same name to measure the soil moisture of your plantsWhy To know whether the plant is thirstyThe hardware transmits soil moisture and ambient temperaturehumidityvia Bluetooth The app connects to the Bluetooth and displays the latest readings;https://f-droid.org/repo/com.macpoule.plantsense_1.apk;This version requires Android 7.0 or newer.;https://github.com/reaper47/plant-sense;https://github.com/reaper47/plant-sense/issues
PariDroid;https://f-droid.org/en/packages/fr.ubordeaux.math.paridroid/;PariDroid is a native port of PARIGP to AndroidPARIGP is a widely used computer algebra system designed for fast computations in number theory factorizations algebraic number theory elliptic curves but also contains a large number of other useful functions to compute with mathematical entities such as matrices polynomials power series algebraic numbers etc and a lot of transcendental functions;https://f-droid.org/repo/fr.ubordeaux.math.paridroid_25.apk;This version requires Android 4.4 or newer.;https://pari.math.u-bordeaux.fr/cgi-bin/gitweb.cgi?p=paridroid.git;https://pari.math.u-bordeaux.fr/Bugs
Spell4Wiki;https://f-droid.org/en/packages/com.manimarank.spell4wiki/;Wikimedia Commons Audio Upload ToolSpell4Wiki is a mobile application to record and upload ogg audio files for Wiktionary words to Wikimedia commonsSpell4Wiki also act as a WikiDictionaryWord meaning from WiktionaryApp FeaturesSpell For Wiktionary  You can record  upload audio for the list of Wiktionary words to Wikimedia commonsSpell For WordList  You can upload for your own list of words from a text file or copy  pasteSpell For Word  You can spell and upload for a single wordWiktionary Explore  You can search meaning from Wikitionary for any words in any languagesPurpose of this applicationThere are plenty of words in the Wiktionary But they do not have enough pronunciation audio files So we can upload pronunciation audio for words in a simple wayAnd we can use those pronunciation for wiki data planning and other technologies like machine learning under CClicense And other linguists can learn how to pronounce a wordPowered ByKaniyam Foundation TamilNaduVGLUG Free Software Activists and Tamil Wikimedia CommunityNoteThis app load some configurationavailable language list categories  contributors details from the apps repoUseful LinksJoin the Telegram group spell4wikiSpell4Wiki Commons Page  CommonsSpell4WikiMore details about development  Blog Post about Spell4WikiTuttorial  Demo Videos  Play Videos;https://f-droid.org/repo/com.manimarank.spell4wiki_13.apk;This version requires Android 4.4 or newer.;https://github.com/manimaran96/Spell4Wiki;https://github.com/manimaran96/Spell4Wiki/issues
Open Ear;https://f-droid.org/en/packages/com.openear.www/;OpenEar is an open source ear training app for musicians Its goal is to provide a flexible variety of exercises so musicians will be able to master recognizing any musical pattern that might help them become better musiciansCurrently includes the following built in exercises1 Identify interval2 Identify note in a tonal context3 Identify chord  chord progressions in a tonal context4 Identify a triad chord inversion in close position;https://f-droid.org/repo/com.openear.www_13.apk;This version requires Android 5.0 or newer.;https://github.com/ShacharHarshuv/open-ear;https://github.com/ShacharHarshuv/open-ear/issues
Hertz contact;https://f-droid.org/en/packages/com.mlkyh.hertz/;Hertz contact application provides calculation on static mechanical ballonflat contact using materials properties;https://f-droid.org/repo/com.mlkyh.hertz_5.apk;This version requires Android 4.1 or newer.;https://gitlab.com/tribology/hertz;https://gitlab.com/tribology/hertz/issues
NuSimi;https://f-droid.org/en/packages/com.ketanolab.nusimi/;NuSimi originally SimiDic is the first freeopen source electronic dictionary for Android mobile devices The app was created to maintain the vitality of native languages through mobile phones y promote the learning and literary use of these languages It includes 30 dictionaries of 11 Native American languagesFor students travelers and the general public NuSimi is the perfect tool which doesnat need an internet connection to function Download it on your cell phone and take in anywhere you want to goAYMARAa F Layme 2011 Diccionario BilingA14e AymaraCastellano 5a eda S Callo Diccionario AymaraCastellano y CastellanoAymara aKAMISARAKIa 2a eda UMSATIC Glosario de nuevos tArminos aimarasa L Bertonio 1612 Vocabulario de la Lengua Aymaraa Min Edu PerAo 2005 Yatiqirinaka Aru Pirwa Qullawa Aymara Arua ILCNA 2021 Aru Pirwa AymaraAYMARAQUECHUAGUARANAa MinEduBolivia 2004 ARUSIMIAEE castellano aymara guaranA qhichwaGUARANAa ComitA HABLE GuaranA 1996 RE ru AaneAee 2a eda Ortiz y Caurey 2011 Diccionario etimolA3gico y etnogrAficoMAPUCHEa Mapuche WixaleyiA 2013 Vocabulario MapucheCastellanoMOCHA MAYAa A GuzmAn 2004 Manual MochA3MOJEAO IGNACIANOa ILC aSalvador Chappy Muibara 2021 Diccionario MojeAo IgnacianoMOJEAO TRINITARIOa ILC aJosA Santos Noco Guajia 2021 Taechirawkoriono Vechjiriiwo TrinranonoMOSETANa OPIM UMSS y PROEIB Andes 2011 Kirjka pheyakdyea tA msia tsinsiakhan kastellanokhanMOVIMAa Edu Intercultural BilingA14eMovima 2007 Diccionario MovimaQUECHUAa AMLQ 2005 QheswaaEspaAolaQheswa Simi Taqe 2a eda T Laime et al 2007 Iskay simipi yuyaykaancha 2a eda D GonzAlez HolguAn 1608 Vocabvlario de la Lengva General de todo Perva R CerrA3nPalomino 1994 Quechua SureAo Diccionario Unificadoa AMLQ ApurAmac 2007 Apurimaqpaq Runasimi Taqea MinEduPerAo 2005 Yachakuqkunapaq Simi Qullqa Qusqu Qullaw Chichwa Simipia MinEduPerAo 2005 Yachakuqkunapa Simi Qullqa Ayakuchu Chanka Qichwa Simipia MinEduPerAo 2005 Yachakuqkunapa Shimi Qullqa Anqash Qichwa Shimichawa Herrero y SAnchez 1983 Diccionario quechua cochabambino contemporAneoa ILCNQ 2018 Qhichwa simipirwa Diccionario de la NaciA3n QuechuaQUECHUAAYMARAa Franciscanos y MinEduPerAo 19051998 Diccionario PolAglota Incaico Cuzco Ayacucho JunAn Ancash y AymarATAKANAa CIPTA UMSS y PROEIB Andes 2011 Mimi butsepi TakanaKastillanu KastillanuTakanaTSIMANEa ChimanAa Edu Intercultural BilingA14eTsimanea 2007 Diccionario TsimaneaURUa K HannA 2013 Vocabulario Uru UchumataquNuSimi means amy languagea from anua my in MojeAoArawak and asimia language in Quechua because the language which we speak is an essential part of our identity and culture and we shouldnat be alienated from our native languages by modern technology If you know other dictionaries that we can include in NuSimi please contact usNu from MojeAoArawak is pronounced like the word gnu with a silent g in English and we share the free software principles of the GNU Project Nu is also pronounced like anewa and NuSimi is a new version of our SimiDic app created in 2011 We have changed the code from Java to Kotlin and it functions in Android 512NuSimi has a freeopen source GPL 30 license and its code is available at httpsgithubcomKetanoLab so that you can improve and adapt it for your needs It includes Simidic Builder to import additional dictionaries in StarDict format The app is the fruit of a collaboration between KetanoLab wwwketanolabcom and the Instituto de Lenguas y Literaturas AndinasAmazonicas ILLACharacteristicsInteractive searches while typing wordsFavorite words can be saved for quick referenceUse of regular ASCII letters to search for letters with diacritical marks such as A and AQuick display of search results;https://f-droid.org/repo/com.ketanolab.nusimi_7.apk;This version requires Android 5.0 or newer.;https://github.com/KetanoLab/Nusimi-android/;https://github.com/KetanoLab/Nusimi-android/issues
Digitales Klassenzimmer;https://f-droid.org/en/packages/de.hoppfoundation.klassenzimmer/;Diese auf Jitsi basierende App stellt die Hopp Foundation ihren Kooperationsschulen in der Metropolregion Rhein Neckar zur VerfA14gung um virtuelle Klassenzimmer zu ermAglichenSie stellt eine Alternative zum Chrome Browser oder Chromium dar und hat einen geringeren Funktionsumfang Sie kAnnen diese App nur nutzen wenn Ihre Schule einen Account hat und Ihnen von Ihrer Schule die entsprechenden Einwahldaten zur VerfA14gung gestellt wurden;https://f-droid.org/repo/de.hoppfoundation.klassenzimmer_6518916.apk;This version requires Android 6.0 or newer.;https://github.com/HoppFoundation/jitsi-meet;None
Seasonal Foods Calendar;https://f-droid.org/en/packages/flunzmas.seasoncalendar/;This App shows you which foods are in Season right now and are thus available from nearby produce Not only are they cheaper and tastier but also their transport is less harmful to our environmentFeatures Boasts the biggest collection of foods Lets you pick and view your favorites Open Source Can be run on a variety of android devices Data presets currently available Central EuropePlease keep in mind that the actual availability of foods in your local supermarket can differ from the information shown hereLicense note this app is subject to the GNU GPL30 license with the exception of the database files in the assets folder assetsdb Please contact me before reusing them;https://f-droid.org/repo/flunzmas.seasoncalendar_45.apk;This version requires Android 4.1 or newer.;https://github.com/Flunzmas/seasoncalendar;https://github.com/Flunzmas/seasoncalendar/issues
ForgetMeNot;https://f-droid.org/en/packages/com.odnovolov.forgetmenot/;ForgetMeNot is an app for memorizing information via flashcards Simplicity usability speed were taken into account in the process of developing this educational program This app provides excellent conditions for achieving high efficiency of memorizationThe features that are supported are    a Importexport of files    a Support CSV Tab text or any other kind of DelimiterSeparated Values    a Intervals Spaced repetition You can specify your own interval scheme for each deck Also it is possible to indicate ones own algorithm of how the answers affects the choice of the next interval    a Several test methods There are Self testing Testing with variants Spell check    a Pronunciation of the text via TTS You can choose languages for questions and answers enable autospeaking of them    a Hiding the text of a question to stimulate improvement of listening skills that is very useful in foreign language learning    a Card inversion    a Hints in the form of masking letters    a Motivational timer that will make you concentrate on your studies optionally    a Saving settings of deck as presets and reusing them in order to avoid routine work on settings    a Editing and searching cards right in the exercise    a Walking mode that enables you do the exercise without looking at the screen    a Autoplaying mode In this mode questions and answers are pronounced sequentially You can combine your own activities and repetition of teaching material    a Catalog of premade decks The catalog contains many decks for language learning which includes basic sets of words thematic words and phrases whole sentences    a Grouping decks into separate lists    a Customizing the card appearance    a Dark themeWhat makes ForgetMeNot so efficient for memorizing     No amount of advertising You can handle a lot of cards in a short time due to the simplicity and convenience of the user interface Nothing prevents you from studying     The exercise is designed so that you must eventually grasp the answer If your answer is wrong the card is postponed to the end of the list until you answer correct     Intervals Spaced repetition Spaced repetition reduces the forgetting that occurs when material is not encountered for a significant time period It also involves actively recalling learned material which supports learning     Possibility to edit a card just in the exercise This allows you not only to correct mistakes but also to rebuild cards if they are difficult to remember For example you can add an additional association in parentheses     Voice accompaniment This is especially helpful when learning languages because it improves listening skills helps to focus on studying and favors memorization You can even set up a deck to perceive a question exceptionally by ear     Modes that allow you to practice not only in your free time Walking mode enables you do the exercise during walking Autoplaying mode lets you listen to questions and answers when your hands and eyes are busy but your ears are free       Focusing aids Motivational timer reminds you when youve lost your attention Full screen mode hides the status bar which might be an additional source of distractionForgetMeNot is free and opensource softwarehttpsgithubcomtema6120ForgetMeNot;https://f-droid.org/repo/com.odnovolov.forgetmenot_17.apk;This version requires Android 5.0 or newer.;https://github.com/tema6120/ForgetMeNot;https://github.com/tema6120/ForgetMeNot/issues
Extended emulator of МК 61/54;https://f-droid.org/en/packages/com.cax.pmk.ext/; 61 was the best seller of all USSR programmable calculators of 1980s B334 MK54 MK56 MK61 MK52Calculators are emulated on microcode level so they behave exactly like the original devices including all nondocumented features and inaccurate calculations For ease of use application features saving and loading emulation statesThis apps emulation engine Java code is based on C source of Felix Lazarevs emu145 projectEmulation was highly optimized for speed and should run in real time on any phoneIts an extended version of the original emulator  6154 by Stanislav Borutskyhttpsplaygooglecomstoreappsdetailsidcomcaxpmk This version allows to exportimport programs from external files and contains some UI improvementsHint 0 you can found the list of all tips in the About dialogHint 1 touch calculators indicator to toggle slowfast mode Indicators blinking looks better in slow modeHint 2 you can choose between MK61 and MK54 using menu option that becomes visible when calculator is switched off Hint 3 with the menu Import you can import programs from external files several such programs you can find in httpsxvadimgithubioxbasoftpmkpmkhtmlHit 4 you can open menu by long tap on the o label;https://f-droid.org/repo/com.cax.pmk.ext_331.apk;This version requires Android 4.4 or newer.;https://github.com/xvadim/pmk-android;https://github.com/xvadim/pmk-android/issues
Mastercom workbook;https://f-droid.org/en/packages/com.stypox.mastercom_workbook/;This is an unofficial client for the Mastercom Workbook a tool for school studentsFeatures Login support for many schools selectable from a popup Subjects calculate averages and needed marks plot graphs and view topics Marks view all marks in a list or in a graph and calculate the overall average Topics view all topics also with a filter for homework Timetable view the timetable of school days Events view color coded events Documents find and download documents Light dark and black themes are available;https://f-droid.org/repo/com.stypox.mastercom_workbook_700.apk;This version requires Android 4.0 or newer.;https://github.com/Stypox/mastercom-workbook;https://github.com/Stypox/mastercom-workbook/issues
Learning Memory;https://f-droid.org/en/packages/eu.quelltext.memory/;This memory is a learning experience for children aged 4Through different challenges they can learn counting numerics and readingThe different game modes and adjustable levels of difficulty allow the child to play with and without guidanceThis game is also available as a web version at httpmemoryquelltexteu for you to try outThese modes can be played in three different difficulties with six twelve or twentyfour cards counting dots and finding the numbers big and small letters adding numbers subtracting numbersIf you and your child like to play an additional game mode please do not hesitate to contact usIf you are a developer or want to become one you can extend the game with the modes you would like to see in itThe internal API and documentation make creating these extensions easyThe game is an opensource software under AGPL so that you are allowed to copy distribute and modify itCode of honor This game is child and privacy friendly no advertisement no communication over the Internet source is open and publicly disclosed no inapp puchases;https://f-droid.org/repo/eu.quelltext.memory_7.apk;This version requires Android 1.0 or newer.;https://github.com/niccokunzmann/app.memory.quelltext.eu;https://github.com/niccokunzmann/app.memory.quelltext.eu/issues
