Workout Time!;https://f-droid.org/en/packages/es.ideotec.workouttime/;Home ScreenLists all workouts the app comes with two predefined workouts and others can be created or imported Tapping on the pencil icon on the left of a workout will go to the Edit Screen tapping on the title or duration of a workout will start it from the beginning tapping on the a symbol on the right will show a list of the exercises it contains Each exercise has a preparationrest time before it shown on the left and a duration shown on the right Tapping on an exercise in the list will start the workout at that exercise To add a new workout tap on the  button on the bottom right corner and select Create to build it from scratch or Import to load a workout in JSON format At the topright corner of the home screen are two icons a calendar with a checkmark in it tapping this will go to the Log Screen and a gear tapping this will go to the Settings ScreenWorkout ScreenWhen a workout is running there is a progress bar at the top showing the current point in the workout with the time elapsed on the left and the time remaining indicated with a  on the right In between these two times are a series of dots that represent the exercises in the workout with the current exercise highlighted in blue Below this is the name of the current exercise During the exercise preparation time the name will have Get ready for before it tapping on this will skip the preparation and begin the exercise Below the exercise name is a stopwatch showing the current progress in that exercise with the remaining time in the middle Tapping on the stopwatch will pause the workout indicated by blinking time inside the stopwatch and tapping again will resume it At the bottom of the screen is the name of the next exercise Tapping on this will skip to the next exerciseEdit screenLists all exercises in a workout with the preparation time on the left and the duration on the right To change an exercise tap on it and the two times will become spinners that can be swiped up or down to modify the time Longpressing on the spinner allows modifying the number with the keyboard must be a number of seconds without any punctuation Tapping on the exercise name will bring up the keyboard to edit it Under the name are three icons an up arrow to move the exercise higher in the list a down arrow to move it lower and a trash can to delete the it In the topright corner of the screen are two icons a download icon to save the workout in JSON format to the Downloads folder and a trash can to delete the entire workoutLog ScreenLists all the executions of workouts with the date and time on the left and the name of the workout on the right At the topright corner of the screen is a download icon that will save this list in JSON format to the Downloads folderSettings ScreenThis screen has three dropdown menus to select the sound to play for the last 3 seconds of preparationexercise time at the start and end of each exercise and at the end of the workout There are 4 options for each nothing a beep a ding or an applause;https://f-droid.org/repo/es.ideotec.workouttime_13.apk;This version requires Android 4.1 or newer.;https://gitlab.com/ideotec/workouttime;https://gitlab.com/ideotec/workouttime/issues
Nextcloud Cookbook;https://f-droid.org/en/packages/de.micmun.android.nextcloudcookbook/;This app is a viewer for recipes in Nextcloud App You need another app eg the Nextcloud Android client to sync the recipes to your Android deviceFirst stepsAfter installation you must go into the settings view and select the recipe directory with the recipes inside When using the Nextcloud Android client you find it on your storage under Androidmediacomnextcloudclientnextcloudyour accountfolderYou also can choose the theme in the settingsAfter that the start view has a list of recipes and you select a recipe to view the detailsIMPORTANT With direct pick of the nextcloud folder there will no images shown and the uri cant be stored right Perhaps at next app start no recipes can be loadedTherefore it is better to use the above mentioned path on the SD card see First steps;https://f-droid.org/repo/de.micmun.android.nextcloudcookbook_270.apk;This version requires Android 6.0 or newer.;https://codeberg.org/MicMun/nextcloud-cookbook;https://codeberg.org/MicMun/nextcloud-cookbook/issues
EnRecipes;https://f-droid.org/en/packages/com.vishnuraghav.EnRecipes/;EnRecipes is an open source privacyfriendly digital cookbook that lets you create manage and share your recipesFeatures Create recipes quickly Add photo combinations and notes to your recipes Organise your recipes by cuisine category and tags Add recipes to your Try Later list and mark them as favourites Quickly search for recipes by title or ingredient Scale your recipe ingredients to serve more or less people Get notified of the last time you tried a recipe Share your recipe to anyone by any means as a nicely formatted message You can share the recipe photo too Shake your device to view a random recipe Create meal plans Set cooking timers You can Import or Export your data Has Light Dark and Black themesHighlights 100 free and opensource Private by Design No special permissions required No annoying ads or popupsCreditsThis app was written in my free time using NativeScriptVue I would like to thank all those people who helped me understand the concepts during the process and my special thanks to the NativeScript team and the community I also would like to thank the members of the Telegram EnRecipes group for contributing their ideas for this project;https://f-droid.org/repo/com.vishnuraghav.EnRecipes_3.apk;This version requires Android 6.0 or newer.;None;None
HeartBeat;https://f-droid.org/en/packages/eu.berdosi.app.heartbeat/;Simple way to estimate the heart rate Please do not use it for medical purposes This utility works by covering the flash as well as the devices camera with a finger and waiting for 10 seconds It works best when the person stays still and the environment is dark The phone analyzes the amount of red captured by the camera and attempts to calculate the heart rate based on the subtle changes it detectsDuring the measurement the application shows the current calculation results and shows the captured data on a line chartOnce completed the following further details are shownStandardized values along with their timestamp the values are scaled between 0 and 1 and a rolling average is applied for smoothingTimings where a new heart beat is detectedThese data can be shared with other application in order to be exported;https://f-droid.org/repo/eu.berdosi.app.heartbeat_5.apk;This version requires Android 5.0 or newer.;https://github.com/berdosi/HeartBeat;https://github.com/berdosi/HeartBeat/issues
WaterTracker;https://f-droid.org/en/packages/com.ktprograms.watertracker/;WaterTracker is a simple app that reminds you to drink waterSimply tap on each glass to drink The glasses go down from full to empty at each tap Alarm of your chosen duration restarts every time you touch a glassA Drink water notification will be displayed if you have not drank for your chosen duration Tapping the notification goes to the appWhen all 5 glasses are empty the notifications will no longer come until you restart them and a Congratulations message will appear;https://f-droid.org/repo/com.ktprograms.watertracker_5.apk;This version requires Android 6.0 or newer.;https://github.com/ktprograms/WaterTracker;https://github.com/ktprograms/WaterTracker/issues
LibreHealth Essential Care For Every Baby;https://f-droid.org/en/packages/io.librehealth.mhbs.essential_care_for_every_baby/; Welcome to LibreHealth Essential Care For Every Baby ProjectThis is an Android application to provide clinical decisionsupport for nurses and doctors delivering essential newborn care interventions during the first day of life This application provides knowledge skills and competencies to nurses and doctors in lowmiddleincome settings so that they can provide lifesaving care to newborns from birth through 24 hours postnatal App uses DHIS2 as backend  can be setup for any hospitalorganizationFeatures Ability to track multiple babies at a time Timestamping births to generate an essential newborn care clock for each baby being tracked in the app Automated classification of babies health status based on results from observations and assessments that are conducted during the first 2 hours after birth Automated advice on management of babies based on their classification Remindersalerts to provide recommended essential newborn care interventions If particular interventions are not delivered on time or at all capture of information regarding why this essential newborn care was late or missedDownload the Android application now and check it out;https://f-droid.org/repo/io.librehealth.mhbs.essential_care_for_every_baby_1.apk;This version requires Android 4.1 or newer.;https://gitlab.com/librehealth/incubating-projects/mhbs/lh-mhbs-eceb;https://gitlab.com/librehealth/incubating-projects/mhbs/lh-mhbs-eceb/-/issues
Siteswap Generator;https://f-droid.org/en/packages/namlit.siteswapgenerator/;The Siteswap Generator is designed for passing Siteswap generation and analysis The following features are supported Find all possible Siteswaps for a given period length and number of objects Easy filtering of zips zaps and holds via check boxes Automatic filtering of nonpassable patterns Support for pattern and interface filters Generation of local Siteswaps and calculation of start position Support for asynchronous passing patters with more than two jugglers Generation of very long patterns in a random mode;https://f-droid.org/repo/namlit.siteswapgenerator_34.apk;This version requires Android 4.0.3 or newer.;https://github.com/namlit/siteswap_generator;https://github.com/namlit/siteswap_generator/issues
Splitfit;https://f-droid.org/en/packages/com.noahjutz.splitfit.fdroid/;Splitfit is an opensource gym tracker It allows for easy creation of workout routines and custom exercises Perform workouts and track your progress;https://f-droid.org/repo/com.noahjutz.splitfit.fdroid_33.apk;This version requires Android 5.0 or newer.;https://github.com/noahjutz/Splitfit;https://github.com/noahjutz/Splitfit/issues
SINE Isochronic Entrainer;https://f-droid.org/en/packages/com.dosse.bwentrain.androidPlayer/;SINE Isochronic Entrainer is a brainwave entrainment application withtons of sessions of isochronic tones Anything from relaxation tofocus enhancement to simulating drugs we have itFeatures Isochronic tones player Lots of sessions for all skill levels A community of creators that regularly adds new sessions Respects your privacy;https://f-droid.org/repo/com.dosse.bwentrain.androidPlayer_26.apk;This version requires Android 4.0.3 or newer.;https://github.com/adolfintel/sine-android;https://github.com/adolfintel/sine-android/issues
LibreCHovid;https://f-droid.org/en/packages/ch.corona.tracing/;LibreCHovid is a fork of the official SwissCovid contact tracing app for Switzerland It does not rely on the proprietary GoogleApple Exposure Notification framework but uses instead the compatible microG free implementation It will therefore run on devices without Google Mobile ServicesThe functionality of the application is the same as the original However as it does not have the privileges granted to GMS its ability to run reliably in the background may be affected Our internal tests have shown it to behave well on various systems but your mileage may varyPlease note that this fork is not supported by the Swiss authorities;https://f-droid.org/repo/ch.corona.tracing_20010.apk;This version requires Android 6.0 or newer.;https://github.com/c4dt/dp3t-app-android-ch/;https://github.com/c4dt/dp3t-app-android-ch/issues
Daily Pill — Medication Reminder;https://f-droid.org/en/packages/br.com.gualandi.dailypill/;Ideal if you need to take your medicine every morning Daily Pill shows a reminder on your lock screen which is visible in the first time you pick up the phone in the morning Respond with the press of a single button without unlockingIf you need need to take your medicine on an empty stomach this app also remembers the exact time when you last took itDaily Pill is free and open source software It does not display ads and does not collect your personal information;https://f-droid.org/repo/br.com.gualandi.dailypill_14.apk;This version requires Android 4.1 or newer.;https://github.com/hugomg/DailyPill;https://github.com/hugomg/DailyPill/issues
Fruit Radar;https://f-droid.org/en/packages/eu.quelltext.mundraub/;Find plants and share them online You have your phone with you all the time When you find an edible plant you like to share with others you can record location type and a photo Later when you have Internet you can upload it to the map of free plants to eat Mundrauborg Features  Collect all plant data offline Integrated map to find plants Notifications when plants are nearby Plants and map in offline mode Plant sources FruitMaporg Mundrauborg NaOvocecz Publish plants to Mundrauborg and NaOvocecz  Permissions  CAMERA to take a photo of the plant GPS to autofill the location INTERNET to upload the plant and display a map STORAGE optional to         save the plants as JSON in an exportable format         and save the app log so you can help us when the app crashes      VIBRATE optional to be notified about plants nearby;https://f-droid.org/repo/eu.quelltext.mundraub_237.apk;This version requires Android 2.3 or newer.;https://github.com/niccokunzmann/mundraub-android;https://github.com/niccokunzmann/mundraub-android/issues
RxDroid;https://f-droid.org/en/packages/at.jclehner.rxdroid/;A simple medication reminder Also keeps track of your pill count and requiredrefillsHelp with translating RxDroid to your language atcrowdincom;https://f-droid.org/repo/at.jclehner.rxdroid_9342.apk;This version requires Android 4.0 or newer.;https://github.com/jclehner/rxdroid;https://github.com/jclehner/rxdroid/issues
TripSit;https://f-droid.org/en/packages/me.tripsit.tripmobile/;Brought to you by TripSit an organisation leading the online harm reductioncommunity this app provides a substantial amount of content intended to helpusers reduce the harm involved in taking drugs TripSit collects relevant andeasily digestible data on most recreational drugs including recommended dosagesand interactions with other substances and it This app pulls data directly from our database which isconstantly updated to reflect the latest scientific and anecdotal researchWe also provide chat rooms where people can get advice from real people withoutfear of persecution or judgement The chat option connects to the tripsitchannel which is used to provide care and assistance to people having adifficult time on a substance Our other channels can be used for generalconversation to ask questions about the content we provide or to get moreinformation on how to reduce the harm involved in drug usePlease note that this information is presented for educational purposes onlyand cannot include all of the information required to make informed decisionsregarding drug use all drugs affect every user differently Dosage andcombination data is provided as a general guideline not as a recommendation andnot as medical advice If you believe you are in need of medical aid then seekmedical attention immediately TripSit does not endorse drug use and while ourteam makes a best effort to provide accurate information we do not claim thatit is 100 correct Always do your own research and be safeWhile this app comes in many languages we ask that users use English in themain chat rooms This helps ensure the best level of communication to get adviceacross to users We also ask that users are mindful of the two primary rulesKeep a positive attitude and no solicitation Please conform to therules;https://f-droid.org/repo/me.tripsit.tripmobile_16.apk;This version requires Android 4.0 or newer.;https://github.com/TripSit/tripmobile;https://github.com/TripSit/tripmobile/issues
Dice Gainz;https://f-droid.org/en/packages/com.nazmar.dicegainz/;A random workout generator based on the General Gainz training method by Cody Lefever;https://f-droid.org/repo/com.nazmar.dicegainz_4.apk;This version requires Android 6.0 or newer.;https://github.com/ramzan/dicegainz;https://github.com/ramzan/dicegainz/issues
RacketGhost;https://f-droid.org/en/packages/com.markusborg.test/;Ghosting is an established training exercise in racket sports to practice courtmovement without a ball Moving to the various corners of the court improvesboth footwork and general stamina In the best of worlds your coach or sparringpartner will always be ready to point you to random corners at a pace thatpushes you to your limitsUnfortunately few people have access to a coach at all times thus have to runthe exercise on their own That means the randomness in the order of corners ismissingGetting Started1 Configure your ghosting session 2 Put your mobile device in front of you onthe court 3 Press GO to start your ghosting session;https://f-droid.org/repo/com.markusborg.test_19.apk;This version requires Android 4.0 or newer.;https://github.com/mrksbrg/RacketGhost;https://github.com/mrksbrg/RacketGhost/issues
HIIT;https://f-droid.org/en/packages/com.atr.hiit/;The first rule of Zombieland cardioHIIT high intensity interval timer is a no frills timer for interval training routines or anything you may need an interval timer for really You may specify a number of seconds for each active period a number of seconds for each rest period and optionally a number of seconds before the end of each rest period to warn of the upcoming active period giving you time to prepareNo adsNo trackersNo permissionsUltra simple interface;https://f-droid.org/repo/com.atr.hiit_3.apk;This version requires Android 4.0 or newer.;https://github.com/ATryder/HIIT;https://github.com/ATryder/HIIT/issues
LibreHealth Cost Of Care Explorer;https://f-droid.org/en/packages/io.librehealth.toolkit.cost_of_care/; Welcome to LibreHealth Cost Of Care ExplorerThe Goal of this LibreHealth Cost Of Care Explorer project is to provide patientfriendly costs of care to help patients get better cost estimates for medical procedures of US HospitalsFeatures User can view the chargemaster Search for a particular procedure in multiple hospitals chargemasters Sort data by Category or sort by price in ascending or descending order Users can also compare hospitals based on ratings  patients experience to get idea about hospital services This App can work offline and updates data once a monthDownload the Android application now and check it out;https://f-droid.org/repo/io.librehealth.toolkit.cost_of_care_3.apk;This version requires Android 4.1 or newer.;https://gitlab.com/librehealth/toolkit/cost-of-care/lh-toolkit-cost-of-care-app;https://gitlab.com/librehealth/toolkit/cost-of-care/lh-toolkit-cost-of-care-app/-/issues
Wine cellar;https://f-droid.org/en/packages/com.nathaniel.motus.cavevin/;This app is a wine cellar manager FeaturesListing of your bottles with characteristics appellation domain cuvee vintage and a few othersEasy stock managementPossibility to add a photoFull database exportimport with photosCSV export to handle the listing in another software so as to print a paper listing for exampleType filterMany predefined sort optionsWhats new in v13 Standard export works fine;https://f-droid.org/repo/com.nathaniel.motus.cavevin_4.apk;This version requires Android 4.4 or newer.;https://github.com/NathanielMotus/Cavevin;https://github.com/NathanielMotus/Cavevin/issues
Breathly;https://f-droid.org/en/packages/com.mmazzarolo.breathly/;Breathly allows you to focus on your breathing You can use Breathlyfor daily relaxation and breath training just choose a breathing techniqueand focus on the guided exercise;https://f-droid.org/repo/com.mmazzarolo.breathly_10.apk;This version requires Android 4.1 or newer.;https://github.com/mmazzarolo/breathly-app;https://github.com/mmazzarolo/breathly-app/issues
Hrm;https://f-droid.org/en/packages/st.wow.git.hrm/;Simple bluetooth lowenergy heart rate monitor with a stopwatch function totime your workouts Automatically connects to your lastused peripheral or youcan scan for nearby bluetooth devices;https://f-droid.org/repo/st.wow.git.hrm_3.apk;This version requires Android 4.1 or newer.;https://git.wow.st/gmp/hrm;https://git.wow.st/gmp/hrm/issues
UK COVID-19 Venue Check-in;https://f-droid.org/en/packages/covidsecure.uk.venuecheckin/;Thirdparty app that allows users to check in to venues in the UK by scanning an NHS Test and Trace QR code if they dont want to or are unable to use the official NHS app As with the official app the users checkin history is stored only on their device and is not shared with the NHS or anyone else The app periodically downloads a list of venues with possible COVID19 exposure and will alert the user if they have checked in to a venue that appears on this list during the relevant time period History is automatically deleted after 21 days and users can view and manually delete their history if desired;https://f-droid.org/repo/covidsecure.uk.venuecheckin_1.apk;This version requires Android 4.1 or newer.;https://gitlab.com/CovidSecure/uk-covid-19-venue-check-in;https://gitlab.com/CovidSecure/uk-covid-19-venue-check-in/issues
Covid19 Stats;https://f-droid.org/en/packages/com.gabriel.covid19stats/;Its a simple app to visualize charts and statistics about the current Covid19 emergency All the data visualized in the app is taken from the website worldometersinfocoronavirus ;https://f-droid.org/repo/com.gabriel.covid19stats_14.apk;This version requires Android 4.1 or newer.;https://github.com/GabrielTavernini/Covid19Stats;https://github.com/GabrielTavernini/Covid19Stats/issues
Rubbish Calc;https://f-droid.org/en/packages/com.mattmaniak.rubbishCalc/;Simple rubbish mass calculator that covers basic and most common trash;https://f-droid.org/repo/com.mattmaniak.rubbishCalc_2.apk;This version requires Android 4.1 or newer.;https://gitlab.com/mattmaniak/rubbish_calc;None
Open FNDDS Viewer;https://f-droid.org/en/packages/com.tjk104.openfndds/;This project is designed to take the data from the USDAs Food and Nutrition Database for Dietary Studies available here httpsfdcnalusdagovdownloaddatasetshtml and present it in a way that people can easily access since right now the way that it is structured and formatted makes getting any information an extremely tedious and timeconsuming taskIn addition to displaying the data it also includes some more handy features including Searching for food items Adding foods to a list of favorites for quick access Comparing information about different food items Showing more detailed info about nutrient densities macronutrient percentages etc Fully offline and privacyfriendly no permissions needed whatsoever;https://f-droid.org/repo/com.tjk104.openfndds_1.apk;This version requires Android 8.0 or newer.;https://gitlab.com/tjkemc2/openFNDDS;https://gitlab.com/tjkemc2/openFNDDS/issues
Step and Height Counter;https://f-droid.org/en/packages/grmpl.mk.stepandheightcounter/;This app counts footsteps and elevation gain if step sensor and barometric sensor is available All data is kept locally only there is no connection to any server For statistics you can save your data locally on SDCardPlease note Pressure sensor is mandatory Steps will not be counted during walking if there is a step sensor but no pressure sensor Elevation gain should only be counted if footsteps are detected so only stairs and hill climbing will count but not elevators or lifts Donat expect high accuracy  due to the concept of the sensors the accuracy is limited And avoid walking in trains or subways with active measurement as the pressure and therefore height can change significantly during driving You can save regular and daily statistics automatically on SDCard and save current values with the floating action button Starting with Android 10 files are not saved to rootfolder of SDcard anymore but in appdirectory There isnat much on graphical display of statistic data besides two progress bars Just use any program which can read csvvalues Permissions Access to physical activity Access to step sensor needs permission to access physical activity since Android 10 The app will not work without this permission on devices with Android 10 and higher Keep device awake Device will not be kept awake all time It will be woken up regulary and kept awake if necessary for short time to ensure proper counting of steps and elevation gain Write to external storage App will work without this permission but you cannot save statistical values or markers;https://f-droid.org/repo/grmpl.mk.stepandheightcounter_8.apk;This version requires Android 5.0 or newer.;https://github.com/grmpl/StepandHeightcounter;https://github.com/grmpl/StepandHeightcounter/issues
