Meditation Assistant;https://f-droid.org/en/packages/sh.ftp.rocketninelabs.meditationassistant.opensource/;This application assists with both timed via duration or ending at a specifictime and untimed sessions with numerous customizations includingstartintervalend sounds and device behavior It also provides a monthlyoverview of your progressA major feature in this application is the ability to share your sessionsonline Though entirely optional sharing your progress online adds anotherdimension to your accountability Now that youve gone public as yourmeditation streak increases more users will see it as a goal of their own Oneuser has posted over 500 days of consecutive days of meditationYour meditation streak is the number of consecutive days you have recorded atleast one session As your streak grows not breaking the chain becomes quiteimportant Soon you will be meditating once a day even if its five or tenminutes out of your schedule;https://f-droid.org/repo/sh.ftp.rocketninelabs.meditationassistant.opensource_166.apk;This version requires Android 4.1 or newer.;https://code.rocketnine.space/tslocum/meditationassistant;https://code.rocketnine.space/tslocum/meditationassistant/issues
RunnerUp;https://f-droid.org/en/packages/org.runnerup.free/;Track your sport activities with RunnerUp using the GPS in your Android phone See detailed stats around your pace distance and time Get stats and progress with builtin highly configurable audio cues Run free runs with target pace or target heart rate zone Easily configure and run effective interval workouts modeled after Garmin Share your favorite workouts with friends using email Heart rate monitor Bluetooth SMART BLE Configure and use heart rate zonesUpload your activities to a variety of running sites with a single click Strava RunKeeper RunningAHEADExplanation to antifeatures NonFreeNet Uploading to Strava and other services makes use of non free net services The uploading is open similar to uploading a tcx file but the services are not open UpstreamNonFree The Play version can be installed at the same time as the FDroid version has additional features using non free libraries see belowFeatures removed compared to Play version Map view OsmDroid instead of MapBox no MapBox API key in free WearOS app requires nonfree Play services HR ANT connectivity requires closed source lib Runalyze and Dropbox upload Requires API keys Runalyze test upload possible Download customized apk to device FDroid binary is universal for all supported binaries;https://f-droid.org/repo/org.runnerup.free_15000326.apk;This version requires Android 5.0 or newer.;https://github.com/jonasoreland/runnerup;https://github.com/jonasoreland/runnerup/issues
Daily Dozen;https://f-droid.org/en/packages/org.nutritionfacts.dailydozen/;In the years of research required to create the more than a thousandevidencebased videos on NutritionFactsorg Michael Greger MD FACLM hasarrived at a list of what he considers the most important foods to include in ahealthy daily dietYes greens are good for you but how much should we try to eat each day DrGregers Daily Dozen details the healthiest foods and how many servings of eachwe should try to check off every day He explains his rationale in his bookHow Not to Die All his proceeds from hisbooks DVDs and speaking engagements is all donated to charityNutritionFactsorg is a noncommercial nonprofit sciencebased public serviceprovided by Dr Greger providing free daily updates on the latest in nutritionresearch via bitesized videos He has nearly a thousand videos on every aspectof healthy eating with new videos and articles uploaded every day Like thisapp everything on the website is both free of ads and free of chargeThis app was developed thanks to the volunteer efforts of John Slavick;https://f-droid.org/repo/org.nutritionfacts.dailydozen_83.apk;This version requires Android 4.4 or newer.;https://github.com/nutritionfactsorg/daily-dozen-android;https://github.com/nutritionfactsorg/daily-dozen-android/issues
BetterCounter;https://f-droid.org/en/packages/org.kde.bettercounter/;A multipurpose counter app Track good and bad habits eg exercising smoking drinking Track whens the last time you did something eg water your plants change your bedsheets poop Count your lives in MtGFeatures Records the date of each individual counter increase Graphs your data over time and calculates statistics Lets you export your data eg to analyze it with your choice of tools Your data is never sent to any server except for Googles app backup if enabled Simple and will stay this way;https://f-droid.org/repo/org.kde.bettercounter_24020.apk;This version requires Android 5.0 or newer.;https://github.com/albertvaka/bettercounter;https://github.com/albertvaka/bettercounter/issues
TimeR Machine;https://f-droid.org/en/packages/io.github.deweyreed.timer.other/;TimeR Machine is a free interval timer for not just workout and exercise but also any situations you need to construct personalized multistage timer plans Its highly customizable and able to create almost whatever kind of timer you needSuitable for all kinds of activities including HIIT HighIntensity Interval Training workout Tabata workout Gym workout Run jog walk exercise Other sports workouts like cycling running stretching boxing MMA circuit training athome bodyweight training workouts cross fit weightlifting yogaThis app can serve as HIIT Timer Tabata Timer Gym Timer Sport Timer Round Timer Productivity Timer Continuous Timer Repeating Timer Custom Countdown Timer Interval Traning App Not just exercise this app can help you Cultivate a habit Complete daily routine Finish game loop Presentation Study Customize Reminders Music feedback Play any sound on your device as a reminder and pause other sounds to remind you Voice feedback backed by Texttospeech Let your phone speak anything you want3 Vibration feedback Pick different vibration pattern for different eventsa Fullscreen notificationa Stopwatch support for the indeterminate event Beep sound Halfway remindera Countdown seconds App notificationYou can Enjoy this free app with no intrusive Ads Create any number of timers for free Set timer names loops warmup and cooldown reminders Add groups as subtimers Let timers work in the background and show the current progress in a notification Start and control many timers at the same time View timers in a list and jump to another stage with a double tap Enter Picture In Picture mode and choose to show a floating window Create timer shortcuts to start them in one click from the launcher Customize action buttons that are shown on the timer screen Show a timing bar  Lock the screen while a timer is running Plus or minus time from current timer time Customize how much time to plus or minus Check activities records and history Schedule a timer to be run at a specific time Repeat a timer every week or every few days Back up your timers and settings Pick an app theme from 9 predefined themes  night mode or Use any color as your theme Automatically change to night mode Choose to play sound only in the headphones or globally Pause timers on phone calls Enjoy nice material design with animations Support for Tasker Automate etc;https://f-droid.org/repo/io.github.deweyreed.timer.other_7010200.apk;This version requires Android 6.0 or newer.;https://github.com/timer-machine/timer-machine-android;https://github.com/timer-machine/timer-machine-android/issues
moreDays;https://f-droid.org/en/packages/de.wuapps.moredays/;moreDays let you define your goals and steps to reach them on good and on strenuous days as well as reflect and remember each dayFeaturesIndividual goals individual activities to reach themJournaling with mood tracking and picture of the dayWeight tracking sleep tracking tracking any numbersTrophiesMany charts to analyze your progressOpensource  The source code is distributed under GNU GPLv3Your data on your phone only100 free and no ads and no registrationHabit apps focus on specific activities and how to establish to do them each day or n times each week However there are strenuous days and days were you feel less fit Often you start highly motivated and end up frustratedWith moreDays you focus on how you want to be goals eg fit or slim or smart or ecological or whatever is important for you Then you define how you want to reach each goal One day you are full of energy and may go on a long bike tour the next day you feel exhausted but may go for a walk and focus a bit more on another goal ie you define more than one way to reach each of your goals and hence ensure to be able to do a step towards your goals each dayIn addition you reflect your days take a picture of the day add notes including emojis and remember each day enjoy each dayFurthermore you may track your weight sleep quality or anything else you may measure Different charts help you to adapt and reflect your goals activities and scales;https://f-droid.org/repo/de.wuapps.moredays_16.apk;This version requires Android 8.0 or newer.;https://gitlab.com/wuapps/moredays;https://gitlab.com/wuapps/moredays/issues
BikeComputer;https://f-droid.org/en/packages/de.nulide.bikecomputer/;BikeComputerA FOSS BikeComputerFeatures Meassures your speed Keep track of your stats Distance Maximum Speed TravelTime Alternative to buying a seperate device for your bike;https://f-droid.org/repo/de.nulide.bikecomputer_6.apk;This version requires Android 5.0 or newer.;https://gitlab.com/Nulide/BikeComputer;https://gitlab.com/Nulide/BikeComputer/-/issues
Nextcloud Cookbook;https://f-droid.org/en/packages/com.nextcloud_cookbook_flutter/;Nextcloud Cookbook Mobile Client written in FlutterThis project aims to provide a mobile client for both Android and IOs for the Nextcloud Cookbook App httpsgithubcomnextcloudcookbookIt works best with an Nextcloud installation  19 and a Cookbook plugin version 079RoadmapCurrent Features    View all recipes by Category    Search Recipes by Name    Recipe Creating    Recipe Editing    Recipe Import    Darkmode Thanks to SeineEloquenz    Timer Thanks to fab920    Stay awake on recipe screen    Settings TabPlanned Features    Offline Usage Caching    Image Upload    Integrate new values of nextcloud plugin  Currently worked onTranslationTo help the translation of the app visit httpswwwtransifexcomnextcloudnextcloudcookbookflutter;https://f-droid.org/repo/com.nextcloud_cookbook_flutter_24.apk;This version requires Android 4.3 or newer.;https://github.com/Teifun2/nextcloud-cookbook-flutter;None
Massive;https://f-droid.org/en/packages/com.massive/;Tired of forgetting where you are in your current workout Massive helps you remember your rest timings last personal best and plan for the day Record your reps  sets progress and visualize your improvement with graphsMassives rest timer can be toggled on and off and it automatically starts after each set is loggedAll data is stored offline on your phones storage so dont worry about internet connectivitySource code is found at httpsgiteapresleynzbrandonpresleyMassive;https://f-droid.org/repo/com.massive_36163.apk;This version requires Android 5.0 or newer.;https://gitea.presley.nz/brandon.presley/Massive;https://gitea.presley.nz/brandon.presley/Massive/issues
Grocy: Self-hosted Grocery Management;https://f-droid.org/en/packages/xyz.zedler.patrick.grocy/;Grocy Android is an opensource Android client for grocy source code Grocy is a selfhosted groceries  household management solution for your homeGrocy Android uses grocys official API to provide you a beautiful interface on your phone with powerful barcode scanning and intuitive batch processing all what you need to efficiently manage your groceriesThis app requires a running selfhosted instance of the grocy server application It is a companion app therefore it cannot run standalone or manage products itself You can try and test all features using the demo option available on the login screenFeatures Stock overview Shopping lists with offline support Instore shopping mode big UI elements Fast barcode scanning OpenFoodFacts implementation Master data editing Dark mode No ads analytics or inapp purchasesContributionIf you run into a bug or miss a feature feel free to give feedback in the app send us an email or open an issue on GitHub Like the grocy project Grocy Android can be translated too Please go to our GitHub page for more informationCompatibilityGrocy Android requires at least Android 50 Lollipop on your device and grocy 300 on your server It is also possible to use the grocy Addon on a Hassio server Our inapp help explains how to do thatWed like to thank the developer of Grocy Bernd Bestel without whose great work this app would never have been possible;https://f-droid.org/repo/xyz.zedler.patrick.grocy_45.apk;This version requires Android 5.0 or newer.;https://github.com/patzly/grocy-android;https://github.com/patzly/grocy-android/issues
MediLog;https://f-droid.org/en/packages/com.zell_mbc.medilog/;Privacy respecting logging of blood pressure oxygen glucose temperature weight water intake as well as a simple diaryIncludes ways to securely share the sensitive data with medical staff if and when required   Support for biometricfingerprint logon   Charts with trends and thresholds   CSV Data export via protectedencrypted zip files  Ability to share health data via PDF files inside protectedencrypted zip files;https://f-droid.org/repo/com.zell_mbc.medilog_5423.apk;This version requires Android 5.0 or newer.;https://codeberg.org/toz/MediLog;https://codeberg.org/toz/MediLog/issues
Daily Diary;https://f-droid.org/en/packages/com.voklen.daily_diary/;Jot down whatever you want throughout the day and the app will reset the next morning All previous days are stored in plaintext files which can be exported and moved to a different deviceSettings are stored in a configtoml file that can also be moved between devices;https://f-droid.org/repo/com.voklen.daily_diary_5.apk;This version requires Android 4.1 or newer.;https://github.com/Voklen/Daily-Diary;https://github.com/Voklen/Daily-Diary/issues
Track & Graph;https://f-droid.org/en/packages/com.samco.trackandgraph/;Track  Graph is a powerful tool for helping you track and analyse your habits behaviours and symptoms Assign numerical values to track changes over time or simply record when something happened With Track  Graph you can quickly and easily track everything in seconds and create insightful graphs to visualise your data Set up line graphs pie charts and statistics to report useful information like moving averages and time between tracking Organise your data into groups and arrange them however you like with ease Track  Graph is completely free open source and has no authentication ads or inapp purchases Your personal information tracked data and app activity are not recorded or stored online and you can easily backup your data at any time Enhance your selfawareness and facilitate selfreflection with Track  Graph;https://f-droid.org/repo/com.samco.trackandgraph_300002.apk;This version requires Android 6.0 or newer.;https://github.com/SamAmco/track-and-graph;https://github.com/SamAmco/track-and-graph/issues
MyMood;https://f-droid.org/en/packages/com.nima.mymood/;MyMood is a minimalistic and simple app that gives you an empty mood page per day to fill itYou can add events that effected your mood today see all the events by their effect and keep track of the day you added;https://f-droid.org/repo/com.nima.mymood_2.apk;This version requires Android 5.0 or newer.;https://github.com/NimaKhajehpour/MyMood;https://github.com/NimaKhajehpour/MyMood/issues
Decisions;https://f-droid.org/en/packages/de.markusfisch.android.libra/;Write down pros and cons then weigh all arguments and get a recommendation based on this Time Articlehttptimecom3772262billionairetrickfordecisionsThis is open sourcehttpsgithubcommarkusfischLibraPlease report bugs herehttpsgithubcommarkusfischLibraissues;https://f-droid.org/repo/de.markusfisch.android.libra_21.apk;This version requires Android 2.3 or newer.;https://github.com/markusfisch/Libra;https://github.com/markusfisch/Libra/issues
OpenTracks;https://f-droid.org/en/packages/de.dennisguse.opentracks/;A sport tracking buddy that respects your privacySport and outdoor activities grants happiness skill and confidenceValue your health by keeping track on your trainingRecords as you go running or walking and gives you a bike computer with a bigger screen for cyclingMark interesting locations along your way with picturesKeep recorded statistics in great detail for analysisShare only the data you want others to have Voice announcements Supports Bluetooth LE sensors heart rate speed and distance cycling cadence cycling and power meter cycling Altitude gain and loss via barometric sensor Altitude shown in EGM2008 above mean sea level exported as WGS84 Export data as tracks either as KMZ incl photos KML or GPX No Internet access or extra permissions Dark and light theme respecting system settings No adsLibre software  Free Software  Open Sourcemeaning you can use study change and share the source codeLicensed Apache 20;https://f-droid.org/repo/de.dennisguse.opentracks_5151.apk;This version requires Android 5.0 or newer.;https://github.com/OpenTracksApp/OpenTracks;https://github.com/OpenTracksApp/OpenTracks/issues
YacGuide;https://f-droid.org/en/packages/com.yacgroup.yacguide/;Offline tool based on the data from httpwwwsandsteinkletterndeFeatures Offline access to climbing route information Personal tourbookThe development version contains regular snapshots which may leadto unexpected changes without notice;https://f-droid.org/repo/com.yacgroup.yacguide_7000.apk;This version requires Android 8.0 or newer.;https://github.com/yacgroup/yacguide;https://github.com/yacgroup/yacguide/issues
GymRoutines;https://f-droid.org/en/packages/com.noahjutz.gymroutines/;GymRoutines facilitates creating custom exercises and routines that fit your needs You can use your existing training plans in the app effortlesslyTrack your progress and view statistics in the app Improve your performance by making decisions based on dataLicensed under the GNU General Public License Version 3 the source code of GymRoutines can be inspected modified and redistributed by anyone see license for more Check out the source code on CodebergAll your workouts are stored locally meaning that your data is as secure and private as it can get Beyond that GymRoutines independence from the internet leads to exceptional performance and stability;https://f-droid.org/repo/com.noahjutz.gymroutines_46.apk;This version requires Android 5.0 or newer.;https://codeberg.org/noahjutz/GymRoutines;https://codeberg.org/noahjutz/GymRoutines/issues
Brethap;https://f-droid.org/en/packages/com.jithware.brethap/;Brethap is yet another meditation app yama Including a timer for meditation it also allows you to configure a breathing pattern for you to follow Your sessions will be saved allowing you to monitor and view stats about your progress in either a list or calendar view Duration breath and other options are configurable through saved preferences Breathing technique presets include 478 physiological sigh among othersHeart rate is only supported in the Wear OS version on Google PlayThe current screenshots are out of date due to an fdroid bug For the latest screenshots visit Brethap on Google Play;https://f-droid.org/repo/com.jithware.brethap_100.apk;This version requires Android 6.0 or newer.;https://github.com/jithware/brethap;https://github.com/jithware/brethap/issues
Migraine Log;https://f-droid.org/en/packages/org.zerodogg.migraineLog/;Migraine Log lets you easily log your migraine attacks or other headaches It is built to make it as easy as possible only requiring a date and the strength of the attack while allowing you to optionally add details like what medications you took and notes about the attack This lets you monitor your migraine and can assist you and your physician in finding the correct treatment for youThe user interface is built with migraine sufferers in mind and uses soft and dark colours so that you can use it during an attackMigraine Log respects your privacy and does not request network access so your information does not leave your device unless you explicitly use the export function in the app;https://f-droid.org/repo/org.zerodogg.migraineLog_658.apk;This version requires Android 4.1 or newer.;https://gitlab.com/zerodogg/org.zerodogg.migraineLog;https://gitlab.com/zerodogg/org.zerodogg.migraineLog/issues
plees-tracker;https://f-droid.org/en/packages/hu.vmiklos.plees_tracker/;Plees Tracker is a simple sleep tracker for your Android phoneThis is meant to be a very simple open source clone of PrimeNap ie just track sleep startstop times and count the average  dayFeatures It literally does nothing while you sleep causes no battery drain Stores past sleeps counts stat from them average Exportsimports sleep data tofrom CSV Can show past sleeps can selectively edit and delete individual sleeps;https://f-droid.org/repo/hu.vmiklos.plees_tracker_41.apk;This version requires Android 6.0 or newer.;https://github.com/vmiklos/plees-tracker;https://github.com/vmiklos/plees-tracker/issues
Bagatur Chess Engine;https://f-droid.org/en/packages/com.bagaturchess/;This is the open source Bagatur Chess Engine with its own GUI graphical user interfaceIt is not as strong as Stockfish Komodo AlphaZero or Leela Chess Zero but is strong enough to beat a grandmasterIt has 16 strength levels From level 5 it could show the search informationThe ELO rating is about 3000 and the program has a unique playing styleIn general the application demonstrates an application of artificial intelligence AI into the domain of chessTo clarify it is not an OEX chess engine and other chess engines cannot be imported into the GUIPlaying instructionsCheck the menu and make sure the strength level is appropriateSelectdeselect the HumanComputer buttons for both sides according to which side you want to play and whether you play against a computer or another personUse the flip board button to change sides if you play with blackMove the piece by drag and drop or by selecting fromto squaresIf you want you could use the move navigation buttons to go back and forward in the move sequenceIt is recommended to check all settings in the menu and make sure you play with the option you like most eg move animation speed chess pieces set colorsFeaturesFEN importexportshareDifferent modes HumanHuman HumanBagatur BagaturBagaturDifferent strengths levelsThe app could show the best moves line as well as the evaluation of the board position produced by BagaturNavigation of played moves first previous next lastFlipboard functionMoving by drag and drop as well as by selecting from and to squaresSupports different color palettes and chess pieces sets for different tastesPermissionsThe app uses ACCESSNETWORKSTATE and INTERNET permsisions because it shows home ads and they open the default browser on the device going to one of our other apps page on the store or on the website of Metatrans AppsTo be more precise if the other app is available on the store from which the app is downloaded then opens the app page of the other app on the same store If still the app is not available on the store then opens the app page on our websiteThe app pages on our website have app demo video on YouTube so a connection to youtube domain will also be listed in order to visualize the page in the browserOur website is created by WordPress so connections to other domains could be opened as well for technical purposes eg downloading text fonts cssYour feedback andor review is more than welcome;https://f-droid.org/repo/com.bagaturchess_136.apk;This version requires Android 6.0 or newer.;https://github.com/MetatransApps/Android_APK_ChessEngineBagatur;https://github.com/MetatransApps/Android_APK_ChessEngineBagatur/issues
