Vedroid Events;https://f-droid.org/en/packages/com.vedroid.events/;Vedroid Events  simple birthdays and events remainder app without any stupid useless smart features and options No need of the google servicesa Create notifications for birthdays or eventsa Set up an additional appointment prior to event;https://f-droid.org/repo/com.vedroid.events_1.apk;This version requires Android 4.0 or newer.;https://gitlab.com/jasuramme/vedroid-events;https://gitlab.com/jasuramme/vedroid-events/-/issues
Grocery manager;https://f-droid.org/en/packages/com.grocerymanager/; You can create an inventory of your pantry using this app This app will remind you whenever an item is about to expire You can check where did you put an item You can check in the inventory before buying a new item;https://f-droid.org/repo/com.grocerymanager_1.apk;This version requires Android 4.1 or newer.;https://gitlab.com/upasana-me/grocerymanager/tree/HEAD;https://gitlab.com/upasana-me/grocerymanager/issues
FOSS Moodle;https://f-droid.org/en/packages/de.baumann.hhsmoodle/;Interact with the Moodle instance of the HeinrichHuebschSchule in Karlsruhe GermanyScreenshots;https://f-droid.org/repo/de.baumann.hhsmoodle_72.apk;This version requires Android 5.0 or newer.;https://github.com/scoute-dich/HHSMoodle;https://github.com/scoute-dich/HHSMoodle/issues
Birthday Buddy;https://f-droid.org/en/packages/com.procrastimax.birthdaybuddy/;BirthdayBuddy is a simple material design orientated app to help you remember birthdays anniversaries and other special eventsInformation about the age of a person and how many days remain until the birthday are clearly presentedYou dont need an extra account because everything happens offline and the data is stored locally on your phoneFeatures support for different event types simple design wide configuration options for notifications import export feature for data darkmodeIf you encounter any problems bugs or you have feature requests then please contact me mmeheykerothtutanota;https://f-droid.org/repo/com.procrastimax.birthdaybuddy_17.apk;This version requires Android 5.0 or newer.;https://github.com/procrastimax/BirthdayBuddy;https://github.com/procrastimax/BirthdayBuddy/issues
Offline Calendar;https://f-droid.org/en/packages/org.sufficientlysecure.localcalendar/;Lets you add offline calendars to the Calendar app which are not synchronizedand are accessible only on the device itself Create the calendar in this appand it will then be available in the Calendar app;https://f-droid.org/repo/org.sufficientlysecure.localcalendar_10.apk;This version requires Android 4.1 or newer.;https://github.com/PrivacyApps/offline-calendar;https://github.com/PrivacyApps/offline-calendar/issues
F-Droid;https://f-droid.org/en/packages/org.fdroid.fdroid/;FDroid is an installable catalogue of libre software apps for Android The FDroid client app makes it easy to browse install and keep track of updates on your deviceIt connects to any FDroid compatible repositories The default repo is hosted at fdroidorg which contains only bona fide libre softwareAndroid itself is open in the sense that you are free to install APKs from anywhere you wish but there are many good reasons for using FDroid as your libre software app manager Get notified when updates are available Optionally download and install updates automatically Keep track of older and beta versions Filter out apps incompatible with the device Find apps via categories and searchable descriptions Access associated URLs for donations source code etc Stay safe by checking repo index signatures and APK hashes;https://f-droid.org/repo/org.fdroid.fdroid_1016053.apk;This version requires Android 6.0 or newer.;https://gitlab.com/fdroid/fdroidclient;https://gitlab.com/fdroid/fdroidclient/issues
Xeonjia: Ice Adventures;https://f-droid.org/en/packages/xyz.deepdaikon.xeonjia/;Xeonjia is an adventure game set in a frozen worldThe floor is frozen Think carefully about your moves because you cant change direction until you meet an obstacleUse you mind to solve the ice slide puzzlesThe world has been frozen by the aKing of Evila and itas no longer a safe placeLegend has it that a brave hero will defeat the King of Evil and save the kingdoma For this reason every year a person is appointed as aheroa and sent on a journey to try to save itNow is your time you have been chosen as this yearas hero Will you be able to defeat the King of EvilYou will have to travel the world explore cities dungeons and mystical cavesAre you ready to solve quests and puzzles in this frozen RPG worldOver time you will gain experience points that will allow you to increase your level and you will find money and hidden treasures that you can use to buy stuff and improve yourselfBe careful the world is full of dangerous enemies ready to attack youKeep in mind that most of the floor is frozen so you canat stop yourself until you reach a wall a boulder or any other type of obstacleUse your mind to figure out the best pathNote this game is currently in early beta stage;https://f-droid.org/repo/xyz.deepdaikon.xeonjia_14.apk;This version requires Android 4.1 or newer.;https://gitlab.com/deepdaikon/Xeonjia/tree/HEAD;https://gitlab.com/deepdaikon/Xeonjia/issues
Quinb: 4 players reaction game;https://f-droid.org/en/packages/xyz.deepdaikon.quinb/;Quinb is a reaction  logic game for up to 4 players on the same deviceIt contains many minigames in which you have to answer questions as fast as you can to get a pointIf the answer is correct you score a point otherwise you lose oneThese games are based on 3 different categoriesa Logic games that require intuition logic and fast reflexesa Audio soundbased games you have to listen carefully to find out the correct answera Vibration vibrationbased games that require you to listen carefully to the vibrations of your deviceEach match consists of a succession of different minigamesThe goal is to score 7 points before your opponentsYou can play alone if you want but it is more fun to play with friends of all ages Its great if you are stuck with nothing to do while youre with friendsIf you think youre fast challenge and beat your friendsMain featuresa 28 minigamesa Up to 4 players on the same devicea Completely freea No Adsa Multiple languagesa Minimalist design;https://f-droid.org/repo/xyz.deepdaikon.quinb_8.apk;This version requires Android 4.1 or newer.;https://gitlab.com/deepdaikon/Quinb/tree/HEAD;https://gitlab.com/deepdaikon/Quinb/issues
Jellyfin for Android TV;https://f-droid.org/en/packages/org.jellyfin.androidtv/;Your media on your termsThe Jellyfin project is an open source free software media server No fees no tracking no hidden agenda Get our free server to collect all your audio video photos and more in one placeTo use the app you must have a Jellyfin server set up and running Find out more at jellyfinorgWith a Jellyfin server you can Watch Live TV and recorded shows from your Jellyfin server additional hardwareservices required Stream to a Chromecast device on your network Stream your media to your Android device View your collection in an easy to use interfaceThis is the official Jellyfin companion app for Android TV Thank you for using Jellyfin;https://f-droid.org/repo/org.jellyfin.androidtv_150599.apk;This version requires Android 5.0 or newer.;https://github.com/jellyfin/jellyfin-androidtv;https://github.com/jellyfin/jellyfin-androidtv/issues
Activity Launcher fork;https://f-droid.org/en/packages/de.szalkowski.activitylauncher.rustore_fork/;This opensource Android App launches hidden activities and creates home screen shortcuts for installed apps;https://f-droid.org/repo/de.szalkowski.activitylauncher.rustore_fork_137.apk;This version requires Android 6.0 or newer.;https://github.com/Sash0k/ActivityLauncher;https://github.com/Sash0k/ActivityLauncher/issues
Translate You;https://f-droid.org/en/packages/com.bnyro.translate/;Translate You is a Translator App built with Material Design 3 YouIt supports multiple different translation engiens such as LibreTranslate Lingva Deepl and moreIn total there are more than 200 supported languages across 6 different translation engines;https://f-droid.org/repo/com.bnyro.translate_29.apk;This version requires Android 5.0 or newer.;https://github.com/Bnyro/TranslateYou;https://github.com/Bnyro/TranslateYou/issues
MoClock;https://f-droid.org/en/packages/com.lako.moclock/;a MoClock  A fairly basic clock appa2 i  A basic clock down to the seconda A settable timera i  A limited stopwatch Modern design with bottom navigation34 Small size;https://f-droid.org/repo/com.lako.moclock_4.apk;This version requires Android 5.1 or newer.;https://github.com/GittyMac/MoClock;https://github.com/GittyMac/MoClock/issues
Alarmio;https://f-droid.org/en/packages/me.jfenn.alarmio/;Alarmio is a simple alarm clock that implements many useful featureswhile following regular design standards to ensure that it is quick andintuitive to use It supports snoozing has themes and more;https://f-droid.org/repo/me.jfenn.alarmio_21.apk;This version requires Android 4.1 or newer.;https://github.com/fennifith/Alarmio;https://github.com/fennifith/Alarmio/issues
Congress Fahrplan;https://f-droid.org/en/packages/de.delusionsoftware.congress_fahrplan/;Overview of all talks of the Chaos Communication CongressUses everythingschedulejson or schedulejsonLightning fast written in Flutter 100 OSSFocused on simplicity prepared to be used with TalkBack for accessibilityDeveloped as Open Source GPL v2httpsgithubcombenjaminSchilling33congressfahrplan;https://f-droid.org/repo/de.delusionsoftware.congress_fahrplan_15.apk;This version requires Android 4.1 or newer.;https://github.com/benjaminSchilling33/congress_fahrplan;https://github.com/benjaminSchilling33/congress_fahrplan/issues
ProgressBars;https://f-droid.org/en/packages/org.mattvchandler.progressbars/;Countdownup tofrom a specified time     Percentage complete for a time interval     Notifications on timer completion     Swipe to delete timers     Drag to reorder timers     Show time remaining  elapsed in any combination of Years Months Weeks    Days Hours Minutes or Seconds;https://f-droid.org/repo/org.mattvchandler.progressbars_190020101.apk;This version requires Android 4.4 or newer.;https://github.com/mattvchandler/progressbars;https://github.com/mattvchandler/progressbars/issues
Todo Agenda for Android 4 - 7.0;https://f-droid.org/en/packages/com.plusonelabs.calendar/;This is a legacy ToDo Agenda app ex Calendar Widget for Android v4  70It is intended for users having older devices For newer releases please use Todo Agenda appSince November 2019 the app changed its ID in FDroid from complusonelabscalendarto organdstatustodoagenda ie to its current real Android package nameThe new app at FDroid web site ToDo AgendaUpcoming releases of the new app will support Android 70 onlyThe name of the new app entry in FDroid stays the same Todo Agenda because the app itself isnt changedBut the name of this legacy app entry in FDroid is changed to Todo Agenda for Android 4  70 to avoid users confusionTodo Agenda is home screen widgets for your Android deviceIt displays a list of calendar events and tasksso that you can easily have a glimpse at your due current and upcoming appointmentsFeatures No advertising Free and Open Source Displays all events from your calendars and task lists Optionally shows past events Automatically updates when you adddeletemodify an event Or you may update the list instantly Select only the calendars you want to see in the widget Create several widgets if you need Each widget will have its own settings including layouts colors filters and selected calendars Customize background colors and transparency of different widget parts texts black and white shading Scroll through the list of events Use Go to Today button to return to today instantly Customize the text size of the widget Fully resizable widget with alternative layouts Indicators for alerts and recurring events Lock time zone when travelling to different time zones Turn off Widget or Day headers event icons Days from today etc and see only what you need Android 4 supported Supports Android tablets;https://f-droid.org/repo/com.plusonelabs.calendar_565.apk;This version requires Android 4.0.3 or newer.;https://github.com/andstatus/todoagenda;https://github.com/andstatus/todoagenda/issues
Pendulums;https://f-droid.org/en/packages/team.swing.pendulums/;Easy to use and efficient time tracking toolYou can use Pendulums to manage time and calculate the time spent as anindividual or as group projects and get charts per team member with theoption of selecting time periods and calculating the overall timeUsing Pendulums allows you to calculate the time spent on various dailyavtivities such as exercise study etc and in a business you can countthe amount of time spent by each person in the project Simply sign up and sign in create your projects touch the start button and at the end touch the stop button and now you have your timesheets Unlimited projects Unlimited team members Use in online and offline modes Easy to use Stay synced in all platforms Web  Android  Desktop Completely free Open source;https://f-droid.org/repo/team.swing.pendulums_4.apk;This version requires Android 4.4W or newer.;https://github.com/Swing-team/pendulums-web-client;https://github.com/Swing-team/pendulums-web-client/issues
Calendar Notifications;https://f-droid.org/en/packages/com.github.quarck.calnotify/;Replace calendar notifications with advanced notifications allowing customsnooze times and reboot notifications persistence The app is focusing on makingits functionality as transparent as possible notification would behave in thesame way as stock calendar notifications All calendar applications should behandled correctly in theory;https://f-droid.org/repo/com.github.quarck.calnotify_4000006.apk;This version requires Android 4.3 or newer.;https://github.com/quarck/CalendarNotification;https://github.com/quarck/CalendarNotification/issues
Sun Time;https://f-droid.org/en/packages/com.gitlab.kreikenbaum.suntime.fdroid/;When the sun is at the highest point its noon so its 1200 pm right Thats the way things should be This app shows you the solar time at your location 1200 pm is natural solar noon and the sun is at its highest point 1200 am is the natural solar midnight and the sun is at its lowest point See solar time in comparison to your zone time in the main app and see the solar time in a nifty widgetYou can use this app to wake up at a solar time of your choosing;https://f-droid.org/repo/com.gitlab.kreikenbaum.suntime.fdroid_9.apk;This version requires Android 4.2 or newer.;https://gitlab.com/kreikenbaum/suntime-app/tree/HEAD;https://gitlab.com/kreikenbaum/suntime-app/issues
Working Time Alert;https://f-droid.org/en/packages/com.androidfromfrankfurt.workingtimealert/;Enter when you started working how long was your break and see how longyou have been working and when its time to leave;https://f-droid.org/repo/com.androidfromfrankfurt.workingtimealert_4.apk;This version requires Android 4.1 or newer.;https://github.com/spidgorny/workingtimealert;https://github.com/spidgorny/workingtimealert/issues
A Time Tracker;https://f-droid.org/en/packages/com.markuspage.android.atimetracker/;Easily startstop time tracking for activities Offers summary report view and export;https://f-droid.org/repo/com.markuspage.android.atimetracker_5102.apk;This version requires Android 6.0 or newer.;https://github.com/netmackan/ATimeTracker;https://github.com/netmackan/ATimeTracker/issues
Repeat Me;https://f-droid.org/en/packages/com.samarthdesai.repeatme/;Repeat Me is the cleanest fastest and most customizeable way to schedulenotifications on your phone With no ads or any questionable permissionsRepeat Me is the lightest and safest way to keep track of everything you needto do in your life;https://f-droid.org/repo/com.samarthdesai.repeatme_6.apk;This version requires Android 4.1 or newer.;https://github.com/SamarthDesai01/RepeatMe;https://github.com/SamarthDesai01/RepeatMe/issues
Board Game Clock;https://f-droid.org/en/packages/org.secuso.privacyfriendlyboardgameclock/;Privacy Friendly Boardgames Clock offers stopwatches and timers to support time tracking while playing boardgamesThe app offers different modes depending on the game that is played If the game is round based players and roundtimes can be continued The app tracks the time that the player needs in each round and alerts the player if he orshe takes too much time Privacy Friendly Boardgame Clock furthermore offers a time tracking mode This is a stopwatchfor each player that participates in the game as well as for the overall game timeThe app belongs to the Privacy Friendly Apps group developed by the research group SECUSO at the Karlsruhe Instituteof Technology;https://f-droid.org/repo/org.secuso.privacyfriendlyboardgameclock_1.apk;This version requires Android 5.0 or newer.;https://github.com/SecUSo/privacy-friendly-boardgame-clock;https://github.com/SecUSo/privacy-friendly-boardgame-clock/issues
Get Off Your Phone;https://f-droid.org/en/packages/com.nephi.getoffyourphone/;Useful for everyone anytime  anywhere End procrastination with this simpleapp that locks down your selected apps for a specific timeFeatures Sleek Design Simple navigation Easy to use Select Any app you want to block never limit yourself Up to 4 lock times 30 minutes 1 2  3 hours Minimal Permissions needed  Check below  Multiple lock screens with different GIFs to know how much left for unlock Beautiful minimal design and colorsHow to use Install Give usage permission Remove Battery optimisation Select Apps Select desired time LockDown ;https://f-droid.org/repo/com.nephi.getoffyourphone_45.apk;This version requires Android 5.0 or newer.;https://github.com/Alikaraki95/Getoffyourphone;https://github.com/Alikaraki95/Getoffyourphone/issues
World Clock & Weather;https://f-droid.org/en/packages/ch.corten.aha.worldclock/;Display the local time and current weather conditions in places all over theworld It comes with two home screen widgets which show weather and time or timeonlyFeatures Light weight application Require less than 1 mb free space Detect your city automatically upcoming Show local time and weather conditions in more than 4000 places Add your own places Add a place in the same time zone and change its name and coordinates to your desired location to show the actual weather condition there A compact clock widget displaying the local time in your favorite locations A widget showing the time and weather which is resizable to show more locations on the home screen Simple and clean UI Customizable widget colors including transparent backgroundNonFreeNet OpenWeatherMap service itself is not open source;https://f-droid.org/repo/ch.corten.aha.worldclock_101.apk;This version requires Android 2.3.3 or newer.;https://github.com/dasbiswajit/worldclockwidget;https://github.com/dasbiswajit/worldclockwidget/issues
Simple ToDo;https://f-droid.org/en/packages/apps.jizzu.simpletodo/;Simple ToDo will help manage your daily tasks and dont forget aboutimportant thingsKey Features Simple ToDo is completely free doesnt contain builtin purchases and annoying advertising The application is made in the style of material design by Google with smooth and pleasant animations This app has a reminder feature which helps you never forget important things With builtin search you can easily find any task you need in a couple of seconds Offers backup and restore functionality Dragndrop and Swipe to dismiss helps you quick and easily manage all your tasks;https://f-droid.org/repo/apps.jizzu.simpletodo_5.apk;This version requires Android 4.4 or newer.;https://github.com/Jizzu/SimpleToDo;https://github.com/Jizzu/SimpleToDo/issues
Taswast;https://f-droid.org/en/packages/com.github.aba2l.taswast/;Taswast is an Amazigh calendar Counts daysmonthsyears with the amazigh systemand repertorying all the traditional events of the year;https://f-droid.org/repo/com.github.aba2l.taswast_1.apk;This version requires Android 4.4W or newer.;https://gitlab.com/AbA2L/Taswast;https://gitlab.com/AbA2L/Taswast/issues
Scrum Chatter;https://f-droid.org/en/packages/ca.rmen.android.scrumchatter/;Time members while they speak at meetings See who chatters the most inmeetingsView average and total speaking time of members for all recorded meetingsShare the stats for one meeting or for all meetingsExport to Excel so you can add your own lovely charts and graphs as you see fitYou can export and import the databaseNote this app does NOT use the microphone to automatically detect when a personis speaking You must press on a play button when a team member speaks;https://f-droid.org/repo/ca.rmen.android.scrumchatter_10606.apk;This version requires Android 4.0 or newer.;https://github.com/caarmen/scrumchatter;https://github.com/caarmen/scrumchatter/issues
Polar Clock;https://f-droid.org/en/packages/eu.polarclock/;A polar clock inspired by the one madeby pixelmaker;https://f-droid.org/repo/eu.polarclock_10.apk;This version requires Android 4.0.3 or newer.;https://github.com/beriain/PolarClock;https://github.com/beriain/PolarClock/issues
French Calendar;https://f-droid.org/en/packages/ca.rmen.android.frenchcalendar/;Resizable widget which displays the current date and time in the FrenchRevolutionary calendar The widget supports the following preferences Whether to display the current time or the name of the object for that day of the year ex grape Calculation method method used to determine the first day of the year Either based on the autumn equinox or the Romme method Language of the calendar limited to just a few languages for nowOther features Possibility to share the information about the current date The color of the widget is customizable but by default is different for each month You can add the widget to your lock screen on supported devicesThree widget styles Horizontal parchment Vertical parchment Minimalist;https://f-droid.org/repo/ca.rmen.android.frenchcalendar_1182.apk;This version requires Android 1.5 or newer.;https://github.com/caarmen/FRCAndroidWidget;https://github.com/caarmen/FRCAndroidWidget/issues
Guessaday;https://f-droid.org/en/packages/com.goltzkiste.guessaday/;A trainer for calculating the day of the week of any given dateThis app displays a random date and asks you what day of the week that date isThen it checks your answer Optionally it measures how long it took you In thesettings you can configure the range for the random dateIf you want to learn how to do this calculation check out on the developerswebsite;https://f-droid.org/repo/com.goltzkiste.guessaday_8.apk;This version requires Android 4.0.3 or newer.;https://github.com/mo271/guessaday;https://github.com/mo271/guessaday/issues
Kimai TimeTracker﻿;https://f-droid.org/en/packages/de.live.gdev.timetracker/;Client for the time managment software Kimai This appmakes mobile tracking and logging into your kimai existing installation easierIf you want to be auto logged in after application start check the appropiateboxNormally you have to open your browser go to favourites click your kimai pageinput data Now you only have to do the last step every time you want to addentries;https://f-droid.org/repo/de.live.gdev.timetracker_26.apk;This version requires Android 4.0 or newer.;https://github.com/gsantner/kimai-android;https://github.com/gsantner/kimai-android/issues
Hourglass;https://f-droid.org/en/packages/com.alaskalinuxuser.hourglass/;A simple application that can be used to start a timer from one second to onehour The app can then be closed or left open while a status bar notificationreminds you that you have a timer in progressUpon reaching 0000 an audible bell as well as a short vibration and visualpopup will indicate that your timer has endedGreat for reminding yourself to do something or for use while playing gamesthat require timers;https://f-droid.org/repo/com.alaskalinuxuser.hourglass_6.apk;This version requires Android 4.0.3 or newer.;https://gitlab.com/alaskalinuxuser/app_hourglass;https://gitlab.com/alaskalinuxuser/app_hourglass/issues
Bewegungsmelder;https://f-droid.org/en/packages/de.arnefeil.bewegungsmelder/;Companion app for Bewegungsmelder a websitefocusing on concerts and other events around Hamburg Germany;https://f-droid.org/repo/de.arnefeil.bewegungsmelder_140632.apk;This version requires Android 3.0 or newer.;https://github.com/arnef/bewegungsmelder-android;https://github.com/arnef/bewegungsmelder-android/issues
Calendula;https://f-droid.org/en/packages/es.usc.citius.servando.calendula/;Manage your medical prescriptions through a simple and intuitive interfaceUsers can easily define their own daily routines wake up lunch dinner and then link medication intakes to them;https://f-droid.org/repo/es.usc.citius.servando.calendula_30.apk;This version requires Android 4.0.3 or newer.;https://github.com/citiususc/calendula;https://github.com/citiususc/calendula/issues
Material Tea Timer;https://f-droid.org/en/packages/org.ligi.materialteatimer/;Material design themed tea timer Time your tea with material style Shows youtemperature and time quickly Have a great tea;https://f-droid.org/repo/org.ligi.materialteatimer_14.apk;This version requires Android 2.3.3 or newer.;https://github.com/ligi/MaterialTeaTimer;https://github.com/ligi/MaterialTeaTimer/issues
