Minidoro;https://f-droid.org/en/packages/com.github.ympavlov.minidoro/;Minidoro is a very minimalist but reliable PomodoroA Technique timerPomodoroA Technique is extremely simple but efficient time management technique developed by Francesco CirilloThe proposal is its simpler to concentrate on work for a relatively short period ie 25 min keeping in mind you can take a rest or switch to another activity after thatThats very simpleYou split your work for 25 minute intervals separated by short break periodsIn these 25 minute intervals try to focus on your work as much as possible try to not distract yourself and to avoid other distractionsAfter a 25 minute interval take a 5 minute break During this break do any other activities except for the previous workReturn to the work after the break or not if youve finishedTake a long break about 10a30 minutes after every 4 work intervalsFull PomodoroA Technique description on the authors websiteThe Minidoro app may help you in PomodoroA Technique adoption Minidoro hasMinimalist user interface only countdown screen with big digits its on all the time while timers onSee only how much time left no other distractionsIt may turn DonotDisturb Mode in your device no other apps will distract youYou may count your distractions by yourself or by outsideYou may set up your preferences periods duration long break frequency notificationsDark theme the onlyNo adsWorks on any Android device phone table or watch you may utilize even your old smartphoneProper work on SamsungA phones and tables httpsDontKillMyAppcom is not applicableWear OS noticeIt would be a great feature that Minidoro running on Wear OS turns DnD mode on both Wear OS and Android device It should be generally possible since Wear OS may turn DnD on Android devices But theres one nuisance Its not possible to allow any app to operate DnD Mode in Wear OS from Wear OS UI The only way to allow Minidoro to operate DnD in Wear OS is ADB command no root should be neededInstall Minidoro turn Wear OS in debug mode and connect to computerAfter that for Wear OS 22 based on Android 9 and above run this adb shell cmd notification allowlistener comgithubympavlovminidorocomgithubympavlovminidorodndDndModeServiceV21For any other Wear OS version below based on Android 81 and below use this adb shell settings put secure enablednotificationlisteners comgoogleandroidwearableappcomgoogleandroidclockworkstreamNotificationCollectorServicecomgithubympavlovminidorocomgithubympavlovminidorodndDndModeServiceV21PomodoroA is a registered trademark Francesco Cirillo This app is not affiliated with Francesco Cirillo;https://f-droid.org/repo/com.github.ympavlov.minidoro_112.apk;This version requires Android 2.0 or newer.;https://github.com/ympavlov/minidoro;https://github.com/ympavlov/minidoro/issues
HOPE 2022;https://f-droid.org/en/packages/info.metadude.android.hope.schedule/;Program app for the HOPE conference 2022httpshopenetA New HOPE will be a transformational conferencefor the hacker community  in so many ways Weveall been through a lot and its been challengingIt is a time to come together again to inspiretransform and share HOPEA New HOPE will be live and in person and at agreat new venue St Johns University has morespace more possibilities and offers us muchmore support for HOPE far into the futureWe will miss our old longtime home the HotelPennsylvania which is sadly being demolishedBut we are now ready for our next chapter We hopeyoull join us for this this exciting bit of historyas we create A New HOPE togetherFeatures View program by day and rooms side by side Custom grid layout for smartphones try landscape mode  and tablets Read detailed descriptions speaker names start time room name links  of events Add events to favorites list Export favorites list Setup alarms for individual events Add events to your personal calendar Share a website link to an event with others Keep track of program changes Automatic program updates configurable in settings Integration with the Engelsystem project httpsengelsystemde  Online tool for coordinating helpers and shifts on large events Supported languagesEvent descriptions excluded Dutch English French German Italian Japanese Portuguese Russian Spanish Swedish Questions regarding the content can only be answered by theHOPE Conference content team This app simply offers away to consume and personalize the conference schedule Bug reports are very welcome It would be awesome if youcan describe how to reproduce the particular error in theissue tracker at httpsgithubcomEventFahrplanEventFahrplanissues The app is based on the EventFahrplan appwhich was initially built for the camp and annual congress ofthe Chaos Computer Club The source code of the app is publiclyavailable on GitHub athttpsgithubcomjohnjohndoeCampFahrplantreehope2022  HOPE artwork by Stefan Malenski;https://f-droid.org/repo/info.metadude.android.hope.schedule_89.apk;This version requires Android 4.1 or newer.;https://github.com/johnjohndoe/CampFahrplan;https://github.com/EventFahrplan/EventFahrplan/issues
SleepTimer;https://f-droid.org/en/packages/com.sleeptimer/;SleepTimer is a timer like the ones in TVs an Hifi systems After a specified time the devicesstandby mode is activated as if the power button was shortly touched It doesnt matter if a videoor audio stream is played or another app tries to prevent the standby modeReactivating is possible by a short press of the power buttonFeatures permanent notification showing the remaining time until standby possibility to use Androids quick settings for pausing and resuming a countdown;https://f-droid.org/repo/com.sleeptimer_8.apk;This version requires Android 4.0 or newer.;https://gitlab.com/onestepb/sleeptimer/tree/HEAD;https://gitlab.com/onestepb/sleeptimer/issues
Screen Time;https://f-droid.org/en/packages/de.markusfisch.android.screentime/;Displays your screen time in a permanent notificationBy making screen time more prominent you can get a better sense of how muchof the day you spend on your phone Without judgement Just so you knowThis is open source httpsgithubcommarkusfischScreenTime;https://f-droid.org/repo/de.markusfisch.android.screentime_11.apk;This version requires Android 3.0 or newer.;https://github.com/markusfisch/ScreenTime;https://github.com/markusfisch/ScreenTime/issues
Infusion Tea Timer;https://f-droid.org/en/packages/com.sesu8642.infusion_timer/;Infusion Tea Timer is a tea timer app made with Flutter Its unique feature is that it supports multiple infusions The app comes with a defaul list of teas but you can also add your own;https://f-droid.org/repo/com.sesu8642.infusion_timer_110.apk;This version requires Android 4.1 or newer.;https://github.com/Sesu8642/InfusionTimer;https://github.com/Sesu8642/InfusionTimer/issues
Ubuntu Countdown Widget;https://f-droid.org/en/packages/com.leinardi.ubuntucountdownwidget/;Keep an eye on the days remaining before the new Ubuntu releaseFeaturesTwo square widgets 1x1 and 2x2Ability to set a custom dateBuilt with an eye on battery consumption widget refresh at most twice a dayLight and Dark themes;https://f-droid.org/repo/com.leinardi.ubuntucountdownwidget_291.apk;This version requires Android 5.0 or newer.;https://github.com/leinardi/UbuntuCountdownWidget;https://github.com/leinardi/UbuntuCountdownWidget/issues
Giggity;https://f-droid.org/en/packages/net.gaast.giggity/;Giggity loads xcalPentabarffrab XML files that contain schedules ofconferencesfestivalsother events and lets you browse them in variousconvenient formatsPreseeded with data for FOSDEM CCC FrOSCon and other conferencesGiggity lets you organise your visit  select talks to be reminded of withwarnings in case of conflicts or hide the topics youre less interested inSchedules are shown in whatever format you like  block schedules plaintimetables or a clear nowandnext screen on the day itselfOr just put a widget on your homescreen which will always show you whats next;https://f-droid.org/repo/net.gaast.giggity_520.apk;This version requires Android 6.0 or newer.;https://github.com/Wilm0r/giggity;https://github.com/Wilm0r/giggity/issues
GPN 2022;https://f-droid.org/en/packages/info.metadude.android.gpn.schedule/;Programm App fA14r die GulaschprogrammiernachthttpsgulaschDie Gulaschprogrammiernacht kurz GPN ist ein 4tAgiger Kongress der vom Entropia eV CCC Karlsruhe einmal jAhrlich veranstaltet wird Der Name ist bei der GPN wArtlich zu nehmen denn immer wieder schafft es auch ein Haufen Hacker eine groAe Menge Gulasch zuzubereiten um die GAste zu nAhren damit sie gestArkt zum nAchsten Vortrag  A14ber Programmierung oder Gesellschaft  oder zum Programmieren ins Hackcenter gehen kAnnenFunktionen TagesA14berblick A14ber alle Programmpunkte VortrAge und SelfOrganized Sessions Beschreibung von Veranstaltungen lesen Veranstaltungen in persAnlicher Favoritenliste verwalten Favoritenliste exportieren Alarm fA14r Veranstaltungen setzen Veranstaltungen in Kalender eintragen Link zu Veranstaltungen mit anderen teilen ProgrammAnderungen einsehen Bewertungen und Kommentare fA14r VortrAge und Workshops hinterlassen Integration mit dem Trollsystem httpsengelsystemde  OnlineTool fA14r Helfer und Schichtplanung auf groAen Events Integration mit Chaosflix httpsgithubcomNiciDieNasechaosflix  Android App fA14r httpsmediacccde teile FahrplanFavoriten mit Chaosflix und importiere sie als Bookmarks UnterstA14tzte SprachenProgrammtexte ausgenommen Deutsch Englisch FranzAsisch Italienisch Japanisch NiederlAndisch Polnisch Portugiesisch Russisch Spanisch Schwedisch Inhaltliche Fragen zum Programm kann nur das ContentTeam der GPN beantworten Diese App stellt lediglich das Programm zur VerfA14gung Fehlerberichte sind herzlich willkommen aber achte darauf dass du erklArst wie man den Fehler reproduzieren kann Bitte nutze den IssueTracker httpsgithubcomEventFahrplanEventFahrplanissues Die App basiert auf der EventFahrplanApphttpsplaygooglecomstoreappsdetailsidinfometadudeandroidcongressschedulefA14r den Kongress des Chaos Computer Clubs Der Quellcode der Anwendung ist auf GitHubhttpsgithubcomjohnjohndoeCampFahrplantreegpn2022 zu finden  LogoDesign Entropia eV CCBYNDNC;https://f-droid.org/repo/info.metadude.android.gpn.schedule_88.apk;This version requires Android 4.1 or newer.;https://github.com/johnjohndoe/CampFahrplan;https://github.com/EventFahrplan/EventFahrplan/issues
Calendar Import-Export;https://f-droid.org/en/packages/org.sufficientlysecure.ical/;This app allows you to importexport your calenders using ics files withoutusing Google synchronization servicesFeatures ExportBackup to ics file Import from SD card or server Supports ics iCal iCalendar files;https://f-droid.org/repo/org.sufficientlysecure.ical_62.apk;This version requires Android 4.0 or newer.;https://github.com/SufficientlySecure/calendar-import-export;https://github.com/SufficientlySecure/calendar-import-export/issues
PolyCal;https://f-droid.org/en/packages/com.gyorog.polycal/;The color coding is intended to be especially useful for people who must coordinate multiple calendars Multiple widgets can be added and they will have separate calendar selection settingsIt is relatively simple at least by Android project standards and attempts to use the standard practices for each part By default it has no calendar permissions and so it will be in screenshot mode which was also used to prepare the app widget previewSource Code GPLv2 httpsgithubcomjasongyorogPolyCalPrivacy Policy httpgyorogcomPolyCalprivacyhtml;https://f-droid.org/repo/com.gyorog.polycal_7.apk;This version requires Android 7.0 or newer.;https://github.com/jasongyorog/PolyCal;None
DiVOC Schedule;https://f-droid.org/en/packages/info.metadude.android.divoc.schedule/;Programm App fA14r das Digital Verteiltes OnlineChaoshttpsdic3vocdeWir spielen gerade ein sehr gefAhrliches Spiel auf unserem Planeten und jedes Mal wenn wir sehen dass es uns und unsere Lebensgrundlage zerstArt drA14cken wir dennoch immer wieder auf acontinuea In Wirklichkeit wird nur a wenn A14berhaupt a ein kompletter Reboot helfen sowohl politisch als auch wirtschaftlich sozial und auch kulturell Wir haben nur eine Erde als Hardware und unser LifeSupport lAuft ausDabei ist die Diskussion ob etwas getan werden muss ehrlich gesagt auch schon durch Deshalb muss jetzt endlich darA14ber geredet werden was getan werden soll und wie Und so ist das Motto des DiVOC zu Ostern aReboot to RespawnaFunktionen TagesA14berblick A14ber alle Programmpunkte VortrAge und SelfOrganized Sessions Beschreibung von Veranstaltungen lesen Veranstaltungen in persAnlicher Favoritenliste verwalten Favoritenliste exportieren Alarm fA14r Veranstaltungen setzen Veranstaltungen in Kalender eintragen Link zu Veranstaltungen mit anderen teilen ProgrammAnderungen einsehen Bewertungen und Kommentare fA14r VortrAge und Workshops hinterlassen Integration mit dem EngelsystemProjekt httpsengelsystemde  OnlineTool fA14r Helfer und Schichtplanung auf groAen Events Integration mit Chaosflix httpsgithubcomNiciDieNasechaosflix  Android App fA14r httpsmediacccde teile FahrplanFavoriten mit Chaosflix und importiere sie als Bookmarks UnterstA14tzte SprachenProgrammtexte ausgenommen Deutsch Englisch FranzAsisch Italienisch Japanisch NiederlAndisch Polnisch Portugiesisch Russisch Spanisch Schwedisch Inhaltliche Fragen zum Programm kann nur das ContentTeam vom DiVOC beantworten Diese App stellt lediglich das Programm zur VerfA14gung Fehlerberichte sind herzlich willkommen aber achte darauf dass du erklArst wie man den Fehler reproduzieren kann Bitte nutze den IssueTracker httpsgithubcomEventFahrplanEventFahrplanissues Die App basiert auf der EventFahrplanApphttpsplaygooglecomstoreappsdetailsidinfometadudeandroidcongressschedulefA14r den Kongress des Chaos Computer Clubs Der Quellcode der Anwendung ist auf GitHubhttpsgithubcomjohnjohndoeCampFahrplantreedivoc2021 zu finden  DiVOC Design von faabe httpstwittercomfaabe;https://f-droid.org/repo/info.metadude.android.divoc.schedule_88.apk;This version requires Android 4.1 or newer.;https://github.com/johnjohndoe/CampFahrplan;https://github.com/EventFahrplan/EventFahrplan/issues
Todo Agenda;https://f-droid.org/en/packages/org.andstatus.todoagenda/;Todo Agenda is home screen widgets for your Android deviceIt displays a list of calendar events and tasksso that you can easily have a glimpse at your due current and upcoming appointmentsFeatures No advertising Free and Open Source Displays all events from your calendars and task lists Optionally shows past events Automatically updates when you adddeletemodify an event Or you may update the list instantly Select only the calendars you want to see in the widget Create several widgets if you need Each widget will have its own settings including layouts colors filters and selected calendars Customize background colors and transparency of different widget parts texts black and white shading Scroll through the list of events Use Go to Today button to return to today instantly Customize the text size of the widget Fully resizable widget with alternative layouts Indicators for alerts and recurring events Lock time zone when travelling to different time zones Turn off Widget or Day headers event icons Days from today etc and see only what you need Android 70 supported Supports Android tabletsFor the older devices please use Todo Agenda for Android 4  70 app;https://f-droid.org/repo/org.andstatus.todoagenda_698.apk;This version requires Android 7.0 or newer.;https://github.com/andstatus/todoagenda;https://github.com/andstatus/todoagenda/issues
CalEF (Calendar Entry Formatter);https://f-droid.org/en/packages/de.k3b.android.calef/;Making an appointment meansAdd date time and title of the appointment to the AndroidCalendarIn AndroidCalendarDetailview use SendShare from menu or toolbarSelect CalEF as share destination to convert to human readable textSelect the final SendShare destination clipboard sms mail Usually calendar entries are shared in a humanunreadable technical formatICS or VCS that calendar programs can readCalEF receives the technical format and resendsreshares its content as human readable textDateTime is formatted according to current languagelocaleCalEF can also process ics or vcs files ie from a calendar backupRequirementsAndroid44 api 19 or laterPermissions  NoneCompatible withEtarCalendar version 1029 or later January 2022SimpleCalendar version 400 or later May 2018Buildin AndroidCalender Tested with android10 on LG deviceBackup Calendar ImportExport version 24 or later November 2016;https://f-droid.org/repo/de.k3b.android.calef_5.apk;This version requires Android 4.0 or newer.;https://github.com/k3b/CalEF;https://github.com/k3b/CalEF/issues
Shorey;https://f-droid.org/en/packages/com.elementlo.spark_list/;Shorey is a simple note app which is built with Flutter 2 and supports both AndroidiOS platforms It provides me full experience of interacting with Flutter and in the meantime I hope it can be your knowledgememory transition tool and yes there still much work to doFeatures Google Material UI Lightweight only 10mb Retrospect everyday to organize information faster Concise notetaking Set the mantra to inspire yourself Set the main goal to stay focus Keep track of the Heat map Supports simple Chinese and English;https://f-droid.org/repo/com.elementlo.spark_list_7.apk;This version requires Android 5.0 or newer.;https://github.com/elementlo/spark_list;https://github.com/elementlo/spark_list/issues
Clock;https://f-droid.org/en/packages/com.best.deskclock/;New Clock is an updated version of the AOSP desk clock including alarms clock timer and stopwatch Features include ao power off alarm alarm will ring with phone off snapdragon phones only tested on all custom rom flip and shake action for dismisspostpone alarm possibility to turn offpostpone the alarm with the power button and volume button swipe to delete alarm Light and Dark mode;https://f-droid.org/repo/com.best.deskclock_3.apk;This version requires Android 4.4 or newer.;https://github.com/qw123wh/new-clock-fdroid;https://github.com/qw123wh/new-clock-fdroid/issues
WorkTimer;https://f-droid.org/en/packages/com.mcsnowflake.worktimer/;This app supports you in structuring your work time into productivity and relax sessions by following the pomodoro principleAdditionally it can remind you to drink and can turn on DoNotDisturb mode when you are working;https://f-droid.org/repo/com.mcsnowflake.worktimer_9.apk;This version requires Android 8.0 or newer.;https://gitlab.com/McSnowflake/worktimer;https://gitlab.com/McSnowflake/worktimer/-/issues
Timetable;https://f-droid.org/en/packages/juliushenke.smarttt/;Smart Timetable is a simple app for school and university time tablesThe Smart Timetable is designed to be quick to set up and use You cansave information like the room of your subject or your teacherThe app also makes it possible to have an fitted timetable for even and oddweeks This means you can save 2 timetables which rotate every week;https://f-droid.org/repo/juliushenke.smarttt_21.apk;This version requires Android 4.1 or newer.;https://github.com/JuliusHenke/Timetable-App;https://github.com/JuliusHenke/Timetable-App/issues
Just 24 Hours;https://f-droid.org/en/packages/com.chancehorizon.just24hoursplus/;When all you need is to know what time it is only the actual time mattersThere are many wonderful clock applications available for Android devicesMany have have lots of great features Choice in applications is a goodthingWhen one wishes to choose a simple clock application that just displays thetime of day in as large numbers as can fit on the screens device Just 24Hours is hereFeaturesJust 24 Hours will display the time of day in 24 hour format in a bignumbers as will fit on the screen For those that were corrective lensesit can be challenging to read small numbers when just waking up Bignumbers are required No matter what size screen your Android device hasJust 24 Hours will use as big a text size that will fit on the screenThat is all No alarm settings No typeface settings No colour settingsJust a big clock to see what time of day it isOf course this is not what everyone wants in a clock application This isokay There are dozens of clock applications available on Google Play Mostmaybe all are great applications We are certain that there will be onethat will satisfy ones desired features For those that just want thetime Just 24 Hours is here;https://f-droid.org/repo/com.chancehorizon.just24hoursplus_10401.apk;This version requires Android 4.4 or newer.;https://gitlab.com/pardomi/just-24-hours;https://gitlab.com/pardomi/just-24-hours/-/issues
BirthDayDroid;https://f-droid.org/en/packages/com.tmendes.birthdaydroid/;Free No Ads Opensource DBirthDayDroid is a simple Android application to help you to remember your contacts birthdays It scans your local contact list looking for birthdays When it finds it it will show you the contacts age sign days until herhis birthday Check our webpageBirthdayDroid Webpage Open sourceThis project is an opensource project and you will find it at Gitlab Help us to have this app translated to your languageIf you want to help us to translate this app to your language go to Transifex Thanks toApp Icon Firefox OS EmojisNavigation bar icons Google TeamEmojis Free emojis provided by Emoji One PERMISSIONS Read your contactsBirthdayDroid will work checking the birthday entry from each contact from your contact list so it will request you to have access to your contacts You can check our source code if you still dont trust giving us that permission Control vibration Birthday Notifications Run at Startup To register the time for the Birthday Notifications;https://f-droid.org/repo/com.tmendes.birthdaydroid_53.apk;This version requires Android 6.0 or newer.;https://gitlab.com/tmendes/BirthDayDroid;https://gitlab.com/tmendes/BirthDayDroid/issues
Clock;https://f-droid.org/en/packages/com.chen.deskclock/;Deskclock is a fork of the AOSP clock so it offers all its functions alarms clock stopwatch countdown timer aka tea timerAdditionally it adds Poweroff alarm function alarm will ring with phone off Snapdragon phones only tested on LineageOS and should work on all AOSP ROMs currently does not work on MIUIFlip and shake action for alarmPermissions used VIBRATE enable vibration when the alarm sounds WAKELOCK DISABLEKEYGUARD alarm notification when the screen is turned off POWEROFFALARM make the alarm sound when the phone is off supported devices only RECEIVEBOOTCOMPLETED register alarms on device start USEFULLSCREENINTENT needed with Android 10 to show the alarm screen when an alarm firesA more detailed description can be found in the repositorys README;https://f-droid.org/repo/com.chen.deskclock_5.apk;This version requires Android 5.0 or newer.;https://github.com/qw123wh/Aospdeskclock;https://github.com/qw123wh/Aospdeskclock/issues
LifeHQ;https://f-droid.org/en/packages/com.abhinavmarwaha.lifehq/;FeaturesRoutinesJournalKnowledgeGoalsHabitsComing SoonDecisions;https://f-droid.org/repo/com.abhinavmarwaha.lifehq_9.apk;This version requires Android 4.4 or newer.;https://github.com/abhinavmarwaha/LifeHQ;https://github.com/abhinavmarwaha/LifeHQ/issues
Giant Stopwatch;https://f-droid.org/en/packages/omegacentauri.mobi.simplestopwatch/;Sports stopwatch withgiant digits and adjustable theme color font size spacing formatcontrol with both onscreen buttons and volume buttonslaptimerdelayedstart with audio 321 countdownFree small no ads open source githubcomarprusssimplestopwatchAs a bonus includes a giant number clock swipe to switch between clock and stopwatch I made this so I could easily see the time while rock climbing at the gym50 feet up Its also useful poolside for swimming and for other sports whereyou need to see the time from a distance or close up if you want;https://f-droid.org/repo/omegacentauri.mobi.simplestopwatch_31.apk;This version requires Android 1.6 or newer.;https://github.com/arpruss/simplestopwatch;https://github.com/arpruss/simplestopwatch/issues
PyConZA 2021;https://f-droid.org/en/packages/info.metadude.android.pyconza.schedule/;Conference program app for the PyConZA 2021 conferencehttpszapyconorgAbout PyConZAPyConZA is the annual gathering of the South African community usingand developing the opensource Python programming language PyConZAis organized by the Python community for the community Wed likePyConZA to be accessible to as many people as possible and to fosterunique solutions to the challenges we face in AfricaFeatures View program by day and rooms side by side Custom grid layout for smartphones try landscape mode  and tablets Read detailed descriptions speaker names start time room name links  of events Add events to favorites list Export favorites list Setup alarms for individual events Add events to your personal calendar Share a website link to an event with others Keep track of program changes Automatic program updates configurable in settings Supported languagesEvent descriptions excluded Dutch English French German Italian Japanese Portuguese Russian Spanish Swedish Questions regarding the content can only be answered by thePyConZA content team This app simply offers a way to consume andpersonalize the conference schedule Bug reports are very welcome It would be awesome if youcan describe how to reproduce the particular error in theissue tracker at httpsgithubcomEventFahrplanEventFahrplanissues The app is based on the EventFahrplan appwhich was initially built for the camp and annual congress ofthe Chaos Computer Club The source code of the app is publiclyavailable on GitHub athttpsgithubcomjohnjohndoeCampFahrplantreepyconza2021  PyConZA logo design by Python Software Society of South Africa;https://f-droid.org/repo/info.metadude.android.pyconza.schedule_84.apk;This version requires Android 4.1 or newer.;https://github.com/johnjohndoe/CampFahrplan;https://github.com/EventFahrplan/EventFahrplan/issues
